id,author,title,created_utc,num_comments,score
qh61jl,yeho_meta,Bitcoin is Unstoppable - New bitcoin meme compilation 2021,1635367187,0,1
qh615k,sportsdirectbandit,Buy BTC with lowest fees?,1635367154,7,1
qh5sxk,BedDecent6198,Best place to invest in Bitcoin Mining ?,1635366516,0,1
qh5r7i,goodbtc,MasterCard president took a stance against cryptocurrency in 2014 - never forget!,1635366382,1,1
qh5ln6,teperilloux,A little Muun help please,1635365962,2,1
qh5j74,pyzzettah1,Electrum on Pc,1635365765,6,1
qh5egn,itsjfam,Up to date,1635365396,14,1
qh5efd,InvestWise89,Be patient my friends!,1635365392,2,1
qh5e2o,Amber_Sam,"The U.S. dollar 'as we know it' will be dead in 10 yrs, bitcoin price to hit $2 million in 5 yrs",1635365364,12,1
qh5cl4,acegarrettjuan,Anyone else see this BS? I don’t pay for SA so I didn’t read it.,1635365251,1,1
qh5bbx,Ionnlyhavehalfabtc,Am I a beast for living in my car and using the rent money to buy bitcoin?,1635365160,88,1
qh54fw,Sad_Persimmon4648,$SHIB is up more this week than $BTC in the past 4 years,1635364641,8,1
qh4yvv,Academic-Daikon-8662,"Not enough resistance for the IRS audit flaging transactions 10,000 a year.",1635364216,3,1
qh4wmw,Thirdeyeknows,If you say bitcoin is going to crash you are right..but if you say it will make new highs again you are also right,1635364043,21,1
qh4ssx,Correct-Sherbet2399,OP-(880 Bitcoin 7 years later) laughing his way to the bank,1635363754,1,1
qh4rly,pumpedlegs,Selling all my stocks and going all in on bitcoin,1635363662,8,1
qh4qo0,Unique-Maintenance32,Don't be the guy.... @bitcoin,1635363591,88,1
qh4j9f,cryptomaniacalist,SHIBU soon to be integrated in Amazon payment systems,1635363026,0,1
qh4aei,faxxxik,Survey for Behavioral Economics course,1635362341,4,1
pzaao3,prayank_gahlot,Replacement transaction and ancestor score bug,1633101899,39,1
pza7ae,andreaarmanni,How do Billionaires Invest in Bitcoin?,1633101609,5,1
pza5pp,Bitcoin_is_plan_A,JUST IN: Hackers rob thousands of Coinbase customers using multi-factor authentication flaw - Bleeping Computer,1633101477,6,1
pza49q,Karmaa,This will likely be the last time you be able to buy Bitcoin at 40k.,1633101355,221,1
pza3f8,simplelifestyle,"CNN: ""Most cryptos will fail, but bitcoin could be here for good"".",1633101281,43,1
pz9zzb,Live_Role_1638,💥💥,1633100983,1,1
pz9tpf,Ucho05,What are some websites that show swap exchanges with new coin listings/trends?,1633100487,13,1
pz9szp,WinterAd1103,Bitcoin SPECIAL UPDATE - Rectangle pattern comes ALIVE ! #btc #bitcoin...,1633100438,0,1
pz9sgr,alr62999,"Lyn Alden :"" It's Worse Than You Imagine!""",1633100410,1,1
pz9s9f,stephendemholm,"Binary trading investment, here your little capital is reinvestment into the stocks of super power companies like Microsoft, Tesla and other house using different trading strategies and techniques for a continuous period of days until the best price outcome is attained",1633100396,0,1
pz9qgq,sepke12345,Bitcoin Lightning Network reaches record highs,1633100244,4,1
pz9mmz,xcryptogurux,I called the 29k bottom back in July. Here's a follow-up analysis,1633099916,5,1
pz9la5,xqcbigschnozer,Place where you can digitally buy prepaid visa with btc,1633099803,5,1
pz9g0x,BitcoinHowTo,This is how to make bitcoin from a phone/pc,1633099339,0,1
pz99ct,zhaoningxuan,"Meet some professionals and get some guidance, thank you",1633098737,13,1
pz97lj,Far_Zone1916,Better buy/sell earn cryptocrurrrency,1633098594,0,1
pz920g,Mortiest_Morty_NJR,why didn't I buy more????,1633098109,1,1
pz8y2s,ProjectSunshine_,Donate Bitcoin to Support Pediatric Patients and their Families,1633097771,2,1
pz8wal,IHubVision,"Thoughts on Bitcoin Investing, and a Frightening Reason it Could Go Up",1633097621,1,1
pz8tyz,jguest1105,China’s latest Bitcoin ban means there’s no more FUD we can expect from its government.,1633097429,38,1
pz8tle,pinkgirltv,Stunning cryptocurrency statement from Fed Chairman Jerome Powell,1633097398,0,1
pz8qyr,Habeeb_2005,Is this the sign????,1633097175,0,1
pz8n86,sjrunner83,Jack Mallers interview on CNN,1633096868,46,1
pz8mnq,EcstaticDistance4304,Ledger Security Question,1633096825,13,1
pz8c76,Dimmao_meme,The bulls won,1633095934,3,1
pz87vu,LilpandaXD,I’m starting to realize no matter how much money I’m down on my investments. Bitcoin has never failed aslong as I HODL and Then I always always always regret. Not buying more. Hahaha.,1633095554,8,1
pz82qp,iammasvidal,What is a Yubikey?,1633095109,0,1
pz81qk,bell2366,When you see moves like this on the first of the month,1633095021,3,1
pz7ziv,LiterallyMostRandom,My first time putting ANY money into ANY crypto. Does anyone have any advice or two?,1633094831,55,1
pz7uuc,rainbowbikerswg,Why are so many people hesitant to learn about Bitcoin Multisig and how to use it,1633094410,3,1
pz7tjl,bdinu89,Kraken’s Security Lab Reveals Weak Points in BTC ATMs,1633094289,5,1
pz7ru5,Moofy73,Real ones remember this coinbase,1633094120,1,1
pz7qob,Technologov,a new Bitcoin payment processor.,1633094013,0,1
pz7ooc,Major_Bandicoot_3239,Buy $100 in Crypto before 10/3 on CB and enter for a chance at $1M in prizes! Pumptoberfest is underway.,1633093836,1,1
pz7oo1,joesus-christ,How to DCA out?,1633093836,10,1
pz7kba,ryan_w_92,Hello Pumptober,1633093431,1,1
pz7joo,undergroundinvestin,$200 Million worth of Bitcoin shorts liquidated over night (12h) 40k+ “traders” rekt,1633093377,120,1
pz7iz0,gasconspw,Full Bitcoin Node Over V3 Tor Network,1633093313,0,1
pz7imc,TerribleD,Today We Get the FOMO Buyers Who Will Cry When the Corn Goes Back to 45 for a While,1633093282,6,1
pz7g2j,lots0fPasta,Waking up to green today like,1633093067,17,1
pz7ej9,CsoroszL,Bitcoin is seeing some positive price movements on Thursday after a stuttering start to the week.,1633092922,1,1
pz7blx,yeho_meta,How to make an NFT - Simpsons Crypto meme,1633092636,0,1
pz7bcf,bmitchell1989,Bitcoin on Sale?,1633092611,0,1
pz7aec,simplelifestyle,Good morning Bitcoin!,1633092517,5,1
pz78fr,plumberoncrack,Of course this happens on payday...,1633092321,1,1
pz77dl,Special_Yam_1174,"Federal Reserve Chair Jerome Powell told U.S. lawmakers that the Fed has ""NO intention to BAN"" cryptocurrencies",1633092214,9,1
pz76hs,gasconspw,Ups &amp; Downs Of Bitcoin Market Trades,1633092127,0,1
pz766c,SnooDonuts2975,I am never ever selling.,1633092095,141,1
pz73sn,NumerousAnimator5770,"Why the big green today , what good news? China supports btc?",1633091855,0,1
pz720n,simplelifestyle,"CNBC: ""El Salvador just started mining bitcoin with volcanoes for the first time ever – and they've already made $269""",1633091675,141,1
pz71n3,zhaoningxuan,"Newbie to digital currency, find some professionals to teach me, thank you.",1633091637,0,1
pz71it,Libertelia,How to accept bitcoin donations in YouTube?,1633091627,13,1
pz6zqf,skeptical-0ptimist,Looking for help (running a node),1633091449,6,1
pz6xxz,FragileRandle,Wise words from a 20 year old game,1633091273,4,1
pz6x9w,Alarmed-Durian7154,Hi Shocktober,1633091205,22,1
pz6t5a,mjnawaz,"$47,000,000 of $BTC shorts liquidated in an hour.",1633090765,0,1
pz6k1n,thecannabisstock,"Bluesky Achieves Corporate Record of $1,044,000 CDN Mined In Quarter, Provides Q3 Snapshot",1633089842,1,1
pz6jeg,Rambalamda,Big Green Candle,1633089776,137,1
pz6fi4,Prollysmokedtoomuch,Lol shorts got wrecked,1633089382,0,1
pz6dkc,Klaasiker,Earning Report: $484 in 8.5 months on DutchyCorp,1633089162,0,1
pz6cv9,mujshanan92,[ESG FUD] Why Bitcoin’s pollution could grow after leaving China,1633089088,8,1
pz6cv8,alphazwest,"I noticed I can buy cryptocurrencies through PayPal this morning when I logged in, but after reading the FAQ section I question their intentions.",1633089087,120,1
pz6bos,Exciting-Celery-2499,"Bitcoin, what the fork?",1633088962,11,1
pz6b96,sami8440p,url linked,1633088915,0,1
pz637e,drummerdan11,Best place to convert GBP to BTC,1633087985,7,1
pz631k,thecannabisstock,Bitfarms Provides Bitcoin Production and Mining Operations Update,1633087965,0,1
pz607j,shaddowkhan,Get up!,1633087646,2,1
pz5ygw,NeedleworkerNo2874,Hi Uptober,1633087440,22,1
pz5wxs,BryanBSolstin,Judas betrayed decentralization for short-term growth. The Lightning Network effect grows like mycelium. Sentient. Cryptonite for all the DINOs.,1633087259,8,1
pz5r19,loic_supreme,Uptober.,1633086578,3,1
pz5n73,Ego_Titan,Bitcoin 20 year treasure hunt for kids: looking for ideas,1633086124,13,1
pz5n1o,iammasvidal,BITCOIN BREAKS 47K! 63K COMING? CRYPTO IS UNSTOPPABLE SAYS Elon Musk!,1633086107,10,1
pz5mup,Individual-Elk-6423,Get ready for alt season it’s gonna be huge,1633086084,0,1
pz5k4s,DonBonJovi88,Let’s go. The ride is open for business.,1633085773,0,1
pz5jdm,BCHisFuture,Fees of LN,1633085683,17,1
pz5i8c,bitnovin,معاملات فیوچرز چیست,1633085543,0,1
pz5hfw,scuttlepuff,What is happening?,1633085441,1,1
pz5h9v,Doleraox,Cryptocurrency Intergration Amongst Trading Platforms,1633085419,0,1
pz5gel,imivani,I thought I read the numbers wrong but BTC really just rose $5k in 5 minutes.,1633085316,0,1
pz5cdv,NeptuneAgency,President Bukele Begins 100% Renewable Volcano Bitcoin Mining In El Salvador,1633084817,4,1
pz5c6p,Professional_Pilot21,El Salvador President: Volcano-Powered Bitcoin Mining Has Begun,1633084793,3,1
pz59kg,SouJuggy,the 5 minute chart is looking trippy today,1633084455,45,2
pz58s9,TillATH_145K,Sweet jesus ... what da f just happened! Massive 5min candle,1633084357,0,1
pz53rv,hex72,Crypto roboadvisor?,1633083714,6,1
pz523f,SirFearless9385,"How do creators of software wallets like Electrum, Sparrow, Samourai, Wasabi, and others make money?",1633083511,11,1
pz4zvw,theograngerM,Journalist's question for Bitcoin miners,1633083237,15,1
pz4ttn,martini412,Buying the Dip🚀🚀,1633082474,11,1
q00m2c,mimomimo2020,bitcoin signals,1633199348,0,1
q00j1o,mr7575,ASUS TUF RX 6900 XT 16 GB GAMING,1633199063,0,1
q00i5t,AlinYogi,help me please i found a token to invest,1633198986,0,1
q00hzo,mr7575,EVGA GeForce RTX 3070 8GB FTW3 ULTRA GAMING,1633198970,0,1
q00h0e,mr7575,SAPPHIRE Nitro+ AMD RX 6700 XT 12GB,1633198878,2,1
q00f4p,Progress_8,Bitcoin has unleashed a wave of speculation and increase popularity!,1633198712,7,1
q00e2z,BTCtester,6000 coinbase clients hacked,1633198615,49,1
q006dy,castorfromtheva,Bitcoin Futures Based ETF is No Good: Buy Real Bitcoin or a Spot Bitcoin ETF From Canada - 9/10/2021,1633197903,26,1
q005jl,oblivi_us,Armory invalid blockdata path,1633197831,7,1
q000i9,trannygranny17,What a legend.,1633197386,61,1
q00017,ChloeTrade1,So relatable in the past weeks,1633197341,0,1
pzzzyc,Amber_Sam,"Bitcoin Is the Most Peaceful Revolution — Borderless in Kyiv, Ukraine.",1633197334,39,1
pzzvtb,Fencesitta,"Eric Yakes Talks Federal Reserve, Central Banks, US Financial History, and Bitcoin",1633196943,0,1
pzzkgu,ale5ole,Are transactions that taking place in Lighting Network private?,1633195903,0,1
pzzka3,Andrewflinchrocks,"We’re not bulls or bears, we make money trading the fuck out of any market situation. And our profits are increasing every month as we grow. DM me to join and make shit loads of money. I’ll be sending crypto futures buy/sell calls and market analysis everyday on telegram so u can make profits daily.",1633195886,9,1
pzzh5w,Hopeful_Age_7198,"Hello guys , if anyone wants to sell bitcoins whereever r you, we are ready to buy it just DM, regards",1633195606,2,1
pzzcqw,jalenkaydendemetrius,This is the newest project of him?,1633195186,0,1
pzz5c9,0506003645,كشف تسربات المياه شرق الرياض,1633194492,0,1
pzz460,C4-PO,"Hackers exploit MFA flaw to steal from 6,000 Coinbase customers — Report",1633194384,19,1
pzz2nk,tinalope12,What is a hash and How profitable is bitcoin mining?,1633194251,0,1
pzz2bm,Stallj,Will BTC ETFs have the same negative impact on BTC that they have had on other assets?,1633194226,20,1
pzz0vw,LengthinessLarge4856,Bitcoin Breakthrough,1633194101,0,1
pzyyff,stevedanews,Türkiye’de Bitcoin ATM’leri Nerelerde Var?,1633193894,3,1
pzyo12,customtoggle,Ledger Live stuck synchronizing,1633192950,5,1
pzyn50,apoorv1619,BTC Price Forecast: Bitcoin addresses at a record high,1633192867,1,1
pzymip,xxadmxx,Null Point Asset,1633192807,10,1
pzy6re,nyess,What's stopping a bank to print itself out of oblivion to buy BTC?,1633191382,97,1
pzy2u3,jenny031hopkins,Need to Buy Crypto? This is what to Look for In a Crypto Exchange.,1633191029,1,1
pzy22q,Jesusness2021,"Coinbase says hackers stole cryptocurrency from at least 6,000 customers/ Are you affected by this? Did you get your coins back?",1633190963,7,1
pzy0kq,wanderingvpsaint,How to receive Bitcoin tip in twitter?,1633190822,5,1
pzy05a,Expert-Apartment7160,"Investor Behind ""The Big Short"" Rings Inflation Alarm - Warns of Huge Market Bubble and ""Mother of All Crashes""",1633190785,0,1
pzxvjb,mujshanan92,[Adoption] Walk-in Cryptocurrency Exchanges Emerge Amid Bitcoin Boom,1633190396,0,1
pzxqcq,adfr92,Introductory overview explaining what Bitcoin is and what it does,1633189906,0,1
pzxnoq,dedeotaku,"Newbie here, Buying bitcoin for the first time on Coinbase and it tell me I can only buy for 3000$ in one day",1633189653,44,1
pzxjsl,bitcoinferret,Am the closest thing to a bitcoin maximalist you could get but keep getting banned from this community for daring to mention shitcoins. Only reason for doing this is to illustrate what an utter scam and joke most if not all of them are. Anyway I've created a subreddit and shan't bother you anymore,1633189292,4,1
pzxg5j,OpenTheBible,Me when Corona just started and Bitcoin crashed to 5k.,1633188968,0,1
pzxfba,mahad3v9,Ripple lawsuit: XRP v. SEC will set precedent for Bitcoin and other crypto regulation to come - TheDailySats,1633188897,0,1
pzxeii,Special_Yam_1174,Chinese crypto investors are buying more!,1633188830,0,1
pzxdvt,LorfingHFD,What is LVL and how is it different from a bank?,1633188774,5,1
pzx9se,AthleticWhiteGuy,Help with buying bitcoin!,1633188415,26,1
pzwwhj,lalalandas123,Autumn time,1633187222,0,1
pzwl7z,Prestigious_Set1029,Invest on real mining,1633186224,0,1
pzwj9o,dbudlov,Bitcoin proves Austrian economics is correct;,1633186042,33,1
pzwj80,regsanman,Borrow using BTC as collateral is live on Coinbase in US,1633186037,68,1
pzwihb,OutrageousSir8047,"Understanding Bitcoin development (a story from past to future), its fight with the Fiat money, and inflationary monetary policies.",1633185971,0,1
pzwebf,savannahjonly,You can send this to your friends who told you to sell.,1633185588,0,1
pzw1to,JustinBennettFx,"What a move from $BTC to kick off October. 👀 As I’ve said, I’m happy to be wrong, just needed the market to prove itself. A daily close above $45,500 would be a good start.",1633184425,1,1
pzvtwj,chaddybox,Little Bitcoin reference @1:00,1633183681,0,1
pzvs2n,ColinTalksCrypto,Bitcoin Bull Run Index adds Willy Woo Metrics (Top Cap &amp; CVDD),1633183513,1,1
pzvoxw,BtcAnonymouse,History of cryptocurrency in 90 seconds,1633183228,10,1
pzvno7,tronic22,Actual reason DOT might moon this month...,1633183111,0,1
pzvk9r,PeteyCruiser123,Biggest Bitcoin hacks in history,1633182775,7,1
pzvdsz,RO-CC,We need more positivity in this Sub :],1633182131,354,1
pzv68b,BroeselAbi,"if all Miners would start to Hodl their Bitcoins like Bitfarms recently did, wouldn't it be an centralized System by then ?",1633181389,14,1
pzv593,CasinoLand,What would you say to SEC to make them approve Bitcoin ETF?,1633181290,17,1
pzv2yb,randomee1,Introducing Coinbase Cloud,1633181045,3,1
pzuy0w,yavoqctjeriuy,Everything about beta finance launchpad on binance,1633180532,4,1
pzuu2d,Both-Ad-9418,Our Mission,1633180125,0,1
pzupe9,ReedB04,Am I diversified?,1633179652,1,1
pzumgp,RO-CC,Bitcoin 2022 :],1633179346,2,1
pzujga,PodClips,A Loaf of Bread Used to Cost 1 BTC; Now It Costs 0.0001 BTC ... now try that with dollars (2-minute audio clip from Anthony Pompliano),1633179005,33,1
pzuenq,Nakarato_,Litecoin Cash was no scam,1633178459,1,1
pzuemb,ncoelho,Find all accounts inside your seed with BlueWallet latest version,1633178454,22,1
pzud65,mujshanan92,Green Co investment instrument to incentives proposal,1633178286,0,1
pzuauf,Nakarato_,Litecoin Cash was no scam.,1633178020,3,1
pzu1wj,DmitriiElj,"Bitcoin Mining using the MS-DOS laptop (Article, sources included:)",1633176975,13,1
pztuxj,AGKSMMM,LONG SET UP (INTRA) SIGNALS FOR SALE,1633176149,0,1
pztteb,JunoKat,I enabled twitter tipping today (UK account),1633175995,30,1
pztovd,BtcAnonymouse,"I'm a Bitcoin maximalist. I don't think I'm toxic, but I suppose that's a matter of personal opinion. To be clear. I'm a Bitcoin maximalist ON PRINCIPLE",1633175407,7,1
pzti2c,SnooPineapplez,"What is the value of a blockchain outside of an application for money? (Bitcoin, not Blockchain by Parker Lewis)",1633174457,16,1
pztgwb,parakite,Stone Ridge 2020 Shareholder Letter,1633174297,1,1
pztfk5,thatmanualmachinist,Solar Flares,1633174115,54,1
pztcv7,BathroomDifficult437,"HOW TO START CRYPTO TREADING FOR BEGINNERS,THIS IS VIDEO COURSE.",1633173752,1,1
pzsz0b,C4-PO,Bitcoin goes Bullish as the US dollar retreats after hitting its one-year high,1633171930,1,1
pzsyge,bsun-321,lost 100 k $ worth ecash xec and bitcoin sv,1633171852,2,1
pzswu8,Single_Ad2250,BottlePay?,1633171623,5,1
pzstc0,saddogge,Bitcoin investment 2009,1633171121,66,1
pzsmuw,DryEagle,Why is everyone cheering volcano mining?,1633170269,0,1
pzsl55,Healthy-Ad-5033,"Trade is a basic economic concept involving the buying and selling of goods and services, with compensation paid by a buyer to a seller, or the exchange of goods or services between parties. Niccherip5 and 37 more users found this answer helpful. Thanks",1633170028,0,1
pzsj7x,alr62999,Peter Schiff: Which is a Better Store of Value: Gold or Bitcoin,1633169753,6,1
pzsiqo,Ok-Monitor9913,"Asides having higher reward opportunities,why are they generally more crypto traders than forex ?",1633169688,1,1
pzseda,rjot28,Learnt a lot from this sub so I made this original artwork for all you hodlers out there.,1633169082,0,1
pzse4a,Raf_a_L,"Extraordinaire, la Crypto BNB avec un rendement entre 19 à 38% chez Swissborg 😱",1633169042,3,1
pzs98r,Boesebotterblum,#Euronext,1633168377,0,1
pzs65c,Unusual-Football6340,SEC extends four Bitcoin ETF deadlines by 45 days,1633167902,2,0
pzs0vz,crypto_lunatic,Crypto currency mining using integrated photonics,1633167146,0,1
pzrezb,parakite,Exchanges Are Now The Enemy of Bitcoin - exchanges are casinos and don’t want to onboard anyone into bitcoin. Avoid.,1633164034,10,1
pzr7jy,Skaiashes,"Crypto Analyst Predicts Altcoin Market Heading for Major Rally, Tracks Current Demand for Bitcoin",1633162924,1,1
pzr0bi,mazaajiya,"Pitch Day at Bitcoin 2022 for Bitcoiners - Devs Lounge, Bazaar and more April 6-9 (use MILL10 to checkout)",1633161879,0,1
pzquek,1minutebitcoin,Hodlers fighting anti bitcoin FUD,1633161034,6,1
pzqtch,Sophie_ck,Italian Luxury Fashion House Dolce &amp;amp; Gabbana Sells NFT Collection for $5.7 Million,1633160881,1,1
pyz4bh,Loretta_cobbs,"Wish me happy birthday, MY SC is Loretta_cobbs",1633057165,0,1
pyz3a0,porula,Here is my TA,1633057053,3,1
pyz1n8,Teaatnighttime,Ukraine Legalizes Bitcoin by Bitcoin Magazine Repost #1,1633056879,4,1
pyz0np,rand0mt0r,What happened to BCH tipping here?,1633056775,6,1
pyyxw4,Telugucryptodaily,"Honesty CHECK! We won't BAN, because we Bought the DIP ! and we dont think we can Compete with the so called SHITCOIN we have.",1633056495,9,1
pyyx3k,simplelifestyle,When Bitcoiners lose their keys,1633056414,0,1
pyymmd,simplelifestyle,The Future Of Defi Is Being Built On Bitcoin,1633055334,3,1
pyyb9q,gendreau85,Coinbase vs CNBC,1633054196,10,1
pyy7ui,Single_Emotion740,"Me again redditors. Buying bitch at the beginning of the month is a smart way to do it. Cause what if it shoots up and it’s $10,000 more at the end of the month? OCTOBER 2nd my friends let’s do it.",1633053850,16,1
pyxva6,Single_Emotion740,October 2nd. Let’s all go $30 in on Bitcoin. 2 days is enough time to repost and get the word out to make this happen. Scared money doesn’t make money let’s do this people. Not a lot of posting goes on here but let’s make it happen let’s get everyone rounded up and hype. Anytime in the day. Let’s go,1633052599,30,1
pyxv7l,jajajajajajaiiii,Would a pro bitcoin presidential candidate have a chance?,1633052592,18,1
pyxsgl,stratguy56,Bitcoin debit / credit cards will SCREW you for tax reporting,1633052324,10,1
pyxppa,Tyron-Fabio,ASK ME HOW👉👉👉 WHATSAPP: +1(213)935-4712,1633052040,0,1
pyxoe6,7h3k3yh01d3r,Gonna need a bigger block,1633051916,0,1
pyxmcv,Lifter_Dan,Block Explorer or tool to show balance at specific date,1633051720,3,1
pyxmaj,AffectThink133,HOMIEBITC is trustful?,1633051714,9,1
pyxlhp,DocumentingBitcoin,"Massmutual’s Chief Investment Officer, “we have come to view #bitcoin as a potential store of value over the long-term. “ (The firm has $616 billion of assets under management)",1633051634,0,1
pyxkbh,ShotBot,"I agree with Gary Gensler, ​USDC and USDT are securities. (and a simple explanation why:)",1633051512,1,1
pyxeii,No_Delay5284,"Bitcoin Stalls as U.S., China Go After Cryptocurrencies",1633050938,7,1
pyx7lp,Gamb1420,Shorters,1633050269,7,1
pyx4b7,JamesW13242,Looking to start a community to research new projects and do TA on bitcoin and other coins. If you are interested on joining the family please message me! hope to see ya soon,1633049967,3,1
pywzil,Charnew03,This has nothing to do with bitcoin but check out my NFT lol,1633049510,0,1
pyww4k,Aida-Medvedeva-2,I JUST PUBLISHED SHOULD YOU INVEST IN BITCOIN?,1633049177,0,1
pywuwe,CTechnology,40k SUPPORT LETS GO!,1633049061,3,1
pywqpd,pistonian,"If Satoshi is alive, he has probably destroyed his keys by now to prevent the overwhelming temptation",1633048653,92,1
pywoxu,Single_Emotion740,Just invested $200 into Bitcoin on cashapp? Wise move? How long should I leave it in there? Should I keep buying in? New to this.,1633048481,91,1
pywn59,Rolff999,Bears when PlanB’s prediction is correct for the 2nd month in a row,1633048303,0,1
pyw725,Roger_Sterling0001,Gold is analog Bitcoin,1633046756,0,1
pyw1as,beluga312,"Get Paid To Use Facebook, Twitter And Youtube",1633046237,0,1
pyvu1g,Renaissance2point0,"Bitcoin Atlas, standing at the edge if the world. 2nd BTC painting.",1633045524,0,1
pyvt0a,CryptoCurrencEEE,Fed Chair Jerome Powell differentiated between regulating stablecoins and banning Bitcoin and other cryptocurrencies.,1633045424,15,1
pyva0g,saidweightloss,Peter Schiff: Banks Will Seize Everything You Own In This Coming Financial Crash,1633043602,17,1
pyv4hd,donmulatito,BitBoy the biggest hack in crypto?,1633043068,30,1
pyuxua,DingWrong,SCAM ALERT: SufficientCell_ - daily returns of 4.6% profit - PrimeFundsPro,1633042456,0,1
pyutwq,Interesting-Honey405,"I would like to draw your attention to a new NFT Series. Individual creatures, individual drawings, and own stories. I'm finally done, please give me your feedback! Thrills and spills...THX, Susie Discussion",1633042086,1,1
pyushz,Illustrious-Phase-48,This may be a dumb question.... (related to business acceptance),1633041954,30,1
pyurjh,Amboo515,Scam website?,1633041868,6,1
pyurds,thefoodboylover,Robert Kiyosaki forecasts economic collapse in October that will affect gold and bitcoin prices,1633041855,6,1
pyumqs,A-Dog22,"$MARA: From $500,000 a Month to $100M | Bitcoin Mining | Power Hour",1633041401,13,1
pyuku8,RandomVanu,What makes Bitcoin special?,1633041227,18,1
pyufro,salvador96,Illinois will be able hold Bitcoin,1633040779,19,1
pyu4hf,TheAntiHokie,Verifone to enable crypto payments at major retailers through BitPay,1633039757,0,1
pytwkc,jeff2077,I kinda don't want it to move anymore,1633039084,1,1
pytp3d,SID1318,Keep trying and always fail! #Bitcoin,1633038422,0,1
pytohb,flclst3v3,Remember when we were all going to buy bitcoin when El Salvador was making bitcoin legal tender. Curious how many of you actually bought? I know there was a huge dump but who cares I hodl long term.,1633038368,49,1
pytesv,mexicanlirlinvestor,Market crash equals= BTC ATH,1633037526,0,1
pytbr8,amgeirpz,Bitcoin Multisignature Implementation,1633037257,0,1
pyt9gw,EROS_VERITAS,Just hilarious!,1633037058,1,1
pyt6ip,Sweet_Maddy1,Defi💙,1633036802,1,1
pysxv4,MikeygoesCrypto,STAR SHIP ENTERPRISE I've taken some sort of a psychedelic plant here. ...,1633036068,5,1
pystnr,zeniapy,2021 is not like 2017 - a humble opinion.,1633035719,2,1
pysmm2,PoensieWeit,Hey PlanB …. F💪cking Legend 🚀,1633035129,303,1
pysjr3,Silver_Local1486,A question about Bitcoin and relationship with my friend!,1633034886,33,1
pysjq4,westneone,Made a special neon sign Bitcoin. i think it turned out amazing,1633034884,1,1
pyshgl,PoensieWeit,Hey PlanB … F💪cking Legend 🚀,1633034686,0,1
pyshgk,ThanosAsAPrincess,Is this the new 'Big Mac'?,1633034686,5,1
pysew5,RonaldLewis17,"Are you aware that Bitcoin is the Feature? I can help you earn up $32,000 actively while investing into bitcoin. Ask me how",1633034472,0,1
pyseps,Garland_Key,It finally came! What do you think?,1633034458,30,1
pysd8e,Teaatnighttime,'Ukraine Legalizes Bitcoin' by Bitcoin Magazine,1633034332,2,1
pysc4s,Zealousideal_Book151,The Fed / BTC and crypto🚀,1633034236,0,1
pyrzth,Funny_Trade9564,What do we do about inflation and a potential market crash,1633033181,23,1
pyryj2,MillerNPR,I have found 2 seed phrases on an old device I used in 2017.,1633033074,4,1
pyryit,BitCoinsAreTheFuture,The next run up,1633033073,40,1
pyrwst,[deleted],What do we do about inflation and potential market collapses?,1633032927,0,1
pyrpcl,jeralynthemoneycoach,Teaching how to make money online,1633032308,0,1
pyromw,OckilliusEnki,New upcoming artist - insane NFT collection 2048 x 1200,1633032243,0,1
pyrki2,J_gilan,Earn Money even when you are sleeping,1633031912,0,1
pyrj1w,MonetiseMyMind,Lyn Alden - What is Driving Bitcoin? #Shorts,1633031788,4,1
pyrg88,MonetiseMyMind,Lyn Alden - Can This Drive Bitcoin Into The Future?,1633031545,2,1
