id,author,title,created_utc,num_comments,score
q2rw5x,DoodleRoodle,Realising thicc btc profits through the company: bank and tax residency advice,1633549404,15,0
q2rvmm,fecktk,Data Points to Record Bitcoin Bull Run Coming Soon,1633549356,14,7
q2rthr,BryanBSolstin,"I’m OK with Apex predator. I’m more comfortable the phrase, “macro consensus”. Bitcoin isn’t my religion. Rather, it is a unifying component of what I believe. Bitcoin is minimalism.",1633549170,7,3
q2rs52,cryptokoy,Here we go BTC,1633549054,71,64
q2rqqz,blmocoin,#blmobank,1633548930,0,1
q2ronh,simplelifestyle,"Edward Snowden: ""Our monetary system is commanded by people who literally believe changing the ""one dollar"" stamp on a platinum coin to ""one trillion dollars"" is the solution to running out of money. Imagine if you tried that with your student loans.""",1633548753,118,22
q2rl5r,TheGAUDENT,BTC MAXI,1633548446,0,1
q2rl4m,AdministrativeWord19,Taking profits,1633548443,16,0
q2rk7q,TheGAUDENT,LIST OF BITCOIN MAXIMALIST,1633548358,0,1
q2rk1p,BashCo,"Tales from the Crypt: #273: Supply chain problems, a proposed solution, and Bitcoin + Natural Rights with Ross Kennedy",1633548342,0,2
q2ria9,[deleted],Buy Bitcoin at the lowest cost,1633548186,0,1
q2r9v8,DejesusMorrobel,Is Dogecoin dead? Is there future for the currency?,1633547512,0,1
q2r7vx,AdNational7013,"Apes who waiting for Bitcoin dip to buy, please comment your price targets",1633547346,0,1
q2r7ii,mccormack555,Bitcoin &amp; the Financial Transformation with Greg Carson — What Bitcoin Did,1633547315,0,2
q2r5vg,SalamandaGrill,Glassnode &amp; CryptoQuant,1633547180,0,2
q2r4sy,jajg,BTC for everyday purchases,1633547091,9,2
q2r3cr,seefo78,1 Sat = 100.000.000 Fin,1633546975,8,0
q2r1px,UnderstandingBroad90,Attention Bitcoin Whales this new upcoming NFT which honors Bitcoin and other crypto whales is for you!,1633546851,0,1
q2qzb4,Particular-Wish-156,Dash will explode to 1500$,1633546678,0,1
q2qulk,[deleted],"Life in another location, imaging my community to the world.",1633546276,4,1
q2qt60,Impressive-Respect83,Noice,1633546156,0,1
q2qn7o,rdfporcazzo,[Adoption] The Landscape of Cryptocurrency Usage in Africa,1633545651,10,3
q2qhyo,olli_ita,Yesterday i got a call from my Bank,1633545197,410,61
q2qd58,CryptoCurrencEEE,"Bitcoin soars to 50,000 again on institutional demand. Market participants cited the increase in institutional crypto services from banks and financial institutions to cope with rising investor demand, as one factor driving bitcoin's surge.",1633544789,4,5
q2q9jx,nvh04531,Gareth Soloway WARNS : Stock markets are about to peak ; how large is next correction?,1633544484,4,0
q2q95l,EkariKeimei,"Patience: Pionex grid trading bot running for 4 months with no transactions; I never do margin or leverage, and I never sell at loss. This is what it looks like to start a bot right before a baer market with that no-loss policy.",1633544452,4,0
q2q5ws,ariesdrifter77,Yolo revelation,1633544175,0,1
q2q3t1,[deleted],Serious question about bitcoin rising (dont flame me),1633544001,56,2
q2q3je,Sofia555512,"Who will be a better investment in the future, ETH or Bitcoin?",1633543978,8,0
q2q308,furca14,Finally hit 0.01 BTC,1633543933,157,43
q2q1z3,001_vanilladreams,Bitcoin Political Party,1633543840,9,1
q2q10n,Prosper_Saint,hi,1633543757,0,1
q2q0sc,[deleted],"When you never sell at loss, and leave the trading bot on during a 4 mo bear market! Profits soon!",1633543740,2,1
q2pyx3,PaxfulOfficial,"Oslo Freedom Forum 2021: Human Rights + Bitcoin, Event Recap",1633543587,0,1
q2pwvy,prp54,College Student's perspective on bitcoin,1633543420,43,0
q2pvyu,prp54,Do you think bitcoin millionaires are seen as less legitimate than regular millionaires?,1633543344,0,1
q2ptlj,[deleted],Attention this is no AD,1633543167,28,0
q2pt1n,WinAllAroundMee,Whats with Grayscale Bitcoin Trust?,1633543123,25,0
q2psmz,Cryptgro,Satoshi Nakamoto’s Easter Eggs – Perfectly Timed Messages,1633543091,5,0
q2pmkn,Zemorphus,Soros Fund Management CEO confirms the billionaire investor's family office is trading bitcoin,1633542559,28,15
q2pj67,BlacksmithExciting35,"The best part about this is that the USD has ABSOLUTELY NO intrinsic value, so of course Bitcoin doesn’t if it is based off the USD. These people need to quit trying to manipulate people’s brains and stop giving false accusations. At least Bitcoin is backed by something that Give it value!",1633542263,0,2
q2pgfv,triplea_gcs,Don't miss out on BTCs satoshi as you missed out on bitcoin!!!,1633542027,0,1
q2pfnj,s3k2p7s9m8b5,History sometimes repeats...,1633541963,2,0
q2pehq,[deleted],Any idea why GBTC is trading at an 18% discount compared to the underlying bitcoins?,1633541862,0,1
q2pdqa,Morty_Goldman,Bitcoin set to become legal payment in Brazil,1633541797,6,26
q2pckp,Crowbar12121,I just bought $2500 in BTC,1633541700,64,0
q2pcja,Appropriate_Yak_8426,Who else watches Bitcoin skyrocket? 📉🤑💃💲💪,1633541696,0,1
q2paef,coinsmash1,Did your crypto portfolio outperform HODLing just Bitcoin or Ethereum?,1633541509,2,0
q2pa6z,-ST4K-,Where is Crypto Zombie?,1633541490,9,0
q2p9t3,HDmac,BearWhale memorial - 10/6/2014,1633541459,2,0
q2p9m8,Simplybitcoin1,"Daily Bitcoin News October 5th, 2021",1633541442,0,2
q2p6el,EnthusiasmFlimsy,Any Bitcoiner/FFXIV fans/Video editors out there? Thought it would be a cool idea to edit the Endwalker trailer for Bitcoin with the fall of the fiat sectors and BTC ending on the moon. Prolly will be a nothingburger here but ya never know lol.,1633541182,0,1
q2p5x1,sylsau,The Four Levels To Achieve Self-Sovereignty With Bitcoin. Buying Bitcoin is just the first step in a long and wonderful journey.,1633541141,14,3
q2p0bg,Zestyclose_Case7382,I buy Bitcoin with good and cool rates and I pay instantly,1633540681,0,1
q2ozrn,Puzzleheaded-Camp-14,El Salvador,1633540637,20,1
q2oy2q,hotdog-water--,Bad to store Bitcoin in Coinbase?,1633540510,23,0
q2oxrt,mrericvillalobos,You Got The Coin,1633540487,3,0
q2oxjp,DryAd7516,"What do you think, will be there a dip soon or will BTC hold this level? I know, that all of us can’t take a look in the future, but I’m interested in your opinion. Thanks, guys.",1633540469,15,0
q2ow7o,Zaid-King,Do you want to invest your money safely and get a stable monthly income ? Are you a beginner and want to invest and don't know where to start? Do you need experts to help you invest your money?,1633540359,0,1
q2otq8,NuklearToxin,Is there any way to buy bitcoin directly to bustabit?,1633540166,12,0
q2ostl,TheArabCanadian,"Bitcoin hits $69,420 CAD for the first time since May 13",1633540089,0,1
q2osew,jmurill20147,Sending screenshots,1633540052,30,0
q2opmp,prp54,How do you plan to be rich?,1633539826,19,0
q2onup,bikash8gupta,KoinKnight in September 2021,1633539681,1,0
q2olor,OsamaBinWhiskers,Cheapest way to dollar cost average BTC,1633539521,33,0
q2ofga,gsarin1980,Simpsons moment in India - Inevitable !!!,1633539006,15,4
q2of01,platham36,Why Bitcoin?,1633538971,0,0
q2od69,ybvb,"So now that Soros is buying, what was this guy from the future... ?",1633538823,3,0
q2od0s,DrGehirn,I got lucky with a leveraged position and am now wondering if there is any downside to keep it open for months/years?,1633538809,50,0
q2o770,blooye123,Best Bitcoin facts,1633538321,39,0
q2o5bb,nativeBTC,Nice,1633538157,0,1
q2o3bp,fecktk,Bitcoin Supply Shock: Is The Mother Of All Supply Squeezes Finally Upon Us?,1633537991,10,6
q2o1wx,xxlibertyordeathxx,A New Era,1633537872,24,14
q2o08j,Hilarious_x,"If a Vegan holds Bitcoin, what do they talk about first ?",1633537734,0,1
q2nwyo,oneoldfarmer,Volatility as an obstacle to adoption for transactions,1633537456,4,0
q2ntuh,[deleted],Whats up my fellow Canadians!,1633537205,0,1
q2ntaw,bandikut2020,Scammers gonna scam - stay safe,1633537158,0,1
q2nrjn,Jethroe1,I have to.,1633537001,14,17
q2nnwr,Phreesion,Bank of America: 1/3 of United States Will Use Crypto Till 2022,1633536706,0,1
q2nlvz,NimbleBodhi,"Today is the 7th Anniversery of Slaying the Bear Whale who sold 30,000 BTC for $300 per bitcoin",1633536536,63,32
q2nle2,stephanlivera,SLP310 Should We Stop Using Software Wallets? Bitcoin Software Security With Charles Guillemet,1633536496,5,0
q2nk7i,Substantial_Race_554,"Bitcoin breakout, daily trading room Elliott Wave analysis.",1633536399,2,0
q2nhzy,BlockingPerson,"Im trying to sell a small amount of bitcoin, about 30$, how could I do it with minimal fees and have the cash go to my paypal?",1633536219,46,1
q2ng32,SlavikZeus,When stop,1633536063,14,0
q0m7ul,Letsmakeitawsome,So I was considering lending,1633281538,33,1
q0m41u,Dear-Study-7236,5#Biggest Companies in the World,1633281218,0,1
q0m2o7,lordtedi,Just moved to Ireland and found this on the streets of Dublin,1633281097,1,1
q0lw5h,a4ther,Good Documental - Dirty Gold,1633280545,3,1
q0lsg3,sylsau,How Bitcoin Is the Answer to US Economic Sanctions for Nations. More and more countries will seize this unique opportunity.,1633280253,4,1
q0lp4p,DefiniteOptimist,"If Gensler approves only a Bitcoin futures ETF and not a spot ETF in October, what is the actual fair reasoning to do so? Is it really just to provide a profitable product to Wallstreet or is there more?",1633279969,16,1
q0lo3q,duduqa,"""Bitcoin soon to become legal tender in Brazil"", says congressman as ""Bitcoin Law"" passes committee and is expected to be approved by the brazilian Congress.",1633279878,268,1
q0lnb8,Terhonator,My favourite BTC song,1633279809,2,1
q0ln9m,SnooPineapplez,Do we need to increase the blocksize? I don't understand Andreas Antonopoulos' position on this..,1633279805,16,1
q0lhym,Exciting-Roof-5099,China crypto ban,1633279367,5,1
q0lgw5,evilninjarobot,El Salvador Mines First BTC Using Volcano Energy,1633279278,4,1
q0lghq,WhalesHeaven,"Honestly, didn't see Bitcoin mining with the power of a volcano becoming a thing, but volcanode is now a thing and it's amazing. El Salvador has already mined $300 and more green BTC is coming! What do you have to say to that, Elon Musk?",1633279243,82,1
q0ldz9,nachunja,Steve Hanke's twitter,1633279033,14,1
q0l9cb,IcyEffective5407,Bitcoin Recovery Service,1633278658,3,1
q0l5y7,ilyasErrafik7,Me after #Bitcoin goes to $0,1633278374,0,1
q0l181,WhalesHeaven,"September is historically a bearish month for crypto, but now Q4 has started. We can already see Uptober helping Bitcoin find its way back to the early September level. Let it flip the market and we gonna see new ATH🔥",1633277986,0,1
q0l0l4,spinbarkit,"hi, my modest input to this (amazing) community",1633277931,30,1
q0kvsd,greatgoogelymoogely,Tether is HOLDING us Back. #CUTTHETETHER,1633277513,10,1
q0kvnh,secret_code_words,Exchange Withdrawal Fees,1633277503,8,1
q0kj7d,joujbiz,Learn how to invest in Crypto with the best techniques used by the best investors out there !!!,1633276516,0,1
q0kizt,mathwizard32,I'm trying to buy an antminer b7. Does this seller look legit?,1633276499,2,1
q0kib9,DianeTmRo,3 ways to buy Bitcoin in less than a minute.,1633276446,2,1
q0kd5j,Razhier,This is the way,1633276023,0,1
q0k9wp,BeautifulEase9974,my website,1633275751,0,1
q0jwwl,btc_has_no_king,Running a bitcoin core node in my laptop for the first time... some doubts,1633274671,4,1
q0js2n,_Hoborg_,Looking for advice on borrowing fiat against my btc,1633274270,106,1
q0joqr,maroonblood94,Buy Bitcoin only? Or trade alts to accumulate more Bitcoin? Help me understand the pros and cons.,1633273963,0,1
q0j2me,_smudger_,⚡⚡⚡It took 2 and a half years for the LN to grow from holding 1000 to 2000 bitcoins. Two months later it has now reached 3000.⚡⚡⚡,1633272071,93,1
q0j27o,jonathansy0521,Switch to iBG Finance. The future of #banking and personal finances is no longer tied to a particular third party point of control.,1633272039,0,1
q0ix00,Blankcoffers,FOR THE 1000TH TIME THERE IS NO EXIT STRATEGY!,1633271596,0,1
q0ish2,Tarquinius_Superbus,What really happened in North Korea: Longread from author who was on trip with Virgil Griffith,1633271190,0,1
q0irvf,jam-hay,The fashion designer Philipp Plein is currently offering a 10% discount for anyone paying in Bitcoin,1633271134,0,1
q0iqyg,OptimusGrinding,BitCoin and a Dope Bank Account,1633271054,0,1
q0ilhm,Jazzlike_Peach_7492,Canadian Perspective on Bitcoin,1633270557,0,1
q0ik4w,fomoFace,Will scams increase exponentially when BTC becomes the main currency?,1633270438,39,1
q0iicg,ItsmeagainS,Take a few Minutes please ...,1633270270,0,1
q0iiax,yaboyyds,LET THE GAME BEGIN ! ! !,1633270267,0,1
q0i9at,AJAXinEXILE,Crypto address last digit wrong - joke video,1633269482,7,1
q0i2c7,99999999999999999989,So how much is a LOT of bitcoin to own?,1633268821,69,1
q0i21d,Feb2nd2022,"Shaun Bridges and story of 20,000 BTC",1633268791,36,1
q0hxj3,KruseTheKing,Thoughts on Bitcoin fee problem?,1633268367,15,1
q0hwxm,Rieffermaddness,Why buy shit when u can have the bit !!!,1633268310,35,1
q0hscu,mujshanan92,[Adoption] Texas Poised To Be A World Leader In Bitcoin And Blockchain,1633267864,20,1
q0hr7u,Special_Yam_1174,"Hash rate is rebounding, reaching the highest level since mid May today.",1633267756,1,1
q0hibs,Few_Still_5735,"Bitcoin, Fiat Currencies and How Banking Took over the World",1633266861,0,1
q0hgbb,Phantazma94,ASIC miner not running on promised hashrate (Canaan Avalon 1246),1633266655,18,1
q0h1f6,code_wizard_,Events that could end current bitcoin cycle,1633265146,22,1
q0h08a,Level_Barracuda6549,Coinbase cryptos stolen? There is soultion for that!,1633265014,8,1
q0gyyn,yeho_meta,Hey China? Still hodling,1633264871,3,1
q0gvv0,hyperinflationUSA,"Fiat currencies are depopulating the earth, nobody can afford to have kids, they can barely support themselves.",1633264531,52,1
q0gt6k,TombStoneFaro,What are the secondary effects of El Salvador adopting Bitcoin?,1633264241,7,1
q0grel,CryptoCurrencEEE,Texas Aim To Be A World Leader In Bitcoin And Blockchain,1633264042,272,1
q0goi0,Hopeium_Littlefish,Bitcoin Passive Income,1633263709,26,1
q0gnq2,poomata,Bitcoin's Hashrate Comes Close to Recording New All-Time High Despite China's Ban,1633263623,1,1
q0gm03,Feb2nd2022,"BTC Monthly Return Chart: Oct, Nov &amp; Dec... Place your bets here!",1633263436,2,1
q0glxd,_Insulin_Junkie,Funny how Visa announces support for crypto after this incredibly educational Jack Mallers interview. Watch and learn.,1633263427,2,1
q0glbk,sepke12345,Mr Goxx - a hamster that performs better than institutional investors - Blockbulletin,1633263365,1,1
q0gcgl,Jim__lad,Is Bitcoin the first AI?,1633262380,20,1
q0gc70,No-Aardvark4098,GALA/BTC 🚀🚀,1633262349,2,1
q0g9uz,JunoKat,What the vodoo Michael Saylor is talking about?,1633262054,80,1
q0g6lk,icurami,stamped and approved by lord coin.,1633261654,0,1
q0g0lp,crabbyreader,FUD incoming...BTC's careening around a corner to victory..equities toward collapse..rather be in this ride than that one.,1633260923,7,1
q0fqx5,Professional-Half-55,Fud,1633259548,5,1
q0fnuo,CringedIn,Which UK bank should I use for cryptocurrency? I need to withdraw what I have in my Binance account..,1633259109,22,1
q0fg9h,yousuf190,Coinjar showing $0 balance? when I bought $2K worth last night???,1633258069,19,1
q0fe6z,ItsSomethingNot,Coinbase Address Whitelisting Security Concerns,1633257787,1,1
q0fbga,PrognosticalSon,"Unpopular opinion: Collateralized loans will move BTC from retail to institutions, who will get even richer.",1633257424,43,1
q0ewz5,Honest_Lemon1,Will crypto market allow to make 100-200x returns within the next 10 years?,1633255566,5,1
q0ekln,Admirable_Cause6137,Top 3 NFT for 5x Returns | Wazirx NFT | What is NFT in Hindi,1633253764,1,1
q0ekfw,MVM_TRADING,Way to study Bitcoin,1633253743,0,1
q0ek48,C4-PO,China’s crypto ban may reveal digital yuan CBDC goals,1633253700,3,1
q0e7ci,BlueSyntax,How does block-rewards work when mining?,1633251905,8,1
q0e5gz,treebee93,Bitcoin to 138k,1633251641,296,1
q0duur,tripleredadam,I thought Jack Mallers wouldn’t need to scam people to get BTC but maybe I was wrong?,1633250152,1,1
q0dt3j,Accurate-Context-542,Airdrop 30 EUR in BTC,1633249889,0,1
q0drw5,comizer2,Gov't out-mining everybody else combined,1633249721,16,1
q0dm9g,samcornwell,Founder of Compound threatens to doxx users who won’t return $90m in mistakenly sent Bitcoin,1633248915,3,1
q0d8cl,Playful-Message-5119,title,1633247170,0,1
q0d3sp,peptopro17,Where should I start out,1633246545,6,1
q0crmi,Successful-Mood2273,Should I take out a loan to buy Crypto,1633244917,108,1
q0cga5,DistributionBorn5372,Does anyone want to communicate about airdrops?,1633243428,0,1
q0bwjz,rahulpundeerreddite,Should you invest in cryptocurrency?,1633240812,0,1
q0br4t,goober0608,Scam or not?,1633240105,35,1
q0bmq1,StoneHammers,It never gets old,1633239550,1,1
q0b5fp,Unusual-Football6340,"Over 6,000 Coinbase Customers Lost Funds in a Hack",1633237419,6,1
q0b4vl,rBitcoinMod,"Daily Discussion, October 03, 2021",1633237353,491,1
q0b221,StalinWasOkIGuess,Pls dont send me any btc,1633237025,0,1
q0b0yg,sburke0708,"ELI5 - Now that Bitcoin is on the lightning network and accessible to everyone with rapid txn speeds, why do we need Bitcoin Cash?",1633236881,7,1
q0ay3i,luoyeguigen,你手上有200万，但你手上有500万的人来买你的房子，你怎么办？那你拿这笔钱做什么？,1633236514,0,1
q4v7ef,Nanner_hammy,"Bitcoin ETFs, will they suppress price?",1633817322,25,1
q4v6dq,cidadefalcao,"The average millionaire today can have at most 0.375 BTC, and this number gets lower by the day",1633817227,190,1
q4v3za,xeaxant,"Block 704267 processed only one transaction, the reward itself",1633817006,34,1
q4v22d,McJuggerNuggets,Satoshi Nakamoto Revealed After Losing His Private Keys,1633816833,2,1
q4uzf0,Objective-Poem-6641,When we hit the moon!,1633816615,0,1
q4uy1e,CptSafetyWafety,"You'd be up 20X if you listened to this guy on July 12th, 2017.",1633816488,105,1
q4uwu4,JJR127,Change Addresses,1633816381,9,1
q4uty7,Positive_Lab6933,Scam alert,1633816115,19,1
q4utuj,Diligent_Buyer9440,CHINA=SATOSHI NAKAMOTO ?,1633816106,70,1
q4utu7,ImaginaryMarsupial38,Your Money and Your Life - Central Banks Digital Currencies will ransom our future,1633816105,1,1
q4up75,bobbysmalls337,Did Elon just send me bootcoin,1633815675,2,1
q4uljh,NFTsir,UPDATE,1633815345,1,1
q4uk6e,LordBromander,Bitcoin ETF question,1633815227,7,1
q4ujuk,NFTsir,NEWS,1633815195,1,1
q4uc9q,TCr0wn,Bitcoin To 125k? TOTAL market cap suggests YES!,1633814496,1,1
q4u8ot,ccrider92,The first mention of Bitcoin in 2600: The Hacker Quarterly.,1633814163,8,1
q4u3ul,Woke_all_the_time69,Bitcoin Helpdesk?,1633813727,10,1
q4u0w6,teflonjon321,Best Day to DCA (past 6 months),1633813463,23,1
q4tzdb,ElMalek-2021,"Any suggestions of how to take more advantage of my BTC , other than just hodling it. ??",1633813336,0,1
q4tyc6,cosmicnag,Someone made a Lightning powered beer tap,1633813247,5,1
q4tx39,James_from_CoinTickr,Bitcoin crossed $55K,1633813158,9,1
q4tt03,wolly399,COORDINATED IG SCAM.,1633812789,0,1
q4tr8e,pcvcolin,"Bitcoin people, Inc. - where to go on Earth and outer space ""where you are treated best"" and how to do that (a summary analysis, post-OECD/G20 2021), &amp; some tech thoughts",1633812626,2,1
q4tqox,abandon-zoo,Best exchange for 1 BTC purchase? (Already tried CoinBase and Strike),1633812576,0,1
q4tosw,erikweisz44,Weiss Crypto Ratings for Extensive Independent Analysis - Attic Capital,1633812407,0,1
q4tmfw,yeho_meta,Bogdanoff Le Movie - Trailer 2021,1633812198,1,1
q4tg17,slvbtc,What is the GDP of bitcoin?,1633811619,6,1
q4tdjy,fizik4,ShibaMini,1633811399,1,1
q4t60l,dbudlov,"Vitalik, store loser, he's right no currency should be forced onto anyone by governments though",1633810716,10,1
q4t4d8,waywego5,Lowest sending limit,1633810572,7,1
q4swqu,fecktk,"As we get closer and closer to true adoption, Politicians endorsing (and buying) Bitcoin and crypto increases.",1633809917,1,1
q4srgf,rndaom,Bitcoin IRA?,1633809502,9,1
q4sm7j,taotraderr,trading Crypto on mt,1633809053,3,1
q4sgv8,William5848,Two-way cryptocurrency trading,1633808569,0,1
q4sfbn,Vinylmanstanding,I need karma please,1633808436,0,1
q4sexs,AdaZhang1987,BTC's latest strong trend,1633808403,8,1
q4sex0,notapersonaltrainer,Senator Ted Cruz Bitcoin talk at Texas Blockchain Summit,1633808401,16,1
q4s5n5,William5848,Cryptocurrency short-term trading,1633807595,0,1
q4s5fm,noNSFWcontent,Probably a stupid question about block rewards becoming extremely low in the future.,1633807577,16,1
q4ryo7,SmartAileen,"Bitcoin (BTC)-$100,000 by the end of 2021?",1633806984,31,1
q4rmru,Special_Yam_1174,The Predator-Prey Dynamics Of Bitcoin: Michael Saylor - Bitcoin Magazine,1633805997,0,1
q4rhsp,ToevolutionOfficial,Bitcoin Trading Strategies To Become a Professional,1633805581,0,1
q4rgfh,Wilynesslessness,Amazon US removed from Bitrefill?,1633805452,4,1
q4rfmn,ashrafbiplob99,How to Transfer Bitcoin to PayPal Instantly | Sell Bitcoin for PayPal,1633805382,0,1
q4r7b9,redditorrheart,Got scammed 6k need help with taxes,1633804671,2,1
q4r735,cerebral_monkey261,Exchanges in Canada?,1633804651,11,1
q4r6zd,start100000,SEC throws sop to US investors with bitcoin ‘lite’ equity ETFs,1633804643,8,1
q4r69x,Special_Yam_1174,What I think about Bitcoin..?,1633804582,0,1
q4qtll,mommmom,What is the reason for Bitcoin's 14% rise this week?,1633803458,27,1
q4qcgp,Impressive_Ad6758,Check out this #NFT for sale on Mintable! Pick up 'Spinning Spirals' before its swooped up!,1633802010,0,1
q4q71k,Set1Less,Vitalik hitting out against Bitcoin because of El Salvador's adoption and spreading FUD like buttcoiners shows he is just a hypocrite,1633801535,309,1
q4pzrb,No-Significance-3227,Gotta be scam,1633800921,0,1
q4pyx1,Lasoscuridades,Bitcoin Heavy Cotton T-Shirt,1633800854,0,1
q4pwmg,cat-playing-poker,Bitcoin Supply is Deceasing,1633800668,31,1
q4puii,abhijaygadai,"JPMorgan Says Institutional Investors Are Replacing Gold With Bitcoin ""Bitcoin's allure as an inflation hedge"" is drawing institutional investors back to the crypto market, JPMorgan's Nikolaos Panigirtzoglou wrote in an Oct. 6 research note to clients. Panigirtzoglou pointed to ""The failure of gol",1633800483,0,1
q4pr6v,tryayahuascaasap,US Bitcoin Exchange with Trailing Stops,1633800195,2,1
q4ppes,TroyStackhouse,"Spencer Schiff mocks his dad, Peter Schiff (infamous bitcoin critic), as he commemorates going 120% long",1633800046,0,1
q4pmnu,IJustStabbedMyNan,"Mining BTC, is it profitable?",1633799809,5,1
q4pgjl,nunya_business0000,looks like bear lord is a little salty,1633799297,0,1
q4pfc3,Unbelievable_OG,Bitcoin’s upside from here is 10x over 10 years,1633799197,143,1
q4p57f,Cinderella0715,When did you first hear about Bitcoin? And how did you learn about it?,1633798369,10,1
q4p4u9,DBquartercoin,Bitcoin on it's way to becoming legal tender in more countries,1633798336,0,1
q4p3t9,Jennifer1Whale,The Volt Crypto Revolution and Technology ETF has passed Can a Bitcoin ETF be far behind?,1633798246,0,1
q4p3n7,SIMindustries,anyone use itrustcapital to own bitcoin in their IRA?,1633798231,3,1
q4p1h6,DBquartercoin,5 countries will be getting on board with bitcoin,1633798044,0,1
q4p1av,SIMindustries,anyone use itrustcapital to on bitcoin in their IRA?,1633798030,0,1
q4oyn1,33nmakkie,China Plans To Add Crypto Mining To Negative List Of Industries To Invest In,1633797802,8,1
q4or46,Substantial_Race_554,#32 Bitcoin and Ethereum Elliott Wave analysis. 10/09/21,1633797148,1,1
q4oqq0,jankis2020,What’s the catch?,1633797114,99,1
q4oefu,Next_Locksmith704,1 ETH Giveaway,1633796032,1,1
q4ocad,TroyStackhouse,Son of world's #1 bitcoin critic (Peter Schiff) roasted his dad and went 120% long,1633795845,1,1
q4oc9k,EcstaticDistance4304,Bitcoin without exchanges / wallets,1633795843,12,1
q4o7bm,Baby999999,Happy,1633795412,1,1
q4o4ak,Simplybitcoin1,"Daily Bitcoin News October 8th, 2021",1633795174,1,1
q4nlht,whimsical_tittynope,What are some reasons BTC can fail.,1633793492,30,1
q4nkij,TransientWonderboy,"I'm proud to say after many years of mining, staking, and hodling I've finally earned the 1 BTC minimum to trade for my own Bitcoin! Thank you all for your sage advice over the years, I couldn't have done it without you.",1633793415,0,1
q4nihp,34Kelvin,"IBuy Cryptocurrency, BTC USDT, ETH Chinese Yuan Rmb BCH Dm Me +2347083676583.",1633793235,0,1
q4nh8n,ghostofanimus,What is a BTC ETF?,1633793121,10,1
q4ng5j,ghostofanimus,ELI5 what is a BTC ETF?,1633793024,0,1
q4neuq,RiskyMotion,Whales Pumping and Dumping,1633792908,8,1
q4nc2r,Fuck_Ethereum,Showing off a rare 2015 physical bitcoin!,1633792662,36,1
q4n5hl,IDidReadTheSideBar,Dumb question: can I have two hard wallets that hold the same keys?,1633792090,22,1
q4n01x,heidtmare,Fed taper in November: Good for Bitcoin?,1633791623,5,1
q4myku,LinLo99,Grateful to meet cryptocurrency,1633791501,4,1
q4mweb,Hefty-Two-283,Top 10 Tips - How to Make Money with Bitcoin,1633791310,0,1
q4mriz,CowboyTrout,FUD Propaganda on CBS. Please watch the end to understand the establishments end game. (Also downvote the heck out of it),1633790842,11,1
q4mq6c,fecktk,Super Bowl Champion Laments Wasting 50k Clubbing Instead Of Buying Bitcoin,1633790717,27,1
q93ht0,spiffyXD,Jack Dorsey's Square Considers Building A Global Bitcoin Mining System,1634353127,5,1
q93gck,simplelifestyle,Bitcoin Price Soars on ETF Optimism,1634352973,6,1
q93fdm,wabtc6,What is bitcoin,1634352870,0,1
q934gf,mybed54,How did people obtain Bitcoin before Tether?,1634351735,6,1
q930ec,Ima-Stonks,I bought at the top so you don't have to. (But you should),1634351329,23,1
q92ytk,Zombie4141,Does anybody fear a bitcoin ETF?,1634351150,25,1
q92t76,ScamJustice,Anyone do direct deposit with Strike for their paycheck?,1634350532,22,1
q92p7c,Phreesion,Square CEO Dorsey says looking to build a bitcoin mining system,1634350105,15,1
q92osx,Bndnvr,"Even though the market is ecstatic I feel Grayscale's move in the long run is not good for BTC. Every time a commodity e.g. gold, silver, oil etc. was approved by SEC to be listed on the futures market the price was manipulated downward in the long run.",1634350067,20,1
