id,author,title,created_utc,num_comments,score
qhwxjo,karenlacera,CAPITAL FXS,1635456126,0,1
qhwvgt,HugoRamos,Shiba Inu Is Dog PooPoo! 💩🤣🤣 (Bitcoin Real Investment),1635455951,10,1
qhwlb8,FreedomNinja1776,I asked HR about Bitcoin as a retirement benefit.,1635455106,20,1
qhwivu,StellaDog1969,Let's Go!!!!,1635454907,7,1
qhwcki,Bingopajama222,BTC will hit 6 digits by eoy!!!!,1635454410,9,1
qhwafq,nasariuamivlo,What's the biggest waste of money you've ever seen?,1635454234,19,1
qhwa1q,xxGallo13xx,Tom Brady promoting Bitcoin. He knows where to invest his money !!,1635454201,0,1
qhw148,Forsaken_Associate77,Shiba is comming,1635453490,1,1
qhw0at,James-netbooknews,[Support Akita Inu] Need your help to build a strong community,1635453424,4,1
qhvzrf,xxGallo13xx,Squid Game inspired crypto trends: what's behind the hype? | StormGain,1635453377,2,1
qhvyay,Leather-Balls,Why does this seem false?,1635453263,1,1
qhvxnw,Unique-Maintenance32,Ndax The worst exchange ever,1635453214,6,1
qhvv2l,mindfulnaser,I Bought A Pizza with BITCOIN ⚡️ in Prague,1635452998,238,1
qhvsdv,blu_mOOn_2020,Bitcoin and the use of energy to humans and climate,1635452776,4,1
qhvqam,Austins-Reddit,Visualize Bitcoin Options Trading,1635452605,6,1
qhvpdh,turick,New hosted mining option,1635452527,1,1
qhvo72,jenameh,stuck situation,1635452432,3,1
qhvnaj,Marcelenenitche,📷📷 HALLOWEEN OFFERS 📷📷 BUY WlND0WS 10 PRO + 0ffice 2019 Pro Plus9.99$,1635452361,0,1
qhvm2p,Baconlawlz,Just read a super cringe article on Bitcoin Magazine. Decent intentions but terrible execution.,1635452263,2,1
qhvlua,WillianBo,"El Salvador now has 1,120 bitcoins after its last purchase",1635452244,58,1
qhv7nh,Illusive-Moose-Shop,Any startups that rely solely on bitcoin ? Using bitcoin as payment ?,1635451095,20,1
qhv3pw,smitty9207,10 year return for school project?,1635450767,7,1
qhv304,mhwayez,How should I learn crypto trading?,1635450709,23,1
qhv10d,gamblingapocalypse,Why Bitcoin will be number 1,1635450550,0,1
qhuvnw,puukuur,Prebuilt plug-and-play bitcoin nodes?,1635450125,3,1
qhupwm,alefrdrm,China and Bitcoin,1635449667,9,1
qhunyr,HotTradition6149,CRYPTO PUMP SIGNALS BINANCE,1635449504,0,1
qhul54,ResponsibleLeg88,"Just visited /btc, had no idea it was that cult like",1635449295,174,1
qhuf0j,houstond98,$46.5M of BTC long positions liquidated in 10 minutes,1635448815,0,1
qhuc5u,Leading_Barracuda837,BTC Earn Is So Easy For Me,1635448586,0,1
qhub20,arthurwolf,"This is so sad, Alexa play Edith Piaf.",1635448500,1,1
qhu9v1,Artistic_Dwilko,Bitcoin Demographic Chart!!,1635448405,0,1
qhu6r5,xcsler_returns,Showerthought: Is BTCs throughput actually larger than 7 tps?,1635448153,6,1
qhu3x7,sylsau,"When a Sh*tcoin Like SHIBA INU Goes Parabolic, Don’t Lose Sight of Why You Bought Bitcoin. Bitcoin is here to give you the power over your money, and the freedom to live your life on your own terms.",1635447925,26,1
qhtxp9,Wiardv,"You probably don't want to be daytrading Bitcoin now, unless you like getting liquidated",1635447454,2,1
qhtwfq,Dylanzz02,What is the best Discord for BTC?,1635447354,0,1
qhtstr,SoftBlacksmith2789,Flash Crash,1635447055,0,1
qiejoz,Fantastic-Release875,Regulators are working together to create a regulatory framework for banks,1635519063,22,1
qiedsh,YOLO_84,Anyone have experience using Gemini Earn?,1635518598,1,1
qieak9,simplelifestyle,Australia's Top Securities Regulator Says It Will Approve Bitcoin ETFs,1635518332,9,1
qie92h,WillianBo,Bitcoin starts to be accepted in one of the biggest business schools in the world,1635518212,6,1
qie8n5,LastBackground6317,How I gain 409$ in 1 day...,1635518181,3,1
qie6qk,kdbfg4,Christmas Idea for those with Kids,1635518032,0,1
qie5ey,Technical-Internal78,UK Police Seize Bitcoin Worth $2.8 Million From Teen Operating Scam Website,1635517925,15,1
qie531,abderhmanhaji,THIS A GOD DAMN SCAM STOP SENDING ELON MUSK BITCOIN,1635517900,11,1
qidnnn,picbuilder,Claim your Bitcoin NFT,1635516508,0,1
qidmqv,Hamraahe,"Cryptocurrency ether hits all-time high of $4,400",1635516444,0,1
qidhwd,Training-Argument-61,Hi Dollar Earning : Earn 16$ Per Day | hi डॉलर से पैसे कैसे कमाए,1635516070,2,1
qidc5g,HalcyonCEO,Bitcoin trumps gold for investors as inflation fears rise,1635515617,17,1
qidbpm,C4-PO,Immersive cooling tech could help Bitcoin mining go green by 2030,1635515580,14,1
qid7g0,Inside_Stick_4819,"Bitcoin has banned in my country and I want to sell them , I can’t use Binance or Coinbase either, any idea how to sell them?!",1635515231,30,1
qid44c,titi1992ks,Should I invest $20K in BTC? Could it go to $100K in early 2022?,1635514972,23,1
qid239,Jumpy_Interaction_98,NEW DAO ON THE RISE,1635514809,2,1
qid21w,Kriptomat,How much would You have if you had bought 100 EUR of #BTC one year ago? You can check it here in second.,1635514807,1,1
qid1ja,whoamisri,Could blockchain and Bitcoin end big tech?,1635514769,6,1
qicyb6,Western_Boris,Bitcoin Spot ETF approved for Australia,1635514506,29,1
qicxnt,angelwriter,MicroStrategy's Bitcoin Coffers Swell to $7 Billion,1635514448,23,1
qicokj,foxy_onthemarket,VIDEO INTERVIEW WITH NIK BHATIA FROM THE BOOK LAYERED MONEY,1635513660,0,1
qico4s,Slapshot382,"There is no excuse not to run your own Bitcoin full node if you own bitcoin. Umbrel teamed up with a company for plug and play bitcoin node. Remember, BTC is hot right now... not your node, not your rules.",1635513622,7,1
qickyy,hasansaleem,This guy claims Chainlink founder is Satoshi.,1635513353,24,1
qickyp,Top_Syllabub7544,"A game of the ""play to earn"" genre in the Witcher world|100% gem|Become an early investor in a great project in the Witcher universeguys, I found an perfect product for investment!",1635513353,0,1
qiciws,Consistent-Signal470,"I understand Bitcoin is a non-inflationary asset that is secured by mining, but who is going to secure the network once they hit the cap? If it is going to cost money to secure the network won’t it affect the price in the future m?",1635513176,14,1
qicf1d,ztpro,"Market Analysis on October 29th, 2021",1635512854,2,1
qic4hg,425-simone,EUR loans with BTC collateral,1635511927,3,1
qic3oa,Thyself_Alpha_Omega,B O G G E D #Shorts,1635511851,1,1
qic3ie,DAKrause,Charts!,1635511836,3,1
qic35w,Lopsided-Signature87,I really want to ask this question ??????,1635511803,25,1
qic0my,Icy-Sheepherder240,THANKS TO GOD ID FRIDAY,1635511580,0,1
qibt6y,PodClips,PlanB's floor model correctly predicted the price of Bitcoin at the end of August &amp; September (and he's about to nail October); here's why he doesn't want to publicize the model (short audio clip),1635510905,27,1
qibr1s,Special_Yam_1174,Bitcoin mining vs gold mining,1635510717,2,1
qiblr9,time_wasted504,OH NO! I bought the tippy top again.,1635510213,6,1
qibky5,Gian_Master69,Monsta infinite ROCKET POTENTIAL,1635510129,0,1
qibkno,White_Mia,Fortune favors the brave,1635510097,1,1
qibg3y,rollingincrypto,Australia joins the Bitcoin race as AISC releases guidelines for ETPs,1635509635,5,1
qib9v1,netinvestco,"Our goal is to provide our investors with the best returns with a focus on risk management to minimize possible losses. In turn, we are able to generate a reliable source of competitive daily returns for our investors without all the traditional costs and red tape involved. See More",1635508994,0,1
qib92h,Fantastic-Release875,"""Meta""",1635508916,7,1
qiaz62,Warm-Signal-9134,Bit good,1635507943,0,1
qiay00,Ok_Ground3302,"Thirteen years ago, on October 31, Bitcoin was introduced to the world. Has it Delivered on its Promise?",1635507829,0,1
qiaqgh,sepke12345,Cryptocurrency market consolidates after reaching new ATH - Blockbulletin,1635507062,1,1
qiaggz,TrowsaGNT,Anyone else receiving pms like this?,1635506069,0,1
qia3fj,shitbagtittyfucks,Got some BTC. Got a newborn. Got a car payment. Cash out some and pay off car for quality of life or keep fighting the good fight?,1635504687,276,1
qi9ty0,Substantial-Ad-3034,ELON!!!!!,1635503600,2,1
qi9rn5,ying4277,"What kind of path will you take when you are close to. People's greatest fortune is not picking up money or winning prizes, but someone who can encourage you, guide you, and help you. In fact, it is often not IQ and academic qualifications that restrict people’s development, but the life circle and",1635503341,0,1
qi9qdo,shubham_2009,Is CryptoWhale on Twitter is a Scammer?,1635503198,2,1
qi9e36,fanzakh,What exactly happened with this crazy wide candle?,1635501788,0,1
qi9643,carlmartz,Bitcoin made easy.,1635500840,0,1
qi94bv,Trading_2Go,Analysis and description of platforms for automatic trading BTC or other cryptocurrency.,1635500622,0,1
qi939b,sylsau,Nigeria Launches eNaira in a Futile Attempt To Combat the Emergence of Bitcoin in Its Territory. The eNaira will not be able to bring to Nigerians what Bitcoin brings to them.,1635500484,1,1
qi90ym,SinhNguyen286,Auto trading Bitcoin:,1635500187,0,1
qi8cr5,Professional-Cut297,Col,1635497118,0,1
qi8bqe,C4-PO,"Bitcoin hodling rate reaches 9-month high, boosting hopes of ‘bull flag’ rally",1635496993,4,1
qi89ru,Long-Particular,Going down into the Bitcoin rabbit hole…,1635496748,81,1
qi82us,coinincome,Sign up - Coinbase,1635495903,0,1
qi825g,StrandedinaDesert,I might pass out,1635495815,1,1
qi824z,Bisembay,earnings without investment,1635495813,0,1
qi7y4l,Gr8tstmaximus,Stimulus check update: Bitcoin investors have scored big returns,1635495290,4,1
qi7wwr,33nmakkie,"Looks like Yellen has found a way to tax Satoshi Nakamoto, on the unrealised Capital Gains. But how will the IRS collect?",1635495138,17,1
qi7t39,_WhoisMrBilly_,"Not sure what I expected, but StarryAi generated this from “Bitcoin exploring the moon” prompt.",1635494660,0,1
qi7s99,Pitiful-Tap3578,Gary Gensler is worried about the new BTC ETF,1635494562,1,1
qi7o13,vibesunmounts,Thoughts on storing bitcoin on Exchanges/Custodians like Coinbase,1635494060,7,1
qi7n27,ItsTrumpsAmerica,"Mt gox coins being released beginning Nov 20, 2020.",1635493934,16,1
qi7h37,ProblemRevolutionary,Huobi global sell fake USDT cryptocurrency to me and there is no USDT trail,1635493201,2,1
qi78y7,HeShootsHeSnores,Does anyone want to donate some Bitcoin for me to play with trading to learn?,1635492199,1,1
qi76qh,Lindsaynolan-291,Bitcoin is here to stay,1635491938,10,1
qi76l1,FuryOctopus,"What if rich countries like US, Russia, China united to do 51% attacks to Bitcoin, will Bitcoin survive such attack?",1635491918,17,1
qi727r,Kind_Essay_1200,Bitcoin has two of the three best things in the world!,1635491381,0,1
qi6zpg,MikeYEAHMusic,This song says it all,1635491084,25,1
qi6ycv,Unusual-Football6340,"MicroStrategy added 9,000 BTC last quarter",1635490922,1,1
qi6xin,daffy_ch,What the 2018 BTC chart looks like when a 3D artist maps it to a roller coaster,1635490832,1,1
qi6v7a,CoinCorner_Sam,"The Bitcoin Boomer Gary Leland, giving a quick advice to TikTokers",1635490583,411,1
qi6tss,CoinCorner_Sam,"The Bitcoin Boomer, Gary Leland giving quick advice to TikTokers",1635490417,0,1
qi6m5h,Torture2580,What does Cathie Wood say about the current craze for Bitcoin? Is it worth investing in?,1635489529,1,1
qi6l5c,sbusisoakoi,A beginners guide to NFTS(Non-fungible Tokens) Africa,1635489403,0,1
qi6j8z,yifan23,Cathie Wood Talked about Bitcoin during recent live interview with Saxo,1635489190,0,1
qi6fs7,ProblemRevolutionary,"Huobi is Scammer, pls withdraw your fund ASAP.",1635488792,8,1
qi653q,MartotoBG,I need Bitcoin to be legal tender in my country.,1635487559,5,1
qi5nug,should_,Imagine borrowing 1 BTC today and paying back the 1 BTC over 10 years...you'd owe way more. Will bitcoin cancel/reshape loans?,1635485635,108,1
qi5mqu,Luckynumba2,Anyone care to explain how RenBTC went above 7.5 million euros in april and currently sitting at 94k euros asking price ?,1635485516,2,1
qi5lgy,Pat_Nie_91,Unanswered Question regarding BTC,1635485386,3,1
qi5a4x,C4-PO,New Bitcoin hash rate highs remove any trace of China mining ban,1635484122,7,1
qcjswm,Cryptorealmoneyman,Bitcoin edges off all-time high but momentum for more gains this year seen intact,1634791525,1,1
qcjqjl,TraySamuels,Love Y’all,1634791277,2,1
qcjpg3,AnotherMillenial93,Uhhhh What now? Tf is Flow,1634791170,0,1
qcjpdo,ShotBot,Google (finally) wrote a long blog post about the cryptocurrency giveaway scams happening on Youtube. Google says it's a highly sophisticated darkweb operation effort led by a specific group of Russian speaking people.,1634791164,2,1
qcjniq,iderzer,Financial Advisors Recommendations,1634790980,3,1
qcjmma,MarkBLeee,Coinmarketcap Glitch! Flow with highest Market Cap.,1634790896,0,1
qcjd3e,Financial-Good2475,What’s the best way to store Crypto offline?,1634789979,5,1
qcjclr,ShotBot,"In a few halvings, the block reward starts to become so insignificant that mining no longer becomes profitable. Bitcoin MUST have global mass adoption, or else the incentive structure fails.",1634789929,5,1
qcj9wm,YagaBomba,Could someone make a price tracker account similar to @BitcoinStimulus but for the Salvadorians?,1634789650,3,1
qcj8mi,Cool_Ad_830,Does anyone know how to fix this or what I should do?,1634789520,0,1
qcj259,altrusistic_asshole,TIL that there is a another subreddit dedicated to the downfall of bitcoin,1634788906,16,1
qcivyt,degrudv,Doesn't matter when you bought your Bitcoin before today. Everyone is in the green. Congrats to all who held through the correction.,1634788316,11,2
qciug4,spiffyXD,Mt Gox Rehabilitation Plan Approved By Virtually All Creditors,1634788170,4,1
qciim0,Perin_Sofia886,Looks like Elon Musk is having a blast,1634787065,2,1
qcihxn,internetnobody23,First time seeing a Bitcoin BTM spotted at my local mall,1634787011,0,1
qcihe2,douglasg123,Pump,1634786963,3,1
qcigg1,kola401,"If you bought Bitcoin 3 years ago, you would have the same returns without having to wait 30 years",1634786877,0,1
qcidbp,s3k2p7s9m8b5,All in Bitcoin,1634786591,1,1
qcicj1,simplelifestyle,"Bitcoin tops $67,000 in record high - YouTube- Reuters",1634786526,0,1
qci9k5,cryptothrowaway56,Love finding old threads like this. Godspeed OP,1634786262,0,1
qci8au,BonkersBen,Tell me am wrong?,1634786144,0,1
qci0t7,TheDumbInvesto,Crypto Lending question,1634785483,5,1
qci0mt,Zealousideal_Tooth88,Wait a minute….,1634785467,1,1
qci05v,sgtslaughterTV,Who is excited for taproot upgrade starting on November 1st 2021? That's 11 days away :3,1634785426,20,1
qchxq5,thetendymahn,How can we help the folks at r/buttcoin?,1634785217,14,1
qchxkb,Over-Pace-700,Best resurrection tips!,1634785207,0,1
qchwb2,RadTadTad,Why Bitcoin will be the base layer for everything: The Bitcoin Stack,1634785093,2,1
qchvym,Sad-Result-6768,Bitcoin = getting rid of cash?? Is that a good thing?,1634785061,25,1
qchtsw,mahad3v9,Here we go again - China seeks public opinion to unban Bitcoin and crypto mining activities - TheDailySats,1634784862,109,1
qchtcp,Special_Yam_1174,....ELON MUSK....$69000,1634784819,4,1
qchpnk,VampireVlad,RaspiBlitz 1.7.1 Adds c-lightning Support,1634784477,6,1
qchmgw,Zoey1234100,Elon Musk is back at it again.,1634784187,0,1
qchm6w,Rustic_Trout,Making a Bitcoin Merch website,1634784161,0,1
qchl18,megaman0007,We looking good #bitcoin,1634784060,0,1
qchj67,AdLoose1615,Bitcoin Breaks all time high!,1634783891,4,1
qchiw6,davidrpc99,BOT,1634783865,0,1
qchiaq,davidrpc99,bot,1634783808,0,1
qchbns,cwmillerrr,Interesting BTC news on the Mt Gox situation!,1634783199,2,1
qch9ms,Berabouman,So give me the straight dope - exactly how easy or hard is it to make money from Bitcoin?,1634783013,21,1
qch2zq,ambrionic,NOT FINANCIAL ADVICE #ZOOT,1634782425,0,1
qch1nc,keiko1988,"I remember sometime ago, bitcoin was at 59.999 and never broke 60.000, hahahahahaha！",1634782308,0,1
qch0vb,lcarten,What’s everyone market exit strategy?,1634782240,0,1
qch02y,mju_crypto,The price is important in only two ways,1634782173,8,1
qcgz5i,Godfreee,"People will start telling you to sell, that it's a bubble. Just show them this chart.",1634782091,0,1
qcgxip,Separate_Necessary21,Cake Day and ATH all on the same day!!!!,1634781960,0,1
qcgx09,RashiQ2000,Bitcoin News Today | Why Crypto Market is Going Down,1634781913,1,1
qcgw5z,Cryptorealmoneyman,"Bitcoin Price Reaches New All-Time-High, Crossing Above $66,000 US Dollars Per BTC For The First Time Ever!",1634781836,3,1
qcgsnz,TylerZackEddy69,"5 minute time frame sucks, but what a crazy retest.",1634781533,0,1
qcgk73,mydevice,"Amazing video, and Jack retweeted",1634780764,2,1
qcgfv1,cocoabeachbrews,DCA Wednesday,1634780377,7,1
qcgfqx,Sad_Test_4619,#BitcoinSaitamA.....Everyone dont forget to load up on your Saitama🚀🚀🚀🚀🚀🚀🚀🚀,1634780366,0,1
qcgepx,RefrigeratorIcy7369,moneeeeyy,1634780272,0,1
qcgdkd,brando2131,Nocoiners right now...,1634780167,0,1
qcgd9j,SEAR_ME,"Question: last time Bitcoin went to 64k all the alts were idle. but this time they going up too, why is that? is this a bad sign?",1634780139,7,1
qcgatl,Immediate-Evidence55,Fast Crypto News | Latest Cryptocurrency News | Bitcoin Futures ETFS,1634779918,0,1
qcg5vv,Nihilisticky,Crypto market cap has risen by +7700% in one year.,1634779455,0,1
qcg35v,plumberoncrack,I just came up with a joke on Tinder. It was wasted on her.,1634779209,6,1
qcg30h,retirementdreams,How do you live off BTC if you don't want to spend BTC?,1634779197,18,1
qcg1na,seif_dz,#bitcoin 🚀🔥🚀🔥🚀,1634779070,9,1
qcfzjv,No_Delay5284,"Bitcoin Price Surges Past $66,000, Reaching New High",1634778876,1,1
qcfz3y,voice-of-reason_,The Pi cycle top indicator seems to be fairly reliable at predicting local tops and subsequent price drops:,1634778836,5,1
qcfy0a,anonymousoctopus777,A fitting time to bring back our anthem.,1634778732,277,1
qcfvq7,Crypto_Nation,Why would I want double gains??,1634778529,1,1
qcftbq,SoundofCreekWater,We Coming,1634778317,4,1
qcfsu4,poopandpeeface,What’s wrong with selling bitcoin?,1634778279,137,1
qcfs7o,Dope_Data,100k Way,1634778230,0,1
qcfokn,Elsa897,BITCOIN FUTURES ETF HAS RECORD DAY,1634777921,1,1
qcfo4c,Separate_Traffic_659,Message me if interested in my ebook $$,1634777881,0,1
qcfmwr,Derisive_Dissent,Is BTC a Trap Created by the Wealthy Elite?,1634777773,49,1
qcfjkr,should_,Scenario: US makes Bitcoin its only official currency. What would happen?,1634777468,23,1
qcfilf,rosemary099,Hi im new,1634777382,23,1
qcf83o,Perin_Sofia886,BTC's Way To 80k Explained.,1634776444,8,1
qcf3wl,Individual-Light-912,Bitcoin went more than ethereum and cardano these months,1634776072,0,1
qcf0i6,blastmax,---TESLA-CRYPTO-GIVEAWAY-EVENT!!--- DONT MISS IT GUYS... ##,1634775770,0,1
qcewwg,Raylan_Senna,Tip of the btc/crypto knowledge spear websites/figureheads/youtube channels?,1634775465,5,1
qceuqw,pix6extra6,coinbase taxes - capital gains,1634775270,27,1
qcete0,itsdevindude,I’m the first person ever to make it rain Bitcoins oddly enough lol,1634775142,20,1
qcero5,BernardMikhail,"Bitcoin sets new all-time high, is $100K next? for COINBASE:BTCUSD by MikhailBernard",1634774985,1,1
qcenou,Actual_Caterpillar23,The Market has Spoken,1634774640,7,1
qcemc5,Grand-Blueberry-91,New to all of this craziness!,1634774531,0,1
qcejdr,OpeningAd6316,Bitcoin adoption avalanche,1634774297,3,1
qcej77,mslittledebbie,"I really want to buy bitcoin, but I'm extremely scared it may crash like it did many times before..... Am I being unreasonable?",1634774282,40,1
qceida,OpeningAd6316,found on 9gag,1634774211,0,1
qcehuj,RoomWhereItHappened_,Buy Steam cards in Canada with Bitcoin?,1634774163,3,1
qceg0h,myzalkidiz,Valkyrie confirms its Bitcoin ETF will launch this Friday!,1634774004,7,1
qixa2x,JunoKat,Bitcoin and lightning have just done something fiat couldn’t for me,1635583037,283,1
qix8o7,rknka,Bitcoin core developer has been sent to Twitter jail.,1635582853,0,1
qix8gk,C4-PO,US Senator Hagerty to CFPB Director: Don’t Stifle Crypto Innovation,1635582828,3,1
qiwzsn,Ethangrhm,WHAT IS CRYPTO SCAM DEFENCE ?,1635581704,0,1
qiwxed,ComfySofa69,Can i recover bitcoin?,1635581402,33,1
qiwp2k,nopara73,#FreeLukeJr,1635580342,17,1
qiwhq7,Medical-Error-4140,Shiba Fantom,1635579363,0,1
qiwf25,thefirescale,My Bitcoin Pumpkin Carving Submission,1635579009,17,1
qiweeh,SunderedLight,BUMP EET!,1635578921,0,1
qiwcjw,Silver-Berry-7073,How to retrieve my lost bitcoin,1635578688,0,1
qiw8no,forexis1,lets help clean the ocean chaintip,1635578192,1,1
qiw8dy,forexis1,Lets help clean the Ocean,1635578155,1,1
qiw0cv,PWR1989,FANTOMICS - Launching on Halloween,1635577170,0,1
qivvrd,ynsq_18,.,1635576577,0,1
qivsha,Seeders,"Ok butters, the Solar Flares are coming tomorrow. Let's see how Bitcoin holds up.",1635576152,12,1
qivsdn,Mailstoop,I need help explaining to my company about bitcoin energy usage. Any one want to help out?,1635576140,19,1
qivqxs,Lumpy-Walk-1930,"Diamond Hands Steady. We're Going To Mars, Boys",1635575964,1,1
qivq1b,cryptodgn,Bitcoin and potential power outages in Europe,1635575854,39,1
qivo3i,david_k87,Lost 25 bitcoin 6 years ago (Need advice/help),1635575608,0,1
qivl20,MCHappster1,"I want to support #TeamSeas and pay with crypto, how do I avoid layer 1 fees?",1635575246,11,1
qivkvg,Bandicoot-Solid,How to prove long term holding capital gains tax for a fungible currency like bitcoin,1635575224,9,1
qivii6,Harkonnen_Baron,Good morning - good article about bitcoin and gold,1635574933,17,1
qiv98a,witnessgreatness101,"Treasury Secretary Yellen says spending bills will be anti-inflationary, lowering important costs",1635573747,20,1
qiv6xt,ImCrius,Shitcoins and Leverage,1635573479,0,1
qiuzin,C4-PO,Biggest Bitcoin fund in the world could become ETF by July 2022,1635572564,5,1
qiuvr0,vukxxx89,fuck Shib!,1635572112,0,1
qiuqu7,blakeboii,Right now!,1635571533,0,1
qiumgx,Quick_Frosting_1261,Looking for people interested in pro-BTC regulation in Missouri/the Midwest,1635571012,9,1
qiufsk,rBitcoinMod,"Daily Discussion, October 30, 2021",1635570209,411,1
qiub8z,FamousPussyGrabber,What does this subreddit think about the Rare Pepe cards? Is their value linked to bitcoin’s success in any way?,1635569686,3,1
qiu5oz,bdinu89,"Steve Wozniak: Bitcoin is Pure, Dollars are Artificial",1635569030,104,1
qiu34y,U4EA2ThuMax,Elliptic Curve Digital Signature Cryptography Question,1635568725,7,1
qitzhy,Wizard_Jeff,BTC Residual Income Question,1635568300,28,1
qity8v,Long-Particular,When people say Bitcoin will hit a MILLION dollars…,1635568161,24,1
qitxg1,nehruulto6,Tokyo court confirms Mt. Gox BTC refund notice,1635568064,27,1
qitt00,MrKittenz,Cypherpunks Write Code,1635567537,6,1
qitl9h,meat_mate,Bitcoin man,1635566723,16,1
qit7do,MonkeyLibra,Is Bitcoin the only truly decentralized crypto?,1635565288,22,1
qit4yl,TypicalAd871,Best place to pull out large amount of bitcoin and liquidate?,1635565025,0,1
qit4ss,Lily_Turf,Do you hold precious metals? Why or why not?,1635565008,3,1
qit3mk,maniparusu,"""Bitcoin is Mathematical Purity"" - Steve Wozniak (Apple CoFounder)",1635564892,26,1
qit1v4,MonkeyLibra,Is Bitcoin the only truly decentralized crypto? How to measure that?,1635564702,0,1
qit167,RothePro88,What is the difference?,1635564628,7,1
qiszla,MonkeyLibra,Is Bitcoin the only truly decentralized crypto? What’s the right measure of that?,1635564459,0,1
qisy0g,simplelifestyle,How to Buy and Store Bitcoin (The Right Way),1635564285,3,1
qist1p,fcuk_the_system,First Timer 2 Crypto - Need Help,1635563742,10,1
qissc3,speedstickman,The way bitcoiners see shiba reminds me of the way old school investors used to see bitcoin years ago,1635563667,0,1
qissbf,simplelifestyle,Bitcoin Lightning Network Upgrades,1635563665,3,1
qisolz,simplelifestyle,The Lightning Network is About to Change the World,1635563249,13,1
qisdga,nhungnhung00,Light DeFi,1635562085,0,1
qisd5o,TrustAlarmed8810,Which altcoin is more suitable for investment?,1635562055,19,1
qisans,RiskSkater,its time to shine ShowOffYourAwards i got crypto account send me ur bitcoins mate 32giouVQsXi1YeccJmzB5tduvSWpN2HSEZ,1635561800,0,1
qisa8n,RiskSkater,its time to shine ShowOffYourAwards i got crypto account send me ur bitcoins mate 32giouVQsXi1YeccJmzB5tduvSWpN2HSEZ i make memes u send me bitcoins ;D or any crypto,1635561754,0,1
qisa0v,CarlosZL,My puppy,1635561731,1,1
qis8qp,Upset_Tourist69,Anyone enjoy memes around here?,1635561600,0,1
qis110,JProff1248,#WifeFindsBitcoin🤷🏼‍♂️,1635560796,0,1
qirzco,SnooSketches1626,Anybody listen to the latest ‘What Bitcoin Did’ Podcast with Willy Woo?,1635560624,9,1
qirxff,Playful_Career_5891,Text me if you want to know more about crypto investments (602) 742-5982,1635560414,0,1
qirtyh,EmilyMcCu,At a loss here,1635560046,2,1
qirtpk,HairyKitchen9121,How was block 0 mined without any transactions?,1635560020,14,1
qirrtl,Both1990,Coin,1635559814,0,1
qirml6,maximus4477,OURO,1635559278,0,1
qirjqv,HalcyonCEO,'Bitcoin is mathematical purity' says Steve Wozniak,1635558977,0,1
qiriqk,liyun520,"The last two days BTC ETH is relatively stable and has an upward trend, what do you think about the current trend",1635558869,0,1
qirghr,ArdoKanon,"Trick or Treat? No, thanks! Crypto for me!",1635558635,3,1
qir1lf,Robinnn03,What's the best day for DCA?,1635557126,24,1
qir14l,Traditional-Ad9948,What do you think guys,1635557075,2,1
qiqynm,howlingwolfpress,Today it is my task to present to you a bird's eye view of The Saylor Series,1635556822,30,1
qiqtkb,Warrior504th,“Who would pay $100k for a bitcoin?”,1635556325,71,1
qiqs0k,nitra007,Don’t wait to buy bitcoin buy bitcoin then wait,1635556175,43,1
qiq8es,desert0r,Stanford Cryptocurrency mined by smartphone,1635554251,0,1
qiq7os,MethodAccomplished84,"Instala el navegador CryptoTab y comienza a ganar dinero extra por solo usarlo. Mientras estés viendo vídeos en YouTube, leyendo noticias y usando las redes sociales de la manera en la que lo haces a diario, consigues bitcoines reales.",1635554175,0,1
qiq79c,IdontknowhothefIam,How to start?,1635554128,15,1
qiq17h,Narrow_Bike,Biggest Bitcoin fund in the world could become ETF by July as GBTC nears $40B AUM,1635553529,0,1
