id,author,title,created_utc,num_comments,score
q9e5ng,JchoxD,Yesterday bought 0.000773 btc at 62k and this morning is at 60k… *start panicking*,1634397939,0,1
q9e3ft,Conscious_Orange101,What is the exact date and time of the ETF Decision ?,1634397743,29,1
q9e30c,jvvillarama,What will Bitcoin reach by December ? Honest answers please :),1634397705,0,1
q9e02s,abrireddit,Is there anything else we need to know??,1634397431,1,1
q9dzf7,Diligent_Buyer9440,JUST ANOTHER APOCALYPTIC POST… 👍,1634397365,16,1
q9dxd3,MonetiseMyMind,Plan B - FOMO Will Drive Bitcoin Over $400K,1634397189,10,1
q9dv5c,molecat1,A revived fossil fuel power plant dedicated to BC mining,1634396998,1,1
q9dqkc,heggen,Bitcoin Gorilla - Can you feel the pumpening?,1634396611,76,1
q9dn66,Player_1one,PSA for people whose stash is not as big as it once was,1634396358,0,1
q9dku3,TRIGGEREDharambe2018,Do you think that Bitcoin is the best currency in the world or could have some competition among other cryptocurrencies?,1634396144,7,1
q9dkdv,Starkgaryen69,"Yellow rock good, orange coin bad",1634396102,0,1
q9di1g,JunoKat,How far are you down the Bitcoin rabbit hole?,1634395882,34,1
q9dgnf,dexmatron9000,Living in a van: help me protect my BTC,1634395753,188,1
q9ddue,Sufficient_Engine_65,What is more profitable miner or crypto,1634395487,0,1
q9ddrl,No_sovereigns,What Makes Bitcoin The Apex Asset?,1634395480,46,1
q9d0s4,Negative_Code_7687,Bitcoin exchanges without verification.,1634394293,3,1
q9cs2m,wealthchaser,Satoshis for Micropayments!,1634393478,8,1
q9cprp,RitSeme-27,"TsarNetwork | World’s First Blockchain project with a Drag-n-drop Contract Builder | Easy, fast, cheaper, and trusted",1634393258,0,1
q9cpho,AragornKingKhan,My Ex blew up on Onlyfans,1634393230,2,1
q9ck0w,minio3,just go for bitcoin.,1634392757,1,1
q9cgxk,SupremeScrum,"Three Altcoins Now Bullish Against Bitcoin As Top Cryptocurrency Targets $60,000: Analyst",1634392467,0,1
q9cgvr,pegiewegie,BTC Current status.,1634392462,0,1
qba2v5,Wolkancoin,Valar Token Official,1634645107,0,1
qb9znf,Background-Feed-2573,Bitcoin banking flawed?,1634644811,38,1
qb9ptr,33nmakkie,Russia aims to replace US dollar reserves with digital assets in long term,1634643725,2,1
qb9p00,nobel_23,B T C mining company,1634643632,0,1
qb9o6l,Hassanpyoo,"What the ETF a “buy the hype, sell the news?”",1634643547,7,1
qb9lla,datsundere,Is selling Bitcoin for the amount you put in a taxable even in the US?,1634643260,0,1
qb9cb6,Morty_Goldman,Analysts Divided on Prospects of Sell-the-Fact Move as Bitcoin ETF Listing Nears,1634642222,1,1
qb9btp,serhr792,Do you have to be rich to start investing in crypto/coins?,1634642163,9,1
qb9a4k,TheBitcoinTutor,Bitcoin and human trafficking,1634641969,12,1
qb94wt,eeddeedde,"This is called the Baltimore stock broker scam. Just a reminder that there are many games to sell people garbage, so careful with other coins. Maybe inappropriate here",1634641389,0,1
qb92cg,lorrainephilippa3,"Microstrategy CEO Advises Nigeria and Zimbabwe to Adopt Bitcoin Standard, Says BTC Is ‘Kingmaker’",1634641131,70,1
qb90vy,bluewindest,iPhone forensics to retrieve my bitcoin,1634640955,0,1
qb8vgy,Expert__digitbtc,BTC earning page and develop income,1634640309,0,1
qb8r1o,Expert__digitbtc,Best way to earn bitcoin and developing,1634639762,0,1
qb8gqw,iamsajaldua,Whale dumping?,1634638480,0,1
qb8frg,Diligent_Buyer9440,BREAKING NEWS: BITCOIN BANS CHINA,1634638364,69,2
qb8ejk,Character-Choice-670,"when the lights go out, Bitcoin ded, change my mind?!",1634638221,0,1
qb8dtf,ulTron91x,Video : Bitcoin ETF Explained - It is just the beginning.,1634638131,5,1
qb8cyg,JunoKat,Borrow against your Bitcoin thought experiment (Hopium on Steroid version),1634638015,38,1
qb8bb7,CokeGMTMasterII,This explains a lot.,1634637794,1,1
qb849x,Therbreg,Trying to time the top this bullcycle?,1634636885,50,1
qb80oi,Agamand,Easy life hack everybody should know,1634636416,0,1
qb808o,C4-PO,Institutional managers hold a record $72.3B of crypto — CoinShares,1634636361,1,1
qb7xxd,bastion_12x,"Congressional Budget Office expects 1.2T deficit per year for the coming decade. It's gonna be a lot of money printing, and increase demand for inflation hedges.",1634636033,9,1
qb7sgt,Laura_manti,Major break outs,1634635278,10,1
qb7rkg,sve9mark,$BITO - ProShares Bitcoin Strategy ETF is live,1634635159,46,1
qb7r35,C4-PO,Here’s why analysts are saying ‘No FOMO’ ahead of Bitcoin’s ETF launch,1634635095,2,1
qb7pvq,sve9mark,BITO - ProShares Bitcoin Strategy ETF is live...,1634634933,0,1
qb7ok4,0xthefutureishere,#Bitcoin is the future,1634634764,1,1
qb7nut,Special_Yam_1174,Bitcoin ETF Opens for Business in the U.S. Today,1634634677,2,1
qb7l1o,Special_Yam_1174,"""There is a lot of excitement for regulators finally allowing a #bitcoin anything onto a national securities exchange ... there is going to be an impact to investors.""",1634634292,0,1
qb7knp,192838475647382910,Is this bullish for us?,1634634236,3,1
qb7hop,Pitiful_Bar_225,Potentially Questionable Bitcoin Transfer and Seizure,1634633869,4,1
qb7evs,MissionAardvark1679,bitcoin revolution ? seen a few different adverts etc recently for this. anyone tried it ?,1634633447,0,1
qb7dvh,Ok-Leadership1083,How to buy Bitcoin with prepaid virtual Mastercard?,1634633314,0,1
qb75cg,CoinsCalendar,Bitcoin (BTC) - ProShares Bitcoin ETF - 19 Oct 2021,1634632129,1,1
qb759d,Rudd-X,Cash is not long for this world... or is it?,1634632118,8,1
qb72ig,Unusual-Football6340,Grayscale Confirms Plan to Convert GBTC Into Bitcoin ETF,1634631725,1,1
qb718t,C4-PO,US Treasury says it must ‘modernize and adapt’ to digital currencies,1634631543,1,1
qb718q,AnoushkaChawla,shall I buy crypto?,1634631543,0,1
qb6zru,fussball9999,Can anybody help me understand the tether problematic with facts?,1634631345,1,1
qb6zcy,AnoushkaChawla,is bitcoin dead?,1634631293,0,1
qb6oa4,castorfromtheva,U.S. Treasury Department’s report says cryptocurrencies could undermine Sanctions. - I guess Yellen is inexplicitly talking about Bitcoin here. This obvious awakening is the accolade for Bitcoin and the best promotion it could ever recieve.,1634629880,79,1
qb6m2p,ComfortOk9514,What BTC means to me... (A bit personal),1634629583,18,1
qb6iyf,C4-PO,ProShares Bitcoin ETF to debut on NYSE Today Oct. 19,1634629139,2,1
qb6elu,qdqyt,wgmi 🚀,1634628544,0,1
qb67zx,33nmakkie,Largest sell order of 10000BTC on OKEX EATEN by buy orders in 1 hour.,1634627667,2,1
qb5q88,IEatFoodForYou,BTC BUY OR NOT?!?,1634625415,18,1
qb5n2f,C4-PO,5 things to watch in Bitcoin this week,1634624998,2,1
qb5ioo,jjjode,pls help T-T anybody good with BTC futures trading?,1634624432,0,1
qb5eg8,jjjode,long shot asking for help. Any1 good with BTC futures trading? I'm afraid I'm caught in a scam and am trying to retrieve my money asap from the system before shit goes down. However the requirement to make a withdrawal is to make a profit on the system but I'm v unfamiliar with futures trading. SOS,1634623910,0,1
qb5ag7,paavanram576ana,Plz Watch,1634623428,0,1
qb57hn,Double-Code1902,2017 when at $1600 investor from predicts $500k by 2030,1634623085,5,1
qb56ct,jmarshall1994,Starlight Gear support crypto,1634622942,0,1
qb523w,MrIndependent-Ad1668,Banned Bitcoin Miners Found Exploding China’s State Resources - Global Coverage,1634622415,1,1
qb4xd8,llewsor,bitcoin has already won because the next gen of hodlers are already here. will clemente interviews dylan leclair,1634621814,0,1
qco1xu,Virtual-Piccolo-5978,Who Win ??,1634809059,0,1
qco1e4,PuzzleheadedCat751,JUST LAUNCHED ON PANCAKESWAP DAORO,1634808991,0,1
qcnyxq,LeatherWriting2387,Bitcoin Rally and Future,1634808674,0,1
qcny8b,Left_Writing_6820,How Elon Musk reacted to Bitcoin hitting record high,1634808593,0,1
qcnxwq,Harsha8398,Bitcoin is the future...,1634808552,2,1
qcnvuj,retailsmart,I bought a business and some bitcoin at the same time,1634808264,51,1
qcnv5j,Rand-Mcki566,"Graphene is a new blockchain with TPS&amp;gt;100,000!| New X100 gem - Graphene! Killer Solana - Graphene| New Coinmarketcap Top 10 - Graphene",1634808176,0,1
qcnskd,Charly9631,Why are you not in this market,1634807844,0,1
qcnq7z,Aromatic-Sprinkles32,What's the plan for when governments has bought most of bitcoins? And start using it for fractional banking. Is there any mechanism to prevent it?,1634807533,16,1
qcnnpa,Lobsterino12,POV: you HODL'd during the May dip,1634807193,33,1
qcnlqk,BashCo,The Unhashed Podcast: Choosing Sigs,1634806938,0,1
qcngye,Harkonnen_Baron,BTC Mcap higher than Silver,1634806323,0,1
qcngxb,Think-Combination644,Best cryptocurrency exchange in October 2021,1634806321,0,1
qcnf2w,hue114,Coun acquisition,1634806091,0,1
qcnctu,Tropicalbrooo,Okay so it is going to 100k after all… nobody’s talking about how to prepare for the dip afterwards.,1634805810,52,1
qcnc0z,Present_Turn7021,BREAKING NEWS,1634805713,0,1
qcnbe0,Cryptorealmoneyman,"Had a no-coiner tell me that BTC is not ""real money"" and to ""enjoy the bitcoin stuff while it lasts, because the US Government will ban bitcoin soon and you'll be out a fortune wishing you would have cashed your BTC in to USD.""",1634805634,575,1
qcnawd,SleepyChino,"Talking heads on Yahoo Finance are now predicting the next line of resistance to be $69,420 lmao. Nice. (2:02 mark)",1634805571,0,1
qcn5s1,Consistent_Drummer21,Mars4 – Unique NFT Land Plots of the Red Planet for Crypto Fans,1634804931,1,1
qcn2on,luoni666,"L7+is coming up next month ,we could be your supplier",1634804534,0,1
qcmuug,Traditional_Care5156,Boomers in bitcoin be like,1634803570,0,1
qcmulm,Bollero,First Sale using Crypto on our Store!,1634803538,8,1
qcmpr8,Coinbaazar_Official,"How you Perceive and Judge Things, Think Wisely and see How you are good in your Decision Making",1634802977,0,1
qcmorp,Unusual-Football6340,Paul Tudor Jones Now Prefers Crypto Over Gold,1634802855,1,1
qcmmrm,Coinbaazar_Official,How you Perceive and Make Judgements...Lets know,1634802622,0,1
qcmlts,ARFASOFTECH,ARFASOFTECH Blog | OPTIMIZE YOUR ECOMMERCE WEBSITE FOR THE HOLIDAY SEASON 2021,1634802518,0,1
qcmh2m,Frostygardens,"Daddy Shark NFTs... Bnb rewards just for holding, minting residuals, and Play to earn!",1634801970,0,1
qcmh1l,C4-PO,Diem tells Senators on the warpath over Novi: We’re not actually Facebook,1634801967,3,1
qcmbhv,Aniketxy,Tax,1634801355,15,1
qcmavw,JacobTheSmuggler,Coinbase Recurrent Purchase - They are likely scamming you,1634801280,93,1
qcma58,Coinbaazar_Official,Pakistani high court orders government to regulate crypto in three months,1634801196,3,1
qcm4yc,Rand-Mcki566,HotCams ecosystem|Next-Gen token for the adult business|revolutionary streaming project for the Blockchain age with built-in sex modulators.,1634800613,0,1
qcm1s0,lorrainephilippa3,"Blockchain Game Developer Animoca Brands Raises $65 Million – Ubisoft, Sequoia China Participate in Funding",1634800248,1,1
qclz9o,100yaan,How do you take profits,1634799953,22,1
qcltqi,PuzzleheadedCat751,JUST LAUNCHED ON PANCAKESWAP COCKTAIL,1634799336,0,1
qclt3w,soyc76,"LN-SOV (RSK) bridge announcement - Hacker Hangout - ""The end goal of this project is that anyone will be able to run this on their personal node and be mini-exchange for their community""",1634799268,2,1
qclp3o,rambogoham1,Bitcoin Crypto Market the last six months,1634798812,2,1
qclho4,sleeknub,Buying Bitcoin with Thai Baht,1634797940,4,1
qclhaj,EataEsBasura,Inherited bitcoins and want advice on platforms.,1634797900,11,1
qclgb0,C4-PO,ETFs listed — What’s next for Bitcoin?,1634797803,1,1
qcle7k,cidadefalcao,The Second U.S. Bitcoin ETF Is Set to Start Trading Friday,1634797571,26,1
qclcbv,uIVUlecT,"Forbes Editor, Avik Roy Urges US To Accept Bitcoin As BTC Is Rarer, Profitable, Secure And Better Form Of Sound Money Than Gold",1634797367,3,1
qclc70,CaptainBoufles,"Every single time there has been a new ATH, there has been an opportunity to buy cheaper at some point later.....",1634797351,10,1
qclbtm,Wridera,A Unique Nothing Collectible. Buy it before The auction ends,1634797314,0,1
qclaop,pincoin2335,Con solo $5 dolarws y nada más solamente $5,1634797193,1,1
qcl9n8,Rebecca_0125,"Today BTC hit another record high, what do you know about the reasons for the rise?",1634797078,6,1
qcl7b1,Ok_Light_2527,Is GBTC a good way to get into BTC?,1634796814,7,1
qcl26s,rBitcoinMod,"⚡ Lightning Thursday! October 21, 2021: Explore the Lightning Network!⚡",1634796274,1,1
qcl1l3,SwordfishEquivalent6,Need help retrieving coins,1634796211,4,1
qcl0d5,ShotBot,Bitcoin Hits a New High — Rising 110% Just 4 Months After Jim Cramer 'Begged' Viewers to Sell,1634796078,64,1
qckzbg,C4-PO,Grayscale parent company expands GBTC purchase allocation to $1 Billion,1634795980,1,1
qcktf0,SoochinTendolkur,Why is buying P2P better than buying on an exchange?,1634795340,0,1
qckq6z,bribec123,SHIB!!!,1634794985,0,1
qckptn,bribec123,SHIB!!!!,1634794942,0,1
qckpkj,bribec123,Buy SHIB!!!,1634794915,0,1
qckpht,edge77_7,Kings Miner,1634794907,5,1
qckomy,sherlock_ma,A sad story,1634794817,12,1
qckfon,babykiekie,Iproyal pawns,1634793873,0,1
qckesa,Appropriate-Way-1669,Thinking about getting rid of my bank account.,1634793780,129,1
qcke32,Melanynavfam,Why Bitcoin Is Worth at Least a Penny,1634793709,2,1
qckdo8,muttoutpickety,Australian Senate Committee Makes 12 Recommendations for Crypto Regulation,1634793667,1,1
qckbxg,Cinderella0715,"Russia foreign minister Pankin declared sovereign fund bought 1.4 billion worth of Bitcoin. Russia government sees Bitcoin as ""a against global inflation"".",1634793493,0,1
qckbiw,Gwas_boy,Sodana Token presale,1634793449,0,1
qckb9b,Specialist-Brush-195,₿ Future Of Bitcoin 2021 Bitcoin 2021 Official Video ₿,1634793420,0,1
qcka56,zhanshenx,world of bitcoin,1634793297,1,1
qck78g,LowKeySalty_,Someone sent me a vague blackmail in exchange for my bitcoin..,1634792993,12,1
qck4sc,alchem_edits,Buy crypto on coinbase but can’t on webull,1634792735,1,1
qck463,Fabulous-Pea7254,What happened to BTFD - Valkyrie Bitcoin Strategy ETF?,1634792676,0,1
qck25y,MoneyMoverz,I have a few words to say … F*** the Feds and F*** our government. Who’s with me? Say I !!,1634792467,0,1
qck21s,rBitcoinMod,"Daily Discussion, October 21, 2021",1634792456,1016,1
qcjxvq,Ok_Light_2527,Portfolio Advice for a 16 Year Old,1634792045,7,1
qcjwjs,Cryptorealmoneyman,Bitcoin Miner Stronghold Stock Pops 52% in First Day of Trading,1634791899,1,1
qcjv4l,cryptochacha,Let everybody know,1634791748,0,1
qcjuoj,ShotBot,"Google (finally) wrote a long blog post about the ""cryptocurrency give away scams"" happening on Youtube. Google says it's a highly sophisticated darkweb operation led by a specific group of Russian speaking people on a ""hack for hire"" forum.",1634791702,2,1
qctbww,Neonightmares,China,1634827259,7,1
qctaol,Neonightmares,See below,1634827159,1,1
qct8sy,Neonightmares,Do you think China is going to ban Bitcoin again?,1634827013,0,1
qct4ct,skoolbees,Looking for the “stripe” version of crypto for online checkout,1634826660,8,1
qct3uh,Teh_ogre,"Dave Ramsey Finally comes around on Bitcoin! It isn't real, but is should be.",1634826618,5,1
qct29f,BruceInc,Can someone ELI5 what exactly happened this morning? Screenshot taken at 4:45AM PDT,1634826500,1,1
qcsxcn,SnooSprouts1582,Bitcoin dev has fix for Lightning’s existential problem — offline payments,1634826113,0,1
qcswm0,No-Flow-8193,"At what amount would you take your crypto off an exchange and put it into storage? Once it gets to $100? $10,000?",1634826054,30,1
qcss3g,khanxamani,Biggest issue on #Crypto,1634825705,1,1
qcsr5l,naunen,about to buy crypto exchange script,1634825634,1,1
qcsqk0,Tunaagoatbeast,Bitcoin HOLDER is getting MOD celebrating when Bitcoin heading towards to 100k,1634825587,2,1
qcspfu,Tarquinius_Superbus,Bitcoin energy critics should check their own footprints first,1634825499,8,1
qcsnvb,moran_no1,To the moon!!!,1634825378,3,1
qcsh96,sylsau,"Bitcoin Adoption Accelerates in Africa, Driven by the Need for a Fairer System. Bitcoin is already a necessity for millions of people on the African continent.",1634824840,2,1
qcsfu0,Academic-Daikon-8662,Has bitcoin saved you?,1634824739,41,1
qcsfaz,ZacharyBanks0,Be brave to buy bitcoin,1634824693,1,1
qcsero,Bright_Hour_1737,"Bitcoin Holds Above $66K, but Elevated Funding Rates Call for Caution",1634824649,0,1
qcsefg,Tunaagoatbeast,Bitcoin HOLDER and getting MOD after bitcoin is going towards to 100k and showing bitcoin hater and like this,1634824625,0,1
qcse0b,angelwriter,Peter Thiel: 'I've Been Underinvested' in Bitcoin,1634824589,20,1
qcscfi,Neonightmares,How long until China band bitcoin again,1634824464,0,1
qcs9kq,FreyasCloak,Chinese Government Seeks Public Opinion on Bitcoin mining. They want to change their stance?,1634824249,49,1
qcs9ak,Similar_Mycologist90,"No malicious comment, No trolling. just good bitcoin vibes",1634824225,0,1
qcs7mv,bitrefill,"Pt. 3 Pavlenex on El Salvador's BTC law, Adopting Bitcoin Conference, BTCPay in El Salvador - Ep. 26",1634824088,0,1
qcs6rl,Neonightmares,How long until China bans bitcoin again?,1634824015,0,1
qcs4cq,kleinars,I want to try Bitcoin because it's getting bigger and bigger but I am scared,1634823804,75,1
qcs2ie,SubstantialAbalone46,Who has more advantage?,1634823655,1,1
qcs2dp,AmandaAndIvan,Bitcoin value looks so much more attractive in CAD than USD,1634823644,1,1
qcry7t,CypressHunter53,Billionaire Paul Tudor Jones Now Prefers Crypto Over Gold as Inflation Hedge,1634823304,11,1
qcrwfj,Divniy,1529 sats/$,1634823153,37,1
qcrsmi,AwkwardElegance1,Do you think the real reason we haven't gotten more helicopter money yet is because they don't want Bitcoin to surge again?,1634822831,9,1
qcrs31,Seebeedeee,I’m ALL IN and it feels good!,1634822780,137,1
qcrr3c,xejd28,Hashing24 latest reviews?,1634822694,4,1
qcrqwd,HtotheEllo,MWEB for Bitcoin?,1634822675,20,1
qcrof4,Bitter_Outside_5098,"Bitcoin is the currency of Satan!?! (Of course its not, thats the €)",1634822468,0,1
qcrlt6,HugoRamos,Dollar Will Be Dead In 10 Years!. Amazing Interview w/ Lawrence Lepard (10 mins),1634822237,8,1
qcri44,Misesofficial,How decentralized social media deals with illegal content - example of Mises,1634821920,4,1
qcrhd9,tictaktoee,Crypto Halloween Plans?,1634821857,2,1
qcreor,_kr_saurabh,Decentralized Finance comes to Bitcoin!,1634821641,5,1
qcre6y,Own-Trainer1509,WHERE IS THE BEST PLACE TO BUY BTC?? TOTALLY NEW IN CRYPTO,1634821604,0,1
qcrde1,HtotheEllo,"Good thread on Mimblewimble Extension Blocks (MWEB), potentially paving the way to better privacy in BTC transactions",1634821533,1,1
qcra45,mahad3v9,"Bitcoin price crashes to $10,000 on Binance US - TheDailySats",1634821268,114,1
qcr8f5,brbnewsagency,‘Surviving Life With Your Gigantic Penis’ author laundered $740K with Bitcoin,1634821142,7,1
qcr2nz,Mars_chego,Bitcoin (BTC) Price Soars to New ATH above $66K Amid Mounting ETF Fever,1634820631,2,1
qcr2c7,SubstantialJuice4212,"Installez le navigateur CryptoTab et commencez à gagner de l'argent supplémentaire pour l'utiliser. Tant que vous regardez YouTube, lisez des nouvelles et utilisez les réseaux sociaux exactement comme vous le faites quotidiennement, vous obtenez de vrais Bitcoins.",1634820605,0,1
qcr0ms,hex_peson,Where are we at from Taproot?,1634820462,1,1
qcqzf9,vluid,HODL,1634820357,1,1
qcqy6d,FreyasCloak,The Chinese Government wants to....what?,1634820247,0,1
qcqwju,Ok_Royal_4848,JUST LAUNCHED ON PANCAKESWAP GOKARIO,1634820101,0,1
qcqvje,SeanyBlaze,When Bitcoin Hit $100: CNBC's 2013 Coverage,1634820013,57,1
qcqtdw,NeedleworkerNo2874,Me at the party,1634819827,24,1
qcqrgz,KindaGoodAtCrypto,Any Trading Bots that Support BTC/USDT Perpetual?,1634819621,1,1
qcqqfj,HeDiedForYou,"Binance says that Bitcoin went to 8k back to 64k, what this a glitch?",1634819526,4,1
qcqlvm,PodClipsApp,"PlanB Predicts the Next El Salvador for Bitcoin: Brazil, Portugal, or Nigeria? (3-minute audio clip)",1634819105,27,1
qcqlnh,Angelica_cuyno,Wow😊,1634819084,0,1
qcqlhb,Waste-Order5703,wooo i bought some coins when btc at 25 back in may and i'm so happy i did. i wish i invested more but it was what i could afford. i added another 20 just for giggles. i think that big dip was such a good opportunity for noobs like me.,1634819070,6,1
qcqhwa,Special_Yam_1174,"Former House Speaker Gingrich: Central banks will hold Bitcoin as ""reserve against inflation""",1634818753,179,1
qcqhq6,badnewz74,nice,1634818737,0,1
qcqhd9,Redfact77,"$1,200 Stimulus Check Would Now Be Worth $11,000 If Used To Buy Bitcoin",1634818707,372,1
qcqge7,stachurski81,Why Bitcoin 21 million supply cap won't be changed? | Bitcoin Education,1634818617,0,1
qcqfim,NeighborhoodIll6073,Long live crypto!,1634818535,1,1
qcqe05,Negative-Progress-76,BTC Disapoinment 🪙,1634818392,24,1
qcqds8,cidadefalcao,Seven GOOD things about the Futures-Based ETF,1634818370,3,1
qcqadw,timoauu,Never seen a scamwick this bad before,1634818043,7,1
qcqa2w,shjcdhj,Did Binance glitch or what is this ?,1634818014,0,1
qcq9dj,AuroraVandomme,"With average ~49k, would you sell at 100k to rebuy cheaper on a dip?",1634817946,36,1
qcq986,TimetooLate,Best exchange to DCA in??,1634817931,4,1
qcq4zy,Coinbaazar_Official,"JPMorgan says inflation concerns, not ETFs, driving Bitcoin price jump",1634817551,10,1
qcq1lz,Some_Dummy,WTF just happened???,1634817195,5,1
qcq1dj,RagingReality1,I just bought my first piece of Bitcoin stock,1634817168,20,1
qcq0r3,SEAR_ME,NY stock market will open about 1 hour and half... lets get ready for another ride :),1634817102,0,1
qcq05d,liamjson,"Invalid transactions, a deeper explanation required",1634817040,4,1
qcpxje,TheGreatMuffin,Joinmarket update 0.9.3 - urgent bugfix upgrade for makers,1634816761,1,1
qcpwzo,No_Independence_4292,"Bitcoin crash suddenly to $6,200.00",1634816703,21,1
qcpvx1,nehruulto6,Green day!,1634816585,1,1
qcpva6,Upstairs_Ad_8180,Huge drop then bounce,1634816518,1,1
qcps70,boxcarracer944,"Long 4 months of HODLing but, here's buying the bottom and selling the top. 125% Gain. Called out the $28,900 support! Technical Analysis.",1634816195,1,1
qcpr2q,shaunchang,The price is going up by so much right now. I was planning to buy about $5000 lump sum worth of BTC. Should i DCA at this moment? What advice could you give?,1634816080,12,1
qcpq0o,No_Delay5284,Crypto Miners Struggle to Cut Carbon Emissions,1634815969,4,1
qcpoyi,Sonya_meme_3779,please follow me I beg you please I'll kill myself if I have to,1634815861,2,1
qcpou7,caltomoto,What’s the best way for a small shop to accept Bitcoin payments?,1634815849,0,1
qcpmey,abhilodha,Rules one must drill in their head,1634815595,15,1
qcplly,Prac234,Rookie question about using Bitcoin to buy things,1634815510,10,1
qcpl81,No_Astronaut_8971,Waste your local scammers time,1634815467,1,1
qcpjf7,Discovermyasshole,Future of defi yield on Bitcoin,1634815274,2,1
qcpj2q,Discovermyasshole,Long term outlooks on Bitcoin yield?,1634815238,3,1
qcpj0w,SaitamaCirven,Investors flee gold for cryptocurrencies as inflation worries perk up,1634815235,29,1
qcpii1,Local-Life-281,Is it legal to have someone trade Bitcoin on my behalf and then pay them a commission?,1634815182,0,1
qcpihy,[deleted],T,1634815181,0,1
qbi1mi,hyperinflationUSA,at the current rate prices in the USA are doubling every 3 year.,1634669291,3,1
qbi1fa,BryanBSolstin,"Bitcoin reached an all-time high of $64,863 on April 14, 2021",1634669275,0,1
qbi0om,Hassanpyoo,BITCOIN IS ON THE BRINK OF NEW ALL TIME HIGHS,1634669219,10,1
qbhyp7,moneymoneymoneyabba,I feel like a king sitting on the toilet when I'm at work...,1634669053,2,1
qbhydf,AwkwardElegance1,It would be an absolute shame if some artist were to incorporate the Bitcoin symbol into these statues.,1634669026,1,1
qbhx6e,MonetiseMyMind,Michael Saylor - The Reason Why Bitcoin is Succeeding,1634668925,0,1
qbhwur,Simplybitcoin1,"Daily Bitcoin News October 18th, 2021",1634668896,0,1
qbhuwz,XxG4iJiNxX,My dad won't STFU.,1634668737,5,1
qbhtya,NintendianaJones-64-,Perhaps,1634668662,0,1
qbhtbz,XxG4iJiNxX,my dad won't STFU.,1634668612,0,1
qbhmr4,cliftonixs,"Just as a reminder, there are only 2.3 million Bitcoin left to be mined and everyone in the world is fighting for it.",1634668102,85,1
qbhhxk,Altruistic_Baker_423,Together we #HODL,1634667711,5,1
qbhhmz,ValarMurghulis99,How much do you think 0.1 Bitcoin will cost in 5-10 years?,1634667689,0,1
qbhgwe,JohnTheRapistBTC,Bitcoin is freedom viva la revolution,1634667627,1,1
qbhgsg,Executioners_son83,XRP/SHI/DOG/ADA not to the mooooon😥😥😥😥,1634667618,0,1
qbhf4x,ledonskim754,It's Official. Bitcoin Just Joined the New York Stock Exchange,1634667481,9,1
qbhdn4,Some_won,Chainalysis will add Bitcoin to its balance sheet as price surges,1634667355,3,1
qbhbkh,notafatkidnomore,Buying the ETF?,1634667188,13,1
qbhaf2,YeaBoio,Kraken or Coinbase?,1634667092,27,1
qbh89a,rootweiler_fr,BLOCK 170 : The First Bitcoin Transaction (by Ambre Collective),1634666912,0,1
qbh5p2,ILikePracticalGifts,Grayscale Investments files with SEC to convert popular GBTC into a Bitcoin spot ETF,1634666714,0,1
qbh1ze,Tank1882,"Whale's getting in! Love you all guys, thx for your support in hard times!",1634666411,1,1
qbh0we,sgsblue,How to borrow against bitcoin?,1634666327,10,1
qbgzhd,rootweiler_fr,Block 170 : The First Transaction (by Ambre Collective),1634666217,0,1
qbgwud,traviszzz,Question on 51% attack on altcoins from btc miner,1634665999,10,1
qbgvu7,bittruthBTC,Some people claiming that Bitcoin isnt unique because their were older projects like Bitgold for example that failed. Essentially using it as an argument that somehow they're better,1634665917,0,1
qbgvgg,Dramatic_Movie_2342,Coinbase “NOTICE OF CLOSURE”,1634665887,4,1
qbguvu,rootweiler_fr,Block 170 by Ambre Collective,1634665840,0,1
qbgunw,Borislimbas,There will never be 21 million bitcoin,1634665824,8,1
qbgqj4,mortal8941,"If you live in India, Philippines, or Indonesia and hold 1 single #Bitcoin You are immediately in the top 1% richest people in the entire country. Incredible.",1634665493,20,1
