id,author,title,created_utc,num_comments,score
mz39cv,Delavan1185,"What Drives Crypto Taxation and Regulation across Countries? Who are the early adopters? | Quantitative Analysis | De-Fi Deep Dive, Part VII | Wonkish",1619458741,0,1
mz350h,reupalex,Physical Painting Backed by NFT?!?!?,1619458416,0,1
mz2slm,ApprehensiveFox2345,Gas fees suddenly low...is this the result of Berlin?,1619457525,0,1
mz2di0,freewarestudio,Some Good News 📰,1619456449,0,1
mz29v2,islyfe,Amnesia's world renowned parties in Ibiza on Ethereum,1619456191,0,1
mz2957,ankobeys,When will people who have staked their ETH be allowed to withdraw them?,1619456137,0,1
mz21u3,Other-Ad617,"I sent some ETH via Metamask to Coinbase ETH-Wallet, it turned out to convert to PEG-ETH",1619455599,0,1
mz1xo0,Ok-Department5061,Logix Mining - World's most trusted Cryptocurrency Mining Equipment Seller - Amazing reduced prices!,1619455292,0,1
mz1v25,GilaMonsterMoney,Transaction Space Value,1619455102,0,1
mz1tfx,Miker0802,Ethereum Classic ETC,1619454982,0,1
mz1mw0,Dartharian,Rollercoin,1619454496,0,1
mz1muh,cjwill2017,Is it possible to add solona style timekeeping in the blockchain to improve tps/settlement time,1619454493,1,1
mz1k2w,whiteninja123,Do you think corporations and Governments will start mining?,1619454288,0,1
mz14d5,stayyfr0styy,Ethereum’s price is too high,1619453133,0,1
mz10qa,investindigital1,Report: The Rise of Institutional Ethereum Investors – Let me Know what you think!,1619452874,0,1
mz0ovy,ligi,EIP-3074 Community Call 2,1619452013,1,1
mz0o7k,ThisBand3,Feast of the Rabbit,1619451962,0,1
mz0jzy,KarinHernandez,"Vitalik Buterin Donates $600,000 in ETH, MKR Towards India’s Covid-19 Relief",1619451655,0,1
mz0ju7,gcfinotti,What do you think about Cardano?,1619451641,0,1
mz0f9i,Immediate_Depth532,"Does anyone know any ""decentralized"" messenging platforms?",1619451303,22,1
mz05pl,lentilsoup4000,Withdrawing from TokenSets to Kraken,1619450602,6,1
mz05em,vbuterin,A proposal for how the ability for validators to change their keys (also useful for delegation) with no downtime could be added,1619450578,37,1
mz0541,3hr4d,Lower Fees?,1619450559,20,1
mz03n7,GRINGR1N,NFT COLLECTORS,1619450454,0,1
myzri1,Kewls21,ETH Current Price,1619449579,0,1
myzdkb,BucketMuncher_25,Is anyone else’s ethereum transfer taking long as hell??,1619448565,0,1
myzczd,HomoMuchosErectus,Are there any good ethereum based dapps for betting pools?,1619448522,0,1
myzcz3,frolleswe,What kind of PSU would run this?,1619448522,0,1
myz5z0,cip43r,Who or how are fees paid for looping smart contracts,1619447979,0,1
myz3ea,icepizza2,🔵 NEW DEFI | ICO (Serious Project – Insane Potential – See for Yourself),1619447783,2,1
msa0vz,sdmikecfc,Solve.Care adds India to its global telehealth network,1618599683,0,1
ms9ukz,windtrainexpress,Best Defi Lending Platform,1618599173,0,1
ms9aby,TobiHovey,You Can Now Earn Ethereum 2.0 Staking Rewards on Coinbase,1618597478,0,1
ms99gv,aimadeart,NFTs and the carbon footprint dilemma,1618597404,0,1
ms8hiy,at_zachiatrist,"Wellp, I gone and minted 3 NFT's this past week on Foundation app. Been animating for forever and finally joined cryptoland with it. ETH is pretty cool",1618595186,2,1
ms8dt1,CanadianCheddar90,Thinking about staking; is there a fee to transfer holdings from Nano X to a staking platform?,1618594882,5,1
ms8cje,senatorskippylips,Staking ETH on RocketPool and the RPL Token,1618594780,0,1
ms84qx,Ok-Breakfast1,Transaction dropped but trade still showing up in my wallet,1618594167,0,1
ms7gju,Frodoono,THIS ENTIRE COMMUNITY🚀🚀,1618592258,0,1
ms7ek0,suspat,Purchasing ETH in Canada?,1618592095,0,1
ms7e25,captainmidday,"What is the ""obvious"" way to use L2 to transfer ETH from one wallet to another?",1618592056,0,1
ms72gx,hks128,Need help - merchant disputing transaction took place,1618591124,12,1
ms702m,Monica3581,What does staking mean? I’m on Coinbase and it asked me if I want to stake my eth. Is that good or bad?,1618590932,15,1
ms6ywo,Blagenator,Is Edge Wallet a good one?,1618590839,0,1
ms6oq1,wds716,Are audits conducted by Consensys and Sigma Prime considered to be high quality?,1618590046,0,1
ms6o4h,Cipherbill,Why is the fee so high? Will it reduce to fees like transferring XRPs?,1618590002,0,1
ms6nrj,Ma5terplanner,"How much ETH is ""enough""?",1618589974,24,1
ms6in1,twigwam,Democracy Awakens - Introducing the Proof of Humanity DAO,1618589580,2,1
ms6hrw,SloppyDonkeyQueef,Best way/place to trade BTC for ETH?,1618589513,1,1
ms67b2,SolorMining,"Soon, all this new Meme Coin money will recirculate into other Cryptos. Ride the wave!",1618588741,0,1
ms5vd9,thefoodboylover,Edward Snowden is auctioning his first NFT,1618587808,75,1
ms5nos,lihorne,"Scaling Ethereum Summit 1/3 is LIVE now! Rollups summit with talks &amp; panels from Optimism, Arbitrum, zkSync and more",1618587196,4,1
ms5mfp,RedHeadedPR76,Dreams can come true,1618587095,2,1
ms5l2q,Dry-Peace7576,One of the biggest Crypto Mining store is offering a Big Spring Sale!,1618586991,0,1
ms5fw8,WWalk82,Transfer still hung up from 2 days ago. Any advice,1618586574,1,1
ms54bs,nunnesje,im pretty new to crypto and is buying 1 eth a good investment,1618585643,1,1
ms515h,RedHeadedPR76,Dreams can come true,1618585389,0,1
ms4wxq,TobiHovey,Who Are the Fastest Growing Developer Communities in Crypto?,1618585061,0,1
ms4win,Putrid_Extent_9321,Filter wallets with combination of tokens,1618585029,0,1
ms4sg1,Dominic-Ian-,Delegated Governance and pure ETH rewards with Dracula Protocol,1618584695,0,1
ms4ebs,twigface,"I still don't understand the value of Ethereum, but I desperately want to. Please correct my wrong assumptions.",1618583518,77,1
ms4dk4,PristineEntertainer9,I need help understanding gas fees,1618583450,0,1
ms4cgx,Ds123455,"The @ETHGlobal Scaling @ethereum Hackathon Kickoff &amp; Summit Starts at 11:00 ET Today: https://youtube.com/watch?v=Hsksm_by7LQ… Register &amp; check out the @ZKSwap sponsored challenges with a total prize of $7,500 and #BUIDL with us!",1618583359,0,1
ms498b,Big_Variation2424,Is it just me or has ethereum gas gotten worse since Berlin? Am I missing something here ?,1618583085,0,1
ms47lo,Warthog_Honest,Can somebody Explain me How i can lower the gas fee? What the F?!?! I dont even have that much money wtffff,1618582953,0,1
ms46d0,Apocalypsenow13,I fucked up,1618582851,0,1
ms3zwt,goto1415,How can I guarantee my ERC20 token transaction won't fail?,1618582325,2,1
ms3odg,Warthog_Honest,HOW LONG IT TAKES??!!?! Already waiting over 2h wtf,1618581365,0,1
ms3kh0,Warthog_Honest,Can anybody Explain my Why im waiting 1.5H for fucking approving my coin on uniswap and im paying these high fucking gas fees for that? TF?,1618581031,1,1
ms3ilu,Edxactly,NFT Digital Asset Authentication and Storage.,1618580877,0,1
ms3b3l,Jury_Greedy,Problem with ETH balance?,1618580236,0,1
ms36yu,SolorMining,"With the attention MITs blockchain course is getting, I would like to remind everyone that Berkeley has 4 freely accessible courses listed, 2 with certificates available",1618579856,0,1
ms340m,AndreiahWilson,PancakeSwap Clone To Build DeFi Exchange like Pancakeswap on BSC,1618579583,0,1
ms2rng,zzcool,etherum gas price is is raising like it was bitcoin itself,1618578492,75,1
ms2dry,Theolaffreuxjojo,Nietzsche and DAOs,1618577154,0,1
ms1zs7,sp1nkzters,ETH EIP 1559 boost. Community of Investors committed to boosting the ETH Blockchain and Web 3.0 Infrastructure!,1618575706,0,1
ms1f8f,jccds1999,I keep buying and selling does anyone recommend a good entry level to just hold because I keep getting fomo,1618573508,0,1
ms0vpi,E8-Starker,Question from a total NOOB,1618571267,0,1
ms0vna,DappRadar,How Rollups are helping DeFi applications on Ethereum scale today,1618571258,0,1
ms0uzw,jbroja,How do I find out the average eth holding per address?,1618571176,0,1
ms0uh4,cesareWT,$DOGIRA - Ex Doge Developer - BULLISH,1618571108,1,1
ms0t82,spikereloaded,"My first big crypto investment, right choice?",1618570962,20,1
ms0hfx,Arsenalfannn,Sent 4 txns some with higher than recommended gas and all of them failed after a few seconds. Paid almost $70 for nothing. Any ideas?,1618569481,6,1
ms0e64,nchiker5,"I've tried swapping various ERC-20 tokens in multiple wallets and have the same problem in all but one instance where I'm charged a gas fee for the swap, which says it was successful, yet I still have the same amount of tokens afterwards. Any ideas for fixing this and/or for reclaiming my gas fees?",1618569060,0,1
ms06dv,GunterTown,Some questions about Ethereum,1618568048,2,1
ms033t,sacha-saint-leger,DAOs and the pitfalls of progressive decentralisation,1618567623,0,1
ms01wf,spikereloaded,Biggest crypto purchase yet...,1618567466,0,1
mrzm2t,CryptoSchmust,On chain transactions per token,1618565349,0,1
mrzeat,gafokras,Questions on transaction fees,1618564287,0,1
mrze9s,Shatter_Hand,Private Charter (ENS-PCT),1618564284,1,1
mrz5gk,Chemical-Return1098,Laid off Facing Eviction- Any Help is Appreciated,1618563103,0,1
mrz3no,kingsichi,Can Etherum ever hard fork again?,1618562837,0,1
mrz1df,futmed_99,New to the crypto (mainly ethereum) game. Loving it. Truly believing in it,1618562513,0,1
mrz11r,Excellent-Cricket-46,To celebrate the ATH of ETH (lol) I bought 1 ETH!,1618562467,0,1
mryz1r,Coinquora_,"Ethereum (ETH) Breaks $2500, Sets New All-Time High - CoinQuora",1618562167,0,1
mryvif,romyh-hi5,Ethereum geth.ipc not created after upgrade,1618561670,0,1
mrytt9,Phil___Swift,Are miner fees always this high,1618561441,18,1
mryqx0,I_LOVE_MOM,Any decent Ethereum shirts/merch out there?,1618561049,0,1
mryn0u,mrzofre,"Ethermine Send me ETHER but i dont see in ""MEW,, (My ether wallet)",1618560528,0,1
mrymw4,fegewgewgew,🌕 Moonwolf 🐺 First deflationary token built on Polygon,1618560512,0,1
mryme0,KarinHernandez,"Ethereum Berlin Upgrade Went Live Today, Promises To Mitigate Gas Fees",1618560438,0,1
mryjl3,mrzofre,"Ethermine Send me ETHER but i dont see in ""MEW,, (My ether wallet)",1618560053,0,1
mryall,moobteets,Help with a pending transaction please,1618558854,1,1
mry8ty,lebigboipantsoff,What is Yield Farming? In Defi - (explained),1618558590,0,1
mry6ib,lebigboipantsoff,What is Yield Farming?,1618558276,0,1
mrxzvc,Glen_Watkins,An easy explanation and interview from the founder of Ethereum,1618557357,0,1
mrxm9o,Due-Judgments,Kinda feels like ETH is right about here,1618555523,0,1
mrxjml,Bluemandegen,Imagine you are Satoshi Nakamota,1618555186,0,1
mrxgxq,CarloxDN,[Devs] Needing a Smart Contract Developer for a new project,1618554822,2,1
mrxac1,K3STROS,Any specific reason for this drop?,1618553946,1,1
mrx5a6,protectedvoidfoo,🤝 Largest DeFi ICO of 2021 • LAST CHANCE TO GET IN EARLY • INSANE POTENTIAL 😱😱 THIS BRINGS CRYPTO TO MAINSTREAM CONSUMERS • GIANT GLOBAL MARKET (Serious Project – See Whitepaper for Yourself),1618553290,0,1
mrx3h0,kcswitzer,Newbie Question: What is the lowest cost way to fund Metamask?,1618553036,6,1
mrx0tu,Crr702,Hey join Nextboat community,1618552714,0,1
mrwuq6,blahpotuspivx,I am in a strange situation. Been in crypto for 5 years and have not a clue what to do. My ether balance in one wallet is 0. But I have a pending transaction that obviously isn't going to complete and I cannot cancel it. It is also preventing me from adding ether to the wallet since said transaction,1618551941,7,1
mrwskh,savagejihadi,"Advice for buying ETH, ETH 2.0",1618551686,0,1
mrwdk0,Completed-It-M8,Will my transaction eventually go through? I'm not used to dealing with Eth and had none left to cancel or speed up transaction. Was showing in sending wallet as pending for 5 days and has now disappeared without appearing in receiving wallet. I did pick a slow speed default gas setting...,1618549825,0,1
mrwczx,Sonutiten,Ethereum On Mooon 🌒🌒🌒🚀🚀🚀,1618549758,0,1
mrwcfc,Completed-It-M8,Will my transaction eventually go through? I'm not used to handling,1618549681,1,1
mrw5un,Ithrewmyliuaway,Do you have to pay fees to execute smart contracts?,1618548887,0,1
mrw2sz,SikhSoldiers,"FUTURE OF MONEY Crypto, CBDCs and 21st Century Cash - Citi GPS",1618548519,0,1
mrvuiv,ev7437,Want to get into crypto but I am not 18,1618547526,0,1
mrvu17,Kameeshkazi,In honor of the latest bull run and to its continued success... I'm gonna make one everyday,1618547463,0,1
mrvqvp,dapp_com,"Top30 Blockchain Game Eco by 30d Volume 🥇Ethereum $36.63M, top3: Sorare $13.97M, Axie Infinity $5.54M, Zed Run $5.27M",1618547086,1,1
mrvhm2,perpetualmunchies,290 block confirmations; eth still hasn’t arrived,1618546063,2,1
mrvbl8,East-Permission-1194,Making pocket change,1618545410,0,1
mrv7xs,farg0th,PLEASE HELP. I think I just lost over half my life savings on an Ethereum scam.,1618544988,3,1
mrv7bt,farg0th,PLEASE HELP. I think I just lost over half my life savings.,1618544919,0,1
mrv5if,NoBallinOnSundays,THIS IS NOT A DRILL,1618544713,0,1
mrus4x,Digging_Monkey,"Did they fix the glitch this morning with the Berlin update? Coin base halted it this morning, haven’t heard anything else about it.",1618543282,0,1
mrupud,k_grinolds,Ethereum could eclipse Bitcoin,1618543051,0,1
mt1821,ConsciousCake7409,Coincircle,1618700810,0,1
mt15z2,HoldOnDearLife,Why wont my ENJ transaction be put into a block using 136GWEI?,1618700609,0,1
mt0zz6,Necessary_Stretch817,My Etereum wallet not loading on Trezor,1618700021,1,1
mt0tn4,yeskio,floppacoin,1618699377,1,1
mt0nbe,Lumko,Where can I learn more about Ethereum?,1618698748,40,1
mt0lxd,JacquilineJackman,These Awesome Necklaces are FREE for a Very Limited Time! Only 1 Left,1618698617,0,1
mt0d8z,RealChicoDee,❤❤❤,1618697757,0,1
mt0bt1,gamingaway,Is a first deposit fee normal?,1618697620,19,1
mt07xz,Tasty_Ad4228,HashShiny - World's Leading Cloud Mining! New user get 3 TH/S (BTC) Hash Rate For Free!,1618697240,0,1
mt04ku,--_-_o_-_--,Has Ethereum achieved anything yet?,1618696921,34,1
mszyez,pepesiq,What should i do?,1618696343,0,1
mszvr9,OldIndependence6611,"Uniswap transaction Pending... Sorry, We are unable to locate this TxnHash",1618696099,0,1
msztpt,Possible_Notice_6250,Ethereum noob asking if it’s worth it,1618695913,0,1
mszktm,DigitalMarketLane,What can we expect the maximum supply of ETH to be once before it becomes deflationary?,1618695080,9,1
mszk53,Your_Ozone,Made 2k over the last two days swing trading Doge then cashed out and used the money to buy 1 ETH. (Translation: I left the casino and went strait to the bank),1618695014,0,1
mszgm1,antwortetae,Canada Approves Three Ethereum ETFs Filed By Three Firms,1618694671,0,1
mszflu,neomatrix248,Is it ok to transfer LP tokens and stake/farm tokens to another ETH address for safe keeping?,1618694574,0,1
msz9vt,aludmer,"Just purchased my first half piece of ETH. I figured instead of my money doing nothing for me in the bank, I would let it grow with y’all.",1618694037,0,1
msz6dx,aludmer,Just purchased my first half piece of ETH.,1618693722,0,1
msz39y,JaclynLilla,Are you gonna miss Student Coin (STC) ICO? Only 5 rounds left!!,1618693442,0,1
msz33o,relativitas,"""phoenixminer exited (exitcode=139), waiting to cooldown a bit"" error how to fix this?",1618693429,0,1
msz2o4,DigitallyCorrupt,Seeking knowledge on gas and transaction fees please. New to ethereum trading.,1618693391,3,1
msyy91,Relprimer,Get 1st bid for 0.0404Eth on limits of control. 7000x7000 px / 16 in the collection. Includes a unique code that can be decoded into an extra hidden picture. Welcome to exhibition and opensea,1618692999,0,1
msyiii,MaMerde,Coinomi and Changelly are some Goddamn Pirates,1618691564,0,1
msyafx,No-Mistake-6276,ERC20 token sent to Bitcoin receive address in error,1618690841,0,1
msxth0,Adynaton,"Bitcoin is dead, we just haven't caught up yet.",1618689337,1,1
msxege,nelomelon,Question...,1618688009,0,1
msxahn,Firm-Sock4779,The most profitable Crypto Mining Equipment on the market! Huge discounts!,1618687657,1,1
msx9at,pandoras_sphere,Ethereum State in Snail Mail,1618687552,2,1
msx8cu,Esh-Morgan,THE REGGAE INVASION of NFTs (Music and Art links in comments!!),1618687468,2,1
mswyvk,Big_Crazy_A,Gas fees / other fees if purchasing ETH with USD through MetaMask/Wyre?,1618686672,14,1
mswy4a,gamingaway,"Just getting started, which wallet?",1618686613,0,1
mswp66,randolphmd,Short term gas expectations,1618685854,0,1
mswg3h,tjayrush,Short Progress Video of TrueBlocks,1618685057,1,1
mswdgg,Luckyprock,Question,1618684824,0,1
mswbwu,Bru011,Coinbase ETH staking LIVE,1618684691,0,1
msvxui,Bananonano123,Can anyone send me (even 0.05$) ETH so I can pay my transaction fee for sending Chainlink? (I can send you Algorand in exchange if you like to),1618683447,9,1
msvv4u,TheWierdGuy,High transaction fees are not a big deal for Ethereum. L2 is coming and most users will switch back from more centralized networks.,1618683205,0,1
msvq1y,kBlizzy55,Missed profits,1618682771,0,1
msvnih,I_love_ADA,Can anyone send me (even 0.05$) ETH so I can pay my transaction fee for sending Chainlink? (I can send you Algorand in exchange if you like to),1618682549,0,1
msv8lh,Firm-Sock4779,Earn fabolous profit with the best and cheapest Crypto mining equipment!,1618681267,0,1
msv1yr,deaglebro,Staking on Coinbase - withdraw anytime?,1618680655,7,1
msuwsq,WSB_Shriyan,private key,1618680194,0,1
msutyt,Asweez,ETH 2.0 Gas Prices,1618679937,0,1
msuspu,Plastic_Gear8460,Missent,1618679823,0,1
msupmb,TanikaIkerd,"Merchant Token $MTO ICO - The most complete review you will find - Tokenomics, ICO Details, Token Distribution, Roadmap and more 🚀💎",1618679556,0,1
msuny0,Firm-Sock4779,The most profitable Crypto Mining on the market! Huge discounts!,1618679403,1,1
msui4l,Realboss734,@Citizen_finance project is going to give us a huge profit in the future and strong team efforts to reach the top and its team is working very hard on this project so that this project is going to give us a very good profit. Best wishes!!,1618678882,0,1
msuc6n,NFTNewsToday,Neon District Achievement Badges,1618678363,0,1
msubyq,Felixthealpaca,SpaceDoge in Ethereum blockchain. Please consider joining this rapidly growing community!,1618678345,0,1
msuaxw,TheWalrus057,Market price ticker - uses a Raspberry Pi,1618678256,65,1
msu9da,rowger2020,"🔥 Community Update 🔥 🤝 Partnership with VortexDefi 💬 AMA on Unifarm 🌌 Galaxyfarm 2 is Live, move your assets from Cohort 1 to farm 🌾 11 tokens ⚙️ Razor supports BinanceSmartChain 🔗 $RAZOR lists on Chainswap 🥞 $RAZOR-$BNB pair live on PancakeSwap",1618678108,0,1
msu4ov,AbstractMichael,(Question) Does Ethereum have a long term competitive advantage over small coins,1618677685,0,1
msu2nl,NickMode,How do you feel about your Ethereum being locked up for 1-2 years by staking it?,1618677509,0,1
msu295,radioactive999,Questions from a noob,1618677474,0,1
mstwhx,BreakfastAntelope,Eth 2.0 - Ethereum 2.0 What's it all about?,1618676962,0,1
mstsx2,CryptoLurker2013,How does EIP-1559 adjust basefee if ETH price goes up or down?,1618676637,49,1
mstiz9,Weary_Ad_1094,"Apparently one of /r/btc users is having ""anger management"" issues. I seek the public opinion of how our subreddit should deal with such cases.",1618675768,0,1
mstei5,Internal_Tip745,MOGO CANADA - just signed a deal with coinsquare - Join by the link before promotion ends! Withdrawal $20 instantly or keep it in bitcoin! Invest for free!,1618675364,0,1
mst78x,WadeBecker554,Ethereum ETH HODL,1618674714,0,1
mst1d4,Dizzy-Philosopher-36,ICONOMI,1618674155,0,1
msstks,KommSur,Where is NFT stored is it like Json Web token?,1618673436,11,1
msstgn,Michelemenef8,Staking ETH on binance,1618673425,5,1
mssnpk,augustech,How to withdraw REEF token from ether wallet.?,1618672885,0,1
mssbfb,ShyUnion,It’s Time for Ethereum: Two Ether ETF Approved by Canadian Securities Regulators,1618671721,0,1
mss888,SpeedyCorals,"I gave my grandparents 10 ETH each on Christmas 2017 — I told them that they’re worth about $50,000 now and if they wanted to cash out. They said HODL!",1618671426,0,1
mss85v,bordoisse,Onboarding Your Assets From Ethereum to Binance Smart Chain [#BSC Tutorial],1618671420,0,1
msrwu2,mrmarijuano,ETH &amp; ANKR,1618670328,0,1
msruxh,NabilahFelix,Aggregated open interest of Ethereum options reaches all time high,1618670130,0,1
msrn44,pseudorandom_Human,Making sure my ETH brothers/sisters are in the loop.,1618669361,0,1
msrgiv,sportifynews,Will Ethereum remain the second largest cryptocurrency?,1618668712,0,1
msrfq1,Heavy_light_N7,Is ~66MH/s a joke?,1618668630,4,1
msrcs2,littlebigship,Need some help with Metamask and Rocket Pool,1618668344,0,1
msr83l,legal-pro,Binance lost my money,1618667892,0,1
msr4g9,MachineLearningNomad,Eth 2.0 staking without locking in,1618667511,0,1
msr2kd,MachineLearningNomad,Eth 2.0 staking without locking in,1618667306,0,1
msr030,piurass,Defi Hacking,1618667044,0,1
msqvf7,eetherway,Influence - Ethereum Powered Space Strategy MMO ----Launches today---,1618666579,7,1
msqml3,Psycd_2020,Accidentally transferred ethereum pegged to binance to my Bitbuy account in August and haven't been able to recover it. Any advice?,1618665688,0,1
msqf36,Adam_hassan06,I’m a beginner that has just started crypto currency. Can someone please help me,1618664901,1,1
msqa1d,TriptoSAFEMOON,"Recommendation- RocketMoon (RMOON), 2 days old, Currently on Massive DIP, easy 3x Short Term.",1618664404,0,1
msq69p,DerFeisteAbt,Ethereum blockchain security,1618663996,0,1
msq4vf,KAMASUTRASMR,Bitcoin News btc 17.04.2021,1618663839,0,1
msq3e4,Logical_Trolla,22 Hearthstone Character art collection. ( Link In the description),1618663677,2,1
mspywg,Dry-Peace7576,The most profitable Crypto Mining on the market! Huge discounts!,1618663177,0,1
mspow7,NewHier,It do be like that,1618661981,0,1
mspdtb,danielrayson,3 year old Ethereum ATM Ticket woes,1618660611,9,1
mspc11,Procrastinatenow7,Can anyone explain to me whether it’s a good (safe) idea to stake my ETH and earn up to 6% APR on coinbase? I don’t want to sell ETH anytime soon,1618660356,0,1
msp6oi,karzinom,How do I know whether my Geth Node is finally snyced?,1618659657,12,1
msow0w,nedelja92,advice needed on investing in altcoins,1618658211,0,1
msouvw,nedelja92,How to invest 10k in this bull market? When to sell eth?,1618658066,0,1
msoj57,gob_magic,USD 100 for USD 4 transaction!? I was excited to use crypto for actual use ...,1618656386,0,1
msocc7,neckstime,What is the Berlin Fork actually do?,1618655365,0,1
mso7yx,Korrak,Influence Space Strategy Game Release today,1618654714,3,1
mso6z8,RiceboySwag,Im bag holding cause of the high gas fee,1618654575,0,1
msnpck,WorriedViolinist7648,Blockchain manipulation - how to spot it?,1618651932,0,1
msnme0,jakkkmotivator,Canada Approves Launch of World's First Ethereum Based ETF,1618651474,0,1
msnlvl,tektas41,Gasprices between Wallets,1618651391,0,1
msnhvg,sportifynews,Is Ethereum Destined to be King of DeFi?,1618650800,0,1
msndri,Finch0s,Someone here applied to the ETH Staking in Coinbase?,1618650172,0,1
n1ivea,Effective-Leather799,Web3 Explained in 2 Minutes with Girl Gone Crypto,1619744493,0,1
n1iitq,Metaverse_Quantum,Metaverse Quantum,1619743277,0,1
n1iifl,marius8617,Thoughts on prospects of USG recognition of Ethereum and ETH,1619743236,0,1
n1i9gy,yeeyeesuckinteets,History of the word HODL,1619742361,0,1
n1hqge,RemoteControlArtist,"Steve-O joins the NFT world with his first piece through Foundation.App, already hit 1.34ETH!",1619740612,1,1
n1hpgr,bpd815,Proof of stake,1619740517,0,1
n1hkt0,lolporocom,🦍APEHAVEN (APES) 🚀 Donates to Charity with auto yield farming from transactions 🦍,1619740088,0,1
n1hibt,notthepopularjames,Good CLI tools for interacting with Ethereum chains?,1619739866,0,1
n1heed,Sweaty_Promotion_785,Too late to mine?,1619739516,0,1
n1he99,anwar_2130,Should I take profit?,1619739502,0,1
n1hchs,Pugzyaltz,$YELLEN COIN LAUNCH in 24hrs,1619739344,0,1
n1h6na,DustinMc_1,All in on ethereum,1619738841,0,1
n1gs5a,Possible_Pickle_1,First space art piece using rarible,1619737628,0,1
n1gqgh,GhostofBlackSanta,"If ETH2 is moving to Proof of Stake, why are some exchanges letting you stake ETH already?",1619737484,30,1
n1gfzo,Important-Barnacle-5,Crypto NAFA,1619736615,0,1
n1gc21,PleaseLord,"IM NEW, any help is appreciated. I just bought in @ $2701. Do you guys HODL and buy the DIPs or are you taking your gains out as they come?",1619736286,1,1
n1g95z,_bush,Is it possible to test how Layer 2 works in the ETH testnet?,1619736057,1,1
n1g08g,Exxtol,Bought ETH a few weeks ago for the 1st time,1619735342,2,1
n1flhj,zeroziad,Wallet choices,1619734176,14,1
n1fdv6,SaltyShrimpy,"Check out Swin! The next best project, linking Crypto to Real estate!",1619733595,0,1
n1fbjf,TRAcademy,"Ethereum Technical Analysis for April 30, 2021 - ETH",1619733419,0,1
n1f8p8,No_Replacement_9201,Well damn lol,1619733192,0,1
n1f4mx,spoonthrows,Transaction complete without gas fee?,1619732870,2,1
n1f1p1,Fit-Luck1907,Bits of Ethereum ⚫ NFT minted on OpenSea,1619732649,1,1
n1f1lb,sejlee09,How many eth will it take to make someone a millionaire this bull cycle?,1619732641,1,1
n1ezra,trogdortb001,A few methods for increasing your privacy when using MyCrypto,1619732506,2,1
n1ez5q,Purple_Magikarp,Help with fees??,1619732455,23,1
n1ey5c,SportEveryDay,Ethereum 1 year!,1619732380,0,1
n1emvg,fredcrs,Do you want crypto to be regulated ?,1619731485,41,1
n1ec5u,alexsant7,"Comparing Stellar XLM to Ethereum - The Sky is the limit for Stellar, potentially! Think about it...",1619730647,0,1
n1e7a7,fplfreakaaro,Economics of proof of stake,1619730284,19,1
n1e4tp,FixComplex4484,[Show ETH] New payment app - feedback welcome!,1619730099,0,1
n1e1ly,shasan3,Eth vs Eth 2.0,1619729860,13,1
n1e1ex,nugget_alex,"Can Ethereum Scale Before Binance Smart Chain, Polkadot &amp; Others Take Market Share",1619729845,0,1
n1e08a,Wide-Cryptographer46,Can eth Scale,1619729751,0,1
n1dy5x,icweiners69,What is a good buying in point for Ethereum?,1619729579,12,1
n1duca,mrsotkogaming,Ripple Wants To Go Public After SEC Lawsuit Settlement,1619729277,0,1
n1dsqy,ArantasticYt,YouTube hacking?,1619729152,0,1
