id,author,title,created_utc,num_comments,score
op7y2o,Jazzlike-Language457,4 Reasons why you should go for cryptocurrency,1626933752,0,1
op7oxy,Bioneciss,Ethereum,1626932593,0,1
op7cdj,olowo24,ETH Developer Back in Jail After Allegedly Checking Crypto account,1626931035,0,1
op70w2,IntroductionPlane141,https://opensea.io/collection/obtention-collection,1626929704,0,1
op6x2b,coinedge,"Can someone ELI5 what these ""Reorg"" miner attacks are all about?",1626929275,0,1
op6sj7,Traditional-Elk-7753,ethereum to the moon,1626928751,0,1
op664p,Katoch_Tubes,My contribution in helping people understand Ethereum blockchain,1626926237,0,1
op5oji,qarish,"Contest: Find A Crypto That Advises the NASA and the NIH, Win $100,000 ETH or 100k in VXV",1626924305,0,1
op5msg,Frabboguwap,Will any blockchain be able to sustain low tx fees so that it can become useful for everyday transactions?,1626924116,29,1
op4thd,BoxyM3,Eth staking is mesmerizing,1626921114,0,1
op4p2o,GimmieLu,The next generation of rewarding buy-back tokens Launch: July 22nd | 6PM UTC,1626920662,0,1
op4oa8,Sidhant_rajput,ETHERUM CO-FOUNDER (Anthony Di Iorio) quits the industry heres the exact reason why ???,1626920583,0,1
op3kwm,Nolimit2050,Ethereum price.,1626916557,0,1
op381p,TobiHovey,Vitalik Buterin Beseeches Ethereum Crowd in Paris to 'Move Beyond DeFi',1626915287,20,1
op35a7,kevin_hyperink,WhaleStats - what Ethereum whales are buying and selling,1626915014,1,1
op2qwr,lazywizard99,Ethereum 2.0 and London Hard Fork: All you need to know,1626913624,1,1
op2k69,twigwam,Ashton Kutcher &amp; Mila Kunis on Crypto -- WAIT FOR IT!,1626912945,0,1
op2bse,moonandgo,Setup Phoenixminer for kawpow 2miners?,1626912102,0,1
op205x,FreePrinciple270,Wait for it...,1626910976,8,1
op1toe,King_Esot3ric,QuickSwap rewards are out for 7/21-7/28!!,1626910366,1,1
op1n3w,ShrimpyApp,Is Ethereum better than Cardano? This article explains some differences.,1626909760,9,1
op171p,jdrumpfl,How much money do you get for running an Ethereum node and how do the operators of the big nodes get profitable?,1626908312,0,1
op0trg,LukewarmApe,Asthon Kutcher and Mia Kunis talk Crypto,1626907096,51,1
op0dvu,chapogrown,What do you guys think Elon musk owns bitcoin Ethereum and doge coin is this Bullish ?,1626905702,7,1
op02uu,UnderstandingOk4212,Dropped &amp; Replaced &amp; LOST Transaction on ETH [HELP!],1626904772,0,1
op02i8,BasedDepartment8898,Interesting stuff coming from the B Word conference. It is worth checking out!,1626904740,1,1
oozqf5,147_a1i,I’m new to Crypto and I don’t know how to deposit my money into my bank account. Help?,1626903676,6,1
oozn12,SatanicSpoon,Was the market crash 3 months ago organic or artificial ?,1626903395,0,1
oozgrp,nicky_papagiorgio,Former Ethereum Developer Virgil Griffith Arrested for Signing Into His Coinbase Account: Report – Bitcoin News,1626902850,14,1
oozgqb,theman__98,Really !! So you are not still on the soku swap farming ?,1626902846,0,1
ooza36,nathan555,900 new validators per day for proof of stake?,1626902269,0,1
ooz8dh,PeacockMamba,Benefits of EIP1559. 🦇🔉,1626902120,6,1
ooynp3,Playful_Patience_285,"low gas ,only wait?",1626900403,1,1
ooyneh,MQplaya,Elon Musk admits he holds Ethereum,1626900382,247,1
ooydpw,Badiscu,token for organizations,1626899569,0,1
ooyann,Playful_Patience_285,"low gas ,only wait?",1626899311,0,1
ooy4cm,QueasyInstruction256,Former Ethereum Developer Virgil Griffith Arrested for Signing Into His Coinbase Account,1626898781,0,1
ooy402,DeezerMyNuts,Celestic Incorporation Already??,1626898752,0,1
ooxwde,fecktk,Blockchain Game Zed Run Gets 20 Million In VC Funding,1626898115,0,1
ooxpdj,HilariaPosada,Crypto.com Introduces its New Ethereum Virtual Machine Chain Testnet,1626897518,0,1
ooxol8,[deleted],"Today is a wonderful day! I have good news about TOMOCHAIN, which made me happy! TOMO has left its mark on many exchanges and partnerships! Soon, this coin will be on everyone's lips!",1626897449,0,1
ooxejj,HilariaPosada,Crypto.com Introduces its New Ethereum Virtual Machine Chain Testnet,1626896608,0,1
oowzyg,NaturalWildFishOil,"How to Create Your Own NFT Art and Sell it on Binance, Axie Infinity, and OpenSea",1626895382,1,1
oowhwp,JadeDoo,Multiple Addresses in One Wallet Connected?,1626893913,0,1
oowg7l,harry12307,Elon says that he holds ETH at the 'B Word' event today,1626893771,0,1
oowamu,Repulsive_Pin_6585,Mining Help,1626893302,0,1
oow9sp,VSP-Michael,Introducing Vesper Lend (Beta),1626893231,0,1
oow8ak,yimbyarts,"EIP-1559 Hard Fork -&gt; Parallel Universe (ETC2) -&gt; ""Free"" Money?",1626893107,0,1
oow7st,Liberosist,Decentralized social networking,1626893062,0,1
oow59t,NessDan,Ethereum “Has to Expand” Beyond DeFi: Vitalik Buterin,1626892851,5,1
oovjuw,coinsmart,We heard you—fees decreased!,1626891070,0,1
oouzbb,yellingfore,"If you are looking to migrate from another wallet provider to XDEFI Wallet, here's a step by step tutorial 🙌",1626889387,9,1
oousmo,No_Mathematician5345,https://www.crowdsense.ai/post/how-crowdsense-empowers-traders-with-early-intelligence,1626888829,0,1
ooufos,Avt0r,EU Regulation proposal: require KYC on crypto transfers.,1626887777,0,1
ootzy8,cryptobriefing,Ethereum “Has to Expand” Beyond DeFi: Vitalik Buterin,1626886518,60,1
ootsxb,confusedman12012,Ethereum/dai lost need help,1626885944,1,1
ooson3,SuccessfulDisk9,Everyone Send ME 0.01 ETH And Let's See How This Goes,1626882719,0,1
oosn2d,Savinox,Relating? Be honest.,1626882586,3,1
oosmrv,SafemoonandBonfire,Check out this #NFT for sale on Mintable! Pick up 'Super Crypto Heads' before its swooped up!,1626882560,0,1
oosm0h,AngellicFloater757,Everyone Send ME 0.01 ETH AND Let's See How This Goes XD,1626882493,0,1
oosg0t,twigwam,The Evolution of Ethereum -- Nasdaq,1626882005,1,1
oosbx6,jaydvd3,Can someone help me understand the Gas Tracker?,1626881668,0,1
oosb8e,arianashares,7% chance that EIP-1559 is live before August 5th according to prediction market Polymarket,1626881612,12,1
oos26x,twigwam,Ethereum.org Q3 '21 product roadmap,1626880859,0,1
oorxzi,EconHacker,"A Prehistory of DAOs: Cooperatives, gaming guilds, and the networks to come",1626880521,1,1
oorq44,nethermindeth,"Ethereum Q&amp;A with Tim Beiko, Matt Garnett &amp; Barnabe Monnot",1626879872,0,1
oorl98,ConfusionOwn333,I need community help to help the community,1626879496,0,1
oor9fy,sebastiaan2809,Ethereum 2.0 and what it means for its circulation,1626878513,0,1
oor5lf,containerd,"The Libp2p project has a roadmap. Read where we are headed, leave feedback and reach out to get involved.",1626878185,0,1
ooqyq0,TimDaub,NFTs are coming for Instagram and other social media platforms,1626877592,1,1
ooqs5t,twigwam,"A new Bank of Canada report, ""The Positive Case for a CBDC"", sites Ethereum as the standard from smart contracts and programmable money",1626877024,58,1
ooqon7,DailyGweiBot,Generation Ethereum - The Daily Gwei #295,1626876711,1,1
ooqm1s,CorrineSomers,Crypto.com Introduces its New Ethereum Virtual Machine Chain Testnet,1626876481,1,1
ooqf43,ResolutionFirm9228,Ethereum Staking after 2.0,1626875884,0,1
ooqdmh,twigwam,"""The Biggest, Clearest Bet of All is Ethereum"", former Goldman-Sachs hedge fund manager Raoul Pal says in his sit-down with Camila Russo on The Defiant",1626875749,19,1
ooqc9w,Few_Bit_3738,Understanding BSC and how it affects my ETH,1626875622,0,1
ooqb6c,Tiko-traders,"Grace and Sophia were shown at the "" robotics exhibition 2021 """,1626875523,0,1
ooq4nb,ligi,Vitalik Buterin : Things that matter outside of defi,1626874909,32,1
ooq3n9,wakandaaaaaa4ever,The Pirate Bay is Back! ☠ - Only 100k Current Low Market Cap. Get in Now. Watch us 500x,1626874817,0,1
oopw85,D-E-W,“ETH 2.0 destroys POLYGON/MATIC” Discuss (12 marks),1626874105,0,1
oopt8y,kate2mc,How NFTs Can Shape the Book Publishing Sector?,1626873826,0,1
oopqsj,Morphius9201,I made an app that predicts crypto performance,1626873609,0,1
ooppin,Doodles1129,Why can’t I stake my eth in NY?,1626873494,0,1
oopg8f,Ok_Guide_7500,What am I doing in this trading strategy? Any tips/tricks will help,1626872633,0,1
oopbvd,Jimbley_Neutralon,Anyone else feel this way?,1626872225,2,1
oooeij,IamChris01,Help,1626868683,0,1
ooodic,sarahlong001,Who wants to be part of a new token I am working on which will have utility,1626868560,0,1
ooo6d1,orchidkart,SuperToken is providing a Free Token Generator,1626867751,0,1
oono2k,ASXSHOTTINGRIP,"Hi, register now to get the 1288 USDC Free Trial in Matrixport! Grow your wealth regardless of market volatility. https://invest.matrixport.com/inviteRegister/en?invite_code=CFA997",1626865585,0,1
oon8sj,economicsdesign,Comparing Alchemix with MakerDAO. Which is better ?? | Econteric.com,1626863742,0,1
oon6yv,OpportunityTraining3,Why I am panicking,1626863519,0,1
ot8xwu,GaryMedel5,"Hey! Look at this, they always want to blame Eth and Btc for all evils, do you agree? I found it on Crowdsense, they are offering a free trial. I recommend it",1627475470,0,1
ot8vti,s618o,Ethereum Eagle Project (EGL) Genesis - Community influencing of Eth gas prices (Coinlist stakedrop),1627475252,1,1
ot85dr,containerd,Filecoin and Hedera Hashgraph Announce Grant Program to Propel Web3 Interoperability,1627472308,0,1
ot6siq,economicsdesign,➡️ What is APY &amp; APR ? | Econteric. com,1627466191,0,1
ot6cu0,andrytail,India to adpot Ethereum blockchain to avoid certificate forgery; says government of Maharashtra,1627463925,126,1
ot6c79,GandALTtheHolder,"Real crypto adoption with BCH and GoCrypto - at GoCrypto locations you can pay with Bitcoin, ETH, BCH, LTC, XTZ, VIB and GoC",1627463839,1,1
ot5y2m,matthewargent,Calling all Shadowy Super Coders - Argent is hiring!,1627461952,8,1
ot57ui,dblake010101,Let's all come together to work on a token which will truly be run by the community,1627458146,0,1
ot53y8,jsmith4818,Just thought my balance was pretty awesome. Also been using Celcius for the reward rates. Just 2 weeks in. 222222222,1627457564,11,1
ot4zkb,Happy_Key_4368,Jax,1627456919,0,1
ot4xv4,diginoorteam,You think you know NFTs? Here's a chance to find out! Which one of the mentioned options is NOT an example of an NFT? Comment your answers below! We will pin the right ones! #BuyNFT #NftCreation #Diginoor #NFTSystem #Trivia #CryptoCollective #DigitalNft #BlockchainProjects #Quiz,1627456689,0,1
ot47fd,CryptoBFC,The DAO Attack (DAO Hack): What is it and What Went Wrong?,1627453008,6,1
ot45el,NewCan891,Invalid shares… how can I removed them? I have 8 RTX 3080 PNY and 1 RTX 3070 eVga,1627452732,0,1
ot3ty8,samdane7777,US Regulations are Abysmally Oppressive,1627451230,0,1
ot2xc5,Flamingos_Go_Ha,Available now! Links in comments. Only 4 galaxies to be collected!,1627447245,1,1
ot2vey,Needle_NFT,partial act – ultra rare 1/1,1627447023,0,1
ot26nt,ethprofit,"Ethereum use case mentioned during US Senate committee hearing about ""Cryptocurrencies: What are they good for?""",1627444267,0,1
ot26dq,ethprofit,"Ethereum use case mentioned during US Senate committee hearing about ""Cryptocurrencies: What are they good for?""",1627444237,0,1
ot219r,MacGuffin-X,The cheapest and easiest way to buy ETH?,1627443679,0,1
ot1i0x,Eastern-Slice-3887,Thoughts on Cardona?,1627441638,0,1
ot1huv,Eastern-Slice-3887,Thoughts on Cardona?,1627441621,0,1
ot18cg,MenacinG_ly,Mining on a slightly older version,1627440625,0,1
ot10y6,BigDaddyDallas,"Screw Cash, Pay Me In Crypto! Just received my 3rd payment for a haircut in ETH. Thoughts on business’s accepting payments only in crypto??",1627439837,96,1
ot0vhn,Zara629,Is writing an Ether dapp that only takes Monero and other privacy coins possible?,1627439263,0,1
ot0dlh,Snoo-14152,I made a transfer from eth to the eth contract wallet.,1627437451,0,1
ot09bs,BasedDepartment8898,"The amazon bitcoin news was fake, but you know what isn't fake... EIP-1559 on August 4th.",1627437005,1,1
ot07dp,CoinjoyAssistant,Ethereum Traders Can Cash In By Making This Move,1627436805,0,1
osz8wl,stanmilc,"Kirobo P2P Swap Button Introduces Slippage-Free, Direct Token Swaps to Crypto Market",1627433261,0,1
osz52h,Worth-Distribution15,ETHEREUM,1627432881,0,1
osz148,RecommendationOk4260,Bitcoin Mining Difficulty to Increase for First Time Since China Crackdown,1627432486,1,1
osyt0t,twigwam,"""For the first time in history, an ENS name and a DAO will receive producing credits on a film.""",1627431678,2,1
osynwj,c-i-s-c-o,Clogging the Ethereum blockchain as a publicity stunt for your NFT drop instead of using L2.,1627431174,0,1
osymu6,c-i-s-c-o,Clogging the Ethereum blockchain as a PR stunt for your NFT drop instead of using L2.,1627431072,0,1
osymk9,mikepolo561,So how bout ETH gas right now😅,1627431047,0,1
osyjkv,BruceKayne,so its gas(gwei) + network fee?,1627430755,0,1
osyj4f,Astronaut-Remote,4 digit gas fees! Wow!,1627430714,60,1
osy8av,Richardwetter,New to ETH,1627429711,0,1
osxymz,ShondraRiemann,India to Adopt Ethereum Blockchain to Verify Diploma Certificates,1627428785,0,1
osxsuy,ShondraRiemann,Ethsign Brings in Seed Funding To Put Signed Documents on the Blockchain,1627428239,0,1
osxpsy,notooth1,Is test net key identical to main net key?,1627427959,0,1
osxhtv,mudgen,Possible plans for an OpenZeppelin implementation of EIP-2535 Diamonds,1627427195,1,1
osxgi0,twigwam,Vitalik Buterin's presentation @ EthCC [4]: *Things that matter outside of DeFi*,1627427069,0,1
oswsmb,AD1AD,"Rina Imports now accepts Ether! [Clothes, Fashion accessories, Luxury]",1627424896,0,1
oswme8,Shamehaza,Buy the Communist Crypto 🖤😎 https://t.me/checointoken,1627424324,0,1
oswl32,s618o,The Zilliqa - Ethereum bridge will be the DeFi game-changer!,1627424214,2,1
osw0z2,mrsotkogaming,HUGE Updates For Ethereum And Cardano Soon!,1627422468,6,1
osw0lf,spiritualloop,Pump it⏰🏋️💰🚀,1627422437,1,1
osvy2j,rundown03,In case someone forgot,1627422208,59,1
osvr05,RFV1985,"ETH gas is through the roof right now, driven exclusively by “Stoner Cats” minting",1627421581,363,1
osvqtl,k1llfasheverywhere,Cross-chain interoperability for DeFi,1627421564,0,1
osvgjg,Wotredca4,"The application name changed from asiax.live to ""Asia Exchange"" in ios app store. We wanted the name.",1627420707,0,1
osvb8j,PeacockMamba,Hang loose boys!! 🌊 Not price or trading discussion.. simply explanation via graphic for the naysayers.. 🤙,1627420274,3,1
osuvis,Salt_Bumblebee9148,Earn Ethereum,1627418863,0,1
osuj2d,twigwam,Reddit Tokens Soar on Ethereum Arbitrum Launch,1627417675,11,1
ostoqc,Didkoxof,Please help!,1627414843,0,1
osthke,TopUser123,Smart contract or immudb for decentralized message board?,1627414180,0,1
ossrfm,NewCan891,"So after seeing this, is anyone switching pools? If so, what do you guys recommend. Also, is anyone staking the ETH they mine?",1627411772,0,1
ossme0,LorenzoByrd4577,Looks nice,1627411307,4,1
ossaac,After-Internal4898,The 10 tokens that have the highest average USD value among the top 1000 Ethereum wallets,1627410208,0,1
oss9vd,Nomad_wallet,DeFi in Nomad Wallet. https://play.google.com/store/apps/details?id=kz.nomadcrypto.bankwallet,1627410175,0,1
oss4e5,twigwam,"Awesome Solidity! -A curated list of awesome Solidity resources, libraries, tools and more //bkrem",1627409673,1,1
oss2wz,Nomad_wallet,"DeFi in Nomad Wallet, available Google Play : https://play.google.com/store/apps/details?id=kz.nomadcrypto.bankwallet",1627409535,0,1
oss23c,twigwam,"Blocksec Incidents -- A curated list of blockchain security incidents including exchange hacks, Defi compromises, blockchain attacks, and others /openblocksec (Great resource for devs learning Solidity!)",1627409461,1,1
osrvyz,twigwam,The Highly Optimistic Dev Blog #01: The Mystery of the Missing Message,1627408916,1,1
osru2q,DemandOk3237,Libonomy is the best scalable blockchain,1627408753,0,1
osrt9q,lwc-wtang12,"Ashton Kutcher, Mila Kunis and Vitalik Buterin Making Stoner Cats NFT Show",1627408678,2,1
osrsgv,MORSHEDA,Energy Mining Comparison Of Different Blockchains,1627408601,0,1
osrsf5,edwardnel,Cardano is struggling with smart contracts,1627408597,0,1
osronb,JuanS289,Some help for some Dapp,1627408261,0,1
osrgv2,Safe_Ad415,Libonomy Blockchain Provides A Solution.,1627407530,0,1
osr7g8,neiman30,Lessons learned from three months of running a decentralized website,1627406658,0,1
osqvys,Goatzn,Should I convert all my cryptos to learn the etherium market?,1627405615,0,1
osqkul,Nothingness1217,"Need Help with my Transaction: Hi, Sending transactions via Polygon (MATIC) main-net from my metamask to Matic Address in the Coinbase wallet never received Funds. Transaction is successful.",1627404594,0,1
osqdbv,hexayurt,"Vinay Gupta @EthCC ""How to use Ethereum to save the planet"" - updates on Mattereum, Trust Communities, UNN.finance and more",1627403873,3,1
osq80g,carloscancab,"People building useful products and valuable applications for the crypto community use nuanced, careful statements. Charlatans trying to sell you books have to invent narratives.",1627403373,20,1
osq547,twigwam,The Road to Trustless Ethereum Staking -- Lido,1627403105,0,1
ospzjs,Orageux101,Private voting on a public blockchain?,1627402588,0,1
ospxde,Orageux101,Private voting on a public blockchain?,1627402376,0,1
ospxce,Exarc799,MyEtherWallet adds BSC and Binance Bridge in their new Android update,1627402373,0,1
osp8ty,gharvhel,Why Amazon will move into the NFT space,1627400244,0,1
osp4wt,itchy-balls,I heard the ETH 1 chain history is not included in the upcoming hard fork and several alts will no longer function. True?,1627399911,0,1
osox5x,kethfinex,The Road to Trustless Ethereum Staking | By Lido &amp; Paradigm,1627399252,1,1
osoueb,Harukkai,"if I stake Ethereum, I have a chance it will get lost?!",1627399024,0,1
osoqxb,TobiHovey,These Are the Most Profitable Ethereum NFT Whales Right Now,1627398724,1,1
oso8kh,That_Teach_9224,Shopify now supports sales of NFTs on Flow and Ethereum blockchains,1627397205,25,1
oso35p,s618o,"Newdex, BSC, ETH L2: an horizontal take off to the moon!",1627396723,1,1
oso27t,twigwam,"ENS at EthCC4: Scaling ENS, Lots of Mentions, &amp; More",1627396632,3,1
oso0d7,twigwam,StarkEx 3.0 now live on Mainnet,1627396452,1,3
osnv1d,bmflip,Taking A Deep Dive Into The London Hard Fork,1627396048,0,1
osnv0e,bmflip,Taking A Deep Dive Into The London Hard Fork,1627396048,0,1
osnsxo,aliahani,Trading platform - cryptoblock.cc,1627395816,0,1
osnswu,aliahani,Trading platform - cryptoblock.cc,1627395816,0,1
osnm6a,DailyGweiBot,True Conviction - The Daily Gwei #299,1627395143,1,1
osnlkn,whotheff,In 9 days ETH will hardfork. Do I also get my current ETH wallet coins forked to old and new ETH?,1627395090,0,1
osn7r3,QuadraSense,Quickswap swaps using Python &amp; Web3 (help),1627393828,0,1
osmxsb,Grand_mac365,Popular YouTuber is going after altcoin promoters. Why I believe he is WRONG! What do you think? https://youtu.be/K3RZvDKATAQ,1627392864,0,1
osmujb,Flick_ftw,Help me understand why someone would take out a DeFi loan,1627392544,0,1
osmi6s,WallStreetDoesntBet,What will happen to ETH after the London Hard Fork launch?,1627391332,0,1
osmhsu,lexx_cheng,WETH to ETH,1627391291,0,1
osmfcq,miloglznava,Is it possible to sell my photography as art NFT?,1627391040,0,1
ohvsfs,CriptoNet,BNB Whale,1625969302,0,1
ohvh54,anongirl905,Just wondering if it will go up,1625968009,0,1
ohve4z,LQDEX,YOLO Bug Bounty — 4 Day Cross-chain Shootout,1625967663,4,1
ohv4is,PeacockMamba,I want to thank the Ethereum community for getting me back into what I love. I used to code but eventually lost interest and my work shifted into sales. Ethereum has ignited my coding passion again. Im currently studying Solidity. I’m getting back into Python. May take a course for C+ &amp; Java. 🙏🏻,1625966565,57,1
ohuq2w,Ciricath,The Rise of NFTs: A Brief History,1625964993,1,1
ohufnu,rustneversleeps22,US Taxes for using ETH as an exchange pair for other cryptos,1625963840,0,1
ohuecg,Richy222,What’s the best benefits of staking ETC 2,1625963686,16,1
ohu42j,PeacockMamba,Sometimes the unintended outcome when solving a problem becomes the de facto answer. EIP1559 is a great use case in this scenario. Intention was to create a more predictable gas fee but ended up making Ether a deflationary 🔥 store of value too.,1625962540,34,1
ohtixk,ARONBOSS,What You Need to Know Before the Ethereum (ETH) London Hard Fork – AronBoss,1625960325,3,1
ohti1n,comicstream,CAPITAL PROTECTION Tool for Uniswap v3! Would you like to have 100% protection against volatility for your crypto?? This could be a reality if you support and VOTE for our proposal! Check it out! Thanks!,1625960229,4,1
ohtclq,Zalir0,Distinguishing Legitimate Blockchain Projects via Decentralized Vesting Protocols,1625959689,12,1
ohtb6p,comicstream,Would you like to have 100% protection against volatility for your crypto?? This could be done using the new CAPITAL PROTECTION Uniswap governance PROPOSAL! Check it out and don't forget to VOTE! Thanks!,1625959537,0,1
oht8gv,QuantInc,How much of a threat is this reorg thing to ETH?,1625959268,0,1
oht2ee,comicstream,Would you like to have 100% protection against volatility for your crypto?? This could be done using the new CAPITAL PROTECTION Uniswap governance PROPOSAL! Check it out and don't forget to VOTE! Thanks! https://bit.ly/UNIg3,1625958677,0,1
ohsty8,BowlerOk9394,What’s the easiest way to transfer ETH to a cold wallet?,1625957865,0,1
ohsonh,SituationSilver7013,Amazon aged buyer accounts with lot’s of purchase history,1625957327,0,1
ohsbdy,RiiguyHATESHFUNDS,Which one is your favorite?,1625956037,0,1
ohs9t5,Richy222,If I had held on from free crypto from Coinbase,1625955879,0,1
ohs9s0,SuperShaggySandwich,Who the hell keeps doing this??,1625955877,207,1
ohs5ew,CriticalThinker22-,Ethereum: time to get in is now!!!,1625955449,0,1
ohru60,Rotakeshan,Why the 3% jump,1625954361,0,1
ohrrcc,helfo,Ethereum London Countdown Site,1625954083,0,1
ohric3,yazan-arafat,buterin2021,1625953221,0,1
ohqvqc,UranusisGolden,Ethereum address registrar and DNS,1625951064,0,1
ohqneo,Maleficent-Grape-664,Central bank digital currency on Ethereum,1625950275,0,1
ohqmuz,QuadraSense,Quickswap with Python and Web3: Fail with error 'UniswapV2Router: INVALID_PATH',1625950224,0,1
ohpboq,Vector3Properties,Any DCL land owners here?,1625945843,0,1
ohp45t,Crypto_BullsClub,What is Ethereum Hard Fork and What it means for Users &amp; Miners,1625945165,0,1
ohoyx0,MorrisMustang,Using ETH.Link to route to Digital Ocean Api endpoint.,1625944690,0,1
ohouhj,noNameCode,Making a post cause I have finally reached 100 comment karma.,1625944287,0,1
ohogdz,Relprimer,Mods deleted my post with 267 Upvotes. This is a prime example of why we need DECENTRALIZATION!,1625943002,21,1
ohod6z,Crypto556,Why are Defi exchange transfers so much more expensive than a regular ETH transfer?,1625942710,0,1
oho22s,Crypto_Exchanger,There are many projects built on it,1625941710,0,1
oho17v,Z_Olek,"4 gwei, how long does it take?",1625941628,0,1
ohnuy0,underratedm,To my Ethereum holders who are looking to buy their first NFT,1625941059,0,1
ohnu8o,Tiko-traders,"SingularityNet 🚀 %600 - %800 🚀 ""AGIX” 🦾",1625940996,0,1
ohnu6y,a-G4G,ETH coin eyes generator,1625940991,13,1
ohnsiq,rex45,Solar powered mining,1625940836,0,1
ohns01,AntPuzzled8478,Metamask Unauthorized Transfer,1625940784,0,1
ohnj9r,Scavanger24,Eth GPU Mining,1625940011,0,1
ohngzb,LojekJ,JustMoney has something for Ethereum holders🚨 Use this link: https://eyes.justmoney.io/#eth,1625939802,0,1
ohn2gt,Big-Machine-59,How do you think London Hardfork will effect price short term as soon as implemented?,1625938482,0,1
ohmzzi,adminalex360,Morning Yoga Class One For Beginners | Next Motion,1625938258,0,1
ohmzop,alex_crypto214,The HOW TO OCSC DEMO.mp4,1625938230,0,1
ohmz3p,Bluebeartheteddy,I prefer Ethereum,1625938182,0,1
ohmy7g,Finncialhealth,Ethereum Price Prediction Ethereum Classic Ethereum News [July] - SEC Ta...,1625938096,2,1
ohmuxl,adminalex360,Libonomy is so interesting,1625937799,0,1
ohmkee,Thiotes,I prefer ethereum.,1625936874,0,1
ohmb8s,Lcoronaboredom,Monday morning after the dip 😂😂,1625936060,0,1
ohm845,D3dR3d8,London hark fork?,1625935764,0,1
ohlz0x,ShondraRiemann,"Ethereum, Cardano, Are Sleeping Giants As Bitcoin Shows Sideway Movement",1625934922,4,1
ohlxts,Substantial-Run-5672,Buying eth in canada,1625934812,0,1
ohlxq5,adminalex360,Who are Libonomy competitors? AMA,1625934801,0,1
ohlviq,johnson1237,Ethereum when you can have incomparably faster.,1625934600,0,1
ohltrp,Ituglobal,"Ethereum Hovers Above $2,045 Support As Buyers and Sellers Continue Price Tussle",1625934439,0,1
ohlss4,silvr3,in canada : how to buy eth cheaply without entrusting my key to third party,1625934349,0,1
ohla1d,mendax135,Jobs for Ethereum,1625932645,0,1
ohl6lx,aLebanese,Stakers Beware: Do NOT Stake Your ETH with Coinbase,1625932304,0,1
ohl3m4,FPW0,I just have my Keystore file and Password how can I access my ERC20 tokens? How can I convert to MEW (Do I have to)?,1625932025,0,1
ohl3i3,Deutschland6812,Unsecured loan ?,1625932013,0,1
ohkx9x,Shtafoo,"""I prefer Ethereum""",1625931434,31,1
ohkkop,mudgen,🏰 BuidlGuidl: 💎 Diamond Standard starter kit,1625930250,0,1
ohkhb7,cryptocurrencypr,Scalability trilemma and the Libonomy blockchain,1625929936,0,1
ohkdsb,bucketsnbodies,Looking to make some extra cash? Join Stake for free money daily and other promos. It’s FREE! (Use VPN) https://stake.com/?c=1ddab2c00d,1625929622,0,1
ohka0z,Hezbolloli,How to stake ETH with Metamask?,1625929291,0,1
ohk3uv,flychicken2008,I Build a Price Alert Web for Exchanges,1625928715,0,1
ohjsmd,MessyCans,Is there anyway I can buy ETH without have to wait 5/10 Days for Debit/Bank account transfer?,1625927661,0,1
ohjcpc,cryptocurrencypr,Libonomy is the optical cable. Fast and interoperable.,1625926099,0,1
ohj7ib,Steven44323,Who are Libonomy competitors? AMA,1625925605,0,1
ohj5w7,CryptocurrnecyTrader,Now there is no need to be stuck on extremely costly Ethereum’s network,1625925442,0,1
ohj3ix,Crypto_Odds,Earn Passive Income on your Stablecoins using Defi,1625925191,0,1
