id,author,title,created_utc,num_comments,score
mhujl0,Silverbackmanllc,Staking on coinbase?,1617281249,0,1
mhudxv,KarinHernandez,"Dharma is an Ethereum Wallet, connecting directly to your bank. The wallet combines major exchanges to offer users greater access. It’s compatible for use on Aave, Compound, Yearn, and Uniswap",1617280712,1,1
mhtxb0,DiamondHandInvestor1,🚀🚀🚀🚀🚀🚀🌙🌙🌙🌙🌙🌙🌙,1617279034,0,1
mhtte6,pratikgandhi,Gas fees using 1inch are 58% less than Uniswap on a $ / $ basis,1617278642,0,1
mht9g0,BooDPT,"ETH Hit $3,000!",1617276484,0,1
mht6t3,azrienvgc,Whale Whale Well 😂,1617276195,6,1
mht5oy,aurymahar,NFTs,1617276089,0,1
mht482,rowger2020,"Razor Network is back with L2 Gasless Farming at GalaxyFarm Cohort 2 by Router and Polygon We are pleased to announce that Razor Network will be collaborating with GalaxyFarm-2, a new staking product developed by Router Protocol, to enable liquidity providers of $RAZOR to farm multiple tokens.",1617275934,0,1
mht28e,Due_Ad_890,What do you guys think of Teeka Tiwari’s prediction on Ethereum? He basically said it’s the coin to watch this year and we can expect great gains by the end of this year.,1617275722,0,1
mht05t,GandALTtheHolder,"Startup Eligma recently released new all-in-one POS device called EllyPOS that allows merchants to accept cards, digital and crypto payments all on one device. Ethereum supported. Also updated Elly wallet and it now supports buying crypto (ETH included) with Visa &amp; Mastercard.",1617275496,0,1
mhssq6,cadicap23726,"Hey, you're in the DeFiTeller's TOP!",1617274692,2,1
mhsmd3,hosannabrand,Will Ethereum Miners Engage In A 51% Attack To Maintain High Profits?,1617273905,0,1
mhslu7,BitboyBitcoins,btc traders in delhi ncr,1617273845,0,1
mhsiep,BluebirdNarrow801,Should I buy more ?,1617273439,0,1
mhsh41,sportifynews,"Ethereum Price Forecast: ETH May Rally to $2,500 in Q2",1617273276,0,1
mhsguu,gravity1369,Tomb of Cyrus the Great (My first NFT),1617273244,0,1
mhsfzn,gravity1369,"""Tomb of Cyrus the Great"" My first NFT",1617273131,0,1
mhsf9d,felp_sssss,"Atari bets on Bitcoin, NFTs and virtual casinos for its rebranding",1617273046,0,1
mhs99b,k11u9,Does anyone know a marketplace with low gas fees,1617272319,0,1
mhs3hl,stanmilc,"DigiMax (CNSX: DIGI, NASDAQ OTC: DBKSF) CEO Chris Carl: I Expect More News To Flow In The Not-Too-Distant Future",1617271609,0,1
mhryaq,Aromatic-Hippo3031,18 years old. 1.2k cash to spare. Should I invest?,1617271002,17,1
mhrx6z,ligi,New opcode: SUDO (EIP-3455),1617270849,20,1
mhrq5q,Mphiltrate,NFT created from bullion 999.9. (24kt) gold $100 bill,1617269936,0,1
mhr19p,elmira_kuzmina,What is Etheruem?,1617266650,0,1
mhr06s,cassiopeialtd,Discussing the next evolution stage in Defi: Uniswap V.3,1617266500,0,1
mhqv3u,Primus1X1,I bought Ethereum for 2000₹,1617265764,0,1
mhqujz,debmo1234,I want to BUY an NFT. Any recommendations?,1617265684,0,1
mhqk5o,augr7,Solo mine ether on windows 10 CPU,1617264302,0,1
mhqdzy,Trina_L,May I ask you guys to help testing this market replay tool for me?,1617263553,0,1
mhqapu,Ok-Mammoth6272,EIP 1559 and existing smart contracts,1617263134,2,1
mhpr5m,SerialMasticator,Such Large Portfolio!,1617260630,0,1
mhpgp3,obsd92107,NFT Marketplace OpenSea to Add Ethereum Layer 2 Protocol for Gas-Free Trading - CoinDesk,1617259381,1,1
mhpfkp,daLabRat,I hate Ethereum,1617259243,0,1
mhp9se,Etnereris,Spread love - less FUD on Ethereum,1617258541,0,1
mhp6ld,chasedenson,Philosophical Question: Abundance of Blockchains and Tokens,1617258128,11,1
mhoz7a,Liberosist,"Opinion: Time to sunset the ""Ethereum 2.0"" branding (and just call then ""Ethereum upgrades""?)",1617257251,22,1
mhotg9,dani_lbrl,I did some NFT cyber punk chicks! Her name is Yoshimi!,1617256587,0,1
mhosm9,kracken4456,Ethereum Improvement Proposal 1559: Is the squeeze worth the juice?,1617256483,3,1
mhos0i,captainlardnicus,Three ERC20 Tokens walked into a bar...,1617256410,1,1
mhohle,Jism_nl,I send 550$ of Usdt to a ETH adress - am i screwed?,1617255178,27,1
mho7wc,IchaIcha13,Can i mine ethereum on 1660 4gb?,1617254033,0,1
mho69i,Immediate_Depth532,Why did you get into crypto and blockchain? What made you stay interested?,1617253855,0,1
mhnw0q,EmergentCthaeh,Reserve team admits they will need to copy MakerDAO to generate revenue,1617252696,0,1
mhnt8s,imToken,The new imToken 2.9.0 with native support for zkSync,1617252375,4,1
mhnq3h,flexpool,Dogepool nice wow luck money yes,1617252016,0,1
mhnp8p,daddyelonxash,Is Trezor x Exodus less secure?,1617251917,0,1
mhnbrx,boba_repo1,Anyone Willing To Sell A Bit Of ETH?,1617250410,0,1
mhn50r,Jbelllaaaa,Need crypto help,1617249715,0,1
mhmi5a,JeffR47,Has anybody tried Pionex?,1617247290,0,1
mhlygb,pyrohammer,Where can I sign up and buy ETH to withdraw instantly?,1617245341,0,1
mhlwn9,DiamondHandInvestor1,🚀🚀🚀🚀🌙🌙🌙💎💎💎🙌🙌🙌🙌,1617245158,0,1
mm7x0y,istmischey6,Polygon expands to Enteprise with a collaboration with Infosys Consulting to revolutionize the trillion dollar insurance industry,1617818335,0,1
mm7wp3,medicidefuma,New to crypto and wanting to up my game,1617818309,0,1
mm7q0n,plentyofhacks,Cannot transfer ERC 721 token in MetaMask in dev environment.,1617817791,0,1
mm7oz4,a1000p,Which blockchain wins the NFT market?,1617817711,0,1
mm7er4,usingvinko,Merchant Token ICO Going Fast - Phase 29 of 100 now 😱,1617816922,2,1
mm7e1c,KEMP369,"Hey fellow Cryptonites! Here's my genesis drop on https://foundation.app/Kemp/m-il-k-ultra-16824 (my Moloko brings all the Droogs to the yard?) More in the collection coming, featuring such pleasantries as cannibalism, the singularity and Cronenberg goo...",1617816862,1,1
mm7cfk,usingvinko,Merchant Token ICO Going Fast - Phase 29 of 100 now 😱,1617816725,0,1
mm79cv,superchargedcristina,The NFT community is a joke.,1617816483,502,1
mm73iy,abigai-ly,Still vibing though,1617816046,0,1
mm72be,mimirv,Can we expect lower gas fees with ETH 2.0?,1617815955,0,1
mm6yrz,Astronaut-Remote,Multiple transfers in 1 transaction?,1617815694,0,1
mm6wq9,Zedfa,Is it a secure site for exchange eth to paypal ?,1617815532,0,1
mm6o0g,Dramatic-Shirt-3711,Sign up to win one of five Ethereum coins,1617814901,0,1
mm6fa5,imohmonami,Clarifying VALUE Token,1617814231,0,1
mm64f1,alfhad91,BridgeOracleSystem,1617813401,0,1
mm6347,Ecv02,Bit of a noob question regarding gas.,1617813298,5,1
mm5xqc,cuffia_azzurra_2,Top Cryptocurrency by Market Capitalization - 2013 to 2021,1617812865,0,1
mm5x34,brantlymillegan,MVP of ENS on L2 with Optimism: Demo Video + How to Try It Yourself,1617812816,2,1
mm5ktz,Guarda-Wallet,How to GETH ethereum (with 40% discount),1617811885,1,1
mm5hso,CryptoPeacock,"Intelligence dossier finds Bitcoin is outperforming gold, but Ethereum is outshining Bitcoin",1617811645,0,1
mm5cpr,carver,"Beam Sync in 80 Seconds, Using Meta-Witnesses",1617811264,8,1
mm59tu,NFTNewsToday,MVP of ENS on L2 with Optimism: Demo Video + How to Try It Yourself,1617811059,0,1
mm57om,aeoixs,At what time and day are Gas fees lowest?,1617810886,0,1
mm4xbm,jmend23,"If you’re interested in crypto, come watch this interview with the Bitcoin billionaire Dave Chapman! He’s the executive director of BC group and has a LARGE amount of Bitcoin (XX,XXX)",1617810083,0,1
mm4wxu,Apprehensive-Push402,2000 Wallets! MelloToken,1617810052,0,1
mm44od,cryptpot,Vitalik Buterin- Why sharding is great: demystifying the technical properties,1617807912,1,1
mm434x,Apprehensive-Push402,2000 wallets! MelloToken,1617807802,0,1
mm3vme,T1nKy_,How long does this Transaction Takes Normally,1617807236,6,1
mm3sfc,vbuterin,Why sharding is great: demystifying the technical properties,1617806980,105,1
mm3r3u,NFTNewsToday,Recap of ENS Online Workshop April 2021,1617806887,0,1
mm3q3e,Chrispenn17,What is Ethereum and How Does ETH Work,1617806810,0,1
mm3kmw,PeteInvests,Anthony Pompliano DESTROYS Kevin O'Leary On Crypto,1617806392,0,1
mm3jdh,WillianBo,MetaMask and Filecoin: the new project to create Web3 sites,1617806291,0,1
mm3i74,Due-Understanding-74,Low hash rate,1617806199,0,1
mm39ic,brantlymillegan,"Recap of ENS Online Workshop April 2021: DNS namespace integration, governance, L2 demo, and more",1617805536,1,1
mm2w5g,xiwebat,"dApp thread:- Read here why EarnBet was awarded the best blockchain casino award. Unlike its competitors, it leverages off state-of-the-art blockchain technology and is fully decentralized with on-chain bets. It has a $2,000 $ETH leaderboard promotion and a $50 sign-up-bonus active.",1617804484,0,1
mm2vud,LBG-13Sudowoodo,🚀HOPR partners with Tidal Finance to insure payment solutions and protect users’ metadata,1617804457,0,1
mm2q4s,Njahh,Will there come a limited supply for eth???,1617804021,36,1
mm2ngf,fitstrong_dead,Unmineable ETH mining code,1617803809,0,1
mm2ddy,MelvinTheGrate,Is this my one chance to get a whole etherum? Or should i wait for a better time?,1617802997,19,1
mm29p1,cadicap23726,Who are the creators of this project?,1617802692,2,1
mm20dh,Roy5891,About right,1617801915,0,1
mm20cy,Abrujosh,Airdrops,1617801914,0,1
mm1si6,CryptoPeachy,ETH Compression zone,1617801241,0,1
mm1oce,DeathsMuse666,MEW wallet stake questions,1617800897,0,1
mm1mrs,satplank,airBaltic the first airline in the world to issue NFTs,1617800762,0,1
mm1jc6,TheGreatFilth,What is a good buy price right now.,1617800461,0,1
mm1g31,G-Standard,OMG 📉⬇️ what's going on? 🦕☄️🌪⛈🌊,1617800182,0,1
mm1fvh,RealChicoDee,Why!?!? 😤,1617800165,1,1
mm1f8n,usingvinko,Merchant Token ICO Going Fast - Phase 27 of 100 now 😱,1617800109,1,1
mm100f,Fallen1729,Ethereum dip,1617798692,2,1
mm0rf5,Glow-fly,How much ETH will fall today? Looking for better entry to buy more,1617797857,1,1
mm0nnk,AESTHTK,r/EthGamers reaches 1k subscribers!,1617797483,0,1
mm0kwl,marcosa89,What do you rate as a ‘reasonable’ initial token distribution for Founders/Team Members?,1617797210,15,1
mm0i4q,-EzW,NFT Resolution,1617796949,0,1
mm0hj8,_truebird_,AtoN - a time-travel NFT,1617796896,0,1
mm0f9g,Bitman321,"How the current tax rules in the 5 eyes nations hurt crypto, especially Ethereum",1617796685,0,1
mm02h3,usingvinko,Merchant Token ICO Going Fast - Phase 27 of 100 now 😱,1617795315,0,1
mlzynw,Josef_ade,Lowest Gwei price,1617794891,9,1
mlzpu0,MagoCrypto,"Ethereum To Be a 'Store of Value,' According to Skybridge Capital’s Anthony Scaramu",1617793899,0,1
mlzkw4,Basic_Bridge_8177,Wrapped and unwrapped coins,1617793332,0,1
mlzgj3,Josef_ade,Help a man out (Please),1617792848,0,1
mlzd99,cryptoroller,Removing MEV and avoiding MEV auctions,1617792449,1,1
mlzbql,Liberosist,Smart contract platforms should become rollups,1617792256,41,1
mlz6cg,AnonCarding420,Looking to trade Pewdiepie NFT(worth 5k) for an NFT of similar value or crypto,1617791595,2,1
mlz62b,KingofBurpees,Do I understand the basics Ethereum? And am I ready to buy in?,1617791558,20,1
mlz0zx,usingvinko,Merchant Token ICO Going Fast - Phase 27 of 100 now 😱,1617790949,0,1
mlynsw,Dexter_100,discord group,1617789334,0,1
mlydx9,debmo1234,3 HashLips NFT giveaway today!,1617788019,0,1
mlybx9,ethmarek,"Second post about useDApp, the new DApp building framework",1617787763,2,1
mlyb71,ethmarek,"Second post about UseDApp, the new DApp buidling framework",1617787666,0,1
mlyasq,A117Z,If ETH is decentralised how can it transfer from PoW to PoS without the approval of the majority of the miners?,1617787616,62,1
mlyacg,ethmarek,useDApp: Deep dive into custom hooks and testing,1617787559,0,1
mlya8i,intr0v3rted,"Dump ETH, let’s buy back in at better prices. WEAK Hands Get Out!",1617787544,1,1
mlxxs5,zzz135792468,"Does anyone know what this transaction refers to, and if funds can be retrieved?",1617785932,6,1
mlxx8a,Porkysays,Studying The Chart,1617785856,8,1
mlxpvt,NOTPR0,Alchemy launches Dutch Auctions for arbitrary tokens. Wrap NFTs into liquid tokens with AlchemyDAO then sell tokens in a fair auction model to unlock capital from NFTs while preserving decentralization.,1617784835,0,1
mlxp9u,A117Z,If ETH is decentralised how can in move from PoW to PoS?,1617784756,0,1
mlxfba,Money_Jellyfish543,Free cash bonus,1617783412,1,1
mlxawg,Peaintania,Is there any website that shows ETH 2.0 staking reward equation?,1617782846,5,1
mlx7f2,VeniVidiVici939393,CRDTpay Partners With Changelly To Make Crypto More Accessible For Its Users,1617782388,0,1
mlx586,thumbsdrivesmecrazy,"The Different Types Of Ethereum Tokens - ERC-20, ERC-223, ERC-721, ERC-777 Comparison",1617782086,15,1
mlx52p,usingvinko,Merchant Token ICO Going Fast - Phase 27 of 100 now 😱,1617782066,1,1
mlx0kd,stevieraykatz,Quick question about how transactions get chosen by block proposers in PoS,1617781466,0,1
mlwsu5,thamilton5,Crypto projects face a challenge to gather metrics and statistics from nodes run by many different parties. Read how the Streamr Network can be used to solve the issue in this blog from Henri Pihkala!,1617780443,0,1
mlwqh9,Bronze_Legion,Two Hashmasks talk about the week's biggest NFT news,1617780140,0,1
mlwodz,KOJAY30,Whats The Move On This Coin Right Now ? What Are You All Doing With Holdings 💨🚀,1617779883,0,1
mlwo2j,jasonwinnipeg,want to buy ETH need help,1617779848,0,1
mlwcei,Naruto97kaf,ETH stuck in a contract...,1617778489,4,1
mlvzta,coronuszodiac,"Introducing HypeSneakrs 👟 10,000 one-of-a-kind NFT Sneaker Collectibles on the Ethereum Blockchain, powered by OpenSea 🐳",1617776983,2,1
mlvy6x,NoUrATowel99,"HELP! Was mining like a dream, now suddenly losing connection often",1617776782,0,1
mlvq2v,FijiWeddings,"New to Ethereum Mining, Please Be Careful of Address Changing",1617775845,0,1
mlvpdd,bank_1990,Error during a swap I did on MetaMask. It still charged me the gas fee. Is this normal? Should I get my ETH I paid for gas returned? Not sure why the swap failed. Im scared to try again and lose more ETH. Any suggestions?,1617775765,18,1
mlvjot,Leandrodlorenzo,When can we shut the mouth of this false person?,1617775132,0,1
mlvdp1,TheWhole12Inches,Ethereum eip-1559 and hardware wallets,1617774419,6,1
mlv0oi,Psychological-Bat405,Check out this #NFT for sale on Mintable! Pick up 'Stronger Collections' before its swooped up!,1617772912,0,1
mlumav,CylonXL,PoS Upgrade Sharding,1617771329,1,1
mluk1j,CryptoLurker2013,How does EIP-1559 adjust basefee if ETH price goes up or down?,1617771079,0,1
mlucbw,Pagedpuddle65,Looking for some private feedback on an Ethereum side-project I've been working on to see if it's worth deploying on the mainnet,1617770254,2,1
mluaqa,unstopablex5,Potential New Use-Case for NFT's,1617770081,0,1
mn1e7n,igthrowawayy,What percentage of your traffic is mobile? Should crypto products be mobile first?,1617915587,3,1
mn19q7,Maximpd,Tether erc20 to trc20,1617915227,0,1
mn153d,Beamy1316,referral code,1617914869,0,1
mn12qz,phoeniixB,"Ethereum switching from POW to POS, Who will replace it?, Ethereumclassic( Original Ethereum)",1617914682,0,1
mn0vu4,thunder_doggy,Blockchain (Paxos/Ethereum) may change equities trading for good,1617914133,0,1
mn0pfj,Live-Reason9447,Eth 2.0 theory.,1617913619,0,1
mn0maf,sialkot123,Future chaning project,1617913370,0,1
mn0dl1,LankyInitial4897,Swapping USDC to USDT Gas fees??,1617912681,0,1
mn07pw,rowger2020,Your favorite crypto hardware wallet Ledger now supports $RAZOR HODL your $RAZOR safe and close to your heart on the go!,1617912235,0,1
mmzqfu,AndreasCost,Tips on trading ERC-20 tokens?,1617910878,0,1
mmzhlb,KarinHernandez,"Ethereum is currently the most popular cryptocurrency on YouTube. The news is based on a study conducted by Total Processing. Total Processing reviewed 10,000 videos to come up with the report.",1617910192,4,1
mmz9az,trent_vanepps,Ethereum is eth1 is eth2 is Ethereum - a super simple diagram,1617909574,113,1
mmz72k,Temwell3,Blockchain Tracking Software,1617909397,2,1
mmz40w,JarWarren1,Noob question: What's the incentive to serve as a node in Proof-of-Staking if there are no miner fees to be collected?,1617909162,0,1
mmz12f,Routine-Lie6160,Please Help!,1617908936,0,1
mmytbw,Puzzleheaded_2029,What to do with current ETH?,1617908333,0,1
mmy7f1,PotentialBranch288,Ether value takes on Bitcoin — What’s behind the sharp ascent popular?,1617906642,0,1
mmy29d,FrozenEternityZA,Does a Six Degrees of Kevin Bacon Ethereum version exist?,1617906228,0,1
mmxv5w,Dharmesh2,Razor Network partners with Cellframe to be quantum ready Oracle solution,1617905681,0,1
mmxr27,econoar,"EthHub Weekly #160: ETH all-time high, Coinbase direct listing 4/14, Caspian from Starkware announced, Element Finance raises $4.4mn, Aave deploys to Polygon and Fei genesis drama",1617905370,0,1
mmxfng,gageyoung,Minted My Very *First* NFT And I Have No Idea If Or When It Will Ever Sell But That Is Okay :),1617904534,0,1
mmxbco,Razaberry,"“On the blockchain, nobody knows you’re a fridge.”",1617904217,0,1
mmxb17,pepepopopie69420,Is ethereum mining going to die?,1617904195,0,1
mmx82k,ipazuty55,Fight of the Century (NFT),1617903977,0,1
mmx79z,aihwao,Question about storage of NFTs and access,1617903917,0,1
mmx54g,[deleted],Merchant Token ICO Going Fast - Phase 35 of 100 now 🚀🌑,1617903748,0,1
mmx0de,ArLuc,Noob question,1617903388,0,1
mmwzg0,NFTUpdates,Crpyto Domain for sale!,1617903318,0,1
mmwsrt,twigwam,Education: The North Star of Navigating Ethereum,1617902808,1,1
mmwf64,Brendan3005,"Built on Ethereum, TCAP, The Worlds First Total Crypto Market Cap Token, is now live on mainnet. Learn more about the specifics of the protocol here:",1617901767,10,1
mmwcvl,Alex-Alex-Alex--,6 reasons to pick PEAKDEFI wallet,1617901589,0,1
mmw3io,MK19RegularGuy240B,I can finally rescue my ETH from Binance!!!,1617900916,0,1
mmw0lg,Warm_Locksmith2072,Ethereum project,1617900684,0,1
mmvvh9,jbroja,You can’t run when we shoooott,1617900281,1,1
mmvs63,rootbank,Ethereum Ecosystem,1617900018,1,1
mmvpvf,ligi,"NFTs - If You Don’t Know, Now You Know",1617899828,28,1
mmvgv5,[deleted],Merchant Token ICO Going Fast - Phase 34 of 100 now 🚀🌑,1617899124,0,1
mmvgcm,[deleted],Merchant Token ICO Going Fast - Phase 34 of 100 now 🚀🌑,1617899083,0,1
mmveon,Whettttt,Coinsmart get $15/€10 + $60/€40 more promotion ends 30th April! UK/EU/CAD,1617898951,0,1
mmvebj,cadicap23726,Join the Crypto Kombat's LP-farming campaign and collect exclusive NFT,1617898924,0,1
mmvc2k,rowger2020,$RAZOR Network &amp; CELLFRAME⚔⚔⚔ Quantum Resistant Partnership ⚔⚔⚔ CELLFRAME is a quantum-resistant layer-1 network focused on facilitating secure and scalable cross-chain transfers.,1617898754,0,1
mmuppa,Laevo_opz,Merchant Token ICO Going Fast - Phase 34 of 100 now 🚀🌑,1617897026,0,1
mmuph9,Riis_KC,Is it normal for my hashrate to fluctuate this much? The large dip is when I restarted on of my rigs. I’m new to the whole mining scene and would love some advice.,1617897009,1,1
mmuoc9,Klaasiker,No money to invest? I made $104 on DutchyCorp in under 3 months to buy Ethereum,1617896921,0,1
mmumfk,Brendan3005,"TCAP, The Worlds First Total Crypto Market Cap Token, is now live.",1617896769,3,1
mmuivu,MGCapitalScam,Don’t trust Clearsave! It claims to be a regulated broker but it’s actually not. The platform is owned by a company called mg capital which is not even on the web. https://mgcapitalscam.com/,1617896482,0,1
mmualb,indalo05,DeFi for a better World ?,1617895822,0,1
mmttaj,cheensean,hello world,1617894413,0,1
mmtptn,Future_S7033,Are other smart contact cryptos like tron and cardano more like ethereum or ethereum classic?,1617894147,0,1
mmtmi3,Greatekel,Merchant Token ICO - DEFI PROJECT 🚀🌕 - Phase 34 of 100,1617893892,0,1
mmtlsc,Pallagucci,anyone selling Ethereum?,1617893831,0,1
mmtfss,radeon8598,Hitbtc does not withdraw money to a trader with cancer.,1617893336,0,1
mmtfn8,400lb6foot7blackman,I need help understanding pool mining,1617893322,0,1
mmt1yz,twigwam,"Ethereum Layer 2 protocol Immutable X launches on mainnet, aims to substantially cut NFT costs",1617892230,12,1
mmt14l,twigwam,"Layer 2 protocol Immutable X launches on mainnet, aims to substantially cut NFT costs with new Layer 2 scaling protocol",1617892168,0,1
mmssde,ivhano7,Berlin Hard Fork on 14th April. What do you think about that?,1617891470,0,1
mmsq4a,shazow,How does DeFi yield? And how it's different from traditional finance,1617891280,0,1
mmsnad,Ownmybets,Get your STC before the fork begins on the 14th. This will be directly on the ETH block after it finishes!,1617891059,0,1
mmsdf4,AllThingsDefi,Is Ethereum Better Than Bitcoin?,1617890265,0,1
mmscsw,Acebo_314,Family Rules,1617890210,0,1
mmsau7,kate2mc,50+ Materials About NFT Everyone Should Check Out,1617890037,0,1
mms5io,DappRadar,5 Reasons Why Developing on Ethereum is Still a Good Idea,1617889601,9,1
mms04w,xiwebat,"This dApp casino is offering a $2,000 $ETH reward for the top 50 leaderboards. It was recently rated as the Best Gambling Dapp in the 2021 Blockchain Casino Awards. It offers 5 games (such as BlackJack that has a house edge of 0.5%) and a massive jackpot of over $260K with low minimum bets.",1617889171,0,1
mmrvxx,PRJVG-,higher gas fees for less gwei ?,1617888797,0,1
mmruyy,pepae,Shutter Alpha Released on the Testnet! #MEV,1617888710,0,1
mmrm3a,cryptodenise,ETH and gas,1617887948,0,1
mmrkuj,cryptodenise,Price V Gas,1617887845,0,1
mmr6ys,CoinjoyAssistant,Ethereum layer 2 solution Polygon leaps into trillion-dollar insurance industry,1617886631,0,1
mmr6m2,bramptonsouthexposed,[28%] of the wallets interacting with [MakerDAO] also interacted with [Compound],1617886598,0,1
mmr5zs,monkeycheese7,Impermanent Loss XYK Equation,1617886537,0,1
mmr5lf,fjl,Geth v1.10.2 - Kepler Verge - is released,1617886499,8,1
mmqx7c,ben_efx,Now is the best time to cross the bridge to L2-Ethereum!,1617885720,14,1
mmqs9t,behradkhodayar,An ethereum domain for sale,1617885232,0,1
mmqnxw,ultimatefighting,Billionaire Mark Cuban Unveils Why ETH Will Surpass BTC - CoinQuora,1617884806,0,1
mmqhqw,Trojen-horse,berlin,1617884177,2,1
mmqgdu,JimnyJones,🚨New Listing Alert🚨,1617884039,0,1
mmqa7h,monkeycheese7,Impermanent loss XYK Calculation,1617883444,0,1
mmq5xs,Kenley_Dylan,VAR Finance is the next moonshot we are pumping this week.,1617883040,4,1
mmq2x3,81bain,Bep 20 address,1617882734,0,1
mmq11v,UnstoppableWeb,How ETH 2.0 will help with scaling,1617882540,121,1
mmpv7r,itsblockchain,INX- The First-Ever SEC Registered Token Sale is happening on ethereum blockchain,1617881913,0,1
mmpsjf,usingvinko,Merchant Token ICO Going Fast - Phase 33 of 100 now 😱,1617881609,1,1
mmpp6h,Barry_ETH,Wanchain fully compatible with Ethereum...,1617881230,0,1
mmpj5s,A117Z,Can you easily amend smart contracts on ETH?,1617880562,5,1
mmp8gf,A117Z,Is there a way to amend smart contracts easily on ETH?,1617879357,0,1
mmp4oq,usingvinko,Merchant Token ICO Going Fast - Phase 33 of 100 now 😱,1617878947,1,1
mmoydn,coinmonks,Web3.py: From Ganache to Infura,1617878219,1,1
mmowm0,SoheilPakpour,Simple Moving Average vs. Exponential Moving Average,1617878013,1,1
mmongv,Aitioo,ETH transaction pending time... (currently 19hrs),1617876897,0,1
mmom0p,ShouldHaveBoughtGME,Who remember this classic?,1617876717,1,1
mmol2i,jastonas,Next Block in 3 years in ethpool.org - Is this a problem?,1617876599,7,1
mmojiz,_r8man,Thoughts on waves coin,1617876406,0,1
mmogtr,GhostyOff,Merchant Token ICO Referral,1617876090,0,1
mmogl9,ECBYart,Is it worth investing?,1617876058,0,1
mmoghr,ben_efx,"Enzyme Finance, Mona L Isa, &amp; DeversiFi Livestream Playback! 🎥",1617876047,0,1
mmo188,Tumorsito,Time locked reversible transactions?,1617874054,0,1
mmnt8m,alfhad91,BridgeOracleSystem,1617873024,0,1
mmnqic,hanyuqn,AI-generated people as NFT's on Ethereum,1617872654,3,1
mmnirj,colvis2,Citizen Finance,1617871650,0,1
mmn0bs,admin_default,NFT’s are the new ICO’s,1617869287,50,1
mk0ztm,Blockchain_Discovery,"My first nft coming soon. Original on canvas, painted myself in color, digitized it on my 1plus 6t in &amp; w. Eth,= my key to crypto financial independence",1617558286,0,1
mk0xf6,F2win,Yep,1617558071,0,1
mk0x5o,r3d3mpshun,Minted my first NFT on rarible!,1617558047,9,1
mk0v6l,Responsible-Public25,Will pay 10% to anyone who can help me get back my lost Eth.,1617557871,22,1
mk0tzr,TheForestPhoenix,"Dated Apr, 4th 2021",1617557773,0,1
mk0ml5,chousila,$SHIB token in ETH room. MOON?,1617557129,0,1
mk0gmn,readysetawesome,"Be First To Own ""Moldy Deuce""",1617556634,4,1
mk0401,memoryfailure,New to Mining: Question Regarding My First Rig,1617555584,0,1
mjzzhp,dv8silencer,"Caspian, an L2-Powered AMM",1617555178,0,1
mjznhr,Ribbit765,"Don't put all your eggs in one basket...be sure to diversify with BTC, ETH, DOGE and others. Happy Easter!",1617554134,0,1
mjzde2,debmo1234,Willing to Buy a bit higher priced NFT this time.,1617553256,1,1
mjz78c,unfuckingstoppable,Vitalik Buterin made a mistake with Ethereum | Nic Carter and Lex Fridman,1617552728,3,1
mjz4cc,jklepatch,"How to do an NFT Flashloan? (Technical deep dive, Solidity, NodeJS)",1617552494,3,1
mjz4b4,cydbeefree,NFT marketing - sales strategies,1617552491,3,1
mjz26e,Khamiam,Questions about mining,1617552301,0,1
mjyvxz,Liberosist,Ethereum Scalability Race - April 2021 update,1617551775,22,3
mjynng,Tiny_Page_9421,Questions on market uses of Ethereum,1617551049,0,1
mjybxa,irfizzy344,Something worth reading in the Crypto industry.,1617550008,0,1
mjy4t0,theshadye,I find these coffeine predictions... Bullish? :),1617549380,0,1
mjxzdm,thenickb,What are your thoughts on PoS comparead to PoSt?,1617548897,3,1
mjxvee,PutinPoops,HELP! Transferring ETH from another chain,1617548550,0,1
mjxt4f,AlwaysGoingBananas,ERC-20 Transfer,1617548362,0,1
mjxojt,binaryfor,"In Console 47 we got an interview with Mark Henderson, one of the core contributors to OrbitDB! I thought /r/ethereum might be interested in checking it out!",1617547944,0,1
mjxj6u,-EzW,How to DAO?,1617547458,0,1
mjxe87,wesleysdad,I want to start mining Ethereum but have no idea where to start.,1617546988,0,1
