id,author,title,created_utc,num_comments,score
mqizic,coinmonks,Ethereum Billboard — Birth of Forevertising,1618373725,0,1
mqixkb,jesa_al,Well deserved celebration. 🚀🚀👏👏,1618373500,0,1
mqir3y,Zero8Crypto,#bullish,1618372773,0,1
mw3v3c,Mandyzz03,Is it too late to buy etheream now?,1619095317,0,1
mw3ov9,Adorable_Acadia_3178,Thinking about buying Ethereum,1619094691,0,1
mw3oij,jctripwire,First time buyer,1619094654,0,1
mw3o41,jctripwire,First time buyer,1619094615,0,1
mw3j0x,Benutzer2019,NOOB QUESTION - HELP: Withdrawing ETH from Kraken to Binance - how high will the gas fee be?,1619094107,0,1
mw3cxl,GoodN0se,Buying ETH with BTC a Taxable Event?,1619093511,121,1
mw3clu,_supremee,How to send from MyCrypto,1619093478,0,1
mw3c5i,brownsmithh,This Project has come to a successful journey.,1619093435,0,1
mw3ar0,brownsmithh,The best project ever.,1619093300,0,1
mw38fy,CoinjoyAssistant,ETHEREUM BIGGEST HIGH IN 2 years,1619093074,1,1
mw33sx,DynamicArrow,What makes Ethereum better than Bitcoin?,1619092645,0,1
mw32sc,poe-0077,Wait for a dip or go for it,1619092534,0,1
mw2zdg,Eleeo037,ETH Haters right now...,1619092172,1,1
mw2u9n,Stadl0r,New ERC-20 Token $PISS PISSCOIN now available for trade (Approved on Etherscan),1619091609,2,1
mw2tl3,bench4rench,"BTC, ETH, XRP, SXP, ZEC, UNI, LINK – Technical Analysis For April 22",1619091534,0,1
mw2sbn,mozilemozi,Whats gon be your target for this bullrun,1619091403,0,1
mw2pyj,rowger2020,"💥 Brace yourself, Razor Meme Contest is here 💥 It could not get easier! 10 days, 10 winners, $1000 Reward 🎈Check out our official telegram announcement channel for instructions 🥳",1619091142,0,1
mw2kc8,pragmat1c1,Creating own tokens,1619090520,9,1
mw2k8e,ALFAcashier,Why was there a drop in Ethereum nodes starting at 9th March?,1619090507,3,1
mw2gde,DarkestChaos,"Ethereum Is About To MELT Brains - Daily Cryptocurrency News LIVE: Bitcoin, Ethereum, &amp; Much More!",1619090090,0,1
mw2ezn,JeffreyETH,Switcheo TradeHub is a L2 DEX buit with Cosmos SDK. Mainnet live with soft launched futures. Stakers receive 37% apy!,1619089932,0,1
mw2cgi,adebeir,"What's your take on sleepminting? (the ERC721 ""hack"")",1619089638,10,1
mw2ax6,ArtificialLawyer100,LawtechUK Launches Crypto and Smart Contract Dispute Resolution Rules,1619089480,0,1
mw22tl,Hummusprince68,Question,1619088549,8,1
mw202u,Usukayat,Ethereum - Tree of Trust,1619088216,1,1
mw1zgb,crypto_pub,"Ether ETF Now Live, Gemini Founder Congratulates Asset Managers - CoinQuora",1619088142,0,1
mw1z5u,nackcollective,Accepting ETH!,1619088105,1,1
mw1vh1,barthib,US house passes bill to require financial regulators to set up digital assets working group,1619087658,0,1
mw1rkb,Annoying_Duck,Help with staking ethereum,1619087193,0,1
mw1q6t,Szalon,How can he check the amount of sending price of token without having it ? Can I estimate it?,1619087025,0,1
mw1l5c,Dougpolkcrypto166k,I am Doug Polk Crypto an ICO Reviewer and Cryptocurrency analyst and supporter.,1619086438,0,1
mw12tg,Unusual-Condition441,Good time for Eth,1619084174,0,1
mw100t,juked1s,"Hello. I have some 1st first blood coins/tokens in one of my wallets from awhile back. I noticed it hit a high yesterday and I want to sell them. Only I live in US NY, I do have a vpn, but they all seem to want verification. Anyone know a site to exchange to a different crypto without verification",1619083797,3,1
mw0ve9,alphabravo31,Wallet,1619083150,2,1
mw0v4m,TrendingBot,/r/ethereum hit 800k subscribers yesterday,1619083113,51,1
mw0t9e,ligi,Custom Errors in Solidity,1619082848,1,1
mw0rxl,bcmdev,Binance Coin Minter - BSC chain,1619082664,0,1
mw0rdw,gwapa_ko1999,Introducing MetisDao - helping people create their own decentralized business on the blockchain using their layer 2 infrastructure.,1619082591,0,1
mw0mju,1byte1,Quick question,1619081925,0,1
mw0lno,j123456t,Cheapest Way to Buy Eth?,1619081785,0,1
mw0i8p,0xBrian,How strong is 0xMonero's privacy?,1619081266,0,1
mw0hio,cn1dappstar,"My personal thoughts on new dapp: FARSITE (MoonCryptoPolis), powered on Ethereum 2!!!",1619081165,0,1
mw0hfv,YllFigureItOut,Which crowdsourcing dapp is mature enough to be used right now?,1619081155,4,1
mw0g84,Fn_Alt_Gr,Introducing MetisDao - helping people create their own decentralized business on the blockchain using their layer 2 infrastructure.,1619080973,0,1
mw0cgh,Apprehensive-Steak17,NFT Affiliate Programs,1619080439,0,1
mw09iy,socialenzymtoken,ENZYM - A Real Life Social Booster,1619080032,0,1
mw03kl,AbhijitVinayak,Lol is this a glitch? I even reloaded many times,1619079192,3,1
mvzvri,Morgentau7,Ether and Maker explained to a newbie,1619078073,0,1
mvzq0v,maragann,"☀️ just bought my first ETH, super excited 🌟",1619077248,63,1
mvzlin,Due_Product1757,importing a 24-word seed phrase from electrum to myetherwallet or vice versa ( what would happen?)(hypothetical question),1619076610,0,1
mvzlbj,PresentThen6990,Don't know how to fund my coinbase account. Can you teach me how?,1619076583,0,1
mvzhyg,GiveMeTheGoods-,How do I get the most out of my Ethereum?,1619076104,82,1
mvzgkg,MariusRadzevicius,"Tired of Bitcoin's Fees? Kindly Switch to Nano, and enjoy ZERO fees",1619075916,0,1
mvzb0d,yhood,$MINI miniswap ethereum erc20 looks ripe for a rip,1619075145,0,1
mvz7sc,DoichDogma,DoichKill's account,1619074732,0,1
mvz3sd,gnojjong,Farsite - DeFi Powered Ethereum 2 Game,1619074191,0,1
mvytbs,mikener1,SELLING QUESTION,1619072789,0,1
mvyi7i,ChaldeanAssyrian,"I caught early signs of Ether’s price rallies happening independent of Bitcoin rallies, so I rebalanced 86% of my portfolio into ETH in the last 45 days. I’ll change that in the year never🏆WEB 3.0🏆dApps🏆DEFI🏆Smart Contracts🏆+everything Bitcoin can do. Bitcoin/Ethereum in 2 Simple Daily Charts👇",1619071331,1,1
mvyggi,Choice-Group-5322,Ethereum ATH without BTC right now,1619071112,1,1
mvy884,yeahnoworriesmate,"Bitcoin to sats, do we have an equivalent for Ethereum?",1619070037,0,1
mvy6p7,Choice-Group-5322,3000$ for next btc pump,1619069846,3,1
mvxzse,chasedenson,Layer 2 vs Sidechain?,1619068971,0,1
mvxpad,MichaelTen,"When Ethereum becomes Proof of Stake, will transactions fees be near a fifth to a half a penny of a fiat US dollar?",1619067674,0,1
mvxnmf,MadalinCristea,ETH airdrop,1619067471,0,1
mvxndy,MichaelTen,Bitcoin Cash has Cash Fusion. Monero has privacy by design. Can Ethereum transactions be private? Is there some smart contract or method for this?,1619067440,0,1
mvxghx,fishtickhs,Enough said 💨,1619066569,2,1
mvxag6,OpenZeppelinTeam,"OpenZeppelin Contracts has over 10,000 stargazers. ⭐",1619065839,0,1
mvx2je,Sad_Moment_7558,ETH Price targets,1619064920,0,1
mvwzzj,KrakerzTheNoob,Staking my ethereum,1619064639,0,1
mvwsgp,NemoHoez00,Eth newb a question,1619063810,0,1
mvwldf,RangingBull33,where is ETH/BTC at by May 31st ?,1619063039,1,1
mvwenu,edlars-sbe,What to do with just 50$ in ethereum?,1619062332,0,1
mvvxyl,_BrianScott_,Crypto Analysis - Bitcoin $BTCUSD &amp; Ethereum $ETHUSD,1619060614,2,1
mvvvbl,carloscancab,Reports That Bitcoin Creator is an International Drug and Arms Dealer Resurface,1619060357,0,1
mvvodb,Chris_Zotos21,Ethereum Block,1619059655,0,1
mvvmwz,Chris_Zotos21,Ether block,1619059506,0,1
mvvjts,cooperbaerseth,Bitinfocharts source,1619059211,1,1
mvvbph,QueasyQuack,Does amount of ETH transfer effect gas price or transaction price?,1619058378,3,1
mvvbgm,bourgDOTeth,Hiring Backend Solidity Dev,1619058351,0,1
mvv0wq,cerynd,ETH newbie,1619057300,0,1
mvutjm,MiPaDo,Your ETH based NFT values wouldn't be dropping like a rock if they were as transferable as the ones on EOSIS.,1619056577,2,1
mvuprw,shaoping,Ethereum is scaling by raising the gas limit from 12.5 million to 15 million,1619056202,89,1
mvunnw,Baconlawlz,"Has anyone tried avoiding fees by selling ETH for a coin like DGB, XRP, etcetera and transferring for quick payment?",1619055989,7,1
mvum6t,r0mpaStompa888,Nexo credit line vs capital gains tax,1619055846,0,1
mvul58,Inside_Ability7916,Mine Ethereum With Telegram,1619055737,0,1
mvukmj,gummadu,Going 80% savings on ETH !,1619055682,71,1
mvuffr,ddoublea96,"Help, can’t transfer eth to Coinbase?",1619055197,0,1
mvuabd,fabinhop,Up or down?,1619054661,1,1
mvu9ml,kanywkicudj,Ethereum fees?,1619054591,0,1
mvu6i7,obsd92107,vitalik buterin devours salad,1619054283,0,1
mvu39l,PutinPoops,UnFUD me. I am nervous about what these gas fees will do to Ethereum.,1619053964,0,1
mvu2ny,g0nzales,Any safe place to park my ETH with minimal risk at &gt;15% APY?,1619053902,0,1
mvu0is,abbyr12346,Phone Giant Deutsche Telekom Invests in Celo's Crypto Network,1619053691,0,1
mvtury,ynotplay,ENS domain renewal help. Are there L2 solutions such as Zksync to renew ENS names?,1619053123,5,1
mvtu8o,JXIX00,Is ETC still worth it to buy?,1619053067,0,1
mvtobb,brk0211,Trade Ethereum at 0 gas fees on MoonSwap,1619052485,0,1
mvtilt,WuiiHuii,"OKAY, I’m so done here 🤦‍♂️",1619051932,0,1
mvt0cw,cryptolicom1,"From Coinbase to Metamask, but where's the ETH???",1619050174,0,1
mvstjp,mrmarijuano,"$ANKR is where you should be staking your ETH, also grab you a big of ANKR and let’s employ this strategy below",1619049535,5,1
mvsrzn,Silver_Vermicelli876,Swapping BNB smart chain for Ethereum,1619049377,0,1
mtylb7,Coin_Star_Codex,Ethereum argument with professor about fat protocol theory.,1618831819,0,1
mtyijk,Shatter_Hand,Ethereum argument with professor about fat protocol theory. Please weigh in:,1618831509,0,1
mtxy32,Away-Entertainer-196,ETH price can be $40k+ if just 1% of centralised financial services moves to DeFi!,1618829199,0,1
mtxxic,sasha_q,"Ethereum inspired stellar crystals painted on wall, 2015",1618829126,0,1
mtxvxr,abcoathup,Crypto Trends 19 April 2021 🇩🇪 Berlin Upgrade consensus error 🤖 Flashbots and gas prices 🌲 Blocknative Simulation Platform + Collaborative art during Berlin viewing party,1618828943,4,1
mtxonn,EOE97,Once EIP1559 gets implemented would block rewards end?,1618828052,0,1
mtxndp,IsidorHS,I am a student attempting to write an ETH miner.,1618827901,0,1
mtxjxv,coinmonks,"Staking , everything you need to know Part 2: Ethereum staking",1618827499,0,1
mtxdop,arslanbajwa,DEUS Finance,1618826756,0,1
mtxd2x,Shatter_Hand,Argument with professor about fat protocol thesis. Please weigh-in.,1618826684,0,1
mtx0lx,Shatter_Hand,Argument with professor about “fat protocol thesis”. Please weigh-in:,1618825091,0,1
mtw84k,Few-Restaurant7897,$20 eth reward for help with wallet,1618821327,0,1
mtw2t2,Etaheltsohg,Converted to Ethereum,1618820614,0,1
mtvq1v,taw3890,"""Day 2 of withdrawing my ETH from HitBTC"" presents: hopefully a short series of posts about withdrawing funds from HitBTC.",1618818809,0,1
mtvq12,Chuhc,Transaction dropped but still queued,1618818806,0,1
mtvly8,L4Y3RTHR33,Buy anonymous,1618818185,0,1
mtvey5,flyngdream,Thoughts on using NFTs to trade physical goods (long post),1618817215,0,1
mtv5kx,yesitsmeandy,Help a guy in need,1618815957,0,1
mtv2vw,whattItDo00BOOBoo,Where is the NFT what is it?,1618815615,0,1
mtuxmg,KarinHernandez,You Can Now Earn Ethereum 2.0 Staking Rewards on Coinbase,1618814908,0,1
mtutsp,the_real_slim_,Told my Dogecoin profitt and put it all on Ethereum!,1618814418,0,1
mtubcy,momen9a7med,C,1618812055,0,1
mtu8mj,Baron_Brazz,How to read smart contract,1618811717,0,1
mtu86t,Metamine90,Added two more 3070 rtx. Total 360mh/s,1618811661,0,1
mttzd6,The-Crypto-Portal,What is Ethereum? A beginner's guide.,1618810566,0,1
mttz11,The-Crypto-Portal,"Vitalik Buterin Says Ethereum Will Scale to 100,000 Transactions Per Second (TPS)",1618810520,0,1
mttxgc,The-Crypto-Portal,A review of the Ethereum White Paper (Ethereum Explained),1618810323,0,1
mttwxk,crypto_pub,Canada Approves Three Ethereum ETFs Filed by Three Firms - CoinQuora,1618810255,0,1
mttupw,attredies,Cheapest way to be eth-chain coins?,1618809989,7,1
mttr7b,Liberosist,"Scalability Race - Update 2, Late April 2021",1618809556,18,1
mttcyp,coinmonks,"New Decentralised Finance Stacks, Alternatives to Ethereum",1618807872,0,1
mttb98,Kohlbey,How high do yall think etherium will go and why?,1618807671,0,1
mtt9o8,superrichin1week,Why my posts are not displayed ?,1618807479,0,1
mtt9ny,SaidNeder9,Appreciation post for u/kevg77 who gifted me 0.021 ETH!,1618807479,0,1
mtt88s,coinmonks,Blockchain development Quick Starter Guide for Software Developers,1618807308,0,1
mtt7l3,superrichin1week,Looking for best place to buy ETH with BTC without KYC,1618807230,0,1
mtsroj,fucktysonfoods,Ethereum 2.0 and my $80,1618805398,18,1
mtsnes,c-i-s-c-o,What's the latest ETA for POS merge and where can I stay updated on it?,1618804922,3,1
mtslu9,Glad-Line4221,How to buy VET,1618804779,0,1
mtrsr7,razboy95,Proof of Work vs Proof of Stake,1618801669,0,1
mtqzrg,Puzzleheaded-Job9031,How to Mine Ethereum | 2021 Guide,1618798661,0,1
mtqjn6,Moofy73,"$10 fees just sending around ethereum, getting too crazy! Not worth buying an NFT at this point unless you're planning to spend $100 and willing to lose 30% in fees and around $100 fee for a swap 🤯 eventually we'll get better but wow",1618797039,0,1
mtq6qt,GoblinGuide93,What’s one of the best apps to trade crypto that’s not robinhood?,1618795706,29,1
mtq5my,Old-Anomaly,Hbar investment option,1618795596,8,1
mtpxpq,hiiighedup,"In a survey of 108 Coinbase employees, the majority voted that they are most interested in investing in Ethereum over other types of cryptocurrency",1618794791,0,1
mtpp89,Practical_Swan8515,I love this,1618793953,0,1
mtpo6d,BitcoinCashRules,"Vitalik: ""[after Berlin] now that the chain is safer, we can increase the gas limit, which makes every application [fees] cheaper."" So, should we do it? Are we ready to lower the fees and make ETH live up to its true potential?",1618793848,0,1
mtpee2,zuko7891,Rate my gaming pc mining setup. RTX 3080.,1618792869,0,1
mtpcqf,Jimbeam5150,Which is more secure leaving ETH on ledger or Online wallet? Thanks,1618792705,6,1
mtpan6,TheArabCanadian,I made it to the 1 ETH club !,1618792503,0,1
mtp8km,yea_okay_dude,Will Eth 2 have gas fees?,1618792290,0,1
mtot8a,GEM1N1_,Join Coinbase Bitcoin Futures 🔥🔥,1618790768,0,1
mtonfw,Aboringcanadian,Purchasing Eth in Canada,1618790213,30,1
mtohiu,pf_bangs_303,Bitcoin is implementing ERC-1559!!!,1618789628,0,1
mtofpi,zach4499,"Need a place to buy ether that can put into separate wallet with no wait, like wyre on metamask.",1618789448,0,1
mtobc0,Sinner-190,Question about multiple transactions,1618789024,0,1
mtnva3,hardcore-self-help,3 major flaws with current NFTs,1618787536,0,1
mtnmvr,cd301f7f91adcc1df69f,Less than 12 words? Wallets from 6+ years ago,1618786759,0,1
mtnfjx,robertmartin,Logo Epiphany,1618786080,0,1
mtnf3d,[deleted],Logo Epiphany,1618786038,0,1
mtnds1,obsd92107,Is it worthwhile to get into LOOM?,1618785910,8,1
mtmz6l,NelsonQuant667,Ethereum/DeFi/web3/blockchain development/solidity meetups in/around Los Angeles???,1618784587,0,1
mtmctg,IvanBliminse48,Purchasing Fees on crypto,1618782640,0,1
mtljhi,Joeymoey123,Should I buy ethereum now?,1618780095,0,1
mtlbce,Signal-Scout,"Are gas fees actually higher, post upgrade?",1618779422,0,1
mtl5qb,dead4586,Are nfts forever? For example let’s say I’m naked in an nft?,1618778940,0,1
mtkphu,Crypto_Doge,Expensive ETH gas,1618777543,0,1
mtkpf3,Soft_Spread97,Made it!!,1618777537,0,1
mtkpe6,AllievatedHunger,Is there anything I can do about a transcation,1618777534,0,1
mtkmdg,Gorrila_Doldos,Why is it that people create tokens on eth?,1618777278,0,1
mtklow,zaboleqqq,Formula for calculation ethereum profit?,1618777221,3,1
mtkhie,Freedom-Phoenix,"Vitalik: ""[after Berlin] now that the chain is safer, we can increase the gas limit, which makes every application [fees] cheaper."" So, should we do it? Are we ready to lower the fees and make ETH live up to its true potential?",1618776856,275,1
mtkf9v,king_of_the_noodles,Best and cheapest way to buy ETH and transfer to my Ledger,1618776657,0,1
mtkds9,Nylnn,Ethereum 2.0,1618776529,0,1
mtk6zq,maruchanr,"We are dCanvas, and we bought a CryptoPunk to give away for free",1618775951,18,1
mtk1a7,AyaxLBs,Blockchain Community on Discord!,1618775458,0,1
mtji8y,Audio_guy101,Problems buying from Canada,1618773830,0,1
mtiwkn,kaoskoder,Why is ETC price going up?,1618772009,0,1
mtivuk,GlubSki,Need help with binance bridge,1618771947,3,1
mtirk8,daxyio,Contract deployment gets reverted?,1618771581,0,1
mtiq1g,daxyio,Contract deployment gets reverted,1618771448,0,1
mtilom,handsofmoore,Ethereum - 3 halvings in 12 months?,1618771070,0,1
mtifsu,julesgou,Generative art to the Defi,1618770562,0,1
mthnpl,ActualSalary5,[Question] Boardgame on the blockchain,1618768191,6,1
mthmtp,spinningpotat0,My L2 NFT on Matic - dogecolors,1618768117,0,1
mthax8,EnergyEmergence,LF Help Understanding the Security &amp; Other Dilemmas Facing Layer-2/Sidechain Solutions,1618767088,0,1
mthaeg,Ribbit765,Bought the dip!,1618767037,1,1
mth7tg,Qontrol1138,Transferring to a USCD Supported Ethereum Wallet?,1618766812,0,1
mtgw2j,bhInstaller198,Join ETHRUN.io,1618765810,0,1
mtgjya,Dry-Peace7576,The most profitable Crypto Mining on the market! Huge discounts!,1618764760,0,1
mtgghg,Astasismusic,"""Words"" - an exploration of censorship by A•STASIS (NFT available on rarible)",1618764453,0,1
mtgfvg,stanmilc,"To be ready for Crypto corrections when ""Bitcoin plunges to levels not seen since last month"" start using the right tool predictive AI trend indicator CryptoDivine.ai by DigiMax Global (OTC: #DBKSF, CSE: #DIGI ),deep-learning AI that predicts price movements in #BTC and #ETH",1618764401,0,1
mtgb6b,WilburBerry859,ethtrader,1618763978,0,1
mtgabr,Imjustghosting198,Cheapest way to withdraw from Coinbase,1618763901,0,1
mtg9ps,mrsotkogaming,Bitcoin Flash Crashed - Here's Why,1618763846,0,1
mtg3wj,Coinquora_,Canada Approves Three Ethereum ETFs Filed by Three Firms - CoinQuora,1618763333,0,1
mtg292,Ijizz4mephisto,New to ether and have a question,1618763189,7,1
mtft0t,JermBrid,Me seeing the Ethereum discount price 📈,1618762389,0,1
mtfq23,Willywonkaatemyass,Ethereum with blockchain,1618762120,0,1
mtfmqs,SolorMining,Bitmain hints at hash rate specification of upcoming Ethereum ASIC miner,1618761825,0,1
mwy3vd,FTejeda1096,My first .5 ETH,1619192508,0,1
mwxx3o,Self_Aware_Eggplant,"I just turned 18, my dad is giving me 0.5 ETH. I'm so excited!",1619191982,0,1
mwxwag,One-Bowl-2512,NETWORK FEE,1619191919,0,1
mwxrg8,Mpat011,Help i just got hacked,1619191555,0,1
mwxo7h,majestic_12inch,"BTC vet, ETH noob here, maybe someone here can help me with a technique to sign a message with my keys, to prove ownership of my ETH account",1619191313,2,1
mwxo5q,zerohalo,Razor Network Partners with Litentry to Support Multi-chain Decentralized Identity Aggregation,1619191309,0,1
mwxnwj,[deleted],three websites to earn some free crypto,1619191289,0,1
mwxdnc,xiaoming1,"noob question, why is eth transaction fee so high if it is even considered high(on roobet)?",1619190504,0,1
mwx8w9,Wet-Monies,Dogecoin is Destroying the Entire Cryptocurrency Market,1619190158,0,1
mwx4lz,icebong424,I own 1 eth!,1619189843,0,1
mwx0ye,Bigkitty9000,Seeking Knowledge,1619189554,0,1
mwwyzx,Academic-Signature37,April 2021: Where can I buy ETH with LOWEST fee and in NY State while using a Bank transfer?,1619189401,17,1
mwwyse,ligi,"Poll: Extend the Price discussion rule to allow mods to delete ""I brought/own XX ETH""",1619189385,39,1
mwwy4w,hmd758,#BurstMoney #DeFi #BSC #Binancesmartchain #cyptowallet #YieldFarming #BSCFarming,1619189335,0,1
mwwulr,Freedom-Phoenix,"Gas fees are going down following the gas limit raise despite increased volatility, well done Ethereum! Looking forward for more in the near future when possible, go ETH!",1619189078,36,1
mwwtbn,Almighty_Tony,I find it kinda FUNNY 🥂,1619188982,0,1
mwwgjh,ligi,A Test of zkSync 1.0’s Exodus Mode on Ropsten,1619187986,2,1
mww4n8,sassal,Introducing The Daily Gwei,1619187051,4,2
mww3t2,Extra-Raspberry3528,"Don't worry everyone, corrections are normal :) Heres' something to get your mind towards the future: Ethereum Blockchain based Betting! (Aggle.io)",1619186982,0,1
mww18e,godforgotus,How much do you guys believe 0.3 ETH will be worth in a couple years ?,1619186763,1,1
mwvzav,hmd758,#citizen_finance #blockchain #nft4ART #nft4FPS #bitcoin #nft4XR #crypto #ethereum,1619186616,0,1
mwvww0,tra1lblaz3r,New to ether....,1619186424,2,1
mwvweb,Harmosh,Buy and sell in exchange or just convert?,1619186401,0,1
mwvhnt,Bitcoin4dmies,What is either STAKING ? They give you 6% for staking ! Yes or No ?,1619185201,0,1
mwvga5,Waggy1936,Gary Vee and his team told me to buy ETH.,1619185083,0,1
mwvb9m,stanmilc,"New York’s H.C Wainwright to host Cryptocurrency, Blockchain and Fintech Conference!!",1619184666,0,1
mwvb84,valholo,Ethereum will overtake Bitcoin,1619184663,0,1
mwvawr,GayMoneyBoy,Has anyone seen or created a smart contract method of consolidating 32 ETH with a friend and then depositing onto the beacon launchpad?,1619184635,0,1
mwv1f9,otarazan,Do you guys interested in developing distributed applications on Ethereum as well?,1619183833,0,1
mwuvcq,Aurura,What just happened,1619183305,1,1
mwura8,MisterDollahSignz,Bought the Dip my first ETH,1619182943,10,1
mwun84,emiliodelacroix,Happened this morning,1619182613,0,1
mwumdy,_ZarkMuckerberg_,‘Legends of Crypto’ - NEW Top Trumps Style NFT Collecting Game,1619182538,0,1
mwui6q,jfms44,Is ETH going any lower?,1619182157,7,1
mwug78,ligi,"Crypto Exchange Goes Dark: Near 400,000 Users Fear Possible $2B Fraud",1619181970,12,1
mwue4l,Unhappy-Salamander92,Sold my Doge and bought 1 ETH,1619181773,630,1
mwu8t4,Nimarixos,chek this out guys my new nft just 200$ but i promis its 1 million Dollor $ worth!,1619181280,1,1
mwu6zz,noquarter1000,Sorry about the flash crash,1619181113,1,1
mwu5jc,Nimarixos,https://mintable.app/art/item/Dividing-Universe-Dividing-Universe/P8p_4yevHlRzxrn,1619180973,1,1
mwu0qr,Nimarixos,https://mintable.app/art/item/Blackhole-Kid-Blackhole-Kid/n0osRm-FiSWkiQh,1619180520,0,1
mwtz91,Gatomoosio,Buying other coins?,1619180382,19,1
mwtz0s,JoelOnCrypto,"Bitcoin is +70% this year, I am +525% this year",1619180358,2,1
mwtvx7,Careymatee,Arteon,1619180053,1,1
mwtfgk,godgbb,"Ethereum PoS, why they want few trusted miners than more miners?",1619178420,0,1
mwtbi8,bench4rench,"NO CRYPTO FOR YOU! - Countries Who have Banned Cryptocurrencies, Here’s Why",1619178011,0,1
mwshsk,EVERWILDOUTDOORS,Could Ethereum overtake Bitcoin as the world’s leading cryptocurrency?,1619174698,0,1
mwsbva,i_m_shlok,ETH DROP!,1619174016,0,1
mwrzh3,Puzzleheaded_Ad_290,Holochain,1619172555,0,1
mwryab,quit_daedalus,"""MetaMask and Infura are unavailable in certain jurisdictions due to compliance with laws."" Are there any good metamask alternatives?",1619172412,0,1
mwrxe5,arslanbajwa,Blockchain protect personal privacy,1619172304,0,1
mwrqpp,shaoping,Estimated Cost of Transactions,1619171478,9,1
mwrq8d,shyakaster2020,Much Needed Mindfulness During This Dip,1619171416,0,1
mwrq69,dapp_com,Top Dapps by 7d Volume: 3 Ethereum projects,1619171409,2,1
mwrokc,sideshiftai,// Giveaway // - Evolution of AI NFT Drop by SideShift,1619171205,1,1
mwr30d,kavicaa,Is there any way I can support ethereum that isn't mining or buying it?,1619168451,0,1
mwqxwt,taniamanco,How to get insane in 1 minute,1619167784,0,1
mwqu1g,TRAcademy,"Ethereum Technical Analysis for April 23, 2021 - ETH",1619167287,0,1
mwqmib,tonz999,Ethereum 2.0 and mining,1619166319,0,1
mwqgbh,girlymoon98,Possibly new market for NFTs and for artists in general?New option for artist to sell their games? Selling whole games as NFTs?,1619165512,0,1
mwqfqs,flufyduky,Almost at 1 ETH!,1619165433,0,1
mwqbj1,ymphaidien,Is this the right time to buy Ethereum or should I wait for some more time?,1619164894,1,1
mwq9go,TimDaub,Can Sleepminting Ruin NFT Provenance?,1619164641,18,1
mwpyko,Affectionate-Fan2694,2017 Market is not comparable to 2021 Market,1619163210,0,1
mwpxq8,GROGOR_,Transaction status,1619163110,0,1
mwpx3g,GROGOR_,"BscScan has record, Etherscan.io does not. Anyone know why?",1619163026,0,1
mwpwl8,IamAFlaw,Safe way to earn interest on my Eth,1619162966,0,1
mwpw9m,Blockchain_Discovery,Hold tight everyone,1619162922,0,1
mwpw00,lambauto,Take advantage of the discount!,1619162889,0,1
mwpvmp,GROGOR_,"Help Please, anyone else have ETH vanish on transfer?",1619162842,0,1
mwpoi7,German_Georg,Question regarding how PoS algorithm select a new validator? (Problem: rich getting richer?),1619161959,0,1
mwpnbr,Traditional_Cattle87,New to crypto Can anyone explain,1619161814,0,1
mwpl1p,dapp_com,"Top30 Gambling Dapps Eco by 30d Volume 🥇 Ethereum $286.55M, top2: dice2win $264.50M Decentral Games (Ethereum) $21.85M 🥈 Matic Network $25.92M 🥉 TRON $21.50M 🔥 Block.one, Thundercore TT, Binance Smart Chain, ICON, WAX.io",1619161523,1,1
mwpgs1,Ok_Calligrapher_6889,🚨🚨🚨🚨🚨🚨🚨🚨🚨🚨,1619161015,0,1
mwpfqg,t_todua,Is it possible to speed up my friend's transaction?,1619160880,0,1
mwpct8,XXVII-Delight,ETH holding stronger than most,1619160517,2,1
mwpbiw,Ituglobal,Ethereum (ETH) Price Analysis: Ether Retraces But Stuck Below $2.360 Resistance,1619160348,0,1
mwpb9h,KI2Ds,"Spent $1,000 on ETC",1619160311,0,1
mwp918,coinmonks,DAOs Are The Next Best Thing,1619160046,0,1
mwp7i6,Uattanciu,On the high GAS fees,1619159853,13,1
mwp3u2,coinmonks,"Writing, Compiling, Deploying Solidity 2021.",1619159410,1,1
mwp3me,coinmonks,Solidity Tutorials – Coinmonks – Medium,1619159388,0,1
mwp1gp,Active_Ad_8273,Update on P2P-DeFi Platform,1619159116,0,1
mwoyye,ImAFlyingPancake,Solidity-IDE: looking for maintainers,1619158810,5,1
mwoyth,Anu_Rag9704,"Just purchased by first ETH, 0.05263157 !!! Hope it pays well",1619158792,0,1
mwoxt6,zimicas,Most user-experience friendly way to store and use crypto?,1619158665,3,1
mwotlb,No-Knee-4576,Inspiration coins held,1619158174,0,1
mwoke4,thegreathand,Just bought my first .4 ETH!,1619157130,69,1
