id,author,title,created_utc,num_comments,score
mldjg3,flexpool,Ethereum miners are padding profits with transaction ordering (MEV),1617721038,0,1
mld9x8,ddolan1289,Staking 2.0 ETH,1617720294,0,1
mlckzl,Silver_Mousse3121,Ethereum Gold Project ETGP,1617718380,0,1
mlbxqf,jaspassi,"De-Fi : What’s working, what’s broken.",1617716542,2,1
mlbtke,MTcrypts,Whats best thing to do with ETH in MEW to avoid huge transaction fee's,1617716195,0,1
mlbas4,hstabley,Tricky situation could use some advice,1617714617,31,1
mlavsj,Longjumping-Rich-900,Ethereum to $3000 Soon...,1617713371,1,1
mlav7x,Michaldeals,How do I invest to generate passive income and retire early?,1617713319,0,1
mlav3u,CookiePsychological1,To traders that are having a hard time in this market,1617713309,0,1
mlapob,Daniel9935,Okay here me out I'm after a new investment and a reason why so please comment why and vote,1617712815,7,1
mlapk1,jackraddit,Beginner-friendly guide on how to get started with cryptocurrency,1617712804,0,1
mlao19,LBG-13Sudowoodo,NFT para chavos - Getting started with NFT in Spanish,1617712662,0,1
mlagb4,itsblockchain,Introducing Sigmadex: Bringing financial stability into digital assets,1617711954,0,1
mlabti,CompassNeedle,Moving Fiat -&gt; L2 directly?,1617711541,0,1
mla9n1,poopybottom_123,Metmask gas price too low?,1617711331,5,1
mla5hv,cornflow,Are NFT used for money laundering?,1617710941,1,1
ml9zfc,bryantdev,Nightmare,1617710411,0,1
ml9ytk,yakisugi36,😷😎🔥! Price Drop now starting at .02! Auction ending tomorrow at 1:00 EST. Get one now before they are gone! 😷😎🔥! https://opensea.io/collection/covid19s,1617710359,1,1
ml9y9r,YouTube_Ideas,"So let me get this straight: I had to pay $20 for a transaction that then says ""failed"" the next day, AND I don't get the money back. This coin will never go anywhere.",1617710305,0,1
ml9fnx,itsmepoopy,Free NFTs!,1617708400,0,1
ml8zx0,slickcrypto_90,"How do you cash out $750,000 worth of bitcoin? 📷",1617706718,1,1
ml8y47,Coinquora_,"Top 5 Crypto Price Analysis: BTC, ETH, BNB, DOT, and ADA (March 29 - April 4)",1617706501,0,1
ml8vg3,SoheilPakpour,Buy The Dip With The Help Of Fibonacci Retracements.,1617706182,1,1
ml8p2u,toxzl2,$BTCS small US company has Charlie Lee as Independent Director,1617705430,0,1
ml8l8f,ctoLarsson,This video helped me with my obsession over daily ETH price,1617704970,1,1
ml8l73,potcasso,Will Uniswap v3 compete with Curve ?,1617704964,2,1
ml8j6v,xiwebat,Reviewing a renowned dApp within the crypto ecosphere and how it could leave its mark on the blockchain industry,1617704717,0,1
ml8fyt,JayAbel156,Cryptocurrency,1617704340,0,1
ml86te,rowger2020,Everyone🌍 Need $RAZOR @Razor_Network In Order To Secure Networks. Project With Real Use Cases Securing⚔ Bridge Between Real World And Virtual World.🚀🚀🚀 https://razor.network,1617703261,0,1
ml8465,Trina_L,ETH Price Analysis: A Major Breakout of $2500 is Coming,1617702958,1,1
ml7fq5,KaceyJaymes,Is Atomic screwing me somehow? 0.o,1617699929,0,1
ml6yxm,PepePaints,My last NFT video!,1617697689,0,1
ml6rps,Stingfisher,EtherLite - A Pure Proof-of-stake Hardfork of Ethereum Scheduled for 1May 2021,1617696755,0,1
ml6bn5,struggle_shuttle,Noob Jumping In (BOTH FEET),1617694756,29,1
ml5se6,acidsiefer,Website Where You Can Watch Videos &amp; Play Games For Money!,1617692492,0,1
ml5fed,ResponsibilityStock4,"1ETH Lost in the Ether. Help, Reward!",1617690962,0,1
ml5axc,Back4More08,Holy crap!!! Jack Dorsey’s EX GF just released an NFT and it looks absolutely enticing and fuuhhhreaking incredible!!! Is she trying to get back at him for something?!?,1617690446,0,1
ml5an4,zsakosbilbo,"Sminem, Harbinger of Green Candles slays The Bog - Sminem Sacred Artifacts | OpenSea",1617690414,0,1
ml58cf,shushukamasuy123,"The first quarterly burn has been completed! In total 3,084,247.29 $uDOOs were burned! Howdoo",1617690148,0,1
ml4hpk,KarinHernandez,Anthony Scaramucci Claims Ethereum Has Good Fundamentals And Will Grow,1617687080,0,1
ml47xd,NavinVethanayagam,All 67 March Madness games were recorded on Ethereum by The Associated Press! Congrats to Baylor on making history!,1617685971,0,1
ml45bf,pixie_wrangler_,"No official wallet? How do I open 2017 eth keystore? The official(?) website even says ""Wallets listed on this page are not official endorsements"" How does this make any sense? So there's no eth wallet? This feels like it turned into a scam.",1617685693,0,1
ml4273,Zot30,"This street art recently appeared in Melbourne, Australia.",1617685350,273,1
ml3oka,New-Leaf100,Vitalik Buterin,1617683915,1,1
ml3ers,mamunal93,Bridge Token (BRG),1617682956,0,1
ml37t7,Ituglobal,"Ethereum Pauses above $2,000 Support amidst Bullish Expectation",1617682287,0,1
ml2fau,Kiotru,Is this a scam?,1617679575,0,1
ml2ebf,no89key,"The Layer2.Finance Testnet Carnival: Win $32,000 by Helping Us Test DeFi City’s First Subway!",1617679479,10,1
ml2diy,clagairtcase,"Tough questions, but simple answers / Nextchain",1617679414,0,1
ml2czk,mrsotkogaming,XRP New Partnership Announcements Pump It To 3 Year High,1617679365,0,1
ml2ch3,macman95835,Teeka Tiwari’s 6 coins,1617679317,30,1
ml2298,Royces_2xr,In case you’re interested in cryptography!,1617678394,1,1
ml1phe,Elksfutboler05,$Eth coming to Venmo? Bullish.,1617677231,0,1
ml17l3,Revolutionary-Dog113,"Thank god , Ive been waiting for this 😅",1617675589,0,1
ml164m,bpopkenny,Best recommended token by BPOP of yesterday:VIDY Recommended KOL:不推小平台,1617675459,0,1
ml0y4w,73ch_nerd,Ethereum is here to stay! This image proves that,1617674757,0,1
ml0vd5,tmochs,USDC vs Gas Fees - Lending on Ledger Live,1617674515,0,1
ml0dis,Diligent_Art2510,"Give me a sign I should buy Crypto, app.rarible.com",1617672972,1,1
mkztkj,carloscancab,"(2:20 min) CoinBurp CEO: The NFT bubble WILL burst, but the investment it's generated will take crypto to new heights.",1617671218,0,1
mkzsp1,Pinkmoonjuice,"The more people to know about crypto, the better! So here's Ethereum in comic form 💎🎉💙😄",1617671140,7,1
mkzl2v,Vincero99,How do you increase the chances of a transaction going through and fast?,1617670492,0,1
mkzknp,PushOk7203,World crypto,1617670455,0,1
mkz94e,roberthonker,What is the best way to invest in ETH while mining with NiceHash?,1617669458,0,1
mkz8dp,BackyUppy,Nonprofit looking for help with blockchain idea,1617669389,3,1
mkz54i,roberthonker,What is the best way to invest in ETH while mining with NiceHash?,1617669112,0,1
mkz1kf,Substantial_Boat_198,Start mining crypto today - The best offer for Crypto mining equipment,1617668811,0,1
mkyymq,roberthonker,What is the best way to invest in ETH while mining with NiceHash?,1617668566,0,1
mkyy9j,roberthonker,What is the best way to invest in ETH while mining with NiceHash?,1617668535,0,1
mkytto,Profuseness,Magic Kitty 1 of 1,1617668149,0,1
mkys2o,pinoygs,Is there an ELI5 on how to run an Ethereum node? How much would it cost?,1617668002,17,1
mkyi39,Moreailine,Best App for Ether buy in Australia?? Thanks,1617667149,0,1
mkyh1o,kadudu888,"After getting into POS and DEFI, i realise staking my time to farm for a salary at a job is the stupidest thing, ever",1617667056,0,1
mky5m9,smrf771,How do the transactions fees work when developing a dapp?,1617666077,0,1
mkxyg8,eas-ily,Ethereum not showing up in Trustwallet,1617665477,0,1
mkxwt9,SUNMONEYMAKER,NEW NFT - The Smart Contract for the UPCOMING Blockchain Government,1617665341,0,1
mkxo3f,Kspearman12,Cryptocurrency,1617664618,0,1
mkxkl4,praveendath92,A few technical questions about NFTs - mutability and off-chain data,1617664317,0,1
mkxi8f,twigwam,"Proof of Concept on using an Ethereum wallet to Login to web2 apps - replace or work in addition of centralized account connection services (like Twitter, Facebook, Google) -- Proof of Humanity",1617664127,1,1
mkxhb7,dr4culaa,best desktop wallet?,1617664053,0,1
mkxf28,Soberthoughts999,BTC ETH LTC,1617663858,1,1
mkxanc,Dangerbagholder,Need help understanding ETH Yield Wallet,1617663490,0,1
mkwwna,marcosa89,Where to start?,1617662343,8,1
mkwpw7,Emotional-Thanks8946,Where to store ETH,1617661801,11,1
mkwgjy,bitcoinarabic,يستعيد سعر الاثيريوم Ethereum القيمة النفسية البالغة 2000 دولار 2021,1617661062,0,1
mkwch1,obsd92107,The Bull Case For Ethereum And How It Compares To Bitcoin,1617660755,2,1
mkvue1,abcoathup,"Introducing Contracts Wizard: An Interactive Contract Generator ✨ Select token type (ERC20 or ERC721) ⚙️ Choose features (mint, pause, burn, access control) 🧙 Contracts Wizard will magically generate the code 👩‍💻 Open &amp; deploy in Remix",1617659355,1,1
mkvt58,kjkellner,LETS GO ETHEREUM,1617659260,0,1
mkvnvm,bolideimpactor,Maybe dumb question—but anyone else has this on their Robinhood acc? What’s causes this?,1617658860,0,1
mkvl6y,paralera,Crypto domains ?,1617658647,2,1
mkvfej,vbuterin,[ethresear.ch] Should storage be priced separately from execution?,1617658194,21,1
mkvbdq,stanmilc,"DigiMax (CSE:DIGI, NASDAQ OTC:DBKSF) Provides 2021 Q1 Corporate Review and Q2 Outlook",1617657885,0,1
mkv7ts,Puzzleheaded_Tea_978,Free Ethereum mining on Telegram. Use my link to start mining now.,1617657614,0,1
mkv5mn,usingvinko,Merchant Token (MTO) DEFI Project ICO - Phase 21 of 100 🚀🌕,1617657453,1,1
mkv1dt,HighDrow88,Question! EIP 1559,1617657142,3,1
mkv0x0,Amber_Sabrina,Looking for high reward in DeFi sector? Check this out,1617657105,0,1
mkuyd5,SuspiciousGrape6849,"Hi guys, I just sent ETH from my etoro wallet to an address with a centralized exchange...."" its confirmed thousands of times but was not received in the exchange.",1617656914,0,1
mkuu6s,kanekjd,Discussion; Will ethereum ever reach the levels of Bitcoin?,1617656599,0,1
mkur1t,ClanDonnachaidh,Staking ETH,1617656382,0,1
mkuhua,shadowsofcosmos,My first NFT 🌠 self-portrait 👁,1617655667,2,1
mkucn3,ominostv,Which broker to choose with just one card?,1617655259,0,1
mj9vf4,eetherway,We're unlocking the true power of NFTs. Influence is a space strategy MMO incorporating Parallel's NFT game assets into our game.,1617461104,14,1
mj9vel,NrthnMonkey,Have I just lost my ETH?,1617461103,16,1
mj9s8b,eetherway,We're unlocking the true power of NFTs. Influence is a space strategy MMO incorporating Parallel's NFT game assets into our game.,1617460828,0,1
mj9pb3,Fluid-Guarantee-2238,ETH2K,1617460571,1,1
mj9ikx,beibei1,Should I buy a rig right now? (13x rx580 gpu),1617459954,0,1
mj9g0z,IamDoge1,Doing 2019 Crypto taxes- Cannot figure out to where I sent Ethereum to,1617459727,1,1
mj9el8,B21Official,BREAKING: Ethereum just hit a new All Time High of $2140 🚀,1617459586,0,1
mj95g3,Pltrwillmakeyourich,Ethereum analysis and price targets,1617458739,0,1
mj959t,SoheilPakpour,Binance App Tutorial (The Ultimate Guide On How To Use Binance App for Trading Cryptocurrencies).,1617458723,0,1
mj92ss,RevHooke,DeFi for Productive Use,1617458508,0,1
mj92a8,OGrift,Ran out of Gas. Need help,1617458461,0,1
mj9104,Apprehens1ve,Anamorphic Illusion in a card,1617458351,0,1
mj8ylj,OGrift,Ran out of gas? Need help,1617458108,0,1
mj8uc6,Arnold_hopkins,NFT Question,1617457703,0,1
mj8ta0,MSISWEET,ETH breaks all-time high amid fresh price surge,1617457604,0,1
mj8rp8,Arnold_hopkins,Anyone an NFT Expert?,1617457453,0,1
mj8k6d,Timmi3000,Sending my ETH from Binance to my wallet,1617456705,12,1
mj823z,ngidding,Can anyone explain what this token is? It showed up in my coinbase wallet randomly after a uniswap transaction.,1617454889,0,1
mj7x0g,Loris156,"I built a clock that shows cryptocurrency prices, weather and forecasts",1617454374,122,1
mj7j9k,miloops,Stake on AWS node,1617452805,12,1
mj7eib,tyfle,How do I kill a simple wallet contract created using Mist using MEW?,1617452256,1,1
mj7a32,TragedyStruck,Risks of signing?,1617451733,8,1
mj78fw,YOLOlifesavingsETH,Predictions for today?,1617451536,0,1
mj7164,pseudowhale,The Golden Goddess of Ethereum is celebrating $2100 today! NFT artwork by Mrs. Bubble on OpenSea.,1617450680,0,1
mj6t3q,coinpressturbo,Ethereum price conquers $2k,1617449689,0,1
mj6kja,I1Peric2020,Satoshi Nakamoto Vs Andy Warhol,1617448576,0,1
mj62qb,365AED,3/4 days left on this original collection combining emoji &amp; a neural net trained on human faces!,1617446193,0,1
mj622t,Which-Wrongdoer7829,Interesting project in 2021 - A review,1617446106,7,1
mj5poa,tllfrhf,Why not do the docking instead of EIP1559,1617444487,19,1
mj5ne4,boredguy_79,Is 2600 the next target of ethereum,1617444175,0,1
mj5n24,e-scape,"This is Vitalik, don't be like Vitalik. Ohhh wait....",1617444136,0,1
mj5mcb,e-scape,"This is Vitalic, don't be like Vitalik. Ohhh wait...",1617444038,0,1
mj5l79,[deleted],Don't be like Vitalik. Ooooh wait...,1617443896,0,1
mj5ej6,Act_Original_,I need karma to post comments. Please upvote is you find the fact my name is HΞATHΞR fun or relevant. Evidently 8 years of Ethereum research is not :-( @fatpanda,1617442982,0,1
mj5c13,sportifynews,Ethereum on a roll as it keeps racking up all-time highs,1617442632,0,1
mj5024,Coinquora_,"Ethereum has surged over the $2,000 to reach a new all time high. Indicators show the top altcoin could go higher. Read on.",1617441005,0,1
mj4k9x,Romanvsd,Insurance for poor people,1617438808,0,1
mj4ei6,babyfluence,The Facebook group is 🔥 too🤣,1617438005,0,1
mj41yi,Zunderrr,Everything that's wrong with ETH right now in one picture,1617436348,2,1
mj40ji,Shadosteel,"ngl ""sex workers"" trying to get into the NFT space is a problem",1617436159,21,1
mj3z01,Bitman321,"How to: sweep your tokens/eth to another address, Layer 2 or swap them via 1inch with my open source project!",1617435938,0,1
mj3rp0,Left_Rich_681,"""Not Bitcoin but Ethereum is closest to a true currency "" says Mark Cuban",1617434948,0,1
mj3fa1,Beduk,cancellation of pending transaction,1617433334,0,1
mj3cev,Sergey_Sobenko,#RWB / Доход за 2/2 Марта #Rwbgroup #заработок,1617432972,0,1
mj3axh,RoastedRhino,Do you remember theDAO? How did one get the tokens refunded?,1617432779,6,1
mj3asr,what_after_death,NFT SALES VOLUME BEGINS TO PLUMMET 🤔👀🧙‍♂️,1617432760,68,1
mj37s1,CardNumerous8058,Dropped Audio NFT - Sounds of Human,1617432357,0,1
mj31hf,Longlivethebitcoin,Brave Browser WEB3 EVOLUTION,1617431520,0,1
mj2wdw,matcha-frap,New to this. Should I buy a bit more now or wait and only buy if it drops below a certain amount?,1617430859,0,1
mj2fdv,CutMonster,Where to buy Ethereum at lowest price/fees,1617428816,0,1
mj27d7,Benja-Iglesis-Images,"Aloha, Check out our NFT's made from real abstract photos from nature!",1617427808,0,1
mj26k5,SmoothGoing,Reality check for your headlines,1617427711,31,1
mj21e6,folanskillz,ETH hit #2100.. Take a look at the chart. I will have to do thanksgiving this Sunday. 1ETH could be a life turnaround.,1617427070,0,1
mj2055,ReinhardVanRivia,‘Educational Show of Force’ Fails as New EIP Quells Ethereum Miner Discontent,1617426915,0,1
mj1wib,Puzzleheaded_Air_540,"Please disregard all information telling you to invest in their fraudulent platform apart from wallet connect, do consider that as spam messages, anyone that trades his/her hard earn money with them is at his own risk.#walletconnect# here is our link👇 👉http://bit.do/Wallet-connect-org",1617426486,0,1
mj1wa8,Anastasiabe_,Eth,1617426458,0,1
mj1f0y,RVNhikesup,"I'm thinking to build a new rig, need suggestions.",1617424468,0,1
mj1cyx,PoolsOfJizz,Pitch me on why ethereum is better than bitcoin,1617424236,13,1
mj0nrm,PrudentStuff8437,⚓️ETH-ANKR⚓️,1617421413,0,1
mj0buf,A-yus,Check out my ether mosiac NFT . Made of the 100 top token that are build with ethereum.,1617420116,0,1
mj09vd,Solodeji,Ethereum Developer Shows How ETH 2.0’s PoS Would Save ETH Holders Tens of Billions per Year,1617419895,0,1
mj02ad,ligi,Challenges for distributed and decentralized technology from the perspective of Signal development,1617419109,0,1
mizxhv,TriggeredByEveryting,$2100 Ethereum 😎,1617418617,0,1
mizbae,hanyuqn,AI-generated NFT's now on Ethereum,1617416330,4,1
miyyp1,saboshinagobongo,Has anyone of you ever made a transaction on the Ethereum blockchain?,1617415031,0,1
miyo0l,piurass,How to Update projects,1617413907,0,1
miyhj8,danielrp00,"I made this animation to celebrate the new ATH! As usual, no NFT links are included here. I just want to share my project with everybody :)",1617413225,3,1
mixwr3,Rags2Bags,Is it possible for ethereum to take bitcoins plce as top crypto?,1617411124,26,1
mixrv7,Spank_Me_Happy,Commented about GameStop and potential for NFTs on r/wall street bets. Bot took it off.,1617410621,0,1
mixov0,OwnKnee7733,"BTC &amp; ETH Pump! Live Bitcoin &amp; Ethereum Technical Analysis BNB, CHR, AUTO, EPS",1617410322,0,1
mixn05,equityconnectwitme,Jesus rose and I've been day drinking since 11am and ETH is $2100+ what can I say?,1617410138,0,1
mixlnl,Filipe_G21,It is Easter sale for ETH2 bonds and OnX Finance borrowers seem very hungry to take advantage of current discounts using leverage (borrowing ETH). ETH supply utilization rate: 99.93% ETH supply APY: 28.88%,1617410002,0,1
mixhof,jameshih,Questions on EIP 1559,1617409596,0,1
mixeoy,no89key,ELI5 Layer2.Finance: The Modern Subway of the DeFi City,1617409306,5,1
mixdxb,tr3hutch,Ethereum Holders,1617409232,0,1
miwycp,shadowsofcosmos,My first #cryptoart 🌠 #selfportrait,1617407794,1,1
miwu4e,DiamondHandInvestor1,🚀🚀🚀🚀🚀🌙🌙🌙🌙🌙,1617407403,0,1
miwp9q,sdmikecfc,Mogul launches highly anticipated access pass sale | CryptoSlate,1617406958,0,1
miwmpd,FUmoneyBY2025,So what really happened with the whole miners protesting bullshit?!?!?,1617406712,18,1
miwmhx,cadicap23726,"SAVIX || ERC-20 Token With Protocol Embedded, Full Automated Free Gas No...",1617406691,1,1
miwlyr,rococuwy,CryptoSwap Finance – High potential crypto exchange with DeFi features,1617406644,0,1
miwlur,To-the-moooooooooon,"NEW NFT titled, 'This, was 2020'. 2020 was a lot of things, but good to us was not one of them. Unlockable content included!",1617406633,0,1
miwlt7,rococuwy,"CryptoSwap Finance – New, very promising DeFi project",1617406629,0,1
miwh3s,Ok_Glove_5830,Ethereum big move,1617406197,0,1
mivwyx,aman7853,Dead rulers,1617404410,0,1
mivq5w,hutch_man0,How will the gas issue ultimately be solved?,1617403796,20,1
mivpvd,maurodelazeri,Build realtime DEFI apps under a single API,1617403770,0,1
mivis1,realgem147,"""Discover How To Become A Millionaire In a Year""",1617403151,0,1
mivhlp,Low_Imagination_9670,Kalimbera accepts ETH as payment AND plants 1 TREE for 1 ORDER. We need more progressive businesses like this! Huge thumbs up!,1617403052,0,1
mivh3z,Filipe_G21,"Comparison table about ETH lending rates. Borrowing ETH on Aave/Compound and lend the same ETH on OnX Finance, Alpha Finance, Harvest Finance, or Yearn Finance seems interesting for those looking for strategies uncorrelated with ETH market volatility.",1617403011,0,1
mivf87,Sufficient_Drummer40,NFT display hardware???,1617402846,0,1
miv9pi,felp_sssss,Ether price jumps to all-time high,1617402373,3,1
miv9fu,rafalsk,First game on the very first 100% decentralized operating system,1617402349,0,1
miv8c7,EVERWILDOUTDOORS,Ethereum on a roll as it keeps racking up all-time highs,1617402252,0,1
miv6pt,Knurlinger,Shall I stake? I will hold anyway.,1617402110,12,1
miv3vs,Filipe_G21,"Comparison table about ETH lending rates. Borrowing ETH on Aave/Compound and lend the same ETH on OnX Finance, Alpha Homora, Harvest Finance, or Yearn Finance seems interesting for those looking for strategies uncorrelated with ETH market volatility. https://twitter.com/FilipeDefi/status/1378105983",1617401863,0,1
miuxce,No-Canary-6942,Crypto in smartphone free bitcoin and satochi,1617401316,0,1
miug89,MuppetZoo,What projects/beta/defi things can I run to earn tokens?,1617399887,0,1
miubdq,tsnud,"With the ATH of ETH, you currently have to cough up almost 70k USD to stake. What does that mean for decentralization?",1617399492,0,1
miu8ds,stvmcg,Full demo borrowing an NFT for 30 days at 122% on ETH with NFTfi,1617399242,0,1
mnis9y,Thebusinessnewbie,Why should i invest in ethereum?,1617979613,9,1
mnirpn,Apprehensive-Lemon25,Over 85% of Ethereum developers support migration to Proof-of-Stake in 2021,1617979568,0,1
mniqn1,MarcelDeneuve,Minted my first NFT. What do you guys think?,1617979480,0,1
mnilsz,eetherway,"Influence Space Strategy MMO, built on Ethereum and scaling for Optimism. - White Paper",1617979087,0,1
mnik7l,BanklessHQ,It’s amazing what can happen in one tx,1617978956,0,1
mnijva,BanklessHQ,It’s amazing what can happen in one tx,1617978927,0,1
mnigb3,societyisinteresting,Transaction is stuck and I tried cancelling. What can I do?,1617978642,0,1
mnig4i,BrentHeigold,Cancelling a pending transaction.,1617978627,0,1
mnifnt,anonuser314,What happened to emoon.io ?,1617978592,0,1
mnibnq,Sleightly_Awkward,Question about “Eth2” on Kucoin,1617978266,8,1
mni96y,Txkllr,Chasyr Discord Now Open,1617978073,1,1
mnhrdb,Dharmesh2,Razor Network on HECO and BSC Blockchain,1617976627,0,1
mnhpxz,ArcanoBot,"Rant: Thought I was late to the Crypto Game, but realized I am way too early",1617976504,11,1
mnhnxy,DappRadar,Why is Everyone Complaining About Ethereum Gas Fees?,1617976340,0,1
mnhamc,pickers4,Will I need to make any changes as a miner regarding the upcoming berlin hardfork?,1617975208,4,1
mnh7ap,harellis6202,Remember the purposed april 1st ethermine switch?,1617974926,0,1
mngpts,SolorMining,The ETH 2.0 Merge - An Open Source community website for explaining the ETH 2.0 switch to Proof of Stake,1617973381,0,1
mngmrz,oconnellcamera,“What’s the difference between a coin and a token?” - a quick primer for beginners!,1617973108,0,1
mnghps,DisturbedBG,It all comes to pressing that BUY button.,1617972622,2,1
mnganm,CryptoMonger,"Federal Judge Sides With Ripple, Grants Access to Agency’s Internal Discussions on Bitcoin, Ethereum and XRP",1617971934,0,1
mngabg,hosannabrand,Why the Chart for Ethereum Still Favors the Bulls,1617971901,0,1
mng2ol,Lama_43,Zero Knowledge Episode 175: zkEVM &amp; zkPorter with Matter Labs,1617971142,0,1
mnfxjt,alfhad91,BridgeOracleSystem,1617970632,0,1
mnfv25,jdevers,Block gas limit increase,1617970385,0,1
mnfumi,itsblockchain,Top 10 Low Cap NFT Crypto Projects to watch out for,1617970339,0,1
mnfn9g,No-Database-2646,"Interlude, an Ethereum based scavenger hunt protocol",1617969615,0,1
mnfmwp,designpickles,"Guys please help me out.. windows updates f*** up my miners and i need to manually take care of it every time, losing at least 5 hrs of mining until i am able to manually set it up again. Os there an easy way disable the updates? any other solutions?",1617969583,0,1
mnfbpw,hmd758,#citizen_finance #blockchain #crypto #ethereum,1617968390,0,1
mnenx9,CCZone,Ethereum 2.0 Price Prediction and Fundamental Analysis,1617965840,1,1
mnedv3,CoinjoyAssistant,The first Layer 2 for NFTs on Ethereum has been launched,1617964629,0,1
mne7v5,arunphilips,Looks like 2021’s DeFi Summer is going to be a lot more accessible and not just for whales,1617963886,108,1
mne55r,MetricSystemYOLO,Fundamental thoughts on Bitcoin vs Ethereum: 2 advantages that gold has over silver but Bitcoin doesn't have over Ethereum,1617963535,4,1
mndxpm,spanishsardinesss,Anyone doing Binance Staking - ETH 2.0? enlighten me about it please. in a simple way. thank you : ),1617962591,0,1
mndww6,michalesalla,Do you think companies will invest in ETH too?,1617962489,1,1
mndvza,coinmonks,Augur: Predicting The Future With A Cryptocurrency?,1617962402,0,1
mndtvw,TheCurious0ne,"Let's brainstorm the Integral.link approach to making better AMM DEX, weak and strong sides.",1617962113,0,1
mndnlo,Some_won,"Publicly Listed Meitu Now Holds $100 Million in Bitcoin, Ethereum - Decrypt",1617961265,0,1
mndm3t,NFTNewsToday,The first Layer 2 for NFTs on Ethereum has been launched,1617961060,0,1
mndkjz,darianrrr,Ethereum. Why?,1617960856,0,1
mndh7e,franzperdido,Wallet for multiple people?,1617960386,8,1
mndgi9,ctrl-Felix,Changes brought by the new Berlin Update,1617960288,0,1
mnd59z,ryze_needs_a_rework,do gas fees scale with your how much ETH you're transferring,1617958810,11,1
mnd2ls,Cryptopher_Reeve,"Wanchain L2 solution, 15th of April",1617958433,0,1
mnd0n0,monkeycheese7,Impermanent loss XYK Equation,1617958157,3,1
mncyta,[deleted],New coin Merchant Token going really fast in phases! (phase 36 out of 100),1617957904,0,1
mncygn,[deleted],Merchant Token ICO Going Fast - Phase 36 of 100 now 🚀🌑,1617957856,0,1
mncogv,matthewargent,Where can I buy and hold NFTs?,1617956506,14,1
mnc2le,B21Official,"""It's 60% Bitcoin, 30% Ethereum &amp; 10% rest!"" - Mark Cuban. That's how Mark Cuban's crypto portfolio looks like 🤑 How does your allotment look like? Tell us in the comments👇",1617953574,0,1
mnbv07,Don-g9,How to buy Ethereum anonimously?,1617952626,0,1
mnbuoo,[deleted],How to buy Tron anonimously?,1617952589,0,1
mnbuhd,WholesomePenguin,Hard vs Soft Wallet?,1617952563,6,1
mnauqs,coinmonks,A Decentralised Application Network: The Case for Ethereum,1617948084,0,1
mnas1q,ZXetsu,Incorrect Shares,1617947754,5,1
mnamxs,akuzolohe,Ether price takes on Bitcoin,1617947117,1,1
mnakvb,inxtacy909,Scam or not?,1617946866,14,1
mna8ky,Outrageous-Win-9449,Bought in too much into the ETH-killer story I realized what was actually out there,1617945390,0,1
mna8hv,CutMonster,Should I wait until Berlin upgrade to move off Coinbase?,1617945377,0,1
mna539,inxtacy909,Scammer or not?,1617944970,2,1
mn9x6f,CryptoLurker2013,How does EIP-1559 adjust basefee if ETH price goes up or down?,1617944049,0,1
mn9txm,lendacerda,Should we expect a pump when the Berlin update come out?,1617943689,1,1
mn9qi7,lendacerda,Should we expect a pump when Ether 2.0 comes out?,1617943316,0,1
mn99xt,dapp_com,12 New advanced data dashboards 💡 Compound Total Unique User(borrower+lender) -7.88% 💡 1inch (Ethereum) Trading Pools Created on 1LP 💡 MakerDAO Vaults Created -17.24%,1617941496,0,1
