id,author,title,created_utc,num_comments,score
obleo5,dotaleaker,Next big thing after DeFi -&gt; NFT -&gt; ?,1625144639,0,1
obkvhs,CorrineSomers,"Jack Dorsey Says HamsterCoin, Not DOGE Is Threat to Ethereum",1625142803,10,1
obksgh,Jealous_Pair6074,"Hi, my name is Joaking and this is my art, look it in Opensea with the link at the final of the text. As The Beatles went across Abbey Road towards the success and to stay alive in history as the most famous band of all time, this painting represents the Cryptos going to the moon!🚀🌕",1625142521,0,1
obkn6p,PhilixSlaxis,EVGA xc3 ultra 3080 &amp; 3070 Settings,1625141988,0,1
obklt6,RoyalQ_BTC,Making money while you sleep doesn't have to be a dream anymore.,1625141850,0,1
obk1vg,VergaraIrene,Cash out?,1625139809,0,1
objjz2,economicsdesign,MakerDAO case study [M] | Econteric.com,1625137831,0,1
objjj9,crypto_pub,Ethereum 2.0 To Reach 6 Million Staked ETH Milestone,1625137785,0,1
objg02,CoinjoyAssistant,EIP-3074: Improved Ethereum UX (post EIP-1559),1625137389,6,1
objcd8,Sea_Animal9703,Ethereum 2.0 To Reach 6 Million Staked ETH Milestone,1625136979,0,1
obj7gp,Robertjordan77,Nucleus Vision on Twitter,1625136390,0,1
obj5y9,4rt3m157,How to stack?,1625136196,0,1
obj55v,Rainmakerman,"ETH had about 200K more daily active addresses than BTC on Sunday, June 27th. This was only the third day since January 1st, 2017 that ETH has had more active addresses than BTC. The other two times that ETH topped BTC were June 5th and 6th, 2021.",1625136101,102,1
obiit0,CorrineSomers,Ethereum 2.0 To Reach 6 Million Staked ETH Milestone,1625133468,20,1
obieh3,StretchFamous7838,ETH 2.0 staking is about to hit six million Ethereum with over 180k validators. Are you excited for ETH 2.0? Check out the latest metrics here - https://stakingrewards.com/earn/ethereum-2-0/metrics $ETH #Ethereum,1625132943,0,1
obid77,broderick9081,Federal.Money on Twitter,1625132784,0,1
obi1gv,Takbira,It is true that London update was postponed to the 4th August?,1625131305,34,1
obhutu,Only_Ad_7973,What is the difference between running a beacon client or being a validator?,1625130447,0,1
obhdr3,Anonutopia,"[Hiring] Defi Smart Contract Developer (Ethereum; Polygon) - Remote, part-time - $200000",1625128242,2,1
obh7u9,ValidNetworkNews,Top Blockchain Attacks in 2020 - Valid Network,1625127454,0,1
obh6fe,AF-_-1997,Goerli London Fork - EIP-1559 - Success. -&gt; checkout total eth burnt -&gt; https://goerli.etherscan.io/blocks,1625127273,1,1
obh3pm,shredthesky,HODL Protocol will help you HODL your coins through any kind of market (⚠️ not HODL token⚠️ ),1625126928,0,1
obgkm6,alvinyap510,[ASK] Is there a Poocoin/Polychart equivalent for ERC20 tokens on Ethereum Mainnet?,1625124326,0,1
obg9tb,Hakan1984,Top Staking Coins For Maximum Gains in 2021!,1625122899,0,1
obg6lu,Waste_Baddelsk_,I just sold 3.5 eth to free up 8k to renovate my newly purchased home 🙏🏽.,1625122499,0,1
obg18q,CoinjoyAssistant,Ethereum’s London network upgrade goes live on Goerli testnet,1625121804,1,1
obfvcx,Accomplished-Road556,Bitcoin and Ethereum cloud mining,1625121023,0,1
obft10,CoinjoyAssistant,"Galaxy Digital CEO, Mike Novogratz: Ethereum Can Become the Biggest Crypto",1625120725,0,1
obfq8j,catsrcuteilikethem,Why aren't stake pools trusted?,1625120363,0,1
obfeqf,jakkkmotivator,"Galaxy Digital CEO, Mike Novogratz: Ethereum Can Become the Biggest Crypto",1625118905,3,1
obfdk3,MichaelTen,Will humans eventually live forever? | Vitalik Buterin and Lex Fridman,1625118756,5,1
obf31w,studysectionexam,Blockchain Ethereum Developer Certification,1625117443,0,1
obeuji,naniham,ETH staking.,1625116439,0,1
obe9mq,Stacker_Ventures,Introducing Stacker Ventures: Reimagining Venture Capital,1625114042,0,1
obe3xe,Mossbeard1337,Erc20 token proof of stake,1625113414,0,1
obdwbc,Needle_NFT,Flower picasso – ultra rare 1/1,1625112592,0,1
obds7a,bymigo,#Ethereum Elliott Waves,1625112163,13,1
obcue5,Ciricath,$HVBT – HIVE Bitcoin &amp; Ethereum Mining Company Goes LIVE as $HVBT. Should You Invest?,1625108679,1,1
obcm62,brinkofbailout,Why does Uniswap V2 consume 4-5x more gas compared to V3?,1625107843,0,1
obc4r4,twigwam,The ABCs of DAOs • 1729,1625106085,2,1
obc2pz,redflexiseal,Devs to pick EIP1559 block next week,1625105873,0,1
obc1k2,twigwam,Virtual DAO Summit Livestream June 30th,1625105752,0,1
obasyd,ExcellentParty5476,Does the climb begin for ether to be king?,1625101203,0,1
obaixt,RomanJIsraelBro,Securing ETH2.0 Validator From Theft!,1625100164,8,1
ob9o5d,CryptoDeFinance,Deep Dive to Three Ethereum Upcoming Events That Could Make Eth Value go ATH - Crypto DeFinance,1625097132,0,1
ob91gk,AffectionateNeck4955,Bull flags all day,1625094945,2,1
ob8x6j,NexusGamer349,Free Ethereum!,1625094535,0,1
ob8gqj,asianpoetaetoe,"Fun free mobile game that pays you in BTC/ETH, similar to Pokemon Go! Only in US and Canada.",1625093027,0,1
ob7zvu,_cryptokeeper,“Goldies” NFT art on Opensea,1625091489,0,1
ob7k97,ctvicious,ETHEREUM BULLS ARE BACK!!!!,1625090144,0,1
ob7cyf,JohnTravolski,First In First Out Cost Basis on Crypto with Business Expenses,1625089523,0,1
ob7ctu,TobiHovey,Bitcoin Booster Jack Dorsey Disses ETH Despite Twitter Using Ethereum,1625089513,74,1
ob7cl2,Only_Ad_7973,"What prevents a country to hodl more than half of the staked supply to attack the ethereum network? Same problem doesnt exist with bitcoin because miners can take away ""market share"" of other miners. I think PoS is superior to PoW in every other way but thats a big issue.",1625089493,0,1
ob6z35,LignariusHominid,Is this data as worrying as it looks?,1625088352,0,1
ob6mcv,socalquest,"What is your first thought when you hear the word “cryptocurrency”? We bet Bitcoin immediately pops up. But with the rapid success of this cryptocurrency, many other cryptocurrencies, called altcoins, began to appear on the market. One of the most outstanding altcoins today is Ethereum.",1625087290,0,1
ob6de6,Cryptostormz,How do you think eth 2.0 will affect the entire crypto/eth ecosystem and price of eth?,1625086541,2,1
ob6ald,aftermath_digital,Ethereum and crypto security blog,1625086306,0,1
ob61ef,Lastlord295,WinkGem: a decentralized marketplace for turning every digital assets and item into a real commodity. Unlocking the global market economy for billions of possibilities with virtual currencies and items.,1625085552,0,1
ob5r0f,Xyiura,"Just wanted to ask, should I convert my ETH to BETH on Binance for staking rewards? Is this worth it?",1625084657,0,1
ob5kfy,CryptoDeFinance,Matic deposits are now accepted in Binance directly from the Polygon blockchain - Crypto DeFinance,1625084110,0,1
ob5iv6,No_Clue_5667,"😳 😱 🚀 🌕 it broke the 2,295 resistance‼️ Last time it did that, it went to 4,200 the next couple days‼️",1625083978,1,1
ob5fq0,CostinSamo,On fire 🔥,1625083712,0,1
ob5937,CryptoCrushR,Don't allow their judgement to create your reality,1625083191,0,1
ob4kbh,AffectionateSearch69,CRYPTO GURU: ETHEREUM WILL SURPASS BITCOIN PRICE PREDICTION,1625081213,0,1
ob4fd2,NateGoyard1,End of 2021 Price predictions anyone? I’m personally Super Bullish when it’s comes to ETH and I’m assuming y’all are too or why else would you be on this subreddit.,1625080819,0,1
ob44w9,lihorne,"The MEV Summit with Vitalik Buterin, Phil Daian, Eli Ben-Sasson, Ben Jones, Ed Felten, and more is tomorrow! (registration link)",1625079943,2,1
ob44e5,lihorne,"The MEV Summit with Vitalik Buterin, Phil Daian, Eli Ben-Sasson, Ben Jones, Ed Felten, and more is this Friday! (registration link)",1625079904,0,1
ob3zre,Lee_Mire,Ethereum is practically a Superset of Bitcoin,1625079556,419,1
ob3vb3,jzamora1123,First Whole Ethereum Coin with today's purchase! Let's go 🚀,1625079176,35,1
ob3rso,sourkatt231,How to find the number of Ethereum Smart Contracts,1625078893,0,1
ob3n63,gomisego,OMGX Rollup Engineering Update #4,1625078523,2,1
ob2q8h,mybed54,What happens after ETH 2.0 is released?,1625075903,0,1
ob2j6y,Creative_Style7574,1Eth staked! 4 months after hitting ROI and paying off my rig I hit my second goal.,1625075331,2,1
ob2d1v,DemandOk3237,Libonomy introduces cross-platform projects,1625074847,0,1
ob2buv,coinmonks,Top 5 Crypto Management Platforms [2021],1625074755,0,1
oeq7bz,ArrowTheSparrow123,Ethereum Hard Fork EtherLite Soars on Trading Debut,1625557099,1,1
oeq6ut,dapp_com,Top DEX by Volume in June: 8 Ethereum Dex,1625557033,1,1
oepygu,pseudonympholepsy,Change my mind: Ethereum is quickly becoming an uninspiring project.,1625555868,0,1
oepot4,Exciting-Chemistry-7,Ethereum logo looks like the tetragonal anatase crystal,1625554573,0,1
oepi8s,Sky_Present,We want everything - Crypto Greed on Opensea,1625553682,0,1
oepej8,solarvortxx,What is geoxbit and if it is legit how do i use it?,1625553197,0,1
oeoy4y,thumbsdrivesmecrazy,What Is Ethereum Classic (ETC): The Difference Between ETC and ETH,1625551078,0,1
oeorgz,Alcoholic001,Sorry We Are Unable To Locate This TxnHash,1625550242,0,1
oeoh1i,Crypto_marketer_,Cryptonaire weekly magazine 188th is out now,1625548997,0,1
oeoeq7,Skyach,MLM Software for Ethereum,1625548726,0,1
oenvmz,juliusdeezer,Took inspiration from u/crystalrun's post and made a quick batch of wallpapers. Post more ideas in the comments!,1625546524,0,1
oent6o,Needle_NFT,wasp fly – ultra rare 1/1,1625546232,0,1
oenipg,Ituglobal,"Ethereum Makes Positive Moves but Faces Rejection at $2,400 High",1625545004,0,1
oeneaq,Dogecoinbaby88,Ethereum investment,1625544521,0,1
oenbs9,NeverEndingToast,I made myself a desktop ETH logo,1625544241,16,1
oemqs5,CautiousMountain5890,"Very Exciting News from 🔥 @yamgoapp Creating your account is quick and easy. All you need to do is fill out your name and email address, complete your account set up, and you’re ready to start earning rewards right away.",1625541975,0,1
oemmyn,Ok_Phrase1106,Is anybody using coinbase to stake eth2 I know its been discussed and im sorry I'm just looking for new and fresh thoughts since time passed and it's now only 5% is it still worth it since u can stake on voyager eth for 5.25%,1625541561,0,1
oemj9m,PeacockMamba,"Eth2, Phase0: staking / validating and the Beacon Chain. EXPLAINED.",1625541186,0,1
oem6el,MagnificentSteinher,Noob here and I have a doubt,1625539804,0,1
oem4to,yatin_garg,How Digital Transformation is Transmuting the Media and Entertainment Industry?,1625539643,0,1
oelimg,ShotBot,Why Ethereum (and 95% of coins) are Securities under US law and will likely be delisted from American exchanges.,1625537290,0,1
oeli4r,mrsotkogaming,Youtuber TechLead Accused Of Scamming Viewers With Million Token,1625537241,4,1
oela2g,economicsdesign,How to Classify Stablecoins (2021) | Econteric.com 🤩,1625536423,0,1
oel7n1,Chaos-D,Preset gas price,1625536177,0,1
oel1fs,crystalrun,"Made these Ethereum wallpapers for fun, figured I would share incase anyone else wants them!",1625535520,54,1
oektu1,StarCitizenTrading,"ERC-20 Altcoin with Tremendous Potential for Businesses, Customers, and Individuals - Merchant Token",1625534722,0,1
oektb9,StarCitizenTrading,"ERC-20 Altcoin with Tremendous Potential for Businesses, Customers, and Individuals - Merchant Token",1625534665,0,1
oeksb9,phenocode,My first foray into DApp development - EthGlobal Hackathon Entry,1625534556,9,1
oekki4,trader_yard,Seeking solidity dev to partner on a 10k NFT avatars project,1625533739,0,1
oejxwo,Arxavenger,I just had all my Gerowallet erc-20 tokens stolen from my coinbase wallet..,1625531380,0,1
oejmeo,Historical-Cobbler11,Thoughts on Midas.Investments ??? 20% APY for staking ???,1625530132,0,1
oejkfw,Disastrous-Strain18,How do you guys actually use this dinosaur chain?,1625529924,20,1
oejbcb,nicky_papagiorgio,The psychology of cryptocurrency trading: Risk and protective factors,1625529002,2,1
oeibvq,yungazier,How dependent is Ethereum on Infura and AWS,1625525585,0,1
oehfxq,BoyYeetzWorld,"Why are cryptocurrency prices decreasing - with Bitcoin, Ethereum, and Dogecoin all under pressure?",1625522594,53,1
oeh7y0,nyc_apartments,Still no way to use RealT in the US unless you're an accredited investor?,1625521887,0,1
oegll7,andrxmeda1733,🚀Start in Friday 🌙 CorgieMoon 🔥 To the Moon 💵,1625519936,0,1
oegjl7,Proof_Supermarket122,Barclays ban Binance,1625519758,1,1
oefp4s,A117Z,ETH2.0 and Staking,1625517118,0,1
oef49a,yungazier,So I tried researching but I am still confused. How dependent ethereum is upon Infura and AWS?,1625515342,0,1
oeeof5,sourkatt231,Daily Contracts Deployed Data,1625514021,0,1
oeem11,pastaboi011,Ethereum Killer,1625513826,0,1
oeeizv,Embarrassed-Pop5834,eth to flip btc ? institutional investor seems more interested in Eth tho,1625513585,1,1
oeeajd,sourkatt231,There are 38 addresses with 150k ETH all with few transactions. Do we know what these are for?,1625512875,46,1
oedsxn,LegendarySlooch,"Transferred ETH from metamask to coinbase, how long should the transfer take?",1625511433,0,1
oedq7l,blockchain7589,Choose Libonomy.,1625511203,0,1
oedlir,blkmre,Check out my Newly Renovated Gallery Space in Cryptovoxels!,1625510817,7,1
oedep3,monokh,Uniswap from Scratch - A simple implementation guide,1625510254,0,1
oed746,Tiko-traders,Grace on the Ethereum network is about to launch in August.,1625509634,2,1
oecw0r,adminalex360,Blockchain coding,1625508679,0,1
oecuys,ExtensionSinger4154,Ethereum 2.0 - Everything you need to know about it!,1625508586,0,1
oecmbq,IntelligentAd6933,Ethereum Active Addresses Surpassed Bitcoin,1625507864,0,1
oecgeb,superphiz,The pandemic sucks. Join EthStaker and Devcon for a consolation Ethereum Trivia game on July 10!,1625507346,0,1
oece4i,ChildhoodBrief1153,My retirement plan Ethereum,1625507146,4,1
oec4jw,adminalex360,Ethereum is struggling with fees,1625506321,0,1
oec46w,4242368789,Tried to buy DPI but transaction details say I bought ETH,1625506287,0,1
oec2ra,BlahzStacks,Sold my soul to the ETH Devil!,1625506167,11,1
oebmp8,fr09sta,Join the waitlist for the BlockFi credit card with my link and we’ll both start earning bitcoin soon.,1625504795,0,1
oebf8j,the_damj,Russian Hackers demand $70 million in Bitcoin ransom from over 200 US companies,1625504171,0,1
oebd0s,kayesmia,Libonomy is the optical cable,1625503980,0,1
oebcty,hiver,Is Ethereum P2P Digital Cash?,1625503965,0,1
oeb7kq,white_and_blackcat,First time buying: is this a proper way of doing it?,1625503504,0,1
oeazpk,CoinjoyAssistant,ETH London Hardfork Expected to Occur on August 4 by EthHub Founder,1625502813,3,1
oeax6e,HighwayMean7436,My retirement plan Ethereum,1625502603,1,1
oeau7j,CryptoCurrencyState,Cardano ADA - Next Steps to $2 - Should you Hodl ADA or ETH in the Next few Months? Which will perform better?,1625502343,0,1
oeahor,Cryptocytrader121,Energy Mining Comparison Of Different Blockchains,1625501282,0,1
oea9nu,Efficient-Sir6418,Libonomy blockchain,1625500626,0,1
oea9ix,blueballsandcancer,How do I get a statement of my transactions on MEW?,1625500612,0,1
oea4k3,pipshacker,100% guaranteed profitable trading strategy for crypto trader,1625500197,0,1
oe9yl3,jamild,Preserving and displaying historical U.S. Election information on the Ethereum blockchain; a small side project of mine,1625499692,26,1
oe9our,Lost_Clothes_5756,"Hi! A new tool for earning money has been found. CorgieMoooooon, meet me on the moon)",1625498872,0,1
oe9nxo,Ok_Brilliant_9083,What wallet?,1625498796,11,1
oe9g17,govnovoz88,🚀Start in Wednesday 🌙 CorgieMoon 🔥 To the Moon 💵,1625498123,0,1
oe9fxp,cryptocurrencypr,Libonomy Blockchain,1625498115,0,1
oe9dvh,andrxmeda1733,🚀Start in Wednesday 🌙 CorgieMoon 🔥 To the Moon 💵 !!!!!!!!Текст!!!!!!!,1625497947,0,1
oe9cmi,MannAfFolki,First post wanting to invest in 10-15 ETH depending on the price of purchase and staking it,1625497843,0,1
oe9bjl,Even_Teacher_8865,https://bit.ly/3vSx5l9,1625497754,0,1
oe98jl,lifeexchange21,Different Public And Private Blockchains,1625497507,0,1
oe8w0s,WildlyShut,Group therapy session,1625496486,0,1
oe8snr,Spiritual-Republic45,Miners,1625496197,0,1
oe8qnf,yeho_meta,Crypto Meme Family F9,1625496028,0,1
oe8ot6,reebokxp1,HELPFUL LINKS - ETH ECOSYSTEM,1625495873,0,1
oe8n2t,CoinMasterGLK,Great job from Binance,1625495729,0,1
oe8mxr,Ipskee,Is there any simple and fun project on Ethereum for a hobbyist programmer?,1625495715,0,1
oe88zs,DemandOk3237,Libonomy blockchain is the first blockchain,1625494516,0,1
oe877x,DailyGweiBot,The Self-Sovereign Network - The Daily Gwei #283,1625494360,2,1
oe86sb,CryptoRights,"Crypto Rights, Bridging law and cryptocurrencies together.",1625494320,0,1
oe7uvu,Robertjordan77,Nucleus Vision on Twitter,1625493253,0,1
oe7tjz,bletchleymcgregor,ETH All Exchanges Reserve Reached a 2.5 Year Low,1625493127,0,1
oe7on1,bultodepapas,"Is there a way that everything that comes to my eth address, the exchange / wallet takes X% and sends it to another address automatically?",1625492666,0,1
oe7ncs,CorrineSomers,"Billionaire Drags ETH, DOGE in Favor of BTC, XMR, ZEC",1625492548,3,1
oe7k29,Cryptocytrader121,Libonomy blockchain,1625492235,0,1
oe7gzz,ErdetgasXD,I made a Chrome extension that allows you to use your Ledger Nano X with Metamask via Bluetooth! :),1625491968,12,1
oe7bqn,youngjay111,Safest place to stake eth,1625491494,0,1
oe7b2e,MORSHEDA,A truly interoperable blockchain - Libonomy,1625491433,0,1
oe6d8q,daGscheid,Staking with the client of your choice made easy with the Stereum - Ethereum Node Setup 1.0,1625488084,2,1
oe6401,Absorbing_Professor_,I stumbled upon this mini-documentary about the DAO. It does a good job summarizing the hack and the ETC fork.,1625487128,65,1
oe612o,CorgieMoon,🚀Start in Wednesday 🌙 CorgieMoon 🔥 To the Moon 💵,1625486829,0,1
oe5yzv,Absorbing_Professor_,I stumbled upon this mini-documentary about the DAO hack. It does a great job at summarizing the hack and the ETC fork.,1625486613,0,1
oe58qr,Steven44323,Libonomy Blockchain,1625483756,0,1
opt70l,Womb3d,"Just created this new NFT titled ""The Twilight Zone"" Unlockable content: Source files for learning purposes 3DsMax",1627008359,6,1
opslfu,economicsdesign,➡️ ELI5 15 DeFi and Crypto Terms | Econteric.com,1627006268,0,1
opshtw,Crypto_Wizard_87,"Get on Cmerge ASAP! They announced they are building a platform to replace Dextools! It’s going to bring many more crypto functions all into one technological space! Locked liquidity 2 years, verified on CG, CMC Listing. 5% redistribution in Ethereum! Check out what 3 days has earned me. Unreal!",1627005937,0,1
opsfpo,socalquest,Ethereum (ETH) Staking Rewards Calculator,1627005740,13,1
opsdk0,tombstonekid8394,What are some eth centered youtube channels you all like?,1627005541,0,1
opscnk,PhilosophyOdd1663,Eth🔥,1627005449,0,1
opsbvv,chrisdh79,Reddit is scaling its two Ethereum-based tokens using Layer 2 solution Arbitrum,1627005377,11,1
ops9g4,Need2PrintCrypto,ENS domain noob,1627005142,0,1
ops92y,olowo24,"Ethereum Co-founder, Vitalik Buterin Says Ethereum Needs to Grow Beyond DeFi",1627005108,0,1
opran3,Sk8r_42069,Always a bridesmaid….. Coulda been somebody….,1627001761,8,1
opr98q,Yanko10A,Mintable.app,1627001626,0,1
opqwhf,AJRollon,"Just converted a bit insignificant to me, amount of a coin I no longer want into ETH. Wondering how to make it work for me the best.",1627000418,0,1
opqmdb,punx926,Ok wtf?,1626999436,6,1
opqftc,Soy_chunks,Very noob staking question,1626998811,0,1
opq6qf,dlystyr,"So after 10 months of buying ethereum from my salary, I eventually own not part but a whole 1.06 Eth",1626997959,0,1
opq3ez,TaxExempt,Would this work to solve or at least reduce the effect of MEV/SEV with staking?,1626997595,0,1
opq0z7,Crypto_Economist42,Jack Dorsey adds Ethiopian flag to every #ETH hashtag on Twitter. Maximalism is a hell of a drug. This is another example of wealthy elites controlling the media and social networks we use. Decentralized social networks are needed more than ever.,1626997283,155,1
opph19,RRStrategy,Full-Stack DeFi Founding Engineer,1626995293,0,1
oppdyu,bigi_G,Made an animated explainer video for Ethereum. Thanks in advance for watching.,1626995021,4,1
opow5j,emofather,"Hanging up at the Five Guys by me. After being a noob and buying at the ATH, I optimistically (re delusionally) take this as a sign",1626993410,13,1
opoivy,Rip_Dip_Skip,For once my trade timing was Immaculate!!,1626992242,0,1
opoijc,twigwam,Juan Benet @ EthCC[4] -- Building Web3: Filecoin + Ethereum Better Together,1626992210,2,1
opog76,DeviantAsp,Blending Two Worlds with Ethereum: Decentralized Finance Ownership Tokens for Real-World Assets,1626992015,19,1
opocwa,trizest,Does anyone know of a website that shows Eth transaction fees vs the amount generated by Mining and ETH2.0?,1626991743,0,1
opnfua,WrappedFi,Wrapped ETH is now live and fully tradable on the Celo blockchain.,1626988999,0,1
opnd65,trogdortb001,Twitter's new official #ETH hashtag icon is the flag of Ethiopia,1626988782,6,1
opn1gm,BabyChloeXO,The Token Maximalist Thesis,1626987776,0,1
opmwjo,xukre,this is awkward,1626987381,0,1
opmtrg,ghost1307,16% Ethereum price rebound activates a classic bullish pattern — $2.5K next?,1626987146,2,1
opmsn7,solargarlicstash,Exploring dapps,1626987049,0,1
opmsgv,jake0keije,Do layer 2 solutions lock up ether like sidechains do?,1626987036,0,1
opmn01,DryCarpet4589,Coincidence? No,1626986572,4,1
opmm7f,di0reflect,How good and how safe would you say is my ether wallet?,1626986505,0,1
opmkmg,twigwam,Scaling Ethereum with zkSync — Placeholder,1626986373,4,1
opmih4,trogdortb001,The Basics of Ethereum Cryptography - how we all sign transactions without exposing our private keys directly,1626986192,8,1
opm8aj,senor_roboto,"A Conversation between Balaji Srinivasan, Joseph Lubin, and Vitalik Buterin on the Future of Ethereum and Web3 (July 29th)",1626985331,1,1
opm7u3,twigwam,EIP-3675: Upgrade consensus to Proof-of-Stake by mkalinin · Pull Request #3675 · ethereum/EIPs,1626985292,16,1
opm5rg,twigwam,"The Block will host a half day event exploring the intersection of ""DeFi and Institutions"" -- 22nd July 11am to 330pm ET",1626985116,2,1
opm05f,TobiHovey,How Ethereum Miners Could Exploit the Network and How to Fix It,1626984634,4,1
oplwrn,senor_roboto,"A Conversation between Balaji Srinivasan, Joseph Lubin, and Vitalik Buterin on the Future of Ethereum and Web3 (July 29th)",1626984357,0,1
oplw8i,twigwam,"Reddit just announced they are scaling their community points token project on Ethereum's Layer 2, Arbitrum",1626984313,4,1
oplo7m,carloscancab,"Want to know what to bet on? Insurance will be the next big trend in DeFi. Not only will we start to see platforms incorporate it into their systems, it'll also make crypto a lot friendlier for the super-rich and the institutions.",1626983674,3,1
ople28,vitaliketh,Ethereum 2.0 Release date,1626982831,0,1
opl649,dgon94,Better than Branson &amp; Bezos baby hop on,1626982176,0,1
opl1dm,SiameseMemories,DC family can't access $5.8M cryptocurrency wallet &amp; asks for help,1626981772,4,1
opkurx,Jimbley_Neutralon,The Bankless BED Index has launched!,1626981233,2,1
opkulf,ShondraRiemann,Vitalik Buterin Wants Ethereum to Innovate Beyond Just DApps,1626981218,23,1
opk4u1,nicky_papagiorgio,Reddit Rolls With Arbitrum to Scale Its Ethereum-Based Community Points System,1626979172,1,1
opjpfz,ShotBot,Do you think the whole premine/ICO launch will forever haunt the image of Ethereum?,1626977936,0,1
opj5gq,Rip_Dip_Skip,EIP-1559?,1626976343,0,1
opj4aw,bench4rench,"BTC, ETH, XRP, DGB, COMP, XLM — Technical Analysis July 22",1626976245,0,1
opiz3d,fleixx,DeFi is just a new way to speculate and to make money out of thin air - Change my view,1626975827,0,1
opitlc,Liberosist,Scalability Race (July update),1626975370,2,1
opia7t,limitedkp,Losing Money on Alt-Coins Really Made Me Appreciate Ethereum,1626973836,0,1
opi9zk,TobiHovey,JP Morgan Gives Wealth Management Clients Access to Ethereum Funds,1626973817,19,1
opi627,Objective-Limit-9064,London fork kommt!,1626973503,0,1
opi5rg,jarins,Scaling Reddit’s Community Points with Arbitrum,1626973479,157,1
opi1fv,SleepIZweak,"About 100 of these alerts from Crypto.com, all the same thing few minutes apart 😂🤷‍♂️ they just keep coming. I was excited at first 🤣💎🚀📈😵‍💫",1626973156,10,1
ophyhi,fluffyallergy606,Celer officially launched the mainnet version of cBridge,1626972916,0,1
ophxsj,flychicken2008,Setup Price Alert for Rebound,1626972859,0,1
ophru0,sasha_sh,State of Stake vol. 53,1626972391,2,1
ophn2b,TylerStewartYT,"For those who don’t have a cold storage wallet yet, you can get 30% off the ledger nano s when you vote for your favorite dApp.",1626972023,1,1
oph3kx,infinite_block01,Infinite-EOS fake deposit (hard_fail status attack) red warning details disclosed,1626970464,0,1
opgyrz,Dogemomo,Don't know why Chinese like ETC that much,1626970091,12,1
opgwtr,Professor-Quiet,Noob to NFT's with question,1626969939,2,1
opgr8i,Levidaniel99,Nucleus Vision on Twitter,1626969523,0,1
opgkh1,iBlowAtCoding,What incentives Ethereum as a whole to provide a platform for DApps?,1626968990,0,1
opgk5c,blackhawk9090,Question on Finding New Projects,1626968965,0,1
opgiov,Hanzburger,Privacy on Ethereum,1626968853,0,1
opfydc,brantlymillegan,number of unique Ethereum accounts that hold at least one ENS name just passed 100k,1626967195,4,1
opfy0e,WigglySausage,Who Pays Transaction Fees,1626967165,0,1
opfwzz,malonesweet001,SWIFTCOIN IS THE BEST,1626967085,0,1
opfrxl,DailyGweiBot,Conference Culture - The Daily Gwei #296,1626966670,3,1
opfpbk,Several_Lifeguard_13,"Does anybody know about the product where you can bet that ""Impermanent Loss"" would be bigger than fees earned on Uniswap v3?",1626966461,0,1
opfc7y,Rainmakerman,"JPMorgan just became the first big bank to give retail wealth clients access to cryptocurrency funds. Yes, that JPM, James Dimon's bank, the “i will fire every employee who touches Crypto” bank.",1626965403,48,1
opf6fn,twigwam,Ethereum Smart Contract plugins -- Ledger Blog,1626964904,2,1
opf4am,datasmash,Hey babe. What's Ethereum?,1626964718,3,1
