id,author,title,created_utc,num_comments,score
ovn6e2,Needle_NFT,Rainbow – ultra rare 1/1,1627799383,0,1
ovn24w,Ok_Force_8976,Newbie - buy ETH today or wait post hard fork?,1627798775,0,1
ovmy39,SosseKun,Smart contracts,1627798199,0,1
ovmibc,Cockroach_Mobile,What platform were these sold on?,1627796035,0,1
ovm9xx,hamsandwich_god,App offering ethereum,1627794933,0,1
ovm1fa,Left-Development-125,"Ethereum cost probably won’t hit $5,000",1627793870,0,1
ovkz3z,thelastbuttsnorkler,"It reads: Transaction XX failed! Error: [ethjs-query] while formatting outputs from RPC '{""value"":{""code"":-32000"",""message"":""intrinsic gas too low""}}'",1627789073,0,1
ovkxzc,Apocalypse_Junkie,Who is collecting NFTS?,1627788942,0,1
ovkjl6,aidfarh,Do you prefer that Ethereum use Proof of Work (POW) or Proof of Stake (POS)?,1627787216,0,1
ovkeqm,Jimmyglaughlin,Boom baby!,1627786655,0,1
ovke27,VirtualRobot,Must you have a large amount of sum in starting to invest in crypto?,1627786573,7,1
ovk97l,PrudentWater,Are you paying more fees to send from BSC to ETH than ETH to ETH,1627785961,7,1
ovjybr,jujubeads81,Best crypto tracker?,1627784655,0,1
ovjitf,troythedefender,"Whether you like him or not (I’m a fan actually), Kevin O’Leary has been giving Eth some good mainstream mentions lately. He thinks Eth will always be #2 though, and calling it silver to Bitcoin’s gold isn’t quite the best descriptor either, but mainstream coverage is good either way.",1627782837,40,1
ovjaua,Ok_Point4820,ETH… 200x in 5 years not a bad return 😉 Notice that if you bought in summer 2017 and held to summer 2019 you would have gained nothing. But conviction and patience &gt;&gt;&gt;&gt;&gt;&gt;,1627781868,13,1
ovj96r,profullstack,wen 3k?,1627781669,0,1
ovj84d,Farge43,Polygon is hosting an AMA with Bree Yin from Darwinian. Ask questions within,1627781542,0,1
ovinjl,PhilixSlaxis,Celebrating Eth 2.0 &amp; breaking static barriers,1627779163,10,1
ovimp3,Lija_2016,Just lost 150$ buying ETC. Instead getting hundreds of thousands of ETC i only got 0.000 something. As if I invested 0.0001$. Can anyone explain this transaction?,1627779061,5,1
ovikex,Dstrada94,Hey Bulls! Who Needs One Of These Cool Tees?,1627778795,0,1
ovijn0,Frooij,How stoner cats lost collectors $800k in 35 minutes,1627778706,0,1
ovij02,SubstantialForm0,"Is there any way to purchase Ethereum without ID Verification, with paypal?",1627778637,0,1
ovics3,Fronkalicious,Storing illegal or highly morally questionable content is very very cheap on ethereum,1627777907,0,1
ovi8x8,TheFronkler,Storing illegal or very morally questionable content is very very cheap on ethereum right now,1627777483,0,1
ovi6bm,TheFronkler,Storing illegal or morally questionable images or content on ethereum is very cheap even at current gas levels.,1627777197,0,1
ovi1j7,-EzW,Liquidation of real-world assets used as collateral,1627776672,0,1
ovhf3k,blockgraze,Congress is Trying to Push Through Terrible Crypto Regulation,1627774284,85,1
ovhez5,StellaKarr,"Polygon(Matic) Listed on Kraken - Deposits, and trading now available for USA, CA and AUS!",1627774270,0,1
ovh68z,theofficialmascot,‘Ethereum Giveaway’ most blatant scam ever ☠️,1627773333,12,1
ovgpzu,Always_Question,Janet Yellen's Treasury Department is Behind The Sneaky Insertion of Anti-Crypto Language Into the Infrastructure Bill,1627771605,295,1
ovgpy9,debbie4400,Ethereum 2.0 Includes Major Changes That Could End Bitcoin's Blockchain Dominance,1627771601,0,1
ovgkzp,PhatFaceMat,Where do I buy asic miners?,1627771087,0,1
ovgcfg,EmmettHernandez44,Nice one,1627770198,0,1
ovgaz1,CravingBeaver,Selling First NFT - 69 Ethereum!?,1627770050,0,1
ovftnf,Ag3nt047,Mining Rig With 6 Nitro Sapphire RX 580 8GB,1627768302,0,1
ovft7r,Ag3nt047,Mining Rig With 6 Nitro Sapphire RX XFX 580 8GB,1627768251,0,1
ovfstf,Ag3nt047,Mining Rig With 6 Sapphire RX 470 8GB,1627768212,0,1
ovfpp0,Dieselpump510,Who else sees Ethereum everywhere they go?? Let’s get back to 4K and beyond!!,1627767890,13,1
ovfk4t,itschris,How to stay up to date on the bleeding edge?,1627767328,0,1
ovfio7,Idreadme,ETH Compatible BCH Sidechain Smartbch Successfully Launches Three Nodes – Technology Bitcoin News,1627767180,3,1
ovf3g5,Ykay1st,AMP Coin | AMP Staking | How AMP Works | AMP Token,1627765702,0,1
ovf2tn,Any_Equipment692,Does anyone own a mining cave rig? I can't get HiveOS to find it.,1627765640,0,1
ovf1i4,Any_Equipment692,Does anyone own a mining cave rig?,1627765513,0,1
oy7alw,Reza-Gol,For traders out there!,1628127253,0,1
oy78he,Brazilifia,Anyone heard of hi.com? Just found them. Looks like a credit union on Ethereum?,1628127044,0,1
oy6tcj,seanyo,EIP-1559 Updates Across the Blocknative Mempool Data Platform,1628125575,1,1
oy6jju,BouzyWouzy,Sending ether from one exchange to another - first time,1628124600,0,1
oy6ii1,KarateKid84Fan,Ethereum EIP 1559 explained! (don't believe everything you read online),1628124491,2,1
oy6gtg,[deleted],My contribution to the community,1628124318,0,1
oy6dzf,TheFronkler,Are there any mobile wallets that implement a light client?,1628124026,0,1
oy6atc,FutureWillingness8,Simple quastion,1628123716,0,1
oy614j,grey_hawk77,It’s about that time,1628122791,38,1
oy5tuv,xBinKz,ETHEREUM EIP-1559 RECAP can’t believe it’s tomorrow. We’re so close! 🎉,1628122075,8,1
oy5ct4,Strongest-There-Is,Experience or advice accepting ETH as donation for animal rescue/shelter or other non-profit (US)?,1628120475,0,1
oy5cq9,ruckusx,Senate is trying to sneak in crypto regulations in the infrastructure bill. Please call you Senator and let them know your against it.,1628120469,0,1
oy5cf8,Yipikaye-,Will it be possible to stake Ethereum held in a Contract,1628120438,0,1
oy55xx,Crypto_Creepa,You're telling me this is going to be fixed by tomorrow? If I come back and attempt the exact same transaction it should be pennies as opposed to nearly $150?,1628119833,12,1
oy4xf0,sandygws,7 years on... and still so much promise. This is just the beginning.,1628119111,12,1
oy4v4h,jose_lb,Half hash rate RTX3060,1628118907,0,1
oy4lp2,Haryyy12,Ethereum - The London Upgrade,1628118053,0,1
oy4faa,acab520ac,Bip39 / Erc 20 Hardware Wallet,1628117491,0,1
oy3x2p,stan0402,ETH transaction expiration timer,1628115892,0,1
oy3wvq,BrigadierAngus,Share this with everyone you know.,1628115878,0,1
oy3u6z,[deleted],https://www.coindesk.com/uruguay-crypto-bill-legal-tender-juan-sartori,1628115639,0,1
oy3q8i,KungfuMonkeyKing,Nice numbers update from coingecko,1628115296,2,1
oy3q1d,No_Alternative6084,London Fork,1628115277,0,1
oy3myn,HoustonHeffnr,UNIO DROPS IN 3 DAYS,1628115008,0,1
oy3m9w,holddodoor,"When ethereum goes up, will all my shitcoins go up too?",1628114948,0,1
oy3jpd,Njoiyt,Just stumbled upon something called Ethernity. Is this a complete rip off of Ethereum and NFTs?,1628114715,8,1
oy3e25,ShondraRiemann,Ethereum (ETH) Will Overtake Bitcoin (BTC) Depicts Pantera Capital CEO,1628114233,0,1
oy36mf,Jeanooo,First block with an ERC-721 token inside?,1628113601,0,1
oy2vcc,sn3ll_,Building Blockchain Tools Devlog - TokenTools.App,1628112645,1,1
oy2uy2,twigwam,Ethereum's 'London' hard fork: What it is and why it matters,1628112612,1,1
oy2qrt,rephxsun,Is it just hopeful thinking or does it seem like Ethereum is gaining momentum on Bitcoin?,1628112292,0,1
oy2qaw,tickletaylor,"Untamed Isles, a New Zealand based MMORPG will spearhead the play-to-earn genre. Their motto is ""Game First, Crypto Second''. Players can, but will not be forced to engage in wallets and are able to trade freely using in-game mechanics and auction houses, without the need to involve blockchain.",1628112256,31,1
oy2p35,halebass,"Largest bug bounty ever, this really says a lot about The Graph. I hope more protocols will follow in their footsteps.",1628112159,0,1
oy2oij,ShondraRiemann,USDT Use on Ethereum Decreases During Asia’s Daytime Hours,1628112113,0,1
oy2aks,Bggnslngr,Eth paper wallet options,1628110971,0,1
oy25wi,2x4the1x,Why not? I mean it's as good as gold in my opinion.....,1628110610,0,1
oy22rj,VLADIMIROVIC_L,Why is Ethereum being scaled with rollups and not state channels? Are state channels better suited for only payments or do they suck more generally.,1628110364,0,1
oy1vpf,ef_esp,Still time to apply for Road to Devcon meetup and event grants!,1628109784,0,1
oy1o0i,ClementeWeigandt,Do you think that Ethereum reached a new floor from which it took off? I got the alert at crowdsense.ai,1628109177,0,1
oy1jju,BITTAH99,Just bought $100 using Paypal,1628108837,0,1
oy16v1,ChangeNow_io,Cryptocurrency Consensus Algorithms - Cryptocurrency Educational Article,1628107842,0,1
oy15tq,sandygws,Best place to stake ETH? (other than Crypto.com),1628107759,0,1
oy127l,ItsAConspiracy,The infrastructure bill could make mining and staking illegal in US by imposing reporting requirements they can't meet. Some senators just proposed an amendment to fix it.,1628107468,8,1
oy1107,fokaiHI,Catch a little aurora in the pendant,1628107359,20,1
oy0s0k,Mr_AAG_,Woman in hat - Pablo Picasso (Woman in hat),1628106665,0,1
oy0pv2,Maleficent_Wrap_7725,Weekly Discussion Thread,1628106487,0,1
oy0nco,rreinhart,I love ethereum and building dApps and I want it to succeed but…,1628106287,0,1
oy0mry,rreinhart,I love ethereum and building dApps and I want it to succeed but…,1628106241,0,1
oy00og,tentemptationFanPage,"Hey guys I found something pretty important with ETH, thought I’d share it with the family 💯 I also support and will make more vids on THETA, Vechain, HOT, BTT, ANKR and others! You can request any coin. Just leave a like and share, so more people can gain TA knowledge for free 💎",1628104503,1,1
oy00o1,Sea_Pie_7285,My MetaMask was hacked and I need help finding out how,1628104502,0,1
oxzsbp,carloscancab,"Reddit, meet one of your own! r/Cryptocurrency moderator and Monero Community Organizer, Justin Ehrenhofer, sits down to talk about the MOONs rollout, fighting manipulation within the sub, DeFi surveillance systems and, much more. It's always great to see this space full of amazing people!",1628103840,0,1
oxzrzd,Ykay1st,Robinhood Vs Coinbase | Trading Experience | Deposit Methods | Security,1628103812,0,1
oxzqr1,shibarocket3,Trying to get a quick answer (Can you send USDC to a bitcoin wallet&gt;?)),1628103714,0,1
oxzqot,Last-Anxiety6438,The Digital Yuan could grow up to 5000% this year.,1628103709,0,1
oxzmuc,Tylanmon,proof of stake,1628103415,0,1
oxzlfj,Clean_Eyes,EIP-1559,1628103310,6,1
oxzeqt,therdai,Ape got a Rocket Tattoo,1628102810,0,1
oxze51,T3nt4c135,Do hard forks generally cause the price to rise or fall?,1628102765,0,1
oxzaxb,dmihal,"It's just a few hours until EIP-1559 launches! 🔥 I built ETHBurned.info, a website that lets you count-down until the upgrade, and track the total ETH burned after it's live! 🙂",1628102511,30,1
oxzaws,yenachar,"Senators Propose Exclusion of Miners, Software Developers from Infrastructure Bill's Crypto Reporting Requirements",1628102510,4,1
oxz9kr,yenachar,Contact Your US Senators to Support the New (Today) Amendment Narrowing Crypto Reporting Requirements,1628102400,9,1
oxz8pr,FrecklePower83,🚀,1628102335,1,1
oxz7oa,Tempus_Finance,Wen Fixed-Rate ETH 2.0 Staking?,1628102255,0,1
oxz799,Safe_Ad415,Libonomy Introduces Cross-Platform,1628102224,0,1
oxz5iv,HodlDwon,"EthHub Weekly #177: Ethereum turns 6, EIP-1559 week, Binance winds down derivatives, StarkEx 3.0",1628102086,0,1
oxz4q7,FrecklePower83,Hodl,1628102026,0,1
oxyvtr,MrINTL1,Need help converting BabyStarL into eth.,1628101354,0,1
oxyrhu,MaterialOver1804,How to mine ETH quickly. Learning by NFTs.,1628101022,0,1
oxyoit,jahidhasan9521,A truly interoperable blockchain - Libonomy,1628100790,0,1
oxyo8y,Happy_Key_4368,Nftmusic,1628100768,0,1
oxyo5j,fightforthefuture,"UPDATE: Last week, news broke that hidden within an upcoming must-pass infrastructure bill was a cryptocurrency provision that would expand US government surveillance of cryptocurrency. Today, an amendment has been introduced that will address this issue, but every Senator need to hear your support!",1628100760,0,1
oxyetc,selfhash,Question about EIP-1559 fork,1628100067,5,1
oxy8c3,teddy31,Real Estate and the Ethereum ecosystem,1628099584,0,1
oxy25o,Steven44323,Energy Mining Comparison Of Different Blockchains,1628099101,0,1
oxxuyr,shaze2,"Only 5,000 blocks remaining",1628098535,277,1
oxxuku,nethermindeth,London Upgrade is happening TOMORROW but what comes along with it?,1628098503,0,1
oxxtb0,TheGoalFIRE,Is London Hard Fork Giving users Free Ethereum?,1628098405,0,1
oxxspm,MORSHEDA,A truly interoperable blockchain - Libonomy,1628098363,0,1
oxxqil,ezra3x3,A good video to watch for the people with paperhands.,1628098203,0,1
oxxpzc,ezra3x3,Reminder for the people with paperhands tomorrow,1628098163,0,1
oxxnbu,Cryptophilatropist,Invest in a Premium Cryptocurrency Domain Today! Parting with some of my portfolio:,1628097966,0,1
oxxl43,dkkc19,I think this image is proof enough that Polygon is necessary for Ethereum and is arguably the future of Ethereum. What do you guys think? I see no other alternatives,1628097811,7,1
oxxjmm,dkkc19,Polygon's gaming landscape has grown exponentially last month,1628097694,0,1
oxxhn2,sepke12345,Ethereum update called London will take place around August 3-5,1628097536,0,1
oxxay7,stratguy56,Breaking Down NFT Game Axie Infinity and How Taxes With It Work,1628097024,1,1
oxxaj0,Rubenoswky,Walmart Checks,1628096993,0,1
oxxa2s,OperationMassive1682,AAX Savings Interest rate up to 20% !!! Earn now . No other exchange does this,1628096959,0,1
oxx9mc,krish882006,Do Miner (Noob) have to upgrade anything after EIP 1559?,1628096925,0,1
oxx77r,Lmao_vogreward_shard,"EIP idea: Expanding ERC-721 NFT's with corresponding rarity, semi-fungibility and randomness.",1628096744,0,1
oxx0sy,Jimbotastic777,The psychological flipping is occurring before our eyes. It is Ethereum that is dictating the direction of the whole market to include the Big “B” today.,1628096277,2,1
oxwz7w,slavik0329,The Ethereum Attestation Service (EAS) now has an explorer live on testnet!,1628096162,2,1
oxwwbi,jahidhasan9521,Libonomy Has Interlaced With Bitcoin &amp; Ethereum,1628095934,0,1
oxwnmk,CaptainJim27,Rigs for Sale on eBay,1628095258,0,1
oxwdwr,Andriana_J,Ethereum has bright future,1628094523,0,1
oxwdq3,AultruisticEthnist,401k dump,1628094510,0,1
oxvtdm,Rydoom,What is Axie/Axie-box and is it a scam?,1628092944,0,1
oxvoho,Friendly_Shame_4229,The current main use of NFTs are today’s beanie babies of the 90’s. Prove me wrong.,1628092585,0,1
oxvnbs,TO0easy,Stonks,1628092501,0,1
oxvlw2,ghost1307,Any idea why the fees are so high? $59.34 to transfer $120 is kind of high. (Not talking about Ethereum Price just the fees.),1628092389,61,1
oxvcc8,DEFALT762,"Guys someone stole my eth yesterday, idk how its possible i didnt get any notification from my wallet.It's the dumb qn but anyway can i recover it coz its my 5month mining revenue",1628091625,17,1
oz3psx,chiangwen,Why Ethereum declined my transaction and froze money,1628244408,0,1
oz3m3u,Funkoala,[NOOB] USDC to ETH or withdraw to bank account,1628243941,0,1
oz3eoq,Rainmakerman,"Out of the top 100 banks by assets under management, 55 have invested in cryptocurrency and/or blockchain-related companies. Banks being like: If you can't compete with them, just buy them.",1628242883,9,1
oz3d37,barkinglong,Mining on EIP 1559,1628242636,0,1
oz3ctd,sportifynews,Ethereum Crypto News: What Is the ETH London Hard Fork? 9 Things to Know,1628242598,0,1
oz3crc,CorrineSomers,Ethereum 2.0: London Upgrade Success Brings Fresh Hopes for Upcoming Merge,1628242591,0,1
oz3c6s,CryptoKing858,ETHEREUM 2.0,1628242513,0,1
oz35f9,Spezgart,Gas fees,1628241562,0,1
oz2smy,ConsciousAuthor3117,Anybody wanna explain to fellow 1m redditors who doesnt understand what burning eth mean real quick,1628239721,0,1
oz2sml,Left_Rich_681,""" Ethereum is becoming ultrasound money "" : ConsenSys founder",1628239720,0,1
oz2pck,Ill_Home_5985,RARX Airdrop Live,1628239217,0,1
oz2mh6,Prior-Buy-1627,Questions from a noob.,1628238779,9,1
oz2bpf,darshitdodhiadd,Gas fees and hardware wallet,1628237239,5,1
oz2b59,Mr_Tommy777,Hodl and get rich,1628237162,0,1
oz2akq,OptimalBit5,NFTMart will Airdrop the NFTs of Chinese Opera Mask Plus to StaFi Community,1628237081,0,1
oz259r,Margol_Man,Fireproof waterproof box/bag for paper phrases,1628236345,0,1
oz1zfm,C4-PO,JPMorgan now offers clients access to six crypto funds,1628235506,1,1
oz1z6e,economicsdesign,ELI5 What are Perpetual Futures ?,1628235469,0,1
oz1y3o,GreatFilter,Simple Reporting Compliance Mechanism,1628235308,2,1
oz1x1k,ScopeTV-be,What do you think about my creation?🙂,1628235157,9,1
oz1rsd,PeacockMamba,"Over $10 million in Ether burned. Over 4,000 tokens. Thank you to the Ethereum team for all of the hard work on the London upgrade. 🙏🏻🙌",1628234454,37,1
oz1p1r,PeacockMamba,Over $1 million dollars in Ether has been burned. Some people just want to watch it all burn! 🔥,1628234030,2,1
oz1oml,I_amNND,PSA for all ETH holders in USA.,1628233969,0,1
oz1h8d,sexyama,Vitalik Buterin sings Bitconnect song with Carlos Matos,1628233016,5,1
oz1guy,[deleted],https://www.youtube.com/watch?v=utD1qGyVWrQ,1628232972,0,1
oz1arg,trymeouteh,2.0 wallets and exchanges,1628232167,0,1
oz14zi,debbie4400,Ethereum mining still profitable.,1628231390,0,1
oz10tp,AOFEX__Official,"[XNFT Goes Live on AOFEX, to Distribute 30,000 XNFT] Reward has been Issued",1628230833,0,1
oz0std,TesticularVibrations,Warner-Portman bill,1628229779,0,1
oz0rdb,rsg1234,POS question,1628229617,0,1
oz0ppx,AOFEX__Official,u/ethereum mainnet has completed its London upgrade,1628229407,0,1
oz0nqb,Futuristic-Lawyer,Ethereum's interoperabiliy?,1628229157,0,1
oz0n8s,Futuristic-Lawyer,Ethereum's interoperability with other blockchains?,1628229087,0,1
oz0muc,Futuristic-Lawyer,Ethereum's interoperability with other blockchains?,1628229033,0,1
oz0j2y,Solodeji,Vitalik Buterin: London Hard Fork Success Gives Me More Confidence over Upcoming Chains Merge,1628228547,2,1
oz0aly,sportifynews,Over $9 million Ether burned following Ethereum London hard fork as network gears up to ETH 2.0,1628227488,1,1
oz07rx,ReitHodlr,The new-ish people's money.,1628227123,0,1
oz03x8,jakkkmotivator,"Vitalik Buterin: ""The London Upgrade Is Proof That Ethereum Ecosystem Is Able To Make Significant Changes, Which Makes Me More Confident About The Merge”",1628226642,256,1
oyzy7a,IPR0310,Getting feedbacks about this Ethereum Converter Calculator i developed,1628225974,2,1
oyztv2,AngryCusstomer,Senators in USA chosing war against PoS and DeFi,1628225462,0,1
oyzgmk,Needle_NFT,Colored triangles – ultra rare 1/1,1628223931,0,1
oyzeu9,Cross54321,Is the same amount of eth minted every day and given out to miners or does the amount created change every day?,1628223729,0,1
oyz1g3,anandaverma18,Over $2 million worth of ETH burned since the London upgrade,1628222277,2,1
oyz0vz,schnieds,Quick &amp; easy way to reject the Warner-Portman-Sinema amendment in the US infrastructure bill,1628222226,11,1
oyyruw,dado3,Are the rewards per block going to change after moving to POS?,1628221250,0,1
oyydsl,ThankstheLord,Question regarding eth 2,1628219764,0,1
oyy8cc,yenachar,"Tonight Senators Warner and Portman are Pushing a Last-Minute, Confusing, Disastrous Change for Cryptocurrency in the Infrastructure Bill",1628219197,50,1
oyy3kd,steelgrey_niomi,Do I need to upgrade my cold storage MEW after the fork?,1628218738,0,1
oyy2hy,DarkestChaos,"LIVE! - ETHEREUM Burns THOUSANDS Of ETH, As London Hard-Fork Successfully Completes (Crypt0's News)",1628218627,3,1
oyxnod,SwagtimusPrime,"If you're from the US, it's time to save crypto from the desastrous infrastructure bill amendment. Call your senator!",1628217112,0,1
oyxlju,SwagtimusPrime,"If you're from the US, it's time to save crypto from the desastrous infrastructure bill amendment. Call your senator now!",1628216900,1,1
oyxib6,dizzylight,The gas fee is surging,1628216590,0,1
oyxeqq,pcn2002,Maybe a Dumb Questions,1628216215,0,1
oyxbbs,DaughtersCompany,Top 6 Logical Reasons to investment in Cryptocurrency,1628215857,0,1
oyxb4f,DaughtersCompany,Myths of Cryptocurrency,1628215834,0,1
oyxayy,DaughtersCompany,Top 12 Advantages of Cryptocurrency Over Fiat Currency,1628215816,0,1
oyx3eq,MiguelS__1411,Crypto Guard,1628215075,0,1
oywykb,Shadowkingszz,🎵 Audius The Decentralized Music Streaming Platform,1628214572,0,1
oywy4c,Shadowkingszz,🎵 Audius The Decentralized Music Streaming Platform 🎵,1628214524,0,1
oywnja,vagueLifeLucidDream,A popular meme which every crypto newbie should watch!,1628213409,0,1
oywn5q,LogicB0mb_,I made a free crypto news and watchlist app for iOS. Any feedback is appreciated!,1628213374,0,1
oywgk8,hail_damage,HODL,1628212696,0,1
oywg0u,LCpl-Sham-ALot,Me trying to use dApps as a new ETH user,1628212644,89,1
oyvyz5,Lumpy-Initiative-779,🤔,1628210983,211,1
oyvvi0,FreakingCrumpets,What cryptos do u guys see as a store of value. I want to put money into something at a steady rate with a good 10 year outlook. Currently I’m in on BTC ETH ETC ADA SOL and LTC. If anyone who is deep into this space has any opinions I would love to hear.,1628210637,0,1
oyvqnj,spaceducknektar,"With this recent spike in value 4 months after the last (even bigger) spike, should we expect another 2 year drop like in 2018? Or will we go to the moon this time?",1628210151,28,1
oyvq6f,Lewandabski710,London Bridges Falling Down,1628210103,3,1
oyvm5i,FruitBunker,Buy the rumor; sell the News examples,1628209693,0,1
oyvjf8,ShrimpyApp,Does this do a good job of explaining the Ethereum Fundamentals?,1628209436,1,1
oyvh80,Clean_Eyes,The world’s second-biggest cryptocurrency is rallying more than bitcoin,1628209209,7,1
oyv7cj,DrRenegade,"When I bought them they were both $250 each, this is the firat time since buying that both are worth the same",1628208267,8,1
oyv2iv,Marcod0111,mining crypto while working from home,1628207833,0,1
oyv22v,AngiospermousBus,First turkish influencer joins Predator's family!,1628207793,0,1
oyv0rx,JomadoSumabi,Transaction completed but I’m not seeing the funds.,1628207682,0,1
oyuza4,Familiar-Judge1833,YOLOING THE FCUK OUTTA ETHEREUM,1628207547,0,1
oyusxn,seanyo,Preliminary findings about how EIP-1559 is impacting gas prices,1628206960,2,1
oyurf1,queefchef_69,Gas price question,1628206814,16,1
oyuqko,DecentTemperature384,"Follow the Burn Rate of ETH due to EIP-1559, here:",1628206731,0,1
oyuirm,mvandemar,The ethereum burned appears to be consistently greater than the transaction fees?,1628206018,0,1
oyuhk8,wafflez77,Only Ethereum HODLers understand,1628205907,8,1
oyuhcb,Huntercap1128,I need help understanding eth burn,1628205886,0,1
oyttjx,Illustrious_Comb1498,After the 2.0 the gas fees change automatically in the NFT pages?,1628203718,0,1
oytrua,thefoodboylover,Mistake makes rare NFT of $69k be sold for less than 1 cent,1628203557,14,1
oytr5y,Bluemandegen,Block fee,1628203495,0,1
oytmyx,AyyyyLeMeow,Should I stop mining with the new update out now?,1628203116,0,1
oytan7,Adventurous_Ad3003,"1,477,916.69 is the approximate number of ETH that will be burned per year. At the current rate of 2.81ETH per minute 🤯",1628202029,31,1
oyt6zd,REDDIT-IS-TRP,hey is there anyway to send tokens to multiple addresses at once?,1628201703,0,1
oyt5yn,Bear_Rhino,Ethereum Founder Says Upgrade Sets Stage for Energy Usage Cut,1628201609,4,1
oyt418,BrianAtSantiment,"Ethereum's Dominance of Discussion Among Crypto Projects Hits a 3-Month High in Tandem With the London Hard Fork &amp; Price Surge to $2,840",1628201442,1,1
oyt1uu,BrianAtSantiment,"Ethereum's Dominance of Discussion Among Crypto Projects Hits a 3-Year High in Tandem With the London Hard Fork and Price Surge to $2,840",1628201246,1,1
oyt0wo,cinoya,VolnaFX - ForexStore.org Dowload Best Free EA ForexStore,1628201166,0,1
oyszon,Prestigious-Assist58,OH WE'RE COMING BABY!!!!!!!,1628201057,2,1
oys8po,trogdortb001,Investigating Crypto Twitter Scam Bots with a Honeypot,1628198772,5,1
oys7vk,IntelligentCan4,"WallStreetBets Launches Synthetic Tesla, Apple And Amazon Stocks On Its Decentralized App Aiming To Be 'Crypto Robinhood' For Retail Investors - Benzinga",1628198703,133,1
oys428,Deep-Cycle-1019,Will gas fees fall with London?,1628198385,0,1
oys1qf,Artistic_Dwilko,This is a Joke... $35 transaction fees,1628198196,11,1
oyru6s,trent_vanepps,Misconceptions about EIP-1559 causing high fees,1628197590,15,1
oyrow5,levi97zzz,What is this smart contract that burn more eth than opensea and uniswap??,1628197162,2,1
oyrotj,CuilHandLuke,What happens to the ETH I have mined below the payout threshold? Is it gone?,1628197154,0,1
oyr8zi,Scooterrrrrrr,Hacker stole my eth.,1628195852,1,1
owqaoj,PlentyInvestigator69,I won a ehtereum giveaway and i don't know what to do with my ethereum,1627945737,0,1
owq2wx,TheRealDrakie,What does the new update plan to do for etherum?,1627945065,0,1
owpoe3,SnooMuffins2840,Staking all your ETH or just some ?,1627943804,0,1
owpm8r,duckgoquacky,Upcoming update,1627943609,0,1
owp4wz,GaryMedel5,"Crypto Weekly Review &amp; Outlook July 26 - August 2, 2021",1627942108,0,1
owoqy7,stanmilc,ETHEREUM UP!!,1627940952,0,1
owofjr,Even_Teacher_8865,http://bit.do/crypto-rank,1627939993,0,1
owoesq,carloscancab,(Long) (OC) What are DAOs good for? Data scientist and architect analyses this model and its use cases,1627939928,0,1
owo7fk,twigwam,Opensea Surpasses over $1 Billion in Cumulative NFT Volume -- Messari Research,1627939299,0,1
owo566,twigwam,Changes Coming in Prysm V2 Stakers Need to Know -- Prysmatic Labs,1627939115,1,1
owo4jr,twigwam,Changes Coming in Prysm V2 Stakers Need to Know -- Raul Jordan,1627939063,0,1
owo04z,Vegetacrypto,Eth 2.0 yo,1627938717,551,1
ownf3g,Perleflamme,Focus on use cases first instead of mechanisms first,1627937035,0,1
owmxwn,s618o,"Vswap (Valkyrie Network), Automatic Token Exchange On Ethereum - Get The App, Earn VAL Tokens!",1627935608,1,1
