id,author,title,created_utc,num_comments,score
p3lxwm,ddavis711,"Hi, can someone teach me how to day trade with Ethereum!? Or in crypto in general. I’m tired of holding 😅 work like to make something every week",1628856017,22,1
p3lt67,noname2xx,Access ETH transactions for analytic purpose,1628855468,0,1
p3lsd3,Happy_Key_4368,Jax,1628855369,0,1
p3lm0a,BlaiseGlory,Now I understand NFTs,1628854581,196,1
p3ldan,Impressive_Resident7,TokenAmulet,1628853499,0,1
p3l8e1,lavucci,Can someone explain what are these and the whole think about it? I see these more often?,1628852910,16,1
p3l77r,r_314d,Blockchain transaction filter,1628852769,0,1
p3l5vw,SmartFatass,I created GUI for easier mining setup,1628852593,2,1
p3kuek,DappRadar,Ethereum At the Center of the Decentralized World,1628851127,0,1
p3ktjt,TheEyesss,Crypto heist hacker returns $260m of stolen Ether tokens,1628851014,0,1
p3ktdl,ThisSiteRocks,Bought 3 ETH yesterday and now this sub makes me regret it.,1628850990,0,1
p3kr6t,jarsanxa,Looking for investor/manager,1628850688,0,1
p3kot9,rollingincrypto,Rep. McHenry opposes SEC Chairman's plan to exert more regulation over the Crypto industry,1628850366,7,1
p3kiyk,Shokty,PolkaDog,1628849561,0,1
p3kfpv,Ellipal_official,What are the common solutions for failed ETH transfers?,1628849101,0,1
p3kfpf,C4-PO,Happy 21st crypto ETF filed for 2021 with Kryptoin’s ‘Ethereum ETF Trust’,1628849098,1,1
p3kcjj,AOFEX__Official,Layer 2 Ethereum scaling solution Optimistic has released the contract simulation,1628848668,0,1
p3kbv5,RoyalKend,📌 We would like to inform you that the 3rd round of the Private Sale will start on August 14th,1628848569,0,1
p3k7qu,Solodeji,Cardano Creator to Anthony Pompliano: Ethereum (ETH) Is Better Than Bitcoin (BTC),1628847981,5,1
p3k76b,ThatsKori,Permabulls NFTs,1628847902,0,1
p3k1nh,sepke12345,Nearly 3 million Ethereum addresses connected to DeFi,1628847093,0,1
p3jvwt,tony0295,EIP 1559,1628846246,2,1
p3jva1,tony0295,EIP 1559,1628846152,0,1
p3js1v,[deleted],Know About Ethereum Staking and How Does It Work in Making Profits,1628845665,0,1
p3jjhl,Bulliish,xDai for transactions - help,1628844409,5,1
p3je79,NeedleworkerNo2874,Vitalik in motion pictures ( My NFT on opensea ),1628843591,3,1
p3j70a,EmergencyMoose8283,Ethereum JavaScript API- web3.js,1628842513,0,1
p3j4ul,Mynoncryptoaccount,In the event of mass validator slashing,1628842184,4,1
p3i2it,bigdichenergy,Thoughts??😆,1628836840,504,1
p3hcig,Needle_NFT,choi seung hyun – ultra rare 1/1,1628833381,0,1
p3haz1,lucky_ela,ETHEREUM! NO POTENTIAL AFTER 2023? ETH PRICE TARGET,1628833179,8,1
p3h9b2,hridoy104,POLKAPARTY,1628832964,0,1
p3h5u2,hridoy104,FederalMoney,1628832534,0,1
p3h5c1,BloodSilvers,Will proof of stake still burn ether?,1628832476,0,1
p3gwng,Massive-Design-4563,Bridging Matic to ETH - help,1628831418,0,1
p3gm1k,Ethan312004,I was finally able to get my online store to accept ethereum! ⬇️,1628830170,3,1
p3gbkq,jai_gulani,What is actually staking is?,1628828966,0,1
p3g92e,dxdifr,"Surge Ethereum was Born yesterday. Surge is a new class of crypto. It a huge breakthrough in crypto an it's in its infancy. Created by a math wiz....designed to be anti rug-pull , and designed to be mathematically impossible to lose value against its paired asset.",1628828675,1,1
p3g5lj,shwascop_crypto,2 gpu RX 580 62.26MH/s - almost 60C running 24hs … Do you think the GPUs will die soon because it’s too hot ???,1628828273,0,1
p3fd34,AlphSai1996,Thoughts about zilliqa?,1628825125,5,1
p3dzft,ShotBot,This just sold for a million dollars. Am I missing something here? What is the value in a random jpeg?,1628819834,894,1
p3dwpd,chased05,How would you invest $1800,1628819541,37,1
p3dry7,ogwebby,I tried to depo some of my etherium onto a crypto gambling site but sent it as BEP-20 and they say they only accept eth sent through the ether network. Is there any way to recover.,1628819031,0,1
p3dimt,Honest_Poor_Man,looking for free sites to publish white papers,1628818074,4,1
p3derh,ItsDesTV,Help with gas fees and interesting find?,1628817650,0,1
p3de7r,economicsdesign,What is a Flashbot ? | Crypto 101,1628817598,0,1
p3dd23,Comfortable-Low6683,New Transaction Type?,1628817474,0,1
p3dbkj,DuoXmachina,Play2Earn shooter featuring The Wicked Craniums NFT! Join our Discord today for more info,1628817322,1,1
p3d99v,Ok-Machine-1223,DAO/Governance token staking,1628817097,1,1
p3cwx1,DMTwolf,DeFi appreciation post - LOOK HOW FAR WE'VE COME!! These numbers blow my mind,1628815828,15,1
p7g3ih,BrianAtSantiment,"Ethereum's Mean Dollar Age Curve is Flattening, a Good Sign For a Bull Run Reoccurring",1629383886,3,1
p7fyf1,acidsiefer,"Play Games, Earn Crypto &amp; More on That-Hill!",1629383429,0,1
p7fu0p,Bk_dude_in_florida,Beer Inu !,1629383029,0,1
p7ftpj,Peter-Bruce,https://ecobitcoin.io/ BTCE will be the most important invention in the history of the world since Internet. https://t.me/OfficialBitcoinEco,1629382998,0,1
p7fqeb,sasha_sh,State of Stake vol. 55,1629382704,2,1
p7fq9i,Zbks,Premine,1629382692,14,1
p7fn3k,RubenDuncan62,Ethtrader,1629382396,1,1
p7fm7x,DailyGweiBot,State of the Wallets - The Daily Gwei #316,1629382313,2,1
p7f32a,TheAnabolicDiet,HOPR Community Update 18.08.2021 + Live Q&amp;A,1629380550,1,1
p7f1bp,Grade19282,Google fired 80 employees for abusing user data and spying on people,1629380383,0,1
p7eulr,C4-PO,"Ether already ‘flippening’ Bitcoin, says Celsius CEO",1629379728,17,2
p7elqb,Nuewim,"I was banned from bitcoin subreddit for promoting shitcoins ( so for them everything else, even ethereum). Are you here more open for different opinions and discussion? What for example you think about ADA, is it shitcoin for you?",1629378816,40,1
p7efj1,Bibil85,Can I Ethereum stake in NYC?,1629378218,0,1
p7eapi,Cameracrispy,Looking for ETH wallet recommendations for Canada.,1629377782,0,1
p7e3yq,Michellerose6834,Ethereum Balance on Exchanges Drops to Lowest Levels Since 2018,1629377086,4,1
p7e333,kingLife24,"Hey everyone, so I’ve got a titan cold storage in the last week or so, and been transferring my assets to it, I stopped with ETH due to not being able to see it actually land in my wallet, it says it has left Coinbase and what not, wondering if anyone has advice or had similar issues",1629376997,0,1
p7dx3v,moabitsaga,"""The Balance is Within"" original artwork",1629376359,0,1
p7dpq6,maxman72go,"Ethereum Co-Founder Vitalik Buterin Tells Bloomberg TV Why He's 'Skeptical' of Twitter's Jack Dorsey, and Facebook's Mark Zuckerberg...",1629375584,55,1
p7do32,socalquest,"Bitcoin is king of crypto, but Ethereum’s ascent to the top of the cryptoverse seems unstoppable. ETH will continue to outperform BTC in 2021 and will, ultimately, exceed its rival’s market value. Longer-term, ETH could hit $17,810 by the end of 2025. I’m LONG &amp; STRONG 💪 65 STAKED ETH! GLTA!!!",1629375400,2,1
p7dayh,hexayurt,"Ethereum’s culture, climate change and xrisk: can the World Computer save the world?",1629373899,4,1
p7d9n4,OxygenPernell,Is Axminers.com a reputable miner site?,1629373740,0,1
p7d9df,Withyourfeetintheair,Vitalik helping billionaires with their bags. Not cool.,1629373711,448,1
p7d3v5,YasminResnik,"Ethereum Dominance Climbs Up, While DeFi Sector Getting Close to ATH of Total Value Locked",1629373071,0,1
p7d3sv,CoinjoyAssistant,Ethereum Dominance Climbs Up While DeFi Sector Getting Close To ATH Of Total Value Locked,1629373062,0,1
p7cppt,Happy_Key_4368,Nftmusic,1629371277,2,1
p7c5md,pratikgandhi,DeFi Yield Farming Masterclass,1629368653,1,1
p7c259,Outji,Mod from r/Bitcoin explaining why Ethereum is a scam. Cringe,1629368175,7,1
p7bswm,Swagga82,SafeTrade BTC withdraw fees Lowered to 0.0004 BTC,1629366900,0,1
p7bmy0,wslyvh,"useWeb3 · a curated overview of the best and latest resources on Ethereum, blockchain and Web3 development. Learn through tutorials, courses, books, videos, games, challenges, or,..",1629365998,5,1
p7bjgo,wslyvh,"useWeb3 · a curated overview of the best and latest resources on Ethereum, blockchain and Web3 development. Learn through tutorials, courses, books, videos, games, challenges, or,..",1629365503,0,1
p7bex6,banksied,Stop underestimating NFTs.,1629364859,32,1
p7b2qe,crypto_pub,Vitalik Buterin brain keeps getting bigger,1629363159,0,1
p7b21h,pepae,In-Depth Explanation of How Shutter Prevents Frontrunning,1629363058,2,1
p7azfl,ExtensionSinger4154,Flash Loans Explained | Animation,1629362694,0,1
p7asod,C4-PO,Ethereum’s rise to No.1 crypto ‘seems unstoppable’ says deVere Group CEO,1629361691,12,1
p7aq68,imarcog29,Ethereum 2 Education?,1629361314,0,1
p7ajiw,cool_cool_guy1,🧐,1629360325,3,1
p7afdm,chaseraxx,I have a serious question. Why can 100+ millionaire/billionaire whales get in a group chat then dump and pump at will? Why doesn’t every crypto have a 10% selling/buying fee to prevent this from happening?,1629359706,37,1
p7abgi,navi9x,Who's with me in this bloodbath?,1629359086,6,1
p7a48f,ChaoticRationalist,How I can Stake ETH in India?,1629358018,6,1
p7a3y6,ShotBot,The future of dapps is not on blockchain.,1629357975,8,1
p7a3y3,Mindless-Taste-3238,Cyberpunk Girl #001 NFT,1629357975,1,1
p79amd,MoistConcert420,The Problem with Ethereum,1629353926,15,1
p799ie,Needle_NFT,Camila Cabello – ultra rare 1/1,1629353782,0,1
p78xnk,biologist1,Slowly moving towards 1 ETH,1629352221,9,1
p78pe9,theguywhoisright,The Mod that recently tried to call Ethereum a centralized pile of garbage Ponzi Scheme banned me from r/Bitcoin a few months ago for calling out his pitiful attempts to compare the energy consumption of the worlds banking system to Bitcoin.,1629351136,65,1
p78lrn,cmstrump,What Is Staking Crypto - How Does Staking Work (Guide),1629350681,2,1
p78lmb,reqgul889,What's the profitable strategy that you stick to?,1629350662,3,1
p9hkga,Seriously_Relax,"Nothing like a virtual rock sale to make you question the crypto market. At the end of the day, kudos to those who recognized the potential of NFTs before anyone else did.",1629655795,5,1
p9hi8c,chapogrown,"This #NFT rock was sold for 125ETH, approx $4,11,392 😳😳😳 #nftrock #crazyNFT #NFTauction etherrock.com",1629655609,13,1
p9hf7q,Dhiri24,I got this nice nft for sale right now (good investment) check it out show some love ❤,1629655353,5,1
p9h5wj,After_Ad_3093,I tried to turn my Unicorn token into Unicorn meat thru the ethereum Unicorn meat grinder; One less Unicorn in existence and no Unicorn meat in exchange. What did I do wrong? And is there any way to retrieve my Unicorn or the Unicorn 🍖?,1629654590,0,1
p9gyvb,Difficult_Island_897,airdrop,1629654007,0,1
p9gulh,jahidhasan9521,A truly interoperable blockchain - Libonomy,1629653638,0,1
p9gt2k,jahidhasan9521,The HOW TO OCSC DEMO,1629653510,0,1
p9grge,jahidhasan9521,Energy Mining Comparison Of Different Blockchains,1629653377,0,1
p9ga9b,bumblebrutis11,Want to transfer ETH to hardware wallet but the fee is crazy expensive,1629651886,25,1
p9g4z5,SheLikesKarl,"I’m stoked for the future of the Ethereum network and ETH for financial freedom. I know I hold this on robinhood so I’m slowly migrating to Binance. Diamond hands, until I can sell partial to buy my mom and sister a house.",1629651453,12,1
p9fzot,El-Coco-No,Question about NFTs,1629650985,4,1
p9fplb,i_have_chosen_a_name,How can the price on a uniswap pair change if one of those tokens is only listed on DEX and not on CEX. How can there be price discovery without arbitrage?,1629650075,4,1
p9fp64,Steven44323,The HOW TO OCSC DEMO,1629650037,0,1
p9ffhw,jerry297,Long Story Short!! Ethereum is nailing with its upgrade!!,1629649188,24,1
p9felk,JohnTravolski,Transaction missing on Etherscan?,1629649109,5,1
p9fdv5,Leyten28,How to buy ethereum with bank transfer? (with the least fees possible!),1629649043,20,1
p9falg,TimDaub,Intellectual Property Will Become Irrelevant,1629648758,2,1
p9f6wl,Joeymhmjr,Hahaha kinda true,1629648422,21,1
p9eo0u,ourlifeintoronto,"Hackers hit Japanese crypto exchange, steal nearly $100 million",1629646741,4,1
p9enh3,Jake10873,What's the best and safest way to earn interest on my ETH?,1629646695,28,1
p9emzu,tradermakemoney,How Trader Journal Helps You to Improve Your Trading. Part 2,1629646653,0,1
p9eml1,tradermakemoney,How Trader Journal Helps You to Improve Your Trading. Part 2,1629646615,0,1
p9eeqc,Netskyz,What's your strategy to get to 32 Eth?,1629645913,13,1
p9eel6,chris_redz,best sources to learn,1629645901,14,1
p9eekk,Tahmid_0007,Where and how is an NFT stored?,1629645899,6,1
p9edpy,Aware-Load4204,scam that is actually pretty good,1629645821,0,1
p9ecrb,Tahmid_0007,Tx Fee vs NFT minting fee,1629645731,2,1
p9e75v,DhruvKumarJha,"Built ERC20 Token Generator for Ethereum using React JS, Ethers JS, React Router &amp; Recoil JS",1629645239,0,1
p9e6iv,101100101000100101,Will miner fees drop in the near future?,1629645184,5,1
p9e60e,MiltonDuncan25,Ethereum,1629645140,0,1
p9e3zt,pbmajor,Anyone ballin tryin to cash out on my opensea store,1629644962,1,1
p9e3nt,DanMards,"If you had to keep one ERC-20 token with your ETH, which one would it be?",1629644931,14,1
p9e1qx,WisePage43,Claudio Freidzon | Domingo 22 de agosto 11:30 hs | #RDRentucasa,1629644758,0,1
p9dxw9,Rubenoswky,Cheap Checks Order,1629644420,0,1
p9dtbw,Abject_Impression_95,Opensea wallet.,1629643987,0,1
p9dsbu,darkstarman,Bitcoin user can't imagine that Ethereum burn might be pumping EVERYTHING,1629643892,4,1
p9de7p,Full-Equipment6506,XircusNFT airdrop,1629642451,0,1
p9dcy5,ChalsFO,Worth have a look.,1629642316,3,1
p9dcfn,TheBearWillEatYou,How decentralized is Etherium?,1629642258,3,1
p9da3b,cln998,https://bit.ly/3iBcFYI,1629642011,0,1
p9d3ys,vinodpandey7,Ethereum Takes Number 1 Spot from Bitcoin (ETH Is Making Fortunes),1629641400,0,1
p9d1y5,Streetmetals7,"Don't put all your direction and investment into Bitcoin, Ethereum is also a good one to look out for, if you want to make it this big message me now or add up Mr Kelvin smith a financial advisor and crypto expert on WhatsApp +19706600349",1629641189,0,1
p9d1f4,unsettledroell,Lightning with Ethereum,1629641131,14,1
p9cz94,Dating_As_A_Service,Should I stake?,1629640899,0,1
p9cr3l,OkraBear,Axion AXN lets you stake tokens and EARN BITCOIN &amp; GET AIRDROPS!,1629640028,6,1
p9cmpf,Enum1,"Kraken has a ETH2.s to ETH trading pair to trade staked ETH to unstacked ETH. Should I just buy some staked ETH there and get a discount instead of clicking ""stake""?",1629639547,21,1
p9ci1d,carvalho24,Eth in the next 4 hours go to the moon,1629639035,8,1
p9ci0x,Enum1,"Is staking 'safe'? If no: why do people do it, if yes: why not everybody(who HODLs)?",1629639034,16,1
p9cbvd,MasrikDahir,ETH 2.0,1629638340,0,1
p9bh8y,Happy_Key_4368,Slinkydoge,1629634768,1,1
p9bg58,TheYoungStardust,How ethereum improvement proposal works?,1629634632,0,1
p9befa,Duahau21,Good project,1629634435,0,1
p9bb2o,SimulationRambo,Price predictions per ETH in next 3-5+ Years ?,1629633997,4,1
p9b5x8,PristineMusician04,How does Ethereum Improvement Proposal works?,1629633344,0,1
p9b0d6,keatonhj,ETH transaction failed due to too low gas limit or ran out of gas,1629632576,26,1
p9b07s,JackHat_,XircusNFT,1629632554,0,1
p9azox,CryptoHoxton,3327 Web 3.0 Summer Camp,1629632477,0,1
p9az5x,saddit42,Hard gas limit - Why is this necessary? Haven't miners been quite conservative with the block gas limit in the past?,1629632407,8,1
p9axwe,Sea-Shop7164,Please come to follow me. Thank you.,1629632232,0,1
p9ao5j,Doodlz_NFTartist,Snazzy Ethereum NFT shill for collectors and ETH enthusiasts. An “Ethelephant” never forgets!,1629630833,0,1
p99wf4,Artless_Dodger,"1,500 year old Mayan Eth Hodler",1629626753,4,1
p99t22,watdotcom,Alternatives to Wyre?,1629626243,2,1
p99qye,calatravo1994,Daily created amount of ETH today (POW) vs. ETH 2.0 (POS),1629625892,0,1
p99q74,calatravo1994,Daily created amount of ETH today (POW) vs. ETH 2.0 (POS),1629625771,0,1
p99no9,baicha124,US ambassador to Slovenia; and businesswoman Jessica Taylor,1629625379,0,1
p99mvh,CarnegieWatermelon,ENS Question,1629625251,0,1
p99lw7,CarnegieWatermelon,ENS Question,1629625102,0,1
p99i4q,Lickmytongue77,The Ethereum FUDBuster - An Attempt 1,1629624502,36,1
p99htl,ttbal,I think Ethereum has become an elitist blockchain,1629624451,26,1
p99exx,kayaknile,Minted some cool art on Rarible please go over and support me. Thank you.,1629623974,2,1
p999oo,cryptouf,"For French speaker, or translators users: Se lancer dans la Defi - How/Where to start on Defi",1629623163,3,1
p990bw,Kvindvr,"This project is good, need to look it! https://bit.ly/3iBcFYI u/xircusNFT #xircusNFT #BSC #BinanceSmartChain #Binance #PancakeSwap #DeFi #YieldFarming #Bitcoin #cryptocurrency #blockchain",1629621685,0,1
p98wxq,Intelligent_Smoke_80,Is it pointless to buy ether or any other crypto currency now?,1629621144,17,1
p98wu2,Crypthomie,"People only say Eth, because they can't spell Etheriuem properly.",1629621128,373,1
p98wci,C4-PO,Unicorns in crypto: A growing herd of billion-dollar crypto companies,1629621052,5,1
p98vga,According-Common5075,ethereum free,1629620920,1,1
p98mc8,Ancient-Jaguar1527,Help … NVML MISSING … anyone having same problem I’ve got 8 1060 cards and only 5 working now …. Many thanks for help in advance,1629619507,7,1
p98iqm,immortalbentley,2.0,1629619006,3,1
ozu4d4,Cuckertarlson315,Is ethereum a buy right now? How far do you think it will go before it plummets again?,1628346012,22,1
oztyp1,kinglatin74,Maybe it’s me,1628345466,34,1
oztret,Rubenoswky,Cheap Checks Order,1628344778,0,1
oztq90,ne174,How I feel about Eth right now,1628344657,1,1
oztcyx,Flat_Respond_5289,when you wake up to 3k ETH,1628343285,0,1
ozta6m,efakyazan,Xircus Project,1628342992,0,1
ozt8xu,dkkc19,"I want to start developing with the Ethereum technology, I'm hoping people could help me out and point me in the right direction",1628342867,0,1
ozt3wz,Flat_Respond_5289,Me every time I’m tempted to buy more ETH,1628342319,0,1
ozsqyw,itsblockchain,2.4 Million ETH could be burned by the end of 2021 and price can hit $10k sooner than you think,1628340949,13,1
ozskeu,Vesuvius803,Explain the new Crypto Bill proposal to me like I'm 5 (condescension a must),1628340216,137,1
ozsiut,alexhartman21,Value of eth as “digital oil”,1628340045,0,1
ozsb2f,sjalq,"Guys, you're killing me with this senate boot licking! We are here to END them!",1628339104,0,1
ozsa16,PortCity_MadMan,Anyone else feel like James Tiberius Kirk? I do!,1628338968,5,1
ozs9gm,ulTron91x,Waiting for 4000$… ETH is on move. 🚀🚀,1628338898,12,1
ozs8yx,LoneWolf124875,"Gas is too damn high, and $250 for a $27 conversion is ROBBERY",1628338839,59,1
ozr3hi,cosims2,Ethereum Ornament [Fan Artwork],1628333297,6,1
ozqzb7,_BeholdThePaleHorse,2miners Min Payout still not recieved after 12 hours?,1628332665,0,1
ozqj53,ShotBot,"Craig Wright calls out ICOs, Chainlink, Defi, for being total scams",1628330233,6,1
ozqi3e,acidsiefer,Create Your Own Mining Operation &amp; Earn Real Crypto!,1628330081,0,1
ozqfp7,mikee3000,"Eth on the raise, despite bad news from Washington",1628329711,4,1
ozqeol,Ituglobal,"Ethereum Sustains Recent Rallies as Bulls Target the $3,100 High",1628329558,0,1
ozqczr,BlaiseGlory,It’s time,1628329296,1,1
ozqakf,Firm_Information_307,$3000,1628328937,1,1
ozq438,mohit_habeeb,"Folks, 3000 IS HERE! Give me your predictions for the high this bull cycle !",1628327948,1,1
ozq0s8,tripanto,Eth 3k,1628327440,0,1
ozq0qs,AsianRiceBall,We reached 3k boiz,1628327434,7,1
ozpzq4,Levidaniel99,https://youtu.be/z_ZGivoNlbA Nucleus vision website is full of new information and design is so cool. I have checked it. If you haven't check it now 😍 - https://www.nucleus.vision/,1628327276,0,1
ozpx6g,joyjit_pal,Is the Ethereum really ultrasound money?,1628326888,0,1
ozpx41,joyjit_pal,https://www.reddit.com/user/joyjit_pal/draft/f6a02678-f75d-11eb-82c3-8a811d13f829,1628326878,0,1
ozput6,ChallengeAdmirable28,RARX Airdrop Live,1628326555,0,1
ozpr50,m10r-vc,Multifarm.fi just launched a yieldfarm search engine to find the best farms for any asset,1628325983,0,1
ozpjr2,fritson1,Gab,1628324842,0,1
ozp4k7,Old_Afternoon3853,"Ethereum Overtakes PayPal, Bank Of America, Nike, And Pfizer In Market Cap As Proponents Set Their Eyes On Bitcoin",1628322554,0,1
ozp1dm,carbonetti,can i set gas limit to 21000 withdrawing slp?,1628322097,0,1
ozowve,Minute_Reflection_65,"Just logged into Coinbase, look at all this 2’s! what are the odds!",1628321441,0,1
ozoudv,AddyProf,ETH WITHDRAWN OVER SMART CONTRACT,1628321082,0,1
ozorbg,I_cant_stop,Coinbase created a page that automatically generates an email to send to your senator to vote YES on the Wyden-Lummis-Toomey amendment and NO on the Warner-Portman amendment,1628320645,45,1
ozomna,AngryCusstomer,Fight back code anonymous,1628319981,2,1
ozom7v,AngryCusstomer,Fight back. Code Anonymous.,1628319922,19,1
ozo9mc,Affectionate-Brain67,ERC20 tokens,1628318174,0,1
ozo8dh,Beal5,EIP and ETH 2.0,1628318002,0,1
ozo2uw,ToTheMoonBoyz69,Scam that got me ! Running again rite now ! Don’t send anything people !,1628317216,0,1
ozo180,Needle_NFT,floral squares – ultra rare 1/1,1628316994,0,1
oznpwl,Medium-System-2986,Ethereum Santa Action,1628315427,0,1
ozncb2,F0ckHedgefunds91,"I am not American, but I wish I could help you waking up those Senators, who have no idea what they are actually doing with supporting this horrible ammendment. Share this all over their twitter, send per mail, call.. NOW!",1628313612,52,1
ozn9ev,Medium-System-2986,Everyone could be Santa ETH :),1628313248,0,1
ozn3gf,sportifynews,Could Ethereum's 2.0 Overhaul Threaten Hive Blockchain?,1628312497,3,1
ozmule,Happy_Key_4368,Jax,1628311406,0,1
ozmu63,ehwhynot-,All this burning is doing great things!,1628311350,10,1
ozmsx1,Important-Stop9341,💎📈🚀,1628311193,0,1
ozmgza,slash_sin_,Can I make NFT from memes which I am not the original artist for? Most memes are just taking images online and slapping text on it. Is this legal?,1628309760,0,1
ozmb8d,Zhuyi1,The energy of some BTC maximalists right now regarding the Infrastructure Bill,1628309094,3,1
ozm8t9,codknobbler,Baller Friday. It's been a good two weeks.,1628308831,2,1
ozm5fs,flwr_blue,https://flwr.blue 🌸 We now accept ethereum. Plant a tree with every purchase 🙏🌲,1628308457,0,1
ozlz6r,AlpineLux,Senate Vote,1628307730,0,1
ozlkwv,CaptainHardhead,Gas Fees!,1628306102,0,1
ozliqg,Temwell3,Charles Hoskinson gives insider info about what's going on behind the scenes with the crypto bill,1628305847,0,1
ozl9as,InterestingFun5472,Apparently we can't talk about eth upgrades here... So yeah go ETH... Hope this doesn't get taken down 🙄,1628304780,0,1
ozkwqa,InterestingFun5472,I plan to invest weekly on ETH. These new upgrades are GOLD. Glad to add a stable coin to my portfolio 🤣🤷🏾‍♂️,1628303375,0,1
ozkd5i,FLAlex111,Elon: “This is not the time to pick technology winners or losers in cryptocurrency” - A disaster is looming in the US for Crypto,1628301205,164,1
ozkcct,SignificantAd8888,🚨 LIVE AMA 🚨 DIREWOLF X UNTAMED ISLES ERC-20 NFT GAMING MARKETPLACE,1628301115,0,1
ozk70l,alamadrid19,"Hello everyone, we need help to diferénciate which function called transfer in our token. StackOverflow question link",1628300511,1,1
ozk1jm,asfan_muhd,ethereum scam expose,1628299921,7,1
ozjywf,runescaperulesok,3k todayyyyy,1628299623,0,1
ozjfqm,C4-PO,Venezuela to launch Central Bank Decentralized Currency in October,1628297492,6,1
ozj7hi,AOFEX__Official,AOFEX's Treatment Process for Users Affected due to Abnormal Data of Perpetual Swap Trading,1628296505,0,1
ozirc3,Old-Disaster-8220,Can you send an erc20 token to an erc777 smart contract address?,1628294785,0,1
ozioqd,cryptochamber7,Disruptive Passive Income,1628294519,0,1
ozilyo,hawperify,Implication of Rollups?,1628294249,0,1
ozilxn,norgan,What is needed for these upcoming forks/changes,1628294245,0,1
ozii4v,AdKey3180,Hahahja,1628293835,32,1
ozigyh,tijuanasso,Derp,1628293718,2,1
ozig4q,AngryCusstomer,War against Ethereum,1628293637,0,1
oziepc,AngryCusstomer,USA War against Ethereum,1628293488,0,1
ozi8jj,JupiterIcee,Has anyone come across recent non-crypto based companies utilising NFTs? Digital assets or tokenising physical assets,1628292860,0,1
ozhymj,Scared_Ass,"I accidentally sent $7,901.10 to this address (0xa0b...eb48) by mistake. I have no idea how this address got switched with the one I thought I copied and am 99% sure its not malware. Can anyone help tell me what this address is or who owns it?",1628291890,34,1
ozhk9s,OTK22,I run a small e-commerce company using SquareSpace. Is there an easy way to integrate payment via ether into my SquareSpace website?,1628290537,0,1
ozhffr,baroskius,Life changing crypto stuff for sub-developed countries (and developed ones) Re-post,1628290059,0,1
ozhbuj,MerchantOfValhalla,The Summer of ETH,1628289711,9,1
ozh9hq,PaulFidika,US Federal Government is run by clowns,1628289482,237,1
ozh2vu,Urbasm,Genesis mining is screwing me out of my ETH,1628288832,0,1
ozh1xn,hawperify,Implications of Rollups,1628288747,0,1
ozgz7k,USA-DE-PT777,Please read and call your Senators and share!,1628288497,20,1
ozgys2,rayykz,This may be a dumb question but...,1628288459,0,1
ozgykp,EZIssue,What makes your portfolio tick?!,1628288442,0,1
ozgtfw,RagnarokMX91,block 0 transactions,1628287969,0,1
ozgr8t,wocloud,Why does the network need to burn eth after EIP 1559,1628287760,0,1
ozgczh,GenreChord,The Original Heath/Genre Chord NFT Art for sale on Rarible.com,1628286475,0,1
ozgb3d,spiritualloop,We can literally see the creation of the future in front of us🤯,1628286306,5,1
ozg4fb,stanmilc,"3 weeks to hedge fund launch, 2 new Saas by EOY, 12 new coins getting added to CryptoHawk by EOY!!! Launch Initiated!! 🚀💎🙌🏻",1628285705,0,1
ozg2iw,SeaEmeraldCS,Gas prices are alittle rough right now,1628285531,27,1
