id,author,title,created_utc,num_comments,score
oudcha,Castcle,What is your opinion for decentralized social media for cryptocurrency users should be,1627617859,0,1
oudc7v,FamousAstronaut2153,Coinbase staked ethereum 2 trading.,1627617828,0,1
oudbzl,fritson1,Hanks' Execution Agony. A must watch and share now.,1627617801,0,1
oud65y,cinsolidarity,Looking to move somewhere with a thriving Ethereum community,1627617200,0,1
oud112,Vishnu675r,Breaking out,1627616652,0,1
oud051,levi97zzz,Stoner cats NFT,1627616557,0,1
oucqu8,kido_blockchain,"ViaBTC | Ethereum Improvement Proposal 3675 Launched on GitHub, Ethereum 2.0 Upgrade Is in Progress",1627615559,0,1
oucj1a,Ocilla,Ethereum fork?,1627614718,0,1
ouc7zu,tussNpuss,I met Vitalik today but didn’t have a pen or paper so he signed my notes,1627613557,12,1
oubpgg,Darcy8231,*UNI #BUYBACK BSC TOKEN,1627611596,0,1
oubov8,abc_reddit_xyz,Staking ETH on allnodes,1627611532,0,1
oubd7d,CitadelDefender,Ledger just dusted,1627610296,0,1
oubbph,twigwam,Overview of JSON RPC changes related to EIP-1559,1627610132,0,1
oubany,twigwam,L2 Kwenta Alpha Live,1627610018,2,1
oub4f4,abc_reddit_xyz,MEW offline txn,1627609340,0,1
oub1an,twigwam,Geth Workshop 2021 -- Optimism,1627609007,1,1
ouar9o,XtheLizardKing,Staking on coinbase: can you choose the amount to stake?,1627607954,0,1
ouanom,twigwam,Ethereum Network on Pace to Settle $8 Trillion in 2021,1627607583,7,1
ouan2e,twigwam,Connecting Metagalaxies with Ethereum -- Ethereum and NFTs can prove pivotal in actualizing an open Metaverse!,1627607513,1,1
ouam9g,swn999,ETH - This is the way.,1627607428,0,1
oualmb,AD1AD,KushyDreams.com now accepts Ether! [Smokable CBD products],1627607362,0,1
oualj2,twigwam,Half A Million Black Female Developers To Be Trained By 2030 To Tackle Diversity In Blockchain,1627607351,11,1
oua9f5,ShrimpyApp,Do you think DEXs have a chance against exchanges like Coinbase?,1627606079,13,1
ou9zc0,Psychological_Shirt,"Ethereum Breaks 200,000 Validators Milestone, Over $14 Billion Now Staked In ETH 2.0",1627605012,156,1
ou9l4r,twigwam,AllCoreDevs Update 005 ⛓ -- Tim Beiko,1627603538,1,1
ou9h3f,Zappa4Eva,Badgeth NFT Art Contest - 10.5k GRT Rewards,1627603141,0,1
ou96f2,kennylienhard,Another Cat-mania Clogged Ethereum—but is Welcomed!,1627602066,6,1
ou93tx,anonymousxo,Is there an easy way to import my holdings into Excel via a Coinbase Pro API?,1627601816,0,1
ou8x8w,Empty-Dark2988,What is your price prediction EOY for eth,1627601186,0,1
ou8m96,carloscancab,"STEM++Inno data scientist interview on crypto, DAOs, Ali Baba Blockchain Adoption, Wyoming Laws, NFTs and AI. Very cool, nuanced perspectives on these issues from a non-cryptohead.",1627600158,0,1
ou8iuy,beleeee_dat,How to build an Ethereum mining pool,1627599830,5,1
ou8drg,CryptoTreasureLLC,New ETH Products with crypto checkout,1627599373,0,1
ou89k4,Due-Candidate-4202,"WINTER has teamed up with Uhive, so should you. Early Registration Rewards Available Now. Download https://www.uhive.com/invite?c=UV656Z Usa este código: UV656Z",1627598969,0,1
ou835e,AussieFinanceGuy,Tim Denning: Ethereum Is the Most Important Technology Since the Internet,1627598352,0,1
ou7u0j,Huck90Finn83,Ethereum ❤️ Dogecoin,1627597512,0,1
ou7rt8,KryptoKryptic,No-loss lottery protocol PoolTogether leads Fortune Magazine’s featured story on DeFi,1627597309,6,1
ou7k7v,mrsotkogaming,BitBoy Crypto Channel Deleted As Youtube Goes On Random Spree,1627596634,1,1
ou71ov,SimulationRambo,12 hour transaction pending on etherscan… how long until it just fails? Don’t see a way to stop it ?,1627594952,0,1
ou6sfz,Danny-God,"Tezos 2,500,000 Smart Contract Calls in July",1627594123,1,1
ou6gua,cjcgyf3819,Michelle White mihailgavrilov99,1627593127,0,1
ou6gmt,TheLastCact1,Best wallets for Ethereum?,1627593111,0,1
ou621n,Biliklok,EthCC[4] hackathon: private voting for Humans (on Starknet),1627591859,0,1
ou61s0,tradermakemoney,How trader journal helps you to improve your trading 🤔,1627591838,0,1
orwwdr,quefear,"DAOs: OpenLaw releases the Tribute DAO, MakerDAO completes its decentralization, Uniswap grants…",1627299382,0,1
orwuv2,andrytail,Report: 58% of Singaporeans own Bitcoin with 38% of them having Ethereum as the best investment.,1627299194,9,1
orwo0o,CorrineSomers,Portfolio Strategist: ADA Could Become Mainstream Crypto Alongside BTC and ETH,1627298348,0,1
orwko2,Arm1nasss,Found 10ETH on keys.lol,1627297930,0,1
orwdcx,Bagger55,Huge performance on ECB CBDC blockchain test.... (cross-posted),1627297051,0,1
orvqlt,angelbud6,Hi morning,1627294053,0,1
orvqbv,sportifynews,Ethereum looks more attractive to crypto traders than Bitcoin in the current recovery,1627294016,2,1
orvk4f,Timziito,"Moving funds onto MyConstant, Nexo, BlockFi?",1627293182,0,1
orvb07,johnfrancoisdr,Sending ETH from Australia to US,1627291884,0,1
orv0ue,Solodeji,"Ethereum 2.0 Validators Now Surpasses 200,000, Currently Holds Over 6.4 Million ETH",1627290439,5,1
orv0sj,sandymani95,Intelligent cryptocrrancy,1627290430,0,1
oruwe4,No-Hovercraft-44,Rinkeby ETH Faucet,1627289844,14,1
orutza,Fine_Ad4467,HashShiny - World's Leading Cloud Mining! New user get 5 TH/S (BTC) Hash Rate For Free!,1627289514,0,1
orusrc,Berlout,AI Art meets NFTs meets Vitalik Buterin,1627289336,2,1
orukmh,Jdtattoos11,Gas fee alert bot?,1627288168,0,1
orug8s,Technical-Virus_,Selling Ethereum stuff for Ethereum,1627287560,2,1
oru5nh,Blockchaindotsupport,EIP1559 - Easiest 2600% gains?,1627286101,0,1
ortxx0,Technical-Virus_,Selling 3D printed Ethereum stuff for Ethereum.,1627285038,1,1
ortiap,Tall-Macaron-8248,Just started with ethereum today hoping for the best! Put $135 in. My address is 0x82383b3975E811ADCB8a5372a27Ed38A008D5bf,1627282992,0,1
orthk5,Which_Condition9182,Xircus airdrop,1627282901,0,1
ortgz3,CrucifiedCrusader,Eth 2.0 Transaction fees,1627282831,0,1
orswfe,colekennelly,Volmex v1 is now live on Polygon!,1627280222,0,1
orsofm,AutoModerator,Weekly Discussion Thread,1627279211,204,1
orrug4,loneMokey,rinkeby test,1627275566,0,1
orrqxu,Lachy_2,Nice project,1627275148,0,1
orrlkr,loneMokey,rinkeby test coin,1627274524,0,1
orrl6u,Winnal,Corehash Protocol - Decentralized hashrate liquidity provision w/ HashFi - White Paper Released,1627274479,0,1
orrjs6,Needle_NFT,stick figure – ultra rare 1/1,1627274320,0,1
orqxgj,Least_Company,How much Ethereum do u guys hodl?,1627271857,0,1
orqrpd,angelbud6,Ethereum,1627271228,0,1
orqom6,angelbud6,Eth rising,1627270890,0,1
orqn65,mbiz05,How does metamask charge a fee on swaps without having considerable gas fees?,1627270724,0,1
orqlc3,angelbud6,Help? Eth?,1627270520,0,1
orqkaw,angelbud6,Eth spike? Big players read please,1627270406,0,1
orqk3u,Remote-Resolution-15,Ether to the moon,1627270387,0,1
orqixv,Niolong1,Amazon to accept Bitco,1627270260,17,1
orqb1f,Hewittjackson71,Investment,1627269393,0,1
orpzg7,Ceche,Yum yummmmmm. Crypto meat going up.,1627268164,2,1
orpoeq,levi97zzz,Failed when trying to send ERC-20 token (stETH) - Anyone know why this might be happening? I’m already make shre to have more than enough ETH for gas fee,1627266990,19,1
oroz2r,stavinlawrence,Do you think Amazon will accept Ethereum as a mode of payment?,1627264356,0,1
orolzo,ItWorkedLastTime,"Cleaning out old folder, found ""Etherium-Wallet"", appears to be version 0.9.3.2075. What files can I dig around for on my HD to see if I happen to have some ETH I forgot about?",1627262983,0,1
orojxm,Ok-Veterinarian3561,ETH trading volume just before 4K,1627262762,0,1
orojlb,Jimbley_Neutralon,The Bankless BED NFT (gif) for the launch of the BED Index,1627262723,1,1
oroa0o,nerdalert86,Tim Beiko Announcement,1627261724,85,1
orndci,zhiwenhuang,I created an Ethereum framework,1627258353,0,1
ormm5k,MakkeVee,Finnish reliability in a mining pool,1627255639,0,1
ormlux,brovbro,Is there a working Rinkeby faucet?,1627255612,0,1
ormjem,anxietyFlesh,Rarible Royalties,1627255381,0,1
ormgv3,No-Hovercraft-44,Rinkeby Ethereum Faucet,1627255155,0,1
ormfl5,comicstream,Any DeFi Protocol implementing Uniswaps Concentraded liquidity that also plans to add Limit Orders?,1627255037,0,1
orm9no,Crypto_kingz_777,https://m.youtube.com/watch?v=XrJiOOnYzwY missed doge but I found something much better easy 50-100x,1627254484,0,1
orm37x,gilquinobi,"Ether transfer not reflected. It says it's a ""contract"". What's going on?",1627253879,0,1
orlvxk,uniproposals,Any DeFi Protocol implementing Uniswaps Concentraded liquidity that also plans to add Limit Orders?,1627253229,0,1
orlup3,trizest,"IDEA: ""Exit waitlist"" for ETH2.0 stakes for those who want to exit.",1627253111,0,1
orls5m,ShotBot,The upcoming doublespend crisis coming from Richard Heart's Ethereum fork.,1627252867,0,1
orlmpi,Putrid_Champion3309,Any sites similar to Poocoin.app on eth?,1627252343,0,1
orldmh,PurpleRound4839,Great project,1627251540,0,1
orldfe,Gale_1,The future of crypto currency,1627251522,0,1
orl9mz,bdesmot,"Sold all my Ethereum but to only profit on a swing trade and will buy back in around 1,730.00",1627251188,0,1
orkty0,EclecticFit,Sean bean,1627249794,0,1
orkmmn,monokh,Ethereum Contract Creation - Explained from bytecode,1627249141,3,1
ork6a4,DapperClancy,"I have a few ETH and I've been trying to use it, however...",1627247715,0,1
orjqz0,SkitzWeb,"Bye-bye, bitcoin: It's time to ban cryptocurrencies",1627246397,35,1
orjji1,xiguy1,What is the best place to buy/hold Ethereum in Canada?,1627245746,0,1
orjimo,twigwam,"ETH 2.0 Surpasses 200K Validators, Now Staking $14B in ETH",1627245669,0,1
orj9vr,switchitoffx,opinions? :),1627244910,0,1
orifaw,ulTron91x,Mantra DAO – A passive income &amp; decentralized finance platform | Stake OM on Ethereum and Binance SC,1627242291,1,1
orhtxf,CarlisleBailey1,💲💲💲WhaleFall💲💲💲1️⃣0️⃣0️⃣0️⃣✖️ Opportunity🗝️🗝️,1627240383,0,1
orhqkq,N3obit,“Aurelion” is ready on my collection in @opensea https://opensea.io/assets/0x495f947276749ce646f68ac8c248420045cb7b5e/89434883103908495122051255838153193148136383363470594887490363313529773096961,1627240090,0,1
orhps9,Specialist_Operation,Uhmmm??,1627240020,7,1
orhnpr,Kratosgamerdude,ETH gas fee,1627239839,0,1
orhjb7,Dry-Molasses7611,Congratulation am so grateful I sent 0.02 BTC and got paid of 0.06 BTC instantly,1627239463,0,1
orhaxo,Killakoch,Staking Eth 2.0 living in NY?,1627238715,0,1
orgurs,ShondraRiemann,Nearly 1.65 Million Coins Are Gathered in the Last Six Days by ETH Whales,1627237274,8,1
orgeo5,consciouscell,Ethereum 2017 bullrun compared to 2021 - Anyone else seeing this?,1627235860,36,1
orgdcq,clashermegas,Vitalik Buterin youtube interview pulled moments ago,1627235743,0,1
orfzyt,baghaz,Nice airdrop,1627234594,0,1
orfyt3,Current_Bad42069,Someone tell me why/how ETH is better than EOSIO🤷‍♂️,1627234498,0,1
orfnyv,baily78123,The only thing stopping more people going bankless is the fees.,1627233568,0,1
orfmth,ShondraRiemann,Cardano (ADA) Vs. Ethereum (ETH): Which is Better to Invest?,1627233467,12,1
orfjk9,SnooTangerines4358,The DeFi Chronicle: Four reasons why DeFi will continue thriving,1627233184,9,1
orfh6a,y_angelov,The basics of Ethereum covered in 7 mins 👍 hope you find it useful (it's more relevant for newbies),1627232975,5,1
orfd6v,PaperImperium,"MakerDAO Speaker Series #3: Representative Ted Budd (of House Financial Services Committee) on Crypto -- July 28, 12:00 EDT",1627232623,5,1
orf34o,Marykate011,promotion,1627231754,0,1
oresjl,loserbmx,Bad journalism and GoFundMe scams at its best.,1627230795,5,1
orek90,zen4,Hardware wallet ok with chrome OS or android?,1627230069,0,1
orejai,debbie4400,Ethereum Cloud Mining,1627229987,0,1
oreeuo,ItsThaKingHomie,Hello.,1627229599,2,1
orea8h,ShondraRiemann,Ethereum Blockchain Fans Begin To Support Ethiopia,1627229183,6,1
ordzit,TrifBoi,Is it worth putting 100 € into eth?,1627228212,0,1
ordu3y,AdAny287,"Seed phrase centralization? My wallet, my keys, my crypto….not my seed? Please help answer some questions so I feel more at ease with my recent discovery.",1627227725,0,1
ordmsv,chrisdh79,"Ethereum 2.0 Surpasses 200,000 Validators",1627227029,83,2
ord30c,jklepatch,Royalties NFT smart contract with Solidity (Tutorial),1627225162,6,1
ord0dq,Icy-Spray-6675,Elon Musk - The DogeFather - ELON MUSKETEER,1627224893,0,1
orcqry,thefoodboylover,"JPMorgan releases Bitcoin, Bitcoin Cash and Ethereum funds to its customers",1627223978,213,1
orcp0m,jlariviere,slow confirmation?,1627223812,0,1
orcgv4,playgroundmx,How Do I Learn to be a Blockchain Developer?,1627223001,1,1
orc9is,skeptical-0ptimist,"Product proposal from an ethereum user (I can't make this, but if someone could I would use it!!) Re: wallet/address security",1627222281,0,1
orbuhd,No_Mathematician5345,How Crowdsense Empowers Crypto Investors with Early Intelligence,1627220786,3,1
orbsc9,BrianAtSantiment,"Ethereum's Top 10 Non-Exchange Whales Hit 5-Year High Holding Levels This Week, as Top 10 Exchange Whales Hit Lowest Amount Held Since Inauguration",1627220558,12,1
ohcik6,RipIntelligent2021,"$eRise is still coming, and EIP-1559 is on the way — Will you be investing in EtherRise when it becomes live?",1625893870,1,1
ohcgzx,SevenGlass,"What the hell is Ethereum, Jack?",1625893681,1,1
ohbttg,rootbank,Um. WTF?!,1625890884,11,1
ohbroh,Sudden-Importance-42,What’s your Daily Target (Daytrading Ethereum)?,1625890633,0,1
ohbatm,Crypto-Account,BTC and ETH prices 3 months apart,1625888702,24,1
ohb5gy,AD1AD,"Nav Marketplace now accepts Ethereum =) [beauty, baby items, random crypto paraphernalia]",1625888111,0,1
ohb3n0,dentlydreamin,Thanks for nothing?,1625887888,0,1
ohb28i,Strong-Hyena4564,Desktop wallet,1625887729,0,1
ohavmo,NoahsArkJP,Energy Use Question,1625886949,0,1
ohav60,FreedomIsNotFree777,Charles Hoskinson has joined the Board of the ETC Cooperative. How does this impact ETH?,1625886899,9,1
ohajzg,abcoathup,⟠ Latest Week in Ethereum News!,1625885722,2,1
oh9iws,MoCityTripp,Eth staking,1625881695,0,1
oh9g0c,EliteFlooring,Just thought I would show you why I am no longer a paper handed bitch and will diamond hand until they get cut off!!! Feel free to tell me how fuckin stupid I am! Also check out #eliteflooring_reno to see what I do to fund these kind of bullshit decisions 🤣,1625881388,0,1
oh91kv,cornfedmania,Colocation/datacenter for lease,1625879834,0,1
oh90gb,CryptoDeFinance,Sotheby failed to sell the jewel in the auction for crypto. It was sold for FIAT instead - Crypto DeFinance,1625879717,0,1
oh905y,FredericBastiat1801,"From Livestock to Bitcoin: ""Legitimacy"" and the Evolution of Money | Mises Institute",1625879688,2,1
oh8u80,dystopianmonke,I only see a blue pill...,1625879079,113,1
oh8u1q,MoCityTripp,Staking,1625879060,0,1
oh8b8q,yungazier,Is Ethereum too dependent on AWS and Infura?,1625877128,0,1
oh80lr,twigwam,Ethereum Core Devs Meeting #117 [ 2021-07-09] 💪,1625876066,0,1
oh7z63,PeacockMamba,At this point what CAN’T the Ethereum blockchain do? It’s only a matter of time until the Ether chain provides verification for NYSE securities. But until then let’s keep pushing the envelope. This isn’t posted for price or trading discussion just an amazing example of what Ether is capable of.,1625875924,198,1
oh7oqr,rayz1707,What is Meryt Protocol?-Initial use-cases explained!,1625874786,0,1
oh7n7n,lazywizard99,"Crypto Sentiment on Reddit – 9th July 2021 | Ethereum is the most mentioned cryptocurrency for a 3rd day in a row | ETH, BTC, ALGO, ADA, MATIC",1625874554,14,1
oh7h30,NateNate60,How many decimal points of precision can I reasonably expect users' wallets to have?,1625873950,0,1
oh6rqj,carloscancab,"What's coming for DAOs in 2021? Consequences of the Wyoming law, most important active DAOs and common misconceptions.",1625871465,1,1
od8iwb,Only_Ad_7973,Is there a way to lose money with flashloans?,1625353971,0,1
od8hxx,SlavikZeus,Do you think etherium will replace bitcoin in future?,1625353870,0,1
od84w6,killawaspattack,Beautiful Ethereum NFT,1625352560,3,1
od83tg,VelothYT,"𝚆𝚎𝚕𝚕, 𝚘𝚔 𝚝𝚑𝚎𝚗.",1625352452,13,1
od7h5z,Hakan1984,Two Kingdoms: ADA vs ETH,1625350175,0,1
od6vaj,Relprimer,"Completed the construction of a gallery in Decentraled Welcome to my [Base64ART] exhibition Jump in [-127,-76] Floor 1 - Introductions, works Floor 2 - Decoding the painting Floor 3 - Details 4 Roof - Secret floor with music and party. //[Base 64 ART] - Nft art with private and public part.(volume+)",1625348065,27,1
od6qw0,Tarantula_Saurus_Rex,Can I rename my existing eth wallet address?,1625347634,0,1
od6iwc,NeonDevil7,"If you're still thinking about cryptocurrency as being only about currency, you haven't had the ""aha"" moment that's coming. It's like thinking of cellphones as being purely about phone calls (circa 2004) and not understanding the potential of smart phones.",1625346884,0,1
od665a,BoyYeetzWorld,"Bitcoin and Ethereum were used to purchase phony COVID-19 vaccination certificates, according to a report.",1625345666,7,1
od62ui,Confused_Acorn21,Is it worth staking eth?,1625345350,0,1
od5t4f,NateNate60,Why does Ethereum not have transaction memos?,1625344441,0,1
od5gnl,NewspaperTiny1404,Did Elon Musk really just post this?,1625343261,0,1
od5bph,ExpensiveSprinkles95,Who can exchange bitcoin for another coin? large amount if you don’t already have coins it’s no discussion. Will middleman it,1625342787,0,1
od5blm,Pickinanameainteasy,Should ETH go up significantly in value would gas costs go through the roof?,1625342776,0,1
od500o,cum_flavor_oreo,"Bernie Sanders comes out as pro Ethereum, July 2021",1625341681,0,1
od4ycc,dandogofuggy,How is this. Different prices at the same time.,1625341521,0,1
od4t9z,hisky0,"Algorand Isn't an Ethereum Killer Yet, but Keep an Eye on It",1625341044,15,1
od4mjq,HammondXX,Crypto Cancer and Covid and kids oh my. Lets pull together #blockchain4good,1625340426,0,1
od4bdc,juked1s,1stblood (firstblood) swap to DAWN token will end soon,1625339445,0,1
od49co,maferase,Portugal Crypto Tax Report to help anyone have a clear understanding of how Portugal tax cryptocurrencies.,1625339248,1,1
od3rcw,teenastyty,What is staking do you have to stake to own eth 2?,1625337598,0,1
od3i8m,LitesLiger,Has anyone measured the potential Burn amount per day for London Hard fork?,1625336768,0,1
od3gld,Stinkfoot09,Evaluating altcoins: How can you tell if a smart contract is malicious or risky?,1625336607,0,1
od3czx,CuriousSearch8687,My refrainment plan Ethereum,1625336267,3,1
od3a5k,Lcoronaboredom,Mind that time Bitcoin was a FAD.. just saying ❤️✌️,1625335998,3,1
od2xmr,CuriousSearch8687,My refrainment plan Ethereum,1625334895,1,1
od2rar,Victhemag,How is a “decentralized application” possible?,1625334334,0,1
od2k98,CuriousSearch8687,My refrainment plan Ethereum,1625333719,0,1
od2k0a,Exact-Yesterday-992,using Ethereum in gaming?,1625333697,0,1
od2dvp,Sendsei13,Liquid Eth Staking With Stakewise Uni Liquidity Pools,1625333160,0,1
od2di9,chaostrophy1964,Where to learn solidity in San Francisco,1625333129,0,1
olqg7p,KoreanJesusFTW,Help,1626470862,0,1
olqbc1,frank3costanza,Synthetic Assets,1626470419,0,1
olqapv,PrestigeDay,ETH Faucets for rinkeby?,1626470362,0,1
olq82j,jmlinpt,Gas fees,1626470120,0,1
olq7gp,safvgbefbae,flashbot.eth for sale,1626470069,0,1
olq20o,sleep_deficit,👀 Shots fired!,1626469591,16,1
olpw2d,tokenaries,AriesToken | Low market cap | Just launched | Airdrops available now,1626469079,0,1
olpnuk,THEREDPILLTOKEN,Our Uniswap liquidity pool just got drained followed by an ERC20 transfer attack,1626468339,0,1
olpe4r,chapogrown,How can you be Bearish EIP1559 hasn’t even Hit yet 🤦‍♂️✅✅ check it ⬇️⬇️,1626467503,0,1
olpdma,B2KMTL,Hardwallet pre-transaction warnings...safe to proceed?,1626467468,0,1
olp710,ShouldaStayedIn,Credit card at $0 and debt free now because of ETH (jumping on the 2021 bandwagon and selling before the Big Dipper),1626466926,0,1
olp19j,Only_Ad_7973,How centralized are L2 solutions like Optimism or Arbitrum?,1626466430,0,1
olon99,olowo24,10 largest ETH Addresses make up almost 20.58% of the total Supply of Ethereum,1626465254,0,1
oloceg,Solodeji,Messari: Ethereum Is Poised To Settle $8 Trillion In 2021. Here’s The Primary Reason for the Increase,1626464395,55,1
olnodn,dlt76028,"Tired of losing all my money on WSB, so I just dumped all my retirement accts into Ethereum instead.",1626462422,21,1
olnoa7,b0xTeam,bZx is rebranding!,1626462415,0,1
olnf58,Crypto_Exchanger,The question goes to you,1626461685,0,1
olnag7,davidahoffman,The new Bankless Weekly Roll Up is live!,1626461278,0,1
oln6h8,Delicious_Paper4754,Mooncake Token - Contract address --&gt; 0xbfc61038fadc1ffd451c341214f8b42c41aa505a,1626460983,0,1
oln2sa,twigwam,An original physical Picasso drawing was burnt and turned into an NFT,1626460691,15,1
olmy72,ligi,Doge-Coun founder Jackson Palmer about his cryptocurrency exit,1626460297,18,1
olmudp,DemandOk3237,Cardano is struggling with smart contracts,1626459987,0,1
olmhml,Putrid-Habit-4262,"Hello everyone, I’m new to developing DeFi apps on the Ethereum blockchain and was wondering if anyone had any suggestions for Beginners, Intermediate and Advanced level programing projects that I could tackle to build my skills and my resume.",1626458990,0,1
olm8z2,j123456t,Sell Stocks to Buy Eth?,1626458337,0,1
olm63j,Onetapfapnap,Is this what going to the moon is like?,1626458090,4,1
ollzb2,[deleted],My retainment plan Ethereum,1626457560,0,1
ollumc,newbmycologist,Finally Got enough saved to buy another half an ETH to bring my total up to 1 whole ETH!,1626457198,1,1
olllfc,BoyYeetzWorld,"Accounts in the Ethereum Name Service (ENS) increased 30 times in four months, according to data.",1626456443,1,1
olldzc,johnson1237,Ethereum when you can have incomparably faster.,1626455819,0,1
olla5w,nethermindeth,EIP 3554 or: How I Learned to Stop Worrying and Love the (Difficulty) Bomb,1626455528,58,1
oll3ej,excusemealot,Looking for a DApp on Polygon? Look no further 😊,1626454992,1,1
olkwja,CryptocurrnecyTrader,The HOW TO OCSC DEMO,1626454467,0,1
olkhw2,melec10,ETH Investment Plan - What to invest on to start,1626453283,0,1
olker0,Aardvark35,protect your ETH price,1626453026,0,1
oljz45,MidnightOnMars,Phil Daian of Flashbots' Statement Chain Reorgs as a Service,1626451816,1,1
oljdpq,blockchain850,"Blockchains have problems communicating with one another,",1626450046,0,1
oljb5s,Mortytorty,I am sooo bullish on ETH and ETH 2.0,1626449835,0,1
olj80j,twigwam,"With its latest update, Metamask now supports transacting with Optimism",1626449576,26,1
olj514,GADHP,If someone sends a fake erc20 token to my eth address would it show up on ethscan,1626449341,0,1
oliv76,Finncialhealth,Ethereum Price Prediction Ethereum Classic Ethereum News [July] - Ethere...,1626448533,0,1
olirrp,Wherehere1,Is it a decent time to buy and hold ethereum? I purchased a few weeks ago and lost so much.,1626448250,0,1
oliqpn,cryptolover789,"Blockchains have problems communicating with one another,",1626448160,0,1
olinrc,shayanbahal,The Heart of Diligence - Git visualization of how 100+ audit reports were created.,1626447912,1,1
olinl4,MORSHEDA,The HOW TO OCSC DEMO.mp4,1626447899,0,1
olil2f,ImSandwich,Where to reach out to users?,1626447691,0,1
olifu5,Crypto_marketer_,ProfitBull,1626447263,0,1
olhzsq,trent_vanepps,How quickly baseFeePerGas changes in EIP-1559 (gSheet and charts),1626445871,2,1
olhtuc,matthewargent,How does Argent protect the highest value NFTs?,1626445341,1,1
olht31,cryptocurrencypr,Who are Libonomy competitors? AMA,1626445274,0,1
olhrzu,joed1967,Square’s Defi,1626445175,0,1
olhnmz,DailyGweiBot,Blinded by Bias - The Daily Gwei #292,1626444779,5,1
olhl88,MORSHEDA,Libonomy Blockchain,1626444563,0,1
olhjww,rollingincrypto,"BTC, ETH &amp; other Cryptocurrency creates wealth mobility and equality, Coinbase CEO contradicts Dogecoin creator",1626444443,93,1
olhds9,TheCryptoKang,Are you ready for the 4th industrial revolution? This interview with Cryptokang could help you in your quest!,1626443917,1,1
olh81q,the_damj,Choose your partners wisely boys...,1626443380,0,1
olh3rw,cryptocurrencypr,Libonomy is the optical cable. Fast and interoperable.,1626442967,0,1
olgxih,twigwam,"Introducing Radicle Orgs, a decentralized code management tool for DAOs built on Gnosis Safe",1626442337,4,1
olgrsx,twigwam,China’s CBDC will use smart contracts to allow for programmability,1626441761,6,1
olgjle,poojaranjan19,Ethereum London Upgrade Community Call,1626440947,1,1
olg33c,adminalex360,"It's difficult for a couple to reach agreement,",1626439259,0,1
olg1k0,adminalex360,Libonomy isn’t yet another project,1626439102,0,1
olfcjk,cryptocurrency132,Now there is no need to be stuck on extremely costly Ethereum’s network,1626436385,0,1
olf38t,mendetrades,Telegram is mendeTrade,1626435316,0,1
oletg0,Vairlee,"The day before yesterday, Caixin.com's picture of ""woman moving a mining machine"" triggered a heated discussion among people related to digital currency. The highest record of unauthorized pictures sold on the NFT platform is 2000 ETH",1626434202,0,1
oleeda,cryptobriefing,"Dorsey Plans DeFi on Bitcoin, Critics Point to Ethereum",1626432381,8,1
ole9mb,economicsdesign,➡️ Analysis of DEX Inflation Via Yield Farming Vs. Token Price | Econteric.com,1626431761,0,1
ole29z,Any_Zookeepergame507,Join CoinTalkz and be a part of this community.,1626430792,0,1
ole270,Any_Zookeepergame507,Join CoinTalkz and be a part of this community.,1626430779,0,1
oldq42,sasha_sh,The NFTs ecosystem: 2021 boom &amp; beyond,1626429199,2,1
oldm73,GFOXSolutions,"GFOX Solutions , GiantFOX Studio Provide Explainer Videos for your brand promotion",1626428654,0,1
oldkpx,alex_crypto214,Libonomy blockchain provides a solution,1626428447,0,1
olc9zh,manojvarmau,B21 International Cards - Live in 80+ countries and accepted at over 45M+ merchants,1626422119,0,1
olc3y0,Coin-Bureau,CAN BTC HIT 40K?,1626421284,0,1
olbza7,bernposapsac,Nice move,1626420657,0,1
olbwlr,IHATEDREAM45,What do you guys think is the better investment Ethereum or NANO,1626420300,0,1
