id,author,title,created_utc,num_comments,score
ol7z7s,PeacockMamba,New graphic for Ethereum’s upgrade path moving forward. To The Merge and beyond! We’re hungry for 🥩 stake! :D,1626403850,295,1
ol72kv,JMcMenemy,Intrinsic Value Offering (IVO) uses smart contracts to allow participants to retrieve back their initial investment at anytime,1626400541,0,1
ol6jpc,twigwam,OpenEthereum is on board for the London Upgrade!,1626398609,2,1
ol6a8v,twigwam,A Guide to Uniswap on Optimism,1626397663,1,1
ol6586,twigwam,Social Token Refresh — Mirror,1626397190,1,1
ol5wir,hah_i_got_you,Eth gas prices??,1626396303,0,1
ol5hlh,t-han72,Rookie Question: How is ethereum earning 5-7% yield on kraken if PoS isn’t deployed yet?,1626394825,0,1
ol5fxb,buzzer58,"Weird issues with Nvidia/amd rig - amd cards fans rev up and down, no access to amd software on windows after atikdag patch",1626394653,0,1
ol5dnj,grn_Factory,"[NEW]: 5_Psychostasia, Mindblood, grn::aesthetic",1626394428,0,1
ol5cuz,Angel_4231,Step ether up to bitcoin,1626394351,0,1
ol5a6u,LothricStraightSword,Guys please help,1626394087,0,1
ol4k7r,amitsrana,Amit Rana on Twitter,1626391610,0,1
ol4fmd,ShrimpyApp,Is Ethereum or Polkadot better?,1626391177,10,1
ol486x,ShotBot,Matic in a nutshell:,1626390476,3,1
ol47ib,goinglongoneth,Arbitrum FAQs,1626390412,0,1
ol2uu0,rgnine,Art Blocks Brings Big Money to Artists Who Paint With Code,1626385963,1,1
ol2ne8,ondruw,How Does Rainbow Wallet Store Private Keys on iPhones?,1626385292,2,1
ol2fe0,cowgrl1,So proud of our little company!! ABCVacuum.com now takes Crypto as payment!!!,1626384601,65,1
ol18mq,trogdortb001,"Some of the important upcoming milestones for ETH2.0 are ""the merge"" and sharding",1626380987,7,1
ol14zp,Mat7ias,Proof-of-Stake: The Concept All Ethereum (ETH) Owners Should Know Backwards and Forwards,1626380677,2,1
ol0inw,Capulous7217,It's FINALLY Confirmed: When Ethereum's Highly Anticipated Upgrade Will Go LIVE...,1626378803,15,1
ol0eir,blockchain850,24% of companies expect to invest between 5 and 10 million USD in blockchain during 2021,1626378454,0,1
ol0986,blockchain850,"Ethereum fees have skyrocketed and will just get worse in the next couple of years,",1626378022,0,1
ol049j,CravingBeaver,69 ETHEREUM - NO COMMENT,1626377602,0,1
okzud6,tokenaries,Launching tomorrow at Noon.,1626376766,0,1
okz6s7,trent_vanepps,"Ethereum's Upgrade Path Infographic (by trent_vanepps, not official, subject to change)",1626374827,14,2
okz493,Tiko-traders,"REMINISCENCES OF A STOCK OPERATOR, Must read for all investor and traders.",1626374617,0,1
okz1f8,LL112,Why is Eth not performing better when everything i read is about Eth investment and growth?,1626374382,1,1
okysb7,RomanHaynes711,Ethereum Grunge,1626373629,1,1
okygqe,lwilson747,Guide to Corda Development - Training (Certification),1626372667,0,1
oky7sc,Pedrohipoltoo,Bitcoin investment,1626371971,0,1
oky6pw,Bitcoinatmpros,Exploring: Crypto vs Big Banking,1626371882,0,1
oky60j,Bitcoinatmpros,Exploring: Crypto vs Big Banking,1626371823,0,1
oky03k,Solodeji,EIP-1559 Is Set To Go Live With London Upgrade in Early August Following Successful Testnet Deployment,1626371331,54,1
okxtif,DemandOk3237,Cardano is struggling with smart contracts,1626370800,0,1
okxq11,twigwam,"Ethereum Name Service grows by 10,700 addresses in June, now attached to $277 million",1626370514,3,1
okxphh,trungn1993,Custom Ethereum Wallet &lt;3,1626370469,0,1
okxosq,Some_won,"[Thanks Ethereum] Stablecoin Transaction Volume was $1.7 Trillion in Q2 2021, Up 59% from Q1",1626370413,4,1
okxidi,GuiltyTomorrow416,ETH hitting $1400?,1626369877,0,1
okxgj2,almighty-Accountant,Projects,1626369718,0,1
okxdqa,Mysterious-Kitchen51,Fitness App??,1626369492,0,1
okxdjl,adminalex360,Over 90% of U.S. and European,1626369476,0,1
okxcw5,Solotox,Turned ETHUSD price into its logo!,1626369426,2,1
okxc2u,adminalex360,One of the bigger problems of blockchain,1626369359,0,1
okxby2,EmeraldWay,An Overview of the UniPower Network,1626369348,0,1
okwvet,RomanHaynes711,Ethereum My Retirement Plan,1626367999,0,1
okwrdq,TreyDBK,"Nonfungible tokens soar even as Bitcoin price drops close to $32,000",1626367672,0,1
okwmqk,arzos,SENs.org Reimagine Aging: Pulse Chain Airdrop now LIVE!,1626367282,5,1
okw69d,Near_Grade990,(Not a trader) just need a hit of crypto memes. #apesstrong,1626365919,0,1
okw41f,the_damj,Staking platform,1626365737,0,1
okw1yr,Specific_Squirrel333,"I used innosilicon.us.com to buy a rig. They’re a scam, does anybody know a way I can recover my funds/ethereum.",1626365569,5,1
okvulu,Truebit_Mod,The Verifier's Dilemma [AMA] Session Starting Now!,1626364959,0,1
okvllm,zhiwenhuang,Finally finished my Ethereum framework,1626364228,0,1
okvhwd,Tiko-traders,Cryptocurrency's 🤔 What Sentiment are we in? 🧐,1626363921,0,1
okvgzl,CulturalInstruction3,Ethereum and its impact on legal studies,1626363846,0,1
okuu3w,DailyGweiBot,The Staking Police - The Daily Gwei #291,1626361953,1,1
okuiqj,twigwam,Women Scaling Blockchains: The Vision Behind Ethereum Layer 2 Solution Metis,1626361048,1,1
okuebv,Tempus_Finance,Tempus Closes $1.9M Seed Funding Round,1626360681,0,1
okubv7,ExtensionSinger4154,Brazil Gets the First Ethereum ETF in Latin America - Cryptorobin.com,1626360470,0,1
oku9kj,twigwam,OpenSea stores NFTs with IPFS and Filecoin,1626360268,2,1
oku5o8,mktatreddit,The Magic Frog - Collaborative Storytelling and a pot full of ETH,1626359935,0,1
oku4w8,caco3boy,Did Hex development team really improve GETH code?,1626359859,0,1
oku3ge,MORSHEDA,Who are Libonomy competitors? AMA,1626359727,0,1
oku1en,focal-fossa,Earn ETH on Biswap!,1626359543,8,1
oktwuw,MORSHEDA,The HOW TO OCSC DEMO,1626359135,0,1
oktq3d,ThisComb,What does a digital currency from a central bank look like?,1626358538,0,1
oktorx,dorothymel,Baby Flowers-Dorothymel | Abstract digital artwork | 0.09 ETH,1626358423,0,1
oktlg3,HarpieNoah,"We are Harpie, an Ethereum-based token recovery service. We've released the first of our security miniseries. Check it out!",1626358126,0,1
oktg6s,milvus,We just released v2.0 of our zkRollup powered mobile wallet - we're always looking to improve so any feedback is welcome,1626357669,4,1
okt2fj,kate2mc,NFTs for Writers: How NFTs Can Shape the Book Publishing Sector?,1626356466,0,1
okt286,CoinjoyAssistant,ETH Miner Balances Recovering with its Transactions Hitting $2.5 Trillion in Q2 of 2021,1626356446,0,1
oksqn4,superphiz,[LIVE] Ethereum 2.0 Call #68 [2021/07/15 - 14:00 GMT],1626355363,4,1
okscxu,Delicious_Physics_40,"Welfare broadcast! ! Cryptocurrency, Bitcoin, Ethereum, Dogecoin, shib. Candy airdrop",1626354055,11,1
oks6o7,pulse5418,Presale,1626353428,0,1
oks2cu,ittybittycitykitty,ubuntu update had lots of geth and ethereum.,1626352995,0,1
okrwo2,MORSHEDA,Libonomy Blockchain,1626352412,0,1
okrl3s,cryptocurrencypr,Scalability trilemma and the Libonomy blockchain,1626351199,0,1
okrevt,Andrew_Musks,Ethereum Documentary Spotlights Co-Founder Vitalik Buterin,1626350528,0,1
okrb3t,twigwam,Ethereum-based Soccer NFT startup Sorare held talks to raise funding at a $3.7 billion valuation from backers including SoftBank,1626350146,5,1
okr8w9,Brave-Enthusiasm-798,Ethereum Documentary Spotlights Co-Founder Vitalik Buterin,1626349896,0,1
okr7gm,the_damj,Disregard the bad and focus on the good,1626349732,2,1
okr5m5,maxirosson,The best books to learn about Cryptocurrencies in 2021,1626349515,0,1
okr5az,Bigdookieball3,BULL RUN LETS GO!!!! Everybody check they shit,1626349476,0,1
okr1pd,twigwam,Aya Miyaguchi &amp; Vitalik Buterin Are Involved in a New Documentary About Ethereum called The Infinite Garden,1626349041,110,1
okqvdv,adminalex360,You can gamble with your hard,1626348317,0,1
okqthz,adminalex360,At the end of the day we have to decide,1626348096,0,1
okql6x,cryptocurrencypr,Libonomy isn’t struggling with anything.,1626347128,0,1
okqjzg,McDallenator,Please help a newbie to run a node,1626346985,0,1
okqjyx,Wild_Attitude,Ethereum Documentary Spotlights Co-Founder Vitalik Buterin,1626346984,0,1
okqjwh,economicsdesign,➡️ What are differences between APY &amp; APR ??,1626346976,0,1
okqhjh,freekzraga,Ethereum Documentary Spotlights Co-Founder Vitalik Buterin,1626346723,0,1
okqg0d,maxpla,How to get access to my wallet / ETH balance?,1626346522,0,1
okpxbk,maxpla,How to revover my key from Electron/Mist wallet?,1626344105,0,1
okpx1d,Bigdookieball2,DUDE YOU GUYS ARENT GONNA BELIEVE WHAT ELON SAID 😦 LISTEN TO THE PODCAST YOURSELF!!,1626344065,0,1
okpvcx,ChowBarbara,Lending club or MyConstant?,1626343852,0,1
okpjra,BitcoinWide,Australian consultancy to accept cryptocurrency as payment,1626342297,0,1
okpfog,McDallenator,Please help a newbie to run a node.,1626341732,0,1
okpcei,alex_crypto214,Libonomy is the only blockchain,1626341291,0,1
okp907,JBSchweitzer,EF Blog: London Mainnet Announcement - Tim Beiko,1626340808,33,1
okost3,Ok-Effect-9358,ETH will go to ZERO!!! Found this interesting article... from 2018,1626338552,0,1
oj4d9d,ShrimpyApp,Anyone find a better article than this about flash loans?,1626136478,2,1
oj48vm,ashbreck,"This seems like a great time to buy, but everyone is saying “sell” now so…. I believe Ethereum is going to rise tremendously very soon along with Card. Who else is buying rn ?",1626136040,0,1
oj3zkb,twigwam,Ethereum L2 Arbitrum supported by Infura,1626135120,18,1
oj3qy0,Dogecoinricflarewooo,"CHECKOUT SOME PHENOMENAL NFTS MARILYN MONROE, DOGE COIN NFT, NO LIMIT NFT, WOLF OF WALL STREET NFT, you won’t be disappointed just a click away to purchase!",1626134330,0,1
oj38am,adogan9,Subscribe to NFTimes,1626132559,0,1
oj37oi,Killin4blaze,WtAF is goin on!! Anybody?! Asking for a friend😳,1626132498,0,1
oj2yca,BenJayson,new piece just came in🚀,1626131622,2,1
oj2phv,toto2809,Sorare experience,1626130826,0,1
oj2nmv,Major_Specific701,Ethereum price on Robinhood: why is the price 2150 whereas other platform shows 2030,1626130661,0,1
oj2n8h,ashburn2k,Is RH messing with me?,1626130623,9,1
oj2lsx,jihbob,Robinhood not letting me sell for a lil profit ???,1626130491,9,1
oj2irs,nishinoran,Ethereum's current fee market is like tons of people doing Market Buys on an asset with very limited liquidity,1626130221,0,1
oj20qx,Ifeeluberish,WHACKD token disappeared,1626128656,0,1
oj1vyh,HalfBluedust,Fuck China,1626128253,7,1
oj1jct,ARONBOSS,The Number of DeFi Users on the Ethereum (ETH) Network Reaches 3 Million – AronBoss,1626127218,12,1
oj1hxw,Remote-Resolution-15,Today’s dip,1626127101,0,1
oj159c,noHiPSTER_hostel,Live scam on you tube with eth airdrop,1626126051,0,1
oj14ho,Topher7117,When should I sell all my ethereum?,1626126001,0,1
oj10jd,yellingfore,If you've been waiting for a code to try XDEFI Wallet - now is your chance 🙌,1626125674,0,1
oj0vck,jimibk,ChainSwap Exploit Leads to Multi-Million Loss For DeFi Tokens,1626125255,3,1
oj09xq,FluffyRevenue,ERC-20 Token Launcher,1626123474,0,1
oj05bm,lwilson747,Blockchain and Data Privacy Masterclass,1626123096,0,1
oizqpc,ilyasshjr,The fully synced Ethereum blockchain now stands at a whopping 862 GB — more than doubling in a year. Blockchains Need to Shrink to Grow.,1626121888,279,1
oiz4w6,virpt,[LIVE NOW] NULS Monthly Update - July 2021,1626120095,0,1
oiymj8,FrancoisBughatti,Ethereum gas prices,1626118595,0,1
oiy3gu,787man,Extremely Undervalued: Why Ethereum Should Be Worth Much More,1626116919,4,1
oixwyb,victorsintnicolaas,Offset ethereum emissions,1626116379,0,1
oixvoi,victorsintnicolaas,Climate Neutral Crypto: Offset your ethereum emissions!,1626116274,0,1
oixu09,AD1AD,"VeryEasyHydroponics.com now accepts Ether! [gardening, hydroponics]",1626116136,8,1
oixo3y,Expensive_Let_2720,What’s the most loss you have seen in your portfolio and still stayed strong? I have a little over $200k vested in ETH and I can’t help but feel nervous when I see my portfolio change drastically in one day even know I have no intentions of selling anytime soon.,1626115668,0,1
oixo3w,pastaboi011,how scams are in ccrypto,1626115668,0,1
oiwwg3,KitchenEducational24,ETH DeFi Film Project Mogul Productions Featured in Major Chinese Publication,1626113453,2,1
oiww39,Hugo0o0,Trying to buy a simple eth domain. Isn't this a little ridiculous? 😕,1626113425,177,1
oiwti4,blockchain850,"Ethereum is struggling with fees, Cardano is struggling with smart contracts",1626113215,0,1
oiwq8m,Srsauto1019,In search of a team,1626112951,0,1
oiwq53,kethfinex,Lido updating their staked ETH withdrawal credentials,1626112942,1,1
oiwmy4,DemandOk3237,Libonomy introduces cross-platform projects,1626112691,0,1
oiwms5,BitcoinWide,Euro 2020 and cryptocurrencies go hand-in-hand this year,1626112676,0,1
oiwhl9,cryptolover789,Ethereum fees have skyrocketed and will just get worse in the next couple of years,1626112250,0,1
oiwcvp,DemandOk3237,"Libonomy - Interoperable, scalable and truly decentralized blockchain",1626111881,0,1
oiwb92,DemandOk3237,The HOW TO OCSC DEMO,1626111750,0,1
oivx4m,LouisRodriquez80,"ETHEREUM Logo I had to find that. For anyone else interested, it is absolutely gorgeous! Please Next page &gt;&gt;&gt;",1626110605,0,1
oivoqm,CorrineSomers,Power Ledger Announces Migration From Ethereum To Solana,1626109936,0,1
oivgjo,kceesaleh8,2damoon,1626109284,2,1
oiveq7,adminalex360,If you compare #Cardano and #Libonomy,1626109159,0,1
oivdec,covalent5,Contract ABI verification,1626109049,0,1
oivbz1,adminalex360,One of the bigger problems,1626108935,0,1
oivb3w,cryptocurrencypr,Who are Libonomy competitors? AMA,1626108860,0,1
oivali,samuelgotit,Exciting times for ETH lovers &amp; Investors,1626108819,0,1
oiv60r,lwc-wtang12,What's the latest and most realistic implementation date for Eth 2.0?,1626108454,0,1
oiv3xc,FitRecognition5037,Hut 8 Mining (TSX:HUT)(NASDAQ:HUT) is a Toronto-based company that operates cryptocurrency mining. Its shares have climbed 68% in 2021. The stock has soared 490% year over year!,1626108290,2,1
oiuvfc,Setvin,"""I'll just wait...""",1626107621,0,1
oiuudz,ApatheticNihilist420,Ethereum at risk of Time Bandit Attack - 51% reorg on blocks attack,1626107536,16,1
oiutws,0xWeb3,ChainSwap Hack Investigation. Scam or not?,1626107496,1,1
oiusnw,MrDubious,"Pocket Network's Portal Launch - Access to ETH, All Testnet's, and Archival with Trace",1626107400,3,2
oiuoja,Binar41,Binar41 a new startup for artist,1626107070,0,1
oiuhkc,brantlymillegan,ENS and Ethereum Foundation are co-sponsoring a grant and RFP to standardize Sign-in with Ethereum,1626106500,6,1
oiuhix,Steven44323,Who are Libonomy competitors? AMA,1626106497,0,1
oiua7j,SevenB_roker,How to trade ETH?,1626105928,3,1
oitu8o,CryptoEngineerObrien,"What is Arbitrum, and how is it different from Polygon?",1626104470,7,1
oitf9q,MORSHEDA,Who are Libonomy competitors? AMA,1626103235,1,1
oit1yb,CryptocurrnecyTrader,Ethereum fees have skyrocketed and will just get worse in the next couple of years,1626102176,1,1
oit05f,Pylontoken,Pylon Eco Token,1626102033,1,1
oisw4k,Blox_Official,Mark Your Calendars! Blox AMA #1 Is Coming,1626101697,1,1
oisrc2,oconnellcamera,The Polygon Report - 07-12-2021,1626101282,3,1
oisqdy,cryptocurrencypr,Libonomy is the optical cable. Fast and interoperable.,1626101205,1,1
oismcz,johnson1237,Ethereum fees have skyrocketed.,1626100882,1,1
oisfrm,adminalex360,Blockchain market is expected,1626100310,1,1
oisdkn,fiverrconsultant,Join us. Play. Earn a passive income,1626100128,2,1
oisa97,Delicious_Pizza5830,My retainment plan Ethereum,1626099840,3,1
ois29x,DailyGweiBot,Ultra Sound Money - The Daily Gwei #288,1626099158,1,1
ois1aq,poojaranjan19,A Brief History of Ethereum's Future with Ben Edgington,1626099070,1,1
ois0qs,something_122,How long will it take for Ethereum to overtake Bitcoin if at all?,1626099020,0,1
oirz6v,Johns_The_Bomb,"Ethereum Double Bottom Possible (Targeting 2200, will confirm double bottom)",1626098888,10,1
oirtdu,Business_Carpet7193,Sigh.....,1626098403,1,1
oirqjq,MORSHEDA,The HOW TO OCSC DEMO.mp4,1626098143,0,1
oirpxs,black_lung_fungus,"Where there’s a step further into centralisation, there needs to be steps deeper into decentralisation. That’s what Ethereum’s here for.",1626098090,3,1
oirkwz,Automatic_Ticket8813,What is happening with the reorg NFT's? Is this good for ETH?,1626097633,0,1
oirg9k,Flying_Koeksister,An interesting take on the future of EVM (long read),1626097206,3,1
oir0l4,pulse5418,Nafty,1626095697,0,1
oiqt3c,adminalex360,The main difference between,1626094952,0,1
oiqoks,sourkatt231,How much money has been raised for Ethereum development/marketing/ect,1626094522,0,1
oiqgr7,computertitan,Hot Takes: Ethereum: ‘I think it’s unlikely to live beyond….20-30yrs’ (due to PoS),1626093703,15,1
oiq04z,jklepatch,How to set the price of your token in a liquidity pool?,1626091962,0,1
oipmly,Artificialeinstein,Ethereum Synthesizer,1626090496,0,1
oip5jf,MORSHEDA,Libonomy Blockchain,1626088468,0,1
oip3vw,raindrop1717,Korean CBDC Submissions Ends; Ethereum L2 Provider Part of One Potential Candidate (Ethereum/Korea CBDC Bridge?),1626088262,0,1
oiorpa,Cheappills,Powerwalk your way to free BTC and ETH in the US and Canada,1626086731,0,1
oioqnx,Harshakoll,Need Desperate Help!!,1626086588,0,1
oiont7,Boring_Nature_8706,"Gold, Crypto or USD",1626086202,0,1
oiolfm,phookiez,Korean CBDC Submissions Ends; Ethereum L2 Provider Part of One Potential Candidate (Ethereum/Korea CBDC Bridge?),1626085894,0,1
oiokiu,GBArcturus,“Sleepminting” NFT’s doesn’t make NFT’s vulnerable.,1626085777,0,1
oiodre,canman44999,"Weekly Roundup: Bitcoin is a “miracle,” Sygnum becomes first bank to support ETH 2.0 staking, Visa customers spend over $1 billion on cryptos in six months",1626084890,1,1
oinvwy,Solodeji,Goldman Sachs: Ethereum Has the Potential to Overthrow Bitcoin as a Digital Store of Value,1626082427,28,1
oinnr0,economicsdesign,➡️ Tokenising your Leveraged Position | Econteric.com,1626081223,0,1
oin2wx,freekzraga,Ethereum Price Prediction 2021 — Will ETH Hit $3000 Soon?,1626078275,0,1
oimo2s,tattoox_official,Best cryptocurrency exchange | 2021 Top 5 best crypto exchange,1626076243,0,1
oimld1,Nerolation,I created a dashboard comparing Ethereum's Stablecoins,1626075860,13,1
oimhlx,YEOHEARTLY,CRYPTOCURRENCY ASSET RECOVERY,1626075345,0,1
oim077,Spirited_Employee_61,Faucet??,1626073043,0,1
of2en4,laureeporter,Does anyone have ETH in their retirement accounts? Looking to see if this is a viable option,1625600419,0,1
of2d63,Ml-Castilo,NIO STOCK My Bias on NIO: Chinese EV stock; we had a close above the resistance at 48.00-52.00 zone. We could see 56.00-64.00 pretty soon! Buckle up 😋 ￼,1625600305,0,1
of27tx,NEAR_Do_Well,Two Tigers Talkin' NEAR,1625599865,0,1
of272s,no_professional12,Huge transaction fee taken for failed transaction,1625599808,0,1
of24i7,kushandrj,My first ethereum,1625599600,0,1
of24cw,Hedge_me,Books on ETH and smart contracting,1625599589,0,1
of1ve1,operator139,El Salvador's team actually depicts it well,1625598847,3,1
of1tg5,ElBuenMayini,Block 12965000 has been proposed for London Fork,1625598690,26,1
of1scy,olowo24,Ethereum Is Flipping Bitcoin Now Says Celsius Network CEO,1625598596,0,1
of1qe9,TallAside6090,Ooo,1625598432,5,1
of1jr3,Conscious-Sound-4448,Can Ethereum be successful without ETH rising in price?,1625597907,0,1
of1dh6,ThenOwl9,How to Migrate ETH-Based Cryptos from Uniswap V2 to V3,1625597390,0,1
of1d43,lwilson747,Getting Started with AWS Blockchain as a Service - BaaS (Certificate of Completion),1625597361,0,1
of1cyq,xxDJBxx,Gravity Collision - Technical Whitepaper Analysis,1625597347,0,1
of16aq,cryptocurrencypr,"Libonomy - Interoperable, scalable and truly decentralized blockchain",1625596798,0,1
of0iz5,CryptoEngineerObrien,How does Ethereum London Hard Fork Work?,1625594898,0,1
of0et8,socalquest,Ethereum 2.0 Staking Interest Calculator. Calculate Your Earnings.,1625594554,2,1
of0dyr,time-to-hodl,Ethereum EIP-1559 Update Scheduled for this August,1625594490,0,1
of05pd,mcsnoogins,Gas fees,1625593844,0,1
of00dw,GravityCollision,Gravity Collision - Technical Whitepaper Analysis,1625593427,0,1
oezsfd,DecentTemperature384,"Where offers the best APR %, when staking less than 32 ETH?",1625592797,0,1
oezqmd,cryptocurrencypr,Ethereum fees have skyrocketed and will just get worse in the next couple of years,1625592647,0,1
oezhd2,sixthgorilla,"Noob here: What RECENT audiobooks can teach me best about blockchain, BTC, ETH, etc.",1625591898,0,1
oeza2x,sneg5555,"Notional - fixed-rate, fixed-term crypto asset lending and borrowing",1625591302,1,1
oez36f,Alexand0x,"district0x Dev Update - July 6th, 2021",1625590761,1,1
oeyzjf,momin_ammar,"Painting of John Mcafee, The Real Hero",1625590458,0,1
oeyz1h,pulse5418,Presale,1625590416,0,1
oeyuog,coinedge,GameStop NFT - GME is building on Ethereum. Many are speculating they will issue an NFT dividend or token for their shareholders. Game changer if true.,1625590060,65,1
oeypg1,Levidaniel99,"The #NV2.0 #PrivateCommunicationNetwork is evolving and we are excited to release our Whitepaper on 12th July. Game changing moves, interesting times ahead! https://t.co/LDXnWzghW7",1625589632,0,1
oeyhg6,BorderTrader,TriCitizen: Uncensored Tox network chat on Android,1625588977,0,1
oeyfeu,Blue_hippo31,Giving away $100 of Eth :),1625588804,0,1
oeye6d,syed0403,did I get it right?,1625588708,2,1
oeydep,semper_fikus,A question about benefits of Ethereum,1625588651,1,1
oey6ay,NOScapital,Educating the world on Cryptocurrency and Blockchain technologies. Join our community today and receive a complimentary Bitcoin bot on us because we think you should make money while you sleep 💤,1625588060,1,1
oey4g9,recktanglez,Stupid noob question,1625587910,0,1
oexw1u,giugiacaglia,150% APR? How are DeFi Yields so High?,1625587264,2,1
oexlct,kusulawt,Analyzing the Institutional Landscape for Blockchain Solutions,1625586402,1,1
oexhup,Tendiehungry999,Upvote if you think ethereum will reach 20k,1625586112,0,1
oexcv5,Bright_Hedgehog_673,Buying ethereum on robinhood.,1625585701,1,1
oexbh3,CuriousSearch8687,Ethereum ETH HODL on we're going to the moon,1625585583,0,1
oex8pw,nemus-raittehc,Help needed!!!,1625585357,0,1
oex7hg,Newssortvip,"अपने सपने को पूरा करने की कोशिश करूंगा चाहे मुश्किल हजार आए,motivational songs,Searchmotivational quote,motivational stories,motivational status,",1625585257,0,1
oex01x,CorrineSomers,Ernst &amp; Young Publishes Ethereum Scaling Solution,1625584655,2,1
oewnci,julien51,Easily customize your membership NFT,1625583593,0,1
oewltl,WolfOfNextStreet,4 Best Indicators Every Crypto Trader Should Know,1625583461,1,1
oewjcf,lanewaymonadiformq6,Will EIP-1559 be implemented by the end of the month,1625583252,0,1
oewhym,Finncialhealth,Ethereum Price Prediction Ethereum Classic Ethereum News [July] - Ethere...,1625583136,0,1
oewber,du-st,"Want to get around the high fees at Coinbase Pro/Gemini for recurring buys. This allows you to do it at Gemini with only 0.1% fee (automated buy at any frequency you want, daily, weekly, hourly, etc..)",1625582563,0,1
oew7bx,sasha_sh,"DeFi in Ether: $54B in DeFi, Compound Treasury announced, Aave Pro detailed, Balancer joins…",1625582205,1,1
oew292,DemandOk3237,Libonomy introduces cross-platform projects,1625581765,0,1
oevwa1,Cryptocytrader121,Ethereum when you can have incomparably,1625581247,0,1
oevva0,sportifynews,"ETH shakes off bears, targets $2,700",1625581160,1,1
oevssc,MORSHEDA,A truly interoperable blockchain - Libonomy,1625580957,0,1
oevriq,LexiNape,A little hope,1625580848,0,1
oevqdd,DailyGweiBot,Endgame - The Daily Gwei #284,1625580746,1,1
oevpyw,BigAl202020,I can’t wait for Eth 2.0,1625580713,0,1
oevolk,MORSHEDA,A truly interoperable blockchain - Libonomy,1625580591,0,1
oev1rb,mellon98,Here’s Why Ethereum and not Cardano,1625578500,0,1
oeuuim,MeIsNotHim,Which one would describe you best?,1625577809,0,1
oeuix0,Horo-86,ETH2 locked stacking. Why yes? And why not?,1625576684,0,1
oeufgy,lorecirstea,A currency for a better world. Based on generosity principles.,1625576381,2,1
oeu9ql,adminalex360,If you compare #Cardano and #Libonomy,1625575806,0,1
oeu4fj,blockchain850,Bitcoin and other top blockchains is Libonomy.,1625575257,0,1
oeu1nw,johnson1237,Libonomy is the optical cable,1625574983,0,1
oetpvr,gifxCrypto,Unlimited Buy &amp; Sell Platform For All Listed Cryptos,1625573745,0,1
oetfcs,HeavyIncrease,Swedish Bank Sygnum to offer Ethereum 2.0 staking service,1625572600,6,1
oetens,johnson1237,Ethereum fees have skyrocketed and will just get worse.,1625572517,0,1
oetebk,cryptolover789,"This is a problem! Cardano has just created a fork, and will likely take another year to launch smart contracts.",1625572473,0,1
oetdm0,BannedNinja42,Ethereum 2.0 design problems?,1625572389,0,1
oetd2m,adminalex360,"Libonomy, the world’s fastest blockchain",1625572326,0,1
oet9yo,tasheba51,Fee included?,1625571969,0,1
oet9n8,Sea_Animal9703,Crypto Analyst: Ethereum Exchange Reserves Hits New Low in 2 Years,1625571925,0,1
oet81h,CorrineSomers,Crypto Analyst: Ethereum Exchange Reserves Hits New Low in 2 Years,1625571730,0,1
oet4pk,LiamGTR,This is why I poured most of my savings into ETH. Lloyd's Bank reducing my savings again...,1625571328,122,1
oesq7e,kashlex012,Finding Investor for my Axie Account,1625569579,0,1
oespy4,kashlex012,Findint Investor for my Axie Account,1625569547,0,1
oesp5l,No-Giraffe1352,Kickstarter for Axie Infinity,1625569450,0,1
oesmm2,fraktalityworld,"Ethereum hologram by me, lenticular technology, 30x40cm",1625569155,97,1
oesmbl,fab-10,Historical value of your wallet,1625569116,0,1
oesgxw,MORSHEDA,Libonomy Blockchain,1625568423,0,1
oesdu3,andrytail,Global Blockchain Equity Index to be acquired by CoinShares for $17 million as company sees growth and popularity in Bitcoin &amp; Ethereum ETFs,1625568012,2,1
oescro,luisfgb,"We have deployed &amp; tested crosschain contracts on r/plian, r/ethereum &amp; r/BinanceSmartChain",1625567878,0,1
