id,author,title,created_utc,num_comments,score
ox87lu,ethereumeglproject,TOMORROW: Live AMA on Ethereum Gas Limit Project (EGL),1628011313,0,1
ox7yr4,BoxyM3,Few ETH staking questions I couldn't find answers to. Cheers !,1628010628,0,1
ox7xod,twigwam,"EIP-1559 Expert Panel -- Tim Beiko, Hasu, Micah Zoltu, Barnabe Monnot, and @Lightclients",1628010541,0,1
ox7tel,jaygee10001,Paid for my Dunkins with ETH. Had to show you guys here too.,1628010220,1001,1
ox7bnq,CheersBros,Made a Cryptocurrency LED Ticker :),1628008818,16,1
ox78fu,That_Teach_9224,Ethereum (ETH) and it’s hard to fork London: all you need to know,1628008554,2,1
ox73ql,MikeJezZ,Beginner question - couldn't staking devalue eth?,1628008175,0,1
ox6ub8,duchoww,Gas Fees,1628007424,0,1
ox6tnz,JanHill45,Ethereum,1628007371,0,1
ox6s95,laawrence,Longevity AMA with Dr. Aubrey de Grey (reversing aging damage - SENS.org) and VitaDAO (funding research in a decentralized way),1628007261,1,1
ox6q4r,Euphoric_Cap1748,Price rise?,1628007095,0,1
ox6jl6,Danielpxp,Crypto backed loans are over-collateralized,1628006588,0,1
ox6bro,HilmPauI,Patience is a virtue,1628005991,0,1
ox6ajx,nethermindeth,LESS THAN 48 HOURS BEFORE MAINNET! Exciting times. EIP-1559 is coming! Remember to upgrade your Nethermind nodes!,1628005898,4,1
ox62ma,bleedtheshorts,Ether presale wallet,1628005264,0,1
ox5wm8,ObjectNo6869,Vamos queblonregalan 1 euros por cada refeter vamos estamos a tiempobde ser algo de consegir alho vamos entra desde este enlace y copia y pega para segir haziendo grande tu dinero ..... totalmente gratis y real,1628004782,0,1
ox5v4q,GenreChord,Crypto Kid- The Animated Crypto Community,1628004661,0,1
ox5q26,TobiHovey,How Will EIP-1559 and Ethereum's 'Triple Halving' Affect ETH's Price?,1628004260,4,1
ox5o2z,Luxer95,"Another awesome campaign for AAX users! If you want know more, feel free to Dm me!",1628004112,2,1
ox5ln9,sasha_sh,"DeFi in Ether: $68B in DeFi, MakerDAO fully decentralizes, YFI celebrates the first year…",1628003909,2,1
ox5ifi,Grade19282,John McAfee faces dying in prison for the same thing Elon Musk does on Twitter,1628003634,0,1
ox5fip,Potential_Fan6138,my problem,1628003392,0,1
ox52gj,T_briggs2524,If you’re interested in expanding your mindset alongside earning money passively then let me know and I’ll basically explain everything for you and I assure you about $15k - $30k or more Click the link below and shoot me a dm👇👇 https://t.me/khalentrott,1628002297,0,1
ox4lpr,Mat7ias,Golem employed to explore the origins of life: deep-dive into collaboration with Allchemy,1628000832,2,1
ox4jg1,py-matt,What' your feeling about tomorrow update? What is gonna Happen to the price?,1628000630,0,1
ox4axf,DailyGweiBot,Searching for Stability - The Daily Gwei #304,1627999898,1,1
ox4al0,Wolfram_George,Immunefi –leading crypto bug bounty platform– just released a guide on how to not get your Telegram hacked,1627999869,3,1
ox4aig,J-96788-EU,What kind of fees reduction we can realistically expect?,1627999863,0,1
ox480b,LDWoodworth,The Cryptocurrency Surveillance Provision Buried in the Infrastructure Bill is a Disaster for Digital Privacy,1627999649,1,1
ox44oo,VLADIMIROVIC_L,Couldn't Ethereum have a lightning network just to do micropayments? And incentivise liquidity with a token?,1627999374,0,1
ox3zry,Gooncookies,Auto-staking?,1627998965,0,1
ox3zes,kate2mc,NFTs for Writers: How NFTs Can Shape the Book Publishing Sector?,1627998930,0,1
ox3wfx,amansonewane1,Great stuff to read about Ethereum - Will Ethereum London Upgrade Affect Price?,1627998657,0,1
ox3w6r,Louisalazar348,ethtrader,1627998634,0,1
ox3b4g,Spirited-You-9465,How to recover ETH sent to wrong account?,1627996719,0,1
ox38d8,BitcoinWide,InvestorBrandNetwork Now Accepts Six Different Cryptocurrencies,1627996462,0,1
ox2lv4,Icy_Data2270,The Graph Blog Posts are now Available in Greek 🇬🇷 at...,1627994325,1,1
ox2lc2,ligi,EFF on Twitter: Here are 6 reasons we hate the new cryptocurrency surveillance provision buried in Biden's infrastructure bill,1627994269,73,1
ox2fwo,Powerzerstoerer,ELI5: The London Hard Fork,1627993718,0,1
ox25tl,Left_Rich_681,Pantera Capital believes Ethereum is going to outpace Bitcoin because of these factors,1627992696,0,1
ox22eg,humanbot01,Gear up guys... It's on the way ! (Zebpay Exchange),1627992344,34,1
ox222n,economicsdesign,FREE Report: Economics of Algo Stablecoins,1627992310,0,1
ox1zbm,bdagrosa2294,Anything I need to know before the London upgrade?,1627992044,0,1
ox1us5,Jazzlike-Language457,RARX MISSION,1627991576,0,1
ox1u71,Jimbley_Neutralon,Anyone else feel this way in public lately?,1627991510,0,1
ox1tsk,gmcgathrwtrer345,Not sure if anyone does this but you can actually put ethereum into a self directed IRA,1627991466,12,1
ox1kz6,ChallengeAdmirable28,RARX MISSION,1627990505,0,1
ox1jr5,Crypto-Angel,"What is your opinion, is it too risky to hold ETH at the time of the Ethereum London Hard Fork or opposite, can earn new coins?",1627990372,18,1
ox1jkh,mikey0hn0,Shit post* made the LOGO!!,1627990348,5,1
ox1in9,odyslam,How to monitor your Ethereum Node in under 5m,1627990253,1,1
ox1gfa,tzu_tzu_flower,"Discussion between Vitalik Buterin and Nadya Tolokonnikova (Pussy Riot) about decentralization, tools for better democracy, the future of ETH - a solid watch!",1627990021,12,1
ox197x,BluejayStock4407,RARX MISSION,1627989190,0,1
ox153z,Ykay1st,Proof of Stake | What Is Proof of Stake | strengths &amp; Weaknesses,1627988721,0,1
ox0yht,ThisGermanGuy,"Want to buy more ethereum, how do I know when?",1627987995,0,1
ox0lnb,Hot_BlueStar,EIP- 1559 activates in approximately 2 hours 55 minutes. Follow the countdown here: https://etherscan.io/block/countdown/12965000,1627986381,1,1
ox0edg,Mathje,EEA Ethereum Anniversary Special,1627985455,0,1
owzyan,Ituglobal,"Ethereum Price Сontinues Its Uptrend After a Minor Retracement to $2,500 Support",1627983352,1,1
owzsss,Admirable-Bake-5871,Please help me,1627982615,0,1
owzmy6,TrillionDollarBaby2,Clown Blossom,1627981828,0,1
owzh0v,sepke12345,Ethereum update called London will take place around August 3-5,1627981047,0,1
owzamc,GeorgeSpasov,Proof of Authority Explained - LimeChain,1627980157,1,1
owz6fl,AOFEX__Official,57.9% of nodes are ready for #Ethereum London hard fork (including EIP1559 upgrade).,1627979585,0,1
owz1my,C4-PO,How low will BTC price go after failing at $42K resistance?,1627978930,0,1
owz0et,C4-PO,China’s attempt to kill Crypto failed — Here’s why,1627978766,20,1
owyyj3,SnoopHappyCoin,Wrapped Ethereum and the London fork,1627978513,0,1
owyyh6,Professional-Spot-34,Earn ETH,1627978506,0,1
owyx9x,cinoya,Forex Flex EA - ForexStore.org Dowload Best Free EA ForexStore,1627978332,0,1
owyaig,franzoppenheimer,Who is the Moses parting the Red Sea in algo stablecoin after Fei’s dilemma？,1627975245,0,1
owy2z6,franzoppenheimer,"Who is the Moses parting the Red Sea in algo stablecoin after Fei’s dilemma, Gyroscope or TiTi ?",1627974297,0,1
owxudz,dakdroid,Upgrade your node. Only 64% are up to date. 2 days left.,1627973224,22,1
owxsdd,johanngr,"Complete proof-of-unique-human system Online Pseudonym Parties, improved RNG and more",1627972963,0,1
owxq92,AOFEX__Official,AOFEX Supports #Ethereum London Upgrade,1627972693,0,1
owxn51,sportifynews,What is Ethereum EIP-1559 and how will it affect ETH price?,1627972307,1,1
owxk3p,TheLuk3r,Compounding every second?,1627971940,0,1
owx6nb,Happy_Key_4368,Jax,1627970313,0,1
owx3cc,5Gvaccine,Will London fork change signature formats?,1627969904,0,1
owwmln,mostgalone,View inside my brain...,1627967928,0,1
owwkb2,bossblunts,"Congressional Budget Office admits inflation and the GDP will ""surpass its maximum sustainable level by the end of the year."" On 7/30/21 US Dept of Commerce Bureau of Economic Analysis reports prove the economy has taken a massive downturn in Q2 2021 and Q3 is expected to be severely worse",1627967659,16,1
owwii6,the-uint_8t,Where to sell high-value ENS .ETH domain?,1627967453,0,1
oww19k,Needle_NFT,cygnus – ultra rare 1/1 -,1627965522,0,1
owv4g2,Iklwa-Impi,12-word Backup Phrase,1627962082,0,1
owv2hk,DKpandaNY,"Can anyone advise what will happen to the wrapped ether held on defi protocols ( aave, sushi, etc) if there is a hard fork on 4Aug? Will Weth holders still get the hard fork tokens?",1627961881,0,1
owun09,irhohoho,Why Ethereum 2.0 is the next big thing in the crypto world? 🔥🔥🔥,1627960350,0,1
owul48,mrsotkogaming,Top 6 Altcoins Of The Week,1627960160,6,1
owuj1y,Afnaankhan,SAMECOIN,1627959961,0,1
owtyya,Cepoid,Dual GPU Boost,1627958009,0,1
owtvs6,PeacockMamba,Ethereum is the way. 👊🏼,1627957704,21,1
owthca,Fuxwiddit,What will happen to my ETH once the hard fork hits?,1627956323,0,1
owtgo0,Happy_Key_4368,Nftmusic,1627956260,0,1
owssqg,drizzywitty,"Mining equipment, costs, and profits",1627953971,0,1
owsl12,Wokeman1,Theoretical voting/election machine?,1627953265,0,1
owsjno,Alexandermwabsa14,"How To Mine Cryptocurrency On Android and IOS device for free, just using these easy steps which have been provided in the video link below. How to make money online in 2021 on your mobile device at the comfort of your home. Cryptocurrency is taking over the world as we know it learn how to mine it.",1627953139,0,1
ows5xw,bigstew6,Created my first NFT on OpenSea today!,1627951867,3,1
ows2dh,Cultural-Nature-7090,Why Invest in Wazirx ?,1627951536,0,1
owry9g,AgentCooderX,State Trie and account update confusion,1627951142,0,1
owrvhk,aharvey101,My feelings right now,1627950887,17,1
owrn4q,bigstew6,Created my first NFT on OpenSea today!,1627950070,1,1
owr780,lyonskill,Just got my first subreddit ban. From where you ask? r/bitcoin..,1627948632,0,1
owqme6,chapogrown,"when Ethereum is fully upgraded to proof-of-stake (PoS) consensus algorithm. It will lead to a large drop in ETH issuance rate to ~0.4% annually. This issuance reduction of 90% is equivalent to 3 BTC halvings, hence “triple halving”.",1627946755,194,1
owqb4c,PlentyInvestigator69,I won a ehtereum giveaway and i don't know what to do with my ethereum,1627945775,0,1
oze01l,DemandOk3237,Cardano is struggling with smart contracts,1628279032,0,1
ozdzbe,Exarc799,Ethereum Mining Will Soon Be Obsolete,1628278967,6,1
ozds2t,carrilloale,I don't know it I want ETH 2.0 anymore,1628278332,7,1
ozdpcs,Actual_Caterpillar23,Why price not affected?,1628278094,17,1
ozdpbk,gogocrypto2013,Hi. This NFT will speak in the future! Carries deep meanings in its smallest…,1628278090,0,1
ozdcmi,amaS345S,about rollups,1628277009,0,1
ozdanm,theaxeisbest,who is 0x0000000000007f150bd6f54c40a34d7c3d5e9f56?,1628276839,0,1
ozd8yt,Safe_Ad415,Top 3 Blockchain In The Next Year Or Two.,1628276698,0,1
ozd7uk,a3dide,Spotify Version of whats going on rn,1628276602,2,1
ozcz8y,sillychillly,"With EIP 1559, Has ETH Become Ultra-Sound Money?",1628275896,10,1
ozcy2d,pig-benis-,Please urge your senators to vote in favor of the Wyden-Loomis-Toomey amendment to Cryptocurrencies in the Infrastructure bill. Allowing proof of work while rejecting proof of stake is a way to paint cryptocurrencies as a whole as being too energy intensive too meet our nation’s climate goals.,1628275793,109,1
ozcus7,mlearyan5644,"More bitcoin adoption in an online university""",1628275515,0,1
ozctw7,brooke_bloXroute,🎉🦅EGL Genesis Starts Tomorrow! 🦅🎉,1628275437,0,1
ozct3n,Stoffmeister31,The Absolute Beginner’s Guide To Cryptocurrency Investing,1628275367,1,1
ozcns7,rgnine,Great video discussing the Generative Art boom we're seeing right now on Ethereum,1628274910,0,1
ozche3,Santificationsensei,2021 has been one hell of a roller coaster 🎢,1628274372,1,1
ozcfmo,MalithRanaweera,What’s HOT in DeFi? Sheesha Finance Lite Paper Launch!,1628274231,0,1
ozcd2x,GeorgeSpasov,Blockchain Implementation Challenges in 2021,1628274009,0,1
ozcagp,BasedDepartment8898,Made a casual video telling you about the news with coinbase and apple pay!,1628273779,0,1
ozc8u7,Elodono,Will L2 scaling solutions become useless?,1628273644,0,1
ozc0tk,yukriss,ETH 2.0 effect on Layer 2,1628272950,5,1
ozbt62,Khlilo98,"Introducing NXTP: a simpler xchain transfer protocol by Connext, bringing interoperability between the L2 Ecosystem",1628272319,1,1
ozbevs,Darius-was-the-goody,So are has prices going to go back down or what's the deal with this new EIP?,1628271103,0,1
ozbeqh,fightforthefuture,You Can't Be Tough On Big Tech While Killing Off Alternatives To It,1628271091,0,1
ozbdja,needleandscrew,How Are You Interpreting the Charts?,1628270994,0,1
ozba6r,chapogrown,Nearly $16m Ethereum has been burned since EIP-1559 upgrade — link,1628270732,35,1
ozb4ag,Crypto-Godz,Gas fees,1628270237,0,1
ozb2di,Appropriate_Quail_55,Disadvantage of EIP 1559,1628270075,0,1
ozb1yr,Appropriate_Quail_55,Disadvantage of EIP-1559 for Defi,1628270041,0,1
ozal4t,VieYang,Block Gas Used,1628268657,0,1
ozagpm,followVibe,EIP1559 Tip for block validator - QUESTION,1628268287,0,1
ozafi9,followVibe,EIP-1559 Miner Tip Question,1628268180,0,1
ozaadh,fightforthefuture,"UPDATE: The White House is backing a terrible NEW cryptocurrency amendment that would kill off PoS validators, DEXs, DeFi, &amp; many others. If you haven't called yet, do it now. If you've already called in support of the Wyden amendment, CALL AGAIN to tell your Senators to REJECT the Warner amendment!",1628267749,0,1
oza6v4,akshay99k,Transaction dropped - does it re-broadcast itself?,1628267457,0,1
oza4n3,Teck_Suppert,"Biden Deals Blow to Crypto Industry, Backs Plan to Tax Proof-of-Stake - Decrypt",1628267277,197,1
oza4i9,ef_esp,Grantee Roundup: July 2021,1628267265,1,1
oza36p,azymondiasD,first time i have seen another coin be more profitable than ethereum for a very long time,1628267153,20,1
oza0mr,dkkc19,I can't wait for Eth 2.0 but I think it's pretty clear that congestion is going to be the number one issue,1628266947,0,1
oz9yng,jahidhasan9521,Scalability trilemma and the Libonomy blockchain,1628266779,0,1
oz9y9c,jahidhasan9521,Who are Libonomy competitors? AMA,1628266747,0,1
oz9scf,Crypto_Creepa,I'd like to speak with a manager please.,1628266230,49,1
oz9rf6,yenachar,Treasury Secretary Yellen is Lobbying Senators to Reject the (Good) Wyden-Lummis-Toomey Infrastructure Bill Amendment,1628266152,412,1
oz9p11,werticalz,Blocks only 50 % full. That is how they're supposed to work.,1628265944,0,1
oz9nx1,This_Clock,Staking while holding your keys,1628265851,0,1
oz9ms0,MORSHEDA,Libonomy Blockchain,1628265756,0,1
oz9mnj,OneWithA11,Very quick question after hard fork and eth's future...,1628265745,0,1
oz9j0e,twigwam,How Congress Might Pass Laws Bad for Proof-of-Stake and DeFi -- Unchained Podcast,1628265468,4,1
oz9h7h,nethermindeth,"So far so good! The London Ethereum upgrade looks stable and after 24h we can say there are no issues found so far! Kudos to AllCoreDevs, all the client devs and everyone else who contributed to make this happen.",1628265334,8,1
oz9h32,twigwam,Ethereum All Core Devs Meeting #119,1628265326,3,1
oz9gcl,Komuzchu,Amazing yield rate!,1628265271,5,1
oz9cw2,luckydepressedguy1,"ETH scam. Don't send your eth to ""get extra eth"" lol",1628264990,27,1
oz9csv,Fujifingers,I finally have 1 eth in my hands and I got to say..,1628264982,0,1
oz9c0v,pezzzor,"Uniswap vs buying the currency, (Gas fees) Polkamon, sending to wallets ?",1628264914,0,1
oz9bfy,PBRent,"Spread the word, call your representatives.",1628264867,7,1
oz9aq1,Winnal,Corehash Protocol Whitepaper - Decentralized mining liquidity provision,1628264808,0,1
oz94lo,CoinjoyAssistant,Weekly Digest: Google Crypto Ads &amp; Fluffy Pony Fraud,1628264290,0,1
oz8wzg,itscarlayall,"If you live in the US, this affects you!",1628263664,19,1
oz8t79,ryker_69,Is the 46 ETH/hour reward for POS being accounted for in all these burn memes?,1628263359,4,1
oz8nvc,DailyGweiBot,Whacky Ethereum - The Daily Gwei #307,1628262916,1,1
oz8lcm,ledonskim754,"In First 24hrs After EIP-1559, 4,700 Ether Were Burned - The Tokenist",1628262704,7,1
oz8avm,Emerson8668,can someone please tell me why,1628261859,0,1
oz87sg,Exciting_Principle_7,Haha i keep my hopes low but not zero,1628261603,0,1
oz84v3,Kunal0700,Rule book,1628261338,0,1
oz84t1,CoinjoyAssistant,Last ETH news for this week!,1628261333,0,1
oz7sg2,ColinTalksCrypto,Massive Ethereum Upgrade: London Hard Fork with EIP-1559. 1.8M+ ETH Burned Per Year! Watch ETH Burn in Real-time.,1628260253,0,1
oz7rfn,That_Teach_9224,"Ethereum: $ 475,000 worth of ETH burned every hour as a result of EIP-1559",1628260166,1,1
oz7pwv,MaverickMan34,Little by little!,1628260042,2,1
oz7n7e,MORSHEDA,Libonomy Blockchain,1628259823,0,1
oz7kqd,TobiHovey,Ethereum Co-Creator ‘Confident’ About Next Steps After London Hard Fork,1628259615,1,1
oz7kf6,Rainmakerman,FED FUD,1628259589,3,1
oz7db1,Pugzyaltz,https://www.reddit.com/r/SHITCOIN_MEDIA/,1628258949,0,1
oz78la,Happy_Key_4368,Nftmusic,1628258518,0,1
oz76rk,Yosskee,Almost 14 Million USD worth of ETH has been burned in the first 24 hours since the London Hard Fork!,1628258373,0,1
oz726x,twigwam,Almost 5000 ETH burned since yesterday upgrade!,1628257943,1,1
oz6zuy,sabir459,FUCK ETHEREUM TEAM,1628257715,0,1
oz6sg0,AlmostGeorgeIV,White House backs senators pushing for stricter crypto reporting rules.,1628257017,60,1
oz6r6a,blockgraze,The Biden Administration Regs Will Hurt Crypto,1628256894,47,1
oz6q8y,T-Wool,Arguments against Economic Abstraction in 2.0?,1628256802,0,1
oz6q3s,twigwam,SEC Charges Decentralized Finance Lender and Top Executives for Raising $30 Million Through Fraudulent Offerings,1628256787,1,1
oz6otc,T-Wool,Arguments against Economic Abstraction in Ethereum 2.0?,1628256667,0,1
oz6cl6,34u1n0x,Ethereum Stats Website,1628255494,0,1
oz6975,Affirmtagfx,"Why is it that, despite EIP-1559 having been succesfully activated, recent blocks still contain a large amount of legacy transactions?",1628255164,0,1
oz66kc,AOFEX__Official,AOFEX Reopens Perpetual Swap Trading,1628254896,0,1
oz63k6,GawkyGibbon,Why do transactions fail when gas prices are rising?,1628254626,0,1
oz5xa7,jahidhasan9521,Libonomy Has Interlaced With Bitcoin &amp; Ethereum,1628253987,0,1
oz5wd1,Woody-In-The-Woods,I did research and we're going to one million baby!!!!,1628253897,0,1
oz5w7b,ReddSpark,PSA for all American ETH Holders,1628253880,0,1
oz56cm,Tasty_Duty856,Nakamoto coefficient of ethereum,1628251145,0,1
oz53iz,datoseriBOMPark,I'm transferring ETH from binance to Luno. Which network should I choose?,1628250829,0,1
oz51ww,ShondraRiemann,Ethereum’s ‘London’ Hard Fork’s Impacts!,1628250632,0,1
oz4wtk,HogManBiker,Gas fees💩,1628250039,0,1
oz4tbr,JediToBe1983,ETH after London upgrade,1628249624,5,1
oz4o5a,baroskius,The beginning of a new era is coming!,1628248985,1,1
oz4nvx,C4-PO,White House to support minor changes to crypto tax proposal,1628248952,6,1
oz4kjs,AOFEX__Official,AOFEX Extends Temporary Maintenance of Perpetual Swap Trading and Deals with Abnormal Losses,1628248528,0,1
oz4ayx,_TheValeyard_,Advice on my mined ETH,1628247294,0,1
oz4835,Ellipal_official,"With the London updated, what do you think of the pros and cons? 👀🌝",1628246853,0,1
oz47j5,Ellipal_official,"With the ETH London updated, what do you think of the pros and cons? 👀🌝",1628246769,0,1
oz42el,jacored,Slice – Decentralized payments infrastructure based on fractional NFTs,1628246071,0,1
oz3ryu,imjenn30,ETH price prediction,1628244715,0,1
p570sf,Rubenoswky,Deposit Slip,1629080487,0,1
p569l1,Trump_Fan_ADA_Pool,Singapore Crypto Owners Are More Likely to Hold Ether Than Bitcoin,1629077586,0,1
p55v0w,Lazarth0,My Decentralized Crowdfunding Smart Contract,1629076021,0,1
p55uro,amos1994,The Holy Grail of Web3 - The OriginTrail Semantic Layer Explained (Built On Eth),1629075995,1,1
p55mnt,CitadelDefender,APAC vs The world,1629075139,2,1
p559ex,ShotBot,Ethereum is not money. Stop spreading the misinformation.,1629073733,0,1
p557sc,wharevaman,If the validators get 2.5% of their 32 stake but they have to convert out to fiat if they want to use it for most things right now. Just for example if the price is the same after one year and if you were in Brazil and converted out. You would actually lose money due to fiat inflation. Right?,1629073561,0,1
p54xlq,sidiney1,Check out this #NFT for sale on Mintable! Pick up 'Cachoeira do parque.' before its swooped up!,1629072502,0,1
p54ryf,ShotBot,Ethereum is not money. Stop spreading the misinformation.,1629071952,0,1
p54rin,crypto_gamer03,Want to earn crypto? Try this Pokemon-GO like game today and earn BTC/ETH for your efforts!,1629071907,0,1
p54r5r,PavlovsBigBell,ETH staking is now available directly from your Ledger hardware wallet!,1629071875,60,1
p54r3l,BLeagues73,Decentralized? Then why the need to 'Follow'?,1629071869,10,1
p54q90,QSoloX,Confused About Gas...,1629071790,0,1
p54j4t,NumLockClear,SCAM ALERT: ETH Coinbase Giveaway,1629071093,0,1
p54fhg,NumLockClear,SCAM ALERT: ETH Coinbase Giveaway,1629070719,0,1
p543i6,Fuzzyfoot12345,"Hodling bitcoin, sell me on why I should diversify a chunk into ethereum please",1629069514,0,1
p5434c,BeginningDark7783,"When I started DeFi on Ethereum I was totally lost. Now started helping beginners through FREE data , research &amp; tools.",1629069471,4,1
p53xus,Sido4398,Is there any way to transfer this amount to an exchange without incredibly high fees?,1629068935,0,1
p53gop,Affectionate-Tax7332,"Started Crypto in January 2021, just minted my first NFT",1629067246,0,1
p53bn8,twigwam,"Microsoft Argus is an Ethereum based fully transparent program, which incentivizes the anonymous reporters of piracy with bounties",1629066763,12,1
p52z58,Joeymhmjr,About the dumbest thing my friend send me he’s such a ada fanboy lol,1629065572,4,1
p52ywf,the88doctor,"Is it possible to run a ""partial"" archive node that only records historical state for certain specified accounts?",1629065548,10,1
p52yui,dogbuyer,Yoroi wallet,1629065541,7,1
p52rjj,ShotBot,Any subreddits where discussions AREN'T mostly just about price?,1629064857,0,1
p52q2v,thefoodboylover,Shark Tank’s host Kevin O’Leary believes Ethereum will become “ultra-sound currency”,1629064737,32,1
p52edt,OptimalBit5,StaFi protocol launches FIS Station,1629063628,0,1
p52anq,jojo_bitch,Checoinn,1629063283,0,1
p52a8q,martindavidartstar,144 million worth of ETH burned already!,1629063242,1,1
p529t4,PeacockMamba,Lessons learned and learned lessons.,1629063203,13,1
p520hp,UnableRevolution1,"[X-Post] Hide your ETH assets Monero style w/ Railgun on a base layer zk-snark smart contract, while complying with regulations",1629062335,4,1
p51k0k,ESTAFADOCONETH,ME ACABAN DE ESTAFAR CON ETH,1629060828,0,1
p51jmt,King_Esot3ric,Project Overview: QuickSwap - Polygon,1629060792,0,1
p51gxm,Impressive_Resident7,TokenAmulet,1629060547,0,1
p51f8v,pythagoras1m,Democratize hedge fund,1629060390,0,1
p51edw,futureglide,"If you had the cash, would it now be worth buying 32 ETH to run a validator/PoS?",1629060314,0,1
p51c3m,godofstake,Aavegotchi most valuable game on Ethereum,1629060105,0,1
p5126i,genius_retard,"Is anyone else seeing a bunch of live streams on Youtube with titles like ""Vitalik Buterin: We Expect $50,000 per Ethereum in the end of 2021""? Then when you watch the video there are graphics on screen telling you to send ETH to get 2X ETH back.",1629059195,0,1
p50xd5,creditfarm,Solidity Discord Sever: Join Discord.gg/Solidity,1629058745,1,1
p50kvd,wtfftw1221,Scam coins,1629057621,0,1
p50i07,Affectionate-Tax7332,Check out this #NFT for sale on Mintable! Pick up 'Nimisilla Resevoir Green Ohio Nature is Beautiful' before its swooped up!,1629057376,0,1
p50f4l,solemnJoker,Gaming Platforms with NFT support: Enjin (Efinity) vs Flow vs Immutable X,1629057121,12,1
p50d69,Hollywafflez,If I mine eth4gb will I get normal Ethereum?,1629056942,0,1
p507dz,hyewonnnnnnnnnnnn,Bringing my Ethereum everywhere from now on!,1629056401,0,1
p501qn,creditfarm,Solidity Discord Sever: Join Discord.gg/Solidity,1629055873,0,1
p500r9,studdmufin,48 ETH burned for a single block!,1629055782,58,1
p50017,studdmufin,Eth block #13031596 burned 48.485 eth ETH,1629055709,0,1
p4zz2h,ToastBrot64,"Normally, the burned eth per block is about 0.5, but now there are a lot of blocks with almost 50 burned eth. How is this possible?",1629055620,4,1
p4zyay,jroosvicee,How can this be good?,1629055547,32,1
p4zujx,Ragnaroknight,"I thought EIP-1559 was supposed to make gas prices more predictable and reduce huge spikes in gas fees. Yet my rigs just got the worst spike they've ever had, and I'm still paying like $50-60 for a swap on Uniswap.",1629055202,0,1
p4zsjz,Ivaylo12,Are people really paying $1.2k just for one contract and $100 per etherium transaction? Why don't they just raise the block size? Wouldn't that help?,1629055010,9,1
p4zro5,sejl0,How does APR work in yield farming?,1629054931,0,1
p4zoks,jklepatch,Top 3 Layer 2 scaling solutions for Ethereum: Polygon vs Optimism vs Arbitrum,1629054641,1,1
p4z8qc,gogocrypto2013,Carries deep meanings in its smallest details,1629053203,0,1
p4z5eo,Vronsky1996,"Pls help, to buy girlfriend a car so i can’t drive her to work, FOR BETTER WORLD send Ethereum",1629052901,0,1
p4y71h,BitNectarine,ETH transaction stuck,1629049856,0,1
p4xutv,sk8tyger,"Wouldn’t it make sense to have multiple $90,000 stakes setup as opposed to one, say $1,000,000 stake? Due to having a higher likelihood that multiple stakes will receive more transactions than one stake?",1629048751,19,1
p4xtq6,Safe_Ad415,6000 TPS Is The Fastest Blockchain Network,1629048650,0,1
p4xtn7,ra1nty,Is there any suitable instrument for hedging ETH/USD rate for small miners?,1629048642,0,1
p4xsi2,MrQot,"Probably still early, but has anything nifty been done with EIP-3198's BASEFEE opcode yet? Or any works in progress?",1629048543,4,1
p4xs9y,MrQot,"Probably still early, but has anything nifty been done with EIP-3198's BASFEE opcode yet? Or any works in progress?",1629048524,0,1
p4xroe,ra1nty,Suitable instrument for hedging ETH/USD rate for small miners?,1629048469,0,1
