id,author,title,created_utc,num_comments,score
p00q7u,I_amNND,This is what the dinosaurs were saying back in the day.,1628368068,23,1
p00n6u,No-Loss185,Innosilicon A11 Pre-order is MIA,1628367779,0,1
p00fsp,CaptainHardhead,High Gas,1628367064,0,1
p00fo1,EmeraldWay,Big news coming for UniPower!,1628367052,0,1
p007rr,Dieselpump510,ETH is over 3k and people are buying ETC again. 🤦🏼‍♂️,1628366348,0,1
ozzqxf,The_frijolero,"Fractio | Fractio allows users to create digital assets that interact with the real world, all without the need for code.",1628364764,0,1
ozzqfv,technomime,Random question,1628364719,0,1
ozzq21,dastockanalyst,Let's make money on Crypto 🔥 #BTC #ETH #ETC #ADA #DOGE #SHIB 🔥,1628364682,2,1
ozznvz,big_jo_123,Help!!!,1628364483,0,1
ozzkm5,tussNpuss,Has Ethereum Become Deflationary - zycrypto article,1628364183,2,1
ozzjmi,terp_studios,"Saw a post on how an Ethereum is made...this is how they’re burned. Don’t worry, I’m trying my best to burn the other 4,499 ETH per day.",1628364093,79,1
ozze4v,ConsciousAuthor3117,"Made a website which accepts ether, which is funniest one i had seen and which my parents would see i would live outside",1628363588,0,1
ozzdpw,ShotBot,Ethereum twitter be like,1628363548,5,1
ozz3qx,Ykay1st,FATF Crypto | The FATF’s “Recommendations” | How To Prepare,1628362630,0,1
ozz1oc,Ok-Imagination-7014,Any new news on the terrible bill?,1628362431,13,1
ozyul2,emerre_,Mining as a way of saving energy,1628361767,0,1
ozylh7,Wyntier,Anybody notice your Fjallraven account has an ethereum address? I feel like I'm seeing more and more ETH integration each week,1628360922,0,1
ozyk0f,Wallstreetfalls,"3k we all new it was coming, only surprise would be 4 k next weekend",1628360786,2,1
ozyg60,BeginningDark7783,"Holy moley! 10k ethereum burned in 48 hours , where is it going to take us ?",1628360432,30,1
ozydgx,CrypticOsc,Best place to stake my ETH longterm?!,1628360177,0,1
ozybx6,jahidhasan9521,Libonomy Blockchain Introduction,1628360035,0,1
ozybie,jahidhasan9521,"Libonomy - Interoperable, scalable and truly decentralized blockchain",1628359996,0,1
ozybb8,ruspow,If average block utilisation why only 50% why is gas so high?,1628359977,0,1
ozy8rb,EugeneWong318,Ethereum smashes through $3K again!,1628359742,2,1
ozxxct,WisePage43,"SALMOS 24 10 ¿Quién es este Rey de gloria? Jehová de los ejércitos, El e...",1628358705,0,1
ozxn9g,ggrey99,Gassssss feeeees!!!,1628357776,0,1
ozx94u,yenachar,"Seeing the Strength of the Crypto Community, the Senators Behind the Bad Amendment (Presumably Working with Treasury) are Seeking to Compromise on the Wording in the Infrastructure Bill",1628356453,12,1
ozx8ww,rickarooo,Help canceling a pending transaction,1628356433,0,1
ozx2uo,Crypto-Noob20,How much ETH to be set for life?,1628355887,25,1
ozx2t4,Financial-Gold-9175,Impulse- An NFT First Person Shooter Powered By Enjin,1628355884,0,1
ozwych,turtledave501,Should I sell it or keep it?,1628355496,22,1
ozwuqi,wherethecatsmatat,For anyone who’s made a lot of money off this bull run… this is a good read I think,1628355170,0,1
ozwqp3,DemandOk3237,Libonomy blockchain provides a solution,1628354810,0,1
ozwma0,CleanedToilet,First 10k ETH has been burned!,1628354405,54,1
ozwkyn,astroverb,great new fees,1628354281,10,1
ozwjdf,etan1,10k ETH burned 🦇🔈,1628354138,6,1
ozwgmi,curiousgeorge87612,How do you lock in your ETH value without getting slammed on taxes?,1628353889,0,1
ozwa8x,Ellipal_official,Is there any change in miners' fees after ETH London fork?,1628353290,0,1
ozw6zi,Ellipal_official,Is there any change in miners' fees after ETH London fork?,1628352998,0,1
ozw4v4,Ellipal_official,Is there any change in miners' fees after ETH London fork?,1628352801,0,1
ozw2c6,jakobjj77,Accepting Eth at my farmers market stand!,1628352568,363,1
ozw2a7,PopeRonPaul2,I bought the domain ProofOfMistake.com to help our cause with the impending U.S. senate vote.,1628352563,1,1
ozw0io,Ellipal_official,Is there any change in miners' fees after ETH London fork?,1628352401,0,1
ozvycg,Dazzling_Carpenter,Is it a good time to invest in Ethereum ?,1628352207,63,1
ozvx81,kmatias1976,https://opensea.io/assets/0x495f947276749ce646f68ac8c248420045cb7b5e/34024367419303724040417166728595235501724924049155623908715220285575506427905/,1628352104,0,1
ozvwh9,Psian,I can't facepalm hard enough... someone does not know the difference between a million and a billion. How do these people ever hope on writing about crypto?,1628352039,44,1
ozvumv,ShotBot,$30 Billion in Ethereum Burned Just Two Days After EIP-1559 Launch,1628351881,8,1
ozvrlk,containerd,Introducing Web3.Storage: A simple interface for Filecoin storage,1628351601,0,1
ozvpt1,reasonablebacklash_3,Scumbag Warner,1628351433,0,1
ozvo97,AlphaMonkey724,I can’t stop thinking about the dude who put 280 mil into ethereum about a week ago,1628351275,0,1
ozvisq,alfpozzi,"Ethereum (ETH) Recaptures $3,000 After “London” Hard Fork Goes Live",1628350761,0,1
ozv9oe,paul2k99,Burning rate 4500 ETH/Day,1628349911,13,1
ozv9k8,Sufficient_Tooth_949,What's the timeline for full 2.0 rollout?,1628349899,0,1
ozv4wp,Hodla__,Thx Reddit for being The only place I found this 😍,1628349474,0,1
ozv418,Hodla__,"Facebook, Instagram, Twitter banned this hoodie",1628349398,0,1
ozuzlv,00DanielXX,"Beautiful double Botton Pattern, rechasing the low from the 17th May 2021!",1628348981,1,1
ozupcp,Cryptolution,The insanity of contrarian action in crypto markets,1628348049,0,1
ozunr3,hridoy104,nat5token,1628347893,0,1
ozuj42,123Delbe,Will Etherium be forever silver,1628347450,0,1
ozubsp,Leading-Slice-7369,"It's great that ETH is recovering and back to bullish and all. What is being done about the gas fees though? At this point, the tech is not really useful.",1628346740,11,1
ozu6u3,Lastlord295,Moonbet,1628346245,0,1
ozu5n5,MORSHEDA,Libonomy Blockchain,1628346131,0,1
p7w7xg,Needle_NFT,Shepard Fairey – ultra rare 1/1,1629439083,0,1
p7w1yu,VLADIMIROVIC_L,What credible education could I do that is shorter than a master's degree on Ethereum/blockchains? I don't hold a CS degree but an econ bachelor (and business MSc).,1629438267,9,1
p7vutl,TheCheese2024,#theflippening,1629437308,4,1
p7vsl8,anandaverma18,"Coinbase purchase of $500 million crypto assets will make it the first publicly traded company to hold Ethereum, Proof of Stake assets, DeFi tokens.",1629437016,3,1
p7vmnc,kidponga10,Valuing AAVE,1629436273,0,1
p7vjao,strabello2020,Ethereum 2?,1629435873,0,1
p7vg4g,cctv07,Vladimir Putin Asks Cabinet to Design a System to Declare Crypto Holdings,1629435505,0,1
p7v0rj,cryptoseller213,Elementa NFT Game,1629433640,0,1
p7uhvh,IsabelM2021,Masterlawcoin.space Protocol ICO 🛸🚀,1629431488,0,1
p7u819,WilyConniver,What does Vitalik mean when he says Blockchain can replace Uber?,1629430402,34,1
p7u667,Gagarin1961,Vitalik’s thoughts on DOGE. What do you guys think?,1629430211,178,1
p7u3jb,Pretend-Comedian13,Helping in Haiti,1629429936,0,1
p7u108,Anxious_Branch_1663,ETH for sure~~~~~~ Agree?,1629429664,0,1
p7tcti,elbenjaz,first NFT and it's my cat holding a beer! 💎🚀. What do you huys think about it?,1629427032,21,1
p7t48k,Visible-Ad743,If only there was a popular decentralized platform where users and creators could connect their wallet and transact with a currency where banks have no way of meddling in people’s private lives. If only that platform existed. Hmmm 🤔,1629426129,541,1
p7t0es,Visible-Ad743,If only there was a popular decentralized platform where users and creators could connect their wallet and transact with a currency where banks have no way of meddling in people’s private lives. If only that platform existed. Hmmm 🤔,1629425726,0,1
p7sl75,dumplingcompromise,Should Ethereum have an on-chain mechanism for funding developers?,1629424157,10,1
p7sgm1,cartisimpson,Stop Fiat Payment Processors From Purging Explicit Creators,1629423679,4,1
p7s2yc,papriccapwn,If you bought ethereum everyday for the past year…,1629422262,21,1
p7rx8o,Techn9cian,Vitalik being brazyyy,1629421673,68,1
p7rwhw,Techn9cian,Vitalik is brazyyy,1629421595,0,1
p7rsjq,Grade19282,Whistleblower leaks government documents showing Afgan downfall was planned,1629421212,0,1
p7rq7w,niftgen,"Interoperability, security, and scalability: Which blockchains have the most promise in each of these areas?",1629420970,38,1
p7rmw0,mohit_habeeb,"Folks, what tool do you guys use to manage your defi portfolios ? This week I reviewed Zapper.fi and Zerion.io on my channel. Let me know if you guys like it. I have been using zapper personally.",1629420627,0,1
p7razo,BeerBellyFatAss,"Enya Launches Mainnet Beta of Boba Network, New Ethereum Scaling Solution (Optimistic Rollup)",1629419386,2,1
p7r0b6,JalapenoPepper-X,ETH vs BETH and staking on Binance.,1629418286,6,1
p7quju,mechanicalhuman,"I’m not understanding. If my Eth was part of (?locked in, not sure the correct language here) in a Defi project, what incentive would I have to not sell my Eth?",1629417712,3,1
p7qmrl,dante410,3070 eth settings?,1629416964,2,1
p7qlh5,YasminResnik,Ethereum creator says Jack Dorsey and Mark Zuckerberg are doing crypto wrong,1629416832,23,1
p7qcqd,BigDaddyDallas,"$50 a day keeps the wallet nice and healthy , now accepting Crypto!",1629415964,7,1
p7qche,deathroker,amazon token,1629415938,4,1
p7qb8q,Mundane_Eagle4220,Open minded conversation about privacy coins,1629415825,7,1
p7q6vg,Crypthomie,I really love this sub because it’s not a bunch of stupid maximalist like r/Bitcoin,1629415397,23,1
p7pqor,Prestigious_Fan_9183,#1 😎,1629413904,0,1
p7pihw,mitchJIMplant,The MLB just signed with Fanatics and their Ethereum based NFT company instead of Topps as a trading card platform. This will lock in exclusive rights to MLB logos for Fanatics and move the historically lucrative business of flipping baseball cards to the blockchain through Ethereum. R U excited?,1629413121,41,1
p7ph5r,BeerBellyFatAss,Coinbase Wallet Extension on Chrome,1629412998,2,1
p7pgxl,cinoya,Forex Flex EA - ForexStore.org Dowload Best Free EA ForexStore,1629412976,0,1
p7p63j,tschmitt2021,#ETH,1629411956,5,1
p7p1ge,UnhappyFirefighter57,Next Earth,1629411525,0,1
p7p0es,Michelemenef8,Ethereum is the new Bitcoin,1629411430,95,1
p7ozej,Hau_On_Reddit,Ethereum climbing FAST Expecting 4K SOON,1629411336,0,1
p7owhk,Snoo_63608,on what crypto exchange should i store my CRYPTO? (EU citizen),1629411074,6,1
p7orup,socalquest,"Ether already ‘flippening’ Bitcoin, says Celsius CEO",1629410661,3,1
p7opxk,Cryptophilatropist,Premium Crypto Currency Domains up for Auction! Don't miss out on a great investment opportunity!,1629410490,0,1
p7odkz,TobiHovey,Ethereum Scaling Solution Polygon Launches DAO to ‘Unite’ DeFi Platforms,1629409398,9,1
p7oclj,alysak6075,Question about PoA,1629409312,5,1
p7o00i,EtherVirtualMachine,"How would businesses respond to a free personalised Ethereum wallet address (e.g. businessname.eth) plus receive $10 in Ether, plus receive free finance coaching on wallet setup and staking process at a time and place convenient to them? Also I'm project coordinator for Ethereum Foundation.)",1629408221,0,1
p7nw41,twigwam,Community Launch -- Optimism,1629407862,2,1
p7nszj,Specialist_Humor5162,what’s up with $BUNNY?,1629407584,0,1
p7nsl9,kindagreenish,EIP 1559,1629407548,9,1
p7npiq,Snoo51702,Ethereum Themed Animation,1629407291,0,1
p7ngl6,FV_Master,USDC vs BUSD vs TRUEUSD foe savings apy,1629406540,1,1
p7nfev,QuaysPwn,The duality of crypto community,1629406436,8,1
p7nb8f,trogdortb001,Are you responsible enough to manage your own assets?,1629406054,2,1
p7n5el,LastRefrigerator9074,Anyone want to buy my friends nft?,1629405538,0,1
p7n42q,bpierre,"useNft() 0.10: on-chain Cryptopunks, easier configuration, new NFT fields",1629405423,1,1
p7mwqr,New-Base-6316,Bullish or bearish ❓,1629404807,0,1
p7mw53,DaVibes,VanEck Submits Application for Ethereum Futures ETF,1629404750,0,1
p7mu15,MetropolitanPig666,How to deposit ethereum,1629404556,7,1
p7mpks,carloscancab,"Just published: CEOs from Coinbase, Bittrex, Consensys' NFT platform and Coinpayments are all in the Crypto Hot Seat panel discussion CBDCs, new regulation, adoption, Elon Musk, and more.",1629404162,1,1
p7mlbq,mahogany_nights,Uniswap sushiswap beef,1629403803,7,1
p7mbck,ILPFoundation,Would businesses like a free personalised Ethereum wallet address (.eth) ?,1629402949,0,1
p7m99w,NOTPR0,"How to Setup your own Onchain Oracles and Data Feeds, using any API, w historical tracking and lookup and multifeed support",1629402774,1,1
p7m99v,Punker1234,4th card prevents computer from booting,1629402773,4,1
p7m4d7,babossa77,Can someone explain me how slashing works from a technical point of view?,1629402361,4,1
p7m2mc,nex733,Private Wallet &amp; Trading Wallet,1629402209,5,1
p7m10l,Jessicaraven100,"Big Green Boner to 3,145k eth $46.6K Btc !!...What up ?",1629402070,0,1
p7lr63,Hecate-Selene,"We now accept ETH! Hi guys, I am one of the founders of Hecate Selene, a slow fashion brand with a focus on looking after the people and planet. We accept ETH, BTC, DOGE, LTC, etc. as a form of payment! :) Enjoy our campaign for the new collection and please do check us out: www.hecateselene.com",1629401239,0,1
p7lh3o,Drunkenshark001,Bullish hen pattern go brr,1629400384,0,1
p7l45m,Sad_Replacement_9801,What are people’s thoughts on ETC? I’ve never seen it discussed here but I’d like to get peoples thoughts on its fundamentals and value going forward.,1629399283,20,1
p7l2id,Rahul_2503,Ethereum Layer 2 Ecosystem,1629399142,14,1
p7kx4j,Happy_Key_4368,Jax.network,1629398670,0,1
p7kws0,alansmith2331975,"hello community, check out what i got from Crowdsense.ai This was to be expected or is it a surprise?",1629398640,2,1
p7kmto,DrinkMoreCodeMore,Vitalik Buterin says he's skeptical of Jack Dorsey's DeFi plans and Mark Zuckerberg's metaverse,1629397752,176,1
p7k9t0,Affirmtagfx,A likely explanation for why Vitalik is on the board of the Dogecoin Foundation,1629396607,7,1
p7k24i,aspiras213,BTC to ETH?,1629395978,2,1
p7jjl4,rfikki,Will ubiquity usurp trustlessness?,1629394410,3,1
p7jjdk,hweng,How do prioritized block/miner transactions work?,1629394389,4,1
p7jcyq,jahidhasan9521,"Libonomy - Interoperable, scalable and truly decentralized blockchain",1629393840,0,1
p7j9mw,SwagtimusPrime,This sub is getting astroturfed by Bitcoin maximalists,1629393563,606,1
p7j7a5,Tenoke,"Presale wallet password accidentally in cyrilic, Vitalik's pyethtool recognizes password but errors differently on it. Need help to proceed",1629393363,0,1
p7izwr,IcyResponsibility238,Get his ass,1629392749,0,1
p7ixp0,IcyResponsibility238,Eth ain't sh☆t. Don't let him say this... get on his ass. Eth gang!!!!,1629392569,1,1
p7iw9w,Nicckkkkkkk,ERC-20 vs ERC-721,1629392455,0,1
p7it9b,gomisego,Boba | Layer 2 Ethereum scaling and augmenting solution,1629392217,1,1
p7isi4,Dry_Huckleberry_318,Who invests in only Ethereum?,1629392151,12,1
p7iaoc,titi1992ks,"Ethereum meets Hollywood, crypto documentary quality taken to the next level! COINS Ep. 1 &amp; 2 are out.",1629390639,0,1
p7i8xs,New_Food7110,"Wish Finance Charity and Cause has a clear mission to utilize the power of the global Crypto Ecosystem and the completely transparent Blockchain to provide support, assistance and money to charities, communities and worthy causes across the globe.",1629390496,0,1
p7i503,ernie98,GitNFTs: Autograph and sell your GitHub commits as NFTs,1629390164,1,1
p7hwt9,WolfofWrecclesham,Hi from the UK,1629389466,0,1
p7hw7y,skudoosh10,Will solana make ethereum less valuable?,1629389418,4,1
p7hn48,twigwam,"DeFi projects could come under SEC's oversight, says chairman Gensler",1629388690,2,1
p7hm1g,neiman30,The ENS+IPFS website of the week award,1629388595,1,1
p7hemu,Mammoth_Camp_6560,Can anyone help me?,1629387971,1,1
p7gsfr,gomisego,Boba Network Optimistic Rollup (OMGX) has launched Mainnet!,1629386068,1,1
p7gqxh,cryptobriefing,Ethereum is Getting a New Layer 2 Optimistic Rollup,1629385939,11,1
p7gaz5,TobiHovey,VanEck Files for Ethereum Futures ETF in US,1629384569,2,1
p7galh,kimmy002eo,What is miner extractable value and how it is hurting the Ethereum Blockchain. Can an increased predictability of Gas Fees solve this problem? This is a good article for anyone that regularly trades on Decentralized Exchanges.,1629384536,1,1
p7g5ol,poojaranjan19,The Ethereum Cat Herders mid-year report,1629384083,1,1
p9xelk,Rich-Narwhal-5384,George bush help me trade my ETH and gave me this was so happy DM if you’re interested.,1629716202,0,1
p9xc5a,EZLIFE420,Visa buys a CryptoPunk,1629715889,424,1
p9x938,FatPandaFat,Is there a decentralised fiat on/off-ramp out there?,1629715527,68,1
p9x7nx,Pretty-Recognition71,Please subscribe to help me make India crypto literate,1629715355,0,1
p9x3ri,Fancy_Construction46,H E L P,1629714883,0,1
p9x0i0,thefoodboylover,President Vladimir Putin ordered new system forcing Russians to disclose crypto holdings,1629714481,15,1
p9wqvd,WorkerFree5967,Ethereum Virtual Machine,1629713268,0,1
p9wjui,jomfas,So is the EIP-1559 a failure?,1629712384,44,1
p9w9ar,vgesmo,What do you think about NFTs on Ethereum blockchain? NFT Research,1629710948,0,1
p9w8qw,TheReelSatori428,Where to hold my ethereum so i can stake.,1629710871,55,1
p9w7u0,LetIllustrious2856,Reef Ecosystem Map,1629710744,1,1
p9w45a,C4-PO,"Concerns around data privacy are rising, and blockchain is the solution",1629710239,5,1
p9vz5d,Tahmid_0007,Whats the cheapest way to transfer ETH from Binance?,1629709604,7,1
p9vx3k,Imaharak,"Thanks, Ethereum.",1629709325,10,1
p9vvur,SRLSR,Coinbase vs hardware Wallet,1629709185,3,1
p9vntp,mtnst,Lost Gas twice even though i offered more Gwei than Ethscan said,1629708054,9,1
p9viok,Solodeji,"PayPal Extends Bitcoin, Ethereum Payment Services to United Kingdom (UK)",1629707318,2,1
p9vg8c,ad_ventures,Where are all the posts re PayPal adding crypto?,1629706959,0,1
p9vbf3,z-2,Bit of a noob here but why does my staking yield keep going down?,1629706283,11,1
p9v9um,Funny_Mushroom_5708,Not confirmed (-404),1629706077,0,1
p9v3bk,siradrian12,http://tubmantokens.com/,1629705202,0,1
p9upa6,Kefass,"To stake, or not to stake? What are the risks? Were to find a good stakepool? Anybody who can help me? Any guids availible? Thanks!",1629703225,6,1
p9ufsg,Responsible-Kitchen5,"Sending ERC20 tokens, do I need ETH on my ledger for the fees?",1629701956,0,1
p9uf0c,trchurt,Prediction flags,1629701849,3,1
p9uc7x,RedditBlockchains,Preparing for my new merchandise store.,1629701459,3,1
p9ubry,Lvna88,Blockchain digital currency makes life more interesting.,1629701406,0,1
p9u57z,Risinguptomynewlife,It is always a pleasure watching Vitalik talk about Eth. The Anchor is very impressed.,1629700553,7,1
p9tz41,Brad504838,Are coins like safemoon(#shitcoins) a good investment! ...,1629699740,0,1
p9tw0f,Needle_NFT,Pure Nature – ultra rare 1/1,1629699328,0,1
p9tosg,AutoModerator,Weekly Discussion Thread,1629698421,265,1
p9tn2e,Impossible_Taste_671,"Will Ethereum Price Hit $10,000?",1629698202,0,1
p9tmdm,Bigbootycrypto,I made an NFT for my love of mushrooms!,1629698111,0,1
p9tks8,jakkkmotivator,"After US, PayPal Today Announced Launch Of A New Service Enabling Its UK Customers To Buy, Hold And Sell Bitcoin, Ethereum, Litecoin And Bitcoin Cash With PayPal",1629697894,9,1
p9tjtu,bsterling604,If gas prices are so high why does etherscan say so low in areas?,1629697762,8,1
p9tg5j,profullstack,Will MEW support staking soon?,1629697272,5,1
p9text,c0laj,My first NFT!,1629697114,42,1
p9td6q,Liberosist,"""Eth 2.0"" is deprecated nomenclature - we're One Ethereum again",1629696890,17,1
p9t8ef,chapogrown,"54.42M (ETH) addresses in the money vs 1.72M the percentage of addresses that would have lost money had they sold at the price of the given date. $3,171",1629696284,1,1
p9t6lh,forambarot04,Use of Ethereum in the future,1629696061,0,1
p9sycr,bringbackthesonics21,Staking Eth on Coinbase,1629695051,5,1
p9sx3z,Isaac_tsc,Daily dose of crypto,1629694905,0,1
p9sp3d,Samkills99,My Profits went down drastically!! Can someone please tell what this thing means in my miner??,1629693998,0,1
p9skjb,sailing_to_the_stars,Sold all doge to buy more Ethereum,1629693487,73,1
p9sjl3,JETLIFEMUZIK94,"When ETH 2.0 happens, will my original ETH become worthless or lose value? Will there be a BTC cash situation? Or is it all going to be the same thing?",1629693379,5,1
p9s95a,Stack3,What should I do with my eth?,1629692203,13,1
p9rqsv,gothflyboi,I am $40 away from my investment of 2 ETH going positive…,1629690299,2,1
p9rj7k,drkfkdk3,Venom 2 HD Trailer 2021,1629689519,0,1
p9reco,Illegaltouch,Who is staking ethereum on coinbase? And if so how are you liking it? Can’t take the money out yet. And no one knows when we will.,1629689022,8,1
p9rc36,pandatrunks17,How would one go about pulling the transaction history of the entire eth blockchain?,1629688790,0,1
p9qvzd,Dadozuk,First pair of crypto kicks made let me know what you think !,1629687169,15,1
p9qras,Big_Medicine9476,Ether UK PayPal https://www.cnbc.com/2021/08/22/paypal-crypto-service-launches-in-the-uk.html,1629686689,0,1
p9qfma,Akemi_Homura666,Will Eth 2.0 solve the high gas prices?,1629685473,27,1
p9q799,Emily9693,Get free Shiba Inu coins and TRX (tron) coins,1629684646,0,1
p9pyru,ETHpeasant,Is it a scam?,1629683800,0,1
p9puxv,ShotBot,How come no one in the industry ever calls out ponzi schemes like HEX? Where's Vitalik?,1629683386,373,1
p9ptbw,chaser232,IDC Cuz It's Going To 20 [Music Video],1629683218,0,1
p9pqdr,Numerous_Sport_2774,Where best to stake ETH in Australia?,1629682923,14,1
p9pjno,Happy_Key_4368,Nintcoin,1629682252,2,1
p9phft,thatguyintech,how to get an ENS domain,1629682030,0,1
p9p9wo,Ambrobot,Where did I send it?,1629681273,29,1
p9osyn,economicsdesign,Why DeFi Is More Than A Ponzi Scam,1629679539,2,1
p9ood8,_just_a_question__,Multi-sig Private Key Issue,1629679067,0,1
p9oczz,Hanzburger,What would be the implications of ETH becoming a security?,1629677899,9,1
p9nwf7,ShotBot,"I think Cardano will flip Ethereum, and my argument has nothing to do with the tech.",1629676273,11,1
p9nu1e,Frequent_Detective17,"As someone with &lt; 1 ETH, should i move my ETH to an exchange?",1629676034,26,1
p9nk8e,Sobutie,What did I do with my ETH?,1629675072,19,1
p9nask,DarianthebestDonegal,Look into openalexa.io and nobody tell me it’s bs until they actually read up on it. HMU you’ll thank me later,1629674134,0,1
p9n6ry,ShotBot,"Cardano (ADA) Hits New All-Time High, Founder Charles Hoskinson Predicts $150 ADA Price By Year-End",1629673756,3,1
p9mxm2,ChadderVox,"For anyone who is in the process of migrating over to Cardano in preparation for September 12th, this video from Ken Adams of KEWW is the best walk through to date on how to properly set up your Staking Node!",1629672866,4,1
p9mq6x,Rubenoswky,Walmart Checks,1629672165,0,1
p9mkab,mattygfunk,Ethception: Ethereum mining on the Ethereum mainnet. ICO Sept 2.,1629671593,0,1
p9mb0e,RedditBlockchains,How to know the price of a coin at a particular time. (i.e. What is the value of ETHUSDT at 12:25:15 UTC on 25 July 2021?,1629670723,18,1
p9lruj,Ahmed_Ali_A,"No More Ethereum ETFs? Proshares, VanEck Withdraw Ether ETF Proposals",1629668994,9,1
p9lfq0,BorneoLove,Which coin next?,1629667886,11,1
p9l9x5,Gullible_Wolf_9586,*100 Free Bags Giveaway Crypto Dreaming Backpacks,1629667359,0,1
p9kvhi,whiteninja123,Can all the ETH be burned up?,1629666063,11,1
p9krbp,sveennn,Now on OpenSea for only 0.01 ETH,1629665714,0,1
p9kl2r,iamS0nas,Crypto Earn Interest,1629665145,0,1
p9kkth,Kiwisegura,What im doing wrong! Polygon --&gt; Eth from OpenSea NFTS,1629665126,0,1
p9kjgq,drink_water_reminder,Why Ethereum is better?,1629665016,12,1
p9k62g,JcpaNYC,Long term ETH burn vs Equities,1629663885,21,1
p9js78,Zek256,The Ethereum Citadel- Part I; Fictional Futuristic Utopian SciFi DeFi Historic Record,1629662668,1,1
p9jlgx,azafea_tech,I’ve just started a uk phone business accepting ethereum. Has anyone got have any experience accepting ethereum and what the upper and lower thresholds should be for payment?,1629662081,0,1
p9jiui,UnyieldingDude,What makes people believe ETH is more worthwhile than Bitcoin?,1629661847,0,1
p9ja95,skalneka,What to do now? Of course buying the dip. Because in a year a current chart will be the deepest dip.,1629661077,7,1
p9j8bh,cryptotentnew,Why is ETH so popular when their gas fees are so unreasonably high?,1629660902,225,1
p9iv61,PristineStation4158,That's the question.,1629659733,0,1
p9iog8,JeanHolloway78,Ethereum--I love This Hoodie &amp; Gift your Friends,1629659157,0,1
p9imql,Fronkalicious,Discussion on hard gas cap,1629659018,0,1
p9imku,Select_Detective_606,Cross-chain atomic swap protocol between Monero and Ethereum,1629659003,6,1
p9ijw5,MyraCruz454,Ethereum-I love This Hoodie &amp; Gift your Friends,1629658796,0,1
p9ii32,Harinivas_,All crypto resources in one place. Do upvote!,1629658636,0,1
p9ifvf,Daniel_C_____,Why are most smart contracts built upon Ethereum?,1629658452,0,1
p9i9m0,Rubenoswky,Home,1629657916,0,1
p9i7z3,juanly_xx,Earning interest on your ETH,1629657769,21,1
p9i4ge,Happy_Key_4368,Neoxcard,1629657461,1,1
p9hzza,Wingsforecaster,"Sent a Unicorn to Heaven thru the ""Great Unicorn Meat Grinder"" contract and didn't get any meat.",1629657086,13,1
p9hwx2,SheLikesKarl,"This may be a naive question but I’d like to learn how to sell personalized gifts from my hobby business and accept Ethereum. Do I need to create a wallet or can I create a business on the Ethereum network? Any resources would help, Thank you folks! Follow us at @fun_graving",1629656828,3,1
p9hrbm,Happy_Key_4368,Jax,1629656360,1,1
p9hqqr,Orenday69,The Little Aliens NFT &amp; (Giveaway),1629656311,1,1
p8mw5l,WonPil101,"At Yamgo. Creating your account is quick and easy. All you need to do is fill out your name and email address, complete your account set up, and you’re ready to start earning rewards right away.",1629529279,0,1
